,country,number,item,item_id,shortform,pageid,wikipedia_summary,wikipedia_url
0,Afghanistan,1,Zakia Wardak,http://www.wikidata.org/entity/Q108312212,wd:Q108312212,68614759,"Zakia Wardak is an Afghan architect, politician, and businesswoman. She served as the first female Consul General of Afghanistan in Mumbai. Wardak is an advocate for inclusion and women's rights. She is from Kabul. Wardak has served as president of the Society of Afghan Women in Engineering and Construction. In 2018, she ran for a seat in the 2018 Afghan parliamentary election.",https://en.wikipedia.org/wiki/Zakia_Wardak
2,Albania,20,Kolë Idromeno,http://www.wikidata.org/entity/Q1390711,wd:Q1390711,1455976,"Nikoll Idromeno (Albanian pronunciation: [ˌniˈkɔɫa kɔl ˈidɾɔˌmɛnɔ]; 15 August 1860 – 12 December 1939), better known as Kolë Idromeno, was an Albanian painter, sculptor, architect, photographer, cinematographer, composer and engineer during the Albanian Renaissance in the nineteenth century. He is widely regarded as a precursor of both realism and landscape art in Albania.Kolë Idromeno was born in Shkodër, which was at that time part of the Ottoman Empire. At age 16, he moved to Venice for six months and began his studies at the Accademia di Belle Arti di Venezia. Subsequently, he travelled throughout Europe and moved back to Shkodër and worked essentially in a variety of artistic fields. In addition, he made himself strongly committed for the Independence of Albania whereby he was forced to emigrate to Ulcinj.Among his important works are a series of paintings where he tried to depict the social aspects of everyday life, customs and religion exactly as it appears. He was also distinguished for its rich use of colours and decorative shades with certain ethnographic elements and landscapes depicting places in or near Shkodër.As an architect, he drew the plans for around fifty buildings either private and public. He also designed several industrial facilities, banks, the Rozafa cinema and Kafja e Madhe café. The coffered ceiling of the St. Stephen's Cathedral, which is one of the largest cathedrals in the Balkans, was also a design by Kolë Idromeno.",https://en.wikipedia.org/wiki/Kol%C3%AB_Idromeno
12,Algeria,7,Rudy Ricciotti,http://www.wikidata.org/entity/Q2811177,wd:Q2811177,38866930,Rudy Ricciotti (born 1952) is a French architect and publisher.,https://en.wikipedia.org/wiki/Rudy_Ricciotti
21,Angola,5,Paula Nascimento,http://www.wikidata.org/entity/Q19662924,wd:Q19662924,44510730,"Paula Nascimento is an Angolan architect and curator who along with Stefano Rabolli Pansera curated the Angolan pavilion at the 55th International Art Exhibition - La Biennale di Venezia which won the Golden Lion  for ""best national participation"".In 2011, Nascimento  and Pansera founded Beyond Entropy Africa, a limited company registered in Angola. Beyond Entropy Africa focuses on Luanda as the paradigm of the urban condition of the African Sub-Saharan region, a type of city that is defined by a lack of basic infrastructures and a high density of population.
In 2012, Beyond Entropy Africa curated the Angola Pavilion at the 13th Architecture Biennale in Venice  with the title of their partnership ‘Beyond Entropy’.
In 2013, Beyond Entropy Africa curated the Angola Pavilion at the 55th Art Biennale in Venice entitled ‘Luanda, Encyclopedic City’ featuring the work of photographer Edson Chagas.",https://en.wikipedia.org/wiki/Paula_Nascimento
23,Argentina,38,César Pelli,http://www.wikidata.org/entity/Q309483,wd:Q309483,2573677,"César Pelli (October 12, 1926 – July 19, 2019) was an Argentine-American architect who designed some of the world's tallest buildings and other major urban landmarks. Two of his most notable buildings are the Petronas Towers in Kuala Lumpur and the World Financial Center in New York City. The American Institute of Architects named him one of the ten most influential living American architects in 1991 and awarded him the AIA Gold Medal in 1995. In 2008, the Council on Tall Buildings and Urban Habitat presented him with The Lynn S. Beedle Lifetime Achievement Award.",https://en.wikipedia.org/wiki/C%C3%A9sar_Pelli
44,Armenia,14,Momik,http://www.wikidata.org/entity/Q1964407,wd:Q1964407,6348407,"Momik (Armenian: Մոմիկ; died 1333) was an Armenian architect, sculptor and a master artist of Armenian illuminated manuscripts. As a sculptor, Momik is also known for his fine carving of khachkars, found primarily at the monastery complex at Noravank. He held an eminent position at the Gladzor School of Illuminated Manuscripts in Syunik, established at Vayots Dzor under the patronage of the Orbelian family's historian, Stepanos Orbelian. Of the manuscripts authored by Momik, only several survive: one is found at the repository of the Mekhitarist Order in Vienna and three others are found at the Mashtots Institute of Ancient Manuscripts in Yerevan, Armenia.Following Stepanos Orbelian's death in 1305, Momik began carving a khachkar in honor of the great historian, completing in 1306.Momik was the author of the miniatures for the Gospel, ""Entombment"" and ""Angel Appearing to Holy Women"", created in Glazdor in 1302, of the building of Astvatsatsin church in Areni village (1321), of its wonderful reliefs and of a number of khachkars. He also designed and carved the masterpiece church of S. Astvatsatsin at Noravank Monastery in Armenia.",https://en.wikipedia.org/wiki/Momik
59,Australia,33,Glenn Murcutt,http://www.wikidata.org/entity/Q333509,wd:Q333509,1820386,"Glenn Marcus Murcutt AO (born 25 July 1936) is an Australian architect and winner of the 1992 Alvar Aalto Medal, the 2002 Pritzker Architecture Prize, the 2009 American Institute of Architects Gold Medal and the 2021 Praemium Imperiale.  Glenn Murcutt works as a sole practitioner without staff, builds only within Australia and is known to be very selective with his projects. Being the only Australian winner of the prestigious Pritzker Prize, he is often referred to as Australia's most famous architect.

",https://en.wikipedia.org/wiki/Glenn_Murcutt
83,Austria,58,Adolf Loos,http://www.wikidata.org/entity/Q44323,wd:Q44323,53604,"Adolf Franz Karl Viktor Maria Loos
(German pronunciation: [ˈaːdɔlf loːs]; 10 December 1870 – 23 August 1933) was an Austrian architect and influential European theorist of modern architecture. His essay Ornament and Crime advocated smooth and clear surfaces in contrast to the lavish decorations of the fin de siècle, as well as the more modern aesthetic principles of the Vienna Secession, exemplified in his design of Looshaus, Vienna. Loos became a pioneer of modern architecture and contributed a body of theory and criticism of Modernism in architecture and design and developed the ""Raumplan"" (literally spatial plan) method of arranging interior spaces, exemplified in Villa Müller in Prague.
Loos had three tumultuous marriages that all ended in divorce. He suffered from poor health, including an inherited hearing affliction. He was convicted as a pedophile in 1928 for exploiting girls from poor families, aged 8 to 10. He died aged 62 on 23 August 1933 in Kalksburg near Vienna.",https://en.wikipedia.org/wiki/Adolf_Loos
106,Azerbaijan,18,Georgios Candilis,http://www.wikidata.org/entity/Q1377712,wd:Q1377712,40730473,"Georges Candilis (Greek: Γεώργιος Κανδύλης; Baku, Russian Empire, 29 March 1913 – Paris, 10 May 1995) was a Greek-French architect and urbanist.",https://en.wikipedia.org/wiki/Georges_Candilis
126,Bangladesh,27,Fazlur Khan,http://www.wikidata.org/entity/Q62918,wd:Q62918,1286023,"Fazlur Rahman Khan (Bengali: ফজলুর রহমান খান, Fozlur Rôhman Khan; 3 April 1929 – 27 March 1982) was a Bangladeshi-American structural engineer and architect, who initiated important structural systems for skyscrapers. Considered the ""father of tubular designs"" for high-rises, Khan was also a pioneer in computer-aided design (CAD). He was the designer of the Sears Tower, since renamed Willis Tower, the tallest building in the world from 1973 until 1998 and the 100-story John Hancock Center.
A partner in the firm Skidmore, Owings & Merrill in Chicago, Khan, more than any other individual, ushered in a renaissance in skyscraper construction during the second half of the 20th century. He has been called the ""Einstein of structural engineering"" and the ""Greatest Structural Engineer of the 20th Century"" for his innovative use of structural systems that remain fundamental to modern skyscraper design and construction. In his honor, the Council on Tall Buildings and Urban Habitat established the Fazlur Khan Lifetime Achievement Medal, as one of their CTBUH Skyscraper Awards.
Although best known for skyscrapers, Khan was also an active designer of other kinds of structures, including the Hajj airport terminal, the McMath–Pierce solar telescope and several stadium structures.

",https://en.wikipedia.org/wiki/Fazlur_Rahman_Khan
158,Belarus,14,Klaudzi Duzh-Dusheuski,http://www.wikidata.org/entity/Q3495280,wd:Q3495280,26666930,"Klawdziy Stsyapanavich Duzh-Dushewski (Belarusian: Клаўдзій Сцяпанавіч Дуж-Душэўскі, Lithuanian: Klaudijus Dušauskas-Duž; 27 March 1891 – 25 February 1959) was a Belarusian civil engineer, architect, diplomat and journalist. He is believed to be the creator of the Flag of Belarus in 1917.",https://en.wikipedia.org/wiki/Klawdziy_Duzh-Dushewski
174,Belgium,48,Victor Horta,http://www.wikidata.org/entity/Q49744,wd:Q49744,421318,"Victor Pierre Horta (French: [ɔʁta]; Victor, Baron Horta after 1932; 6 January 1861 – 8 September 1947) was a Belgian architect and designer, and one of the founders of the Art Nouveau movement. His Hôtel Tassel in Brussels, built in 1892–93, is often considered the first Art Nouveau house. The curving stylized vegetal forms that Horta used influenced many others, including architect Hector Guimard, who used it in the first house he designed in Paris and in the entrances he designed for the Paris Metro. He is also considered a precursor of modern architecture for his open floor plans and his innovative use of iron, steel and glass.Horta's later work moved away from Art Nouveau, and became more geometric and formal, with classical touches, such as columns. He made a highly original use of steel frames and skylights to bring light into the structures, open floor plans, and finely-designed decorative details. His later major works included the Maison du Peuple/Volkshuis (1895–1899); Brussels' Centre for Fine Arts (1923–1929); and Brussels Central Station (1913–1952).
In 1932, King Albert I conferred on Horta the title of Baron for his services to the field of architecture. Four of the buildings he designed have been designated a UNESCO World Heritage Site.

",https://en.wikipedia.org/wiki/Victor_Horta
194,Belize,7,Esther Ayuso,http://www.wikidata.org/entity/Q21165247,wd:Q21165247,48174362,"Esther Ayuso,  (born November 1958) was the first female Belizean architect. She is known for her designs to improve hospitals in Belize including Belize Medical Associates, the Cleopatra White Polyclinic, Matron Robert polyclinic, the Hoy Eye Clinic and the PICU/NICU wing of Karl Heusner Memorial Hospital due to be completed in 2015. She has served as a Senator and as the Chair of the National Women's Commission, as well as the Belizean delegate to the Inter-American Commission of Women. In 2015 she was awarded the Most Excellent Order of the British Empire for contributions to the community.",https://en.wikipedia.org/wiki/Esther_Ayuso
198,Benin,8,Paul Ahyi,http://www.wikidata.org/entity/Q3743747,wd:Q3743747,25770222,"Paul Ahyi (January 15, 1930 – January 4, 2010) was a Togolese artist, sculptor, architect, painter, interior designer and author.  Ahyi is credited with designing of the flag of Togo.Ahyi was known for his massive outdoor artworks, reliefs and sculptures, including his contributions to the Independence Monument in Lomé, which commemorates the country's independence from France.  Other outdoor sculptures and statues by Ahyi can be found on buildings and in parks throughout Togo, as well as the Vatican, Senegal, Benin, Côte d’Ivoire, Nigeria and South Korea.He also created his pieces using a wide array of mediums including jewelry, pottery, ceramics and tapestries. He was also an interior designer who created household objects and art pieces.",https://en.wikipedia.org/wiki/Paul_Ahyi
200,Bhutan,6,Dorji Yangki,http://www.wikidata.org/entity/Q1245423,wd:Q1245423,49344112,"Dorji Yangki is one of the first female architects from Bhutan.She studied architecture at Deakin University in Melbourne, Australia, and later studied in England, Norway, and Japan. From 2008 until 2009 she held the Loeb Fellowship at the Harvard Graduate School of Design. She also completed a Masters in historic buildings at the British University of York.
Dorji is the first elected female President of the Bhutan Association of Architects and the first female Chair of SAARCH  (South Asian Association for Regional Cooperation of Architects). Dorji is currently one of the only actively practicing female Bhutanese Principal Architects leading a private firm in BhutanSince graduating in 1996, she selected as the first local architect in Bhutan to work on the conservation of heritage sites in Bhutan. As the pioneering Head of the office for Conservation of Heritage Sites at the Ministry for the Home and Cultural Affairs, for over 15 years, Dorji not only helped establish the first office for the conservation of heritage sites, she also drafted the first Bhutan Guidelines for the conservation of heritage sites in Bhutan and initiated the first training workshops in this field. One of her key initiatives was also the incorporation of traditional local architectural concepts and craftsmanship into new architecture and construction in Bhutan.At the office she worked not only as Principal Architect but also as the project coordinator/Director in numerous projects. Some of the projects include the restoration of the famous monastery Takshang (Tiger's Nest) in Paro after the fire of 1998, the establishment of the first Folk Heritage Museum, the renovation of the Thimphu Memorial Chorten, the Dechenphug monastery, the Trongsa Dzong fortress and the Simtokha Dzong fortress among many others.Some of her key new architectural design works include the design of the National Archives of Bhutan (which was the first climate controlled building in Bhutan), the Office /gallery building of the National Museum, the offices of the Royal Academy of Performing Arts, the Chukha Dzong redesign, the Pangrizampa School of Astrology, the Ugyen Pema Woedling Zangdol Palri temple at Paro, the Smithsonion Folk life Bhutanese temple, and the new Guru Rimpoche Temple at Dechenphug monastery. She also helped curate and design the first exhibitions on Bhutanese culture held outside of Bhutan in the National Museums in Delhi and Kolkata.
Following her passion for sustainable architecture, Dorji was responsible for helping the Ministry of Works and Human Settlements of Bhutan to establish the first Guidelines for the introduction of Green Buildings in Bhutan in 2013. She was also instrumental in leading the drafting of the Bhutanese Architecture Guidelines 2014, for the design of new buildings and cities in the nation. With the Royal University of Bhutan, Dorji was one of the key advisers to help set up the course for the very first degree in Architecture within Bhutan.  
As a native from Bhutan, a country that follows the principle of ‘GNH’ or Gross National Happiness, Dorji advocates for sustainable Biophilic design and planning that has a sense of place, connects people to nature and helps to initiate happiness among people.",https://en.wikipedia.org/wiki/Dorji_Yangki
201,Bolivia,12,Teresa Gisbert Carbonell,http://www.wikidata.org/entity/Q16438439,wd:Q16438439,44166035,"Teresa Gisbert Carbonell de Mesa (November 30, 1926 – February 19, 2018) was a Bolivian architect and art historian. She specialized in the history of the Andean region.",https://en.wikipedia.org/wiki/Teresa_Gisbert
208,Bosnia and Herzegovina,16,Ksenia Milicevic,http://www.wikidata.org/entity/Q2625077,wd:Q2625077,24770736,"Ksenia Milicevic (born September 15, 1942) is a French painter, architect and town planner. She is based in Paris, with a studio in Bateau-Lavoir in Montmartre and also maintains a base in South West France.",https://en.wikipedia.org/wiki/Ksenia_Milicevic
227,Brazil,41,Lucio Costa,http://www.wikidata.org/entity/Q298926,wd:Q298926,766384,"Lúcio Marçal Ferreira Ribeiro Lima Costa  (27 February 1902 – 13 June 1998) was a Brazilian architect and urban planner, best known for his plan for Brasília.",https://en.wikipedia.org/wiki/L%C3%BAcio_Costa
249,Bulgaria,18,Sunay Erdem,http://www.wikidata.org/entity/Q18393109,wd:Q18393109,44246985,"Sunay Erdem (born 17 March 1971) is a Turkish Landscape architect (graduated) and self-taught Architect. He is one of Turkey's most prolific and best Landscape architects of his generation. Sunay Erdem founded Erdem Architects with his brother, Günay Erdem, in 1998.
Sunay Erdem designed many urban design projects in more than 40 different countries. Erdem has been using free-hand sketching method since 1992 and he has more than 700 free-hand perspectives. His water colored sketch won the first prize in 2013 Sketch Showdown Competition, Mixed Media which was organized by Philadelphia Center for Architecture. He won Turkish National Architecture Award in the category Presentation of Ideas (2010). Sunay Erdem also won Turkish National Landscape Architecture Awards in 2009, 2010 and 2013 which were given by Chamber of Landscape Architects in Turkey. One of the important projects developed by Sunay Erdem is the wall project for the US-Mexico border.",https://en.wikipedia.org/wiki/Sunay_Erdem
270,Burkina Faso,9,Diébédo Francis Kéré,http://www.wikidata.org/entity/Q99416,wd:Q99416,25986110,"Diébédo Francis Kéré is an architect who was born April 10, 1965 in Gando, Burkina Faso and studied at the Technical University of Berlin. Since 1985, he has been living in Berlin, Germany, where he set up Kéré Architecture. Parallel to his studies, he established the Kéré Foundation e.V. (formerly Schulbausteine für Gando e.V.), and in 2005 he founded Kéré Architecture. His architectural practice has been recognized nationally and internationally with awards including the Aga Khan Award for Architecture (2004) for his first building, the Gando Primary School in Burkina Faso, and the Global Holcim Award 2012 Gold. Kéré has undertaken projects in varied countries including Burkina Faso, Mali, Germany, the United States, Kenya, and Uganda. In 2017 the Serpentine Galleries commissioned him to design the Serpentine Pavilion in London. He has held professorships at the Harvard Graduate School of Design, Yale School of Architecture and the Swiss Accademia di Architettura di Mendrisio. In 2017 he accepted the professorship for ""Architectural Design and Participation"" at TU München (Germany).",https://en.wikipedia.org/wiki/Di%C3%A9b%C3%A9do_Francis_K%C3%A9r%C3%A9
271,Burundi,7,Costas Kondylis,http://www.wikidata.org/entity/Q1136471,wd:Q1136471,6385633,"Costas Kondylis (1940 – August 18, 2018) was an American architect. He designed over 85 buildings in New York City, many of them for real-estate developer and later U.S. president Donald Trump, through his eponymous architectural firm.Kondylis was born in Burundi, though his parents were from Greece; he ultimately ended up attending boarding school there. He attained master's degrees at the University of Geneva and at Columbia University. After receiving his master's degrees in 1967, Kondylis worked at Davis, Brody & Associates, and then at Philip Birnbaum & Associates. In 1989, Kondylis created Costas Kondylis and Partners; the firm's work was featured in several magazines and was the subject of a television documentary. Costas Kondylis and Partners, which was headquartered in New York City, dissolved in 2009. Afterward, he created another firm called Kondylis Design. Kondylis died on August 18, 2018, of undisclosed causes.",https://en.wikipedia.org/wiki/Costas_Kondylis
272,Cambodia,10,Vann Molyvann,http://www.wikidata.org/entity/Q379178,wd:Q379178,12398858,"Vann Molyvann (Khmer: វណ្ណ ម៉ូលីវណ្ណ; 23 November 1926 – 28 September 2017) was a Cambodian architect.  During the Sangkum Reastr Niyum regime (1955–1970), Prince Norodom Sihanouk enacted a development policy encompassing the whole kingdom with the construction of new towns, infrastructure and architecture.  Vann was the foremost of a generation of architects who contributed to the unique style of architecture that emerged during this era and that has been coined New Khmer Architecture.  In 1997 Darryl Collins Historian and Helen Grant Ross Architect Historian, two lecturers at the Royal University of Fine Arts, Phnom Penh, questioned the history behind this heritage of modern architecture that all could see throughout the land, but that everybody had forgotten due to the troubled history of the Kingdom.  After nearly 10 years of research in 2006 they published the facts.  In the meantime they produced exhibitions, participated in university conferences, and wrote many articles in the press about the phenomenon known as New Khmer Architecture, and the accomplishments of Vann Molyvann who was still alive and who they had interviewed lengthily.",https://en.wikipedia.org/wiki/Vann_Molyvann
274,Cameroon,6,Isaac Menyoli,http://www.wikidata.org/entity/Q2238468,wd:Q2238468,18249975,"Isaac Menyoli (born 6 August 1972) is a Cameroonian architect and skier who was the first person to represent his country at the Winter Olympic Games when he took part in the 2002 Winter Olympics in Salt Lake City. He competed in the men's classical 10 km race in cross-country skiing, finishing 80th and last with a time of 45:40.3. He also took part in the 1.5 km sprint, where he finished 67th out of 71, with a time of 4:10.07, just behind Philip Boit of Kenya.The Australian Broadcasting Corporation reported that he had been ""voted the day's best Olympian overnight"", and described him as a Winter Olympics' version of Eric the Eel.Menyoli's stated aim as a competitor was not to win a medal, but to attract media attention (as a Cameroonian skier) so as to speak up, in front of a global audience, about the prevalence of AIDS in his country, and specifically in his home town of Buea.Menyoli explained that many people in Buea were not convinced of the threat posed by AIDS and that he hoped to persuade them by being interviewed during an international event. ""I want to ski for a reason. I want to tell people that they really have to watch out, that AIDS is serious.""",https://en.wikipedia.org/wiki/Isaac_Menyoli
276,Canada,71,Frank Gehry,http://www.wikidata.org/entity/Q180374,wd:Q180374,53404,"Frank Owen Gehry, , FAIA (; born Frank Owen Goldberg; (1929 -02-28)February 28, 1929) is a Canadian-born American architect and designer. A number of his buildings, including his private residence in Santa Monica, California, have become world-renowned attractions.
His works are considered among the most important of contemporary architecture in the 2010 World Architecture Survey, leading Vanity Fair to call him ""the most important architect of our age"". He is also the designer of the National Dwight D. Eisenhower Memorial.

",https://en.wikipedia.org/wiki/Frank_Gehry
303,Cape Verde,4,Jorge Ferreira Chaves,http://www.wikidata.org/entity/Q6277979,wd:Q6277979,28975514,"Jorge Ferreira Chaves (22 February 1920 – 22 August 1981) was a Portuguese architect.
Some authors may refer to him as ""Jorge Chaves"" or simply ""Chaves"".
He was one of the architects responsible, in the latter part of the 1940s, for the establishment of the Modern Movement in Portugal.Professionally active between 1941 and 1981, he is considered one of the most perfectionist Portuguese architects. From 1946, in his office, he developed several dozens of projects for continental Portugal, the island of Madeira, Portuguese Guinea and Angola.He also collaborated with some of Lisbon's most important architectural offices of the first half of the 20th century: those of Joaquim Ferreira, Miguel Jacobetty Rosa and Porfírio Pardal Monteiro.",https://en.wikipedia.org/wiki/Jorge_Ferreira_Chaves
305,Chile,23,Alejandro Aravena,http://www.wikidata.org/entity/Q3609433,wd:Q3609433,39935926,"Alejandro Gastón Aravena Mori (born 22 June 1967) is a Chilean architect and executive director of the firm Elemental S.A.  He won the Pritzker Architecture Prize in 2016, and also, he was the director and curator of the Architecture Section of the 2016 Venice Biennale.",https://en.wikipedia.org/wiki/Alejandro_Aravena
322,Colombia,13,Bruce Graham,http://www.wikidata.org/entity/Q62570,wd:Q62570,1428886,"Bruce John Graham (December 1, 1925 – March 6, 2010) was a Peruvian-American architect. Graham built buildings all over the world and was deeply involved with evolving the Burnham Plan of Chicago. Among his most notable buildings are the Inland Steel Building, the Willis Tower (formerly the Sears Tower), and the John Hancock Center. 
He was also responsible for planning the  Broadgate and Canary Wharf developments in London.Architectural historian Franz Schulze called him ""the Burnham of his generation.""  He was a 1993 Pew Fellow.",https://en.wikipedia.org/wiki/Bruce_Graham
