,country,number,item,item_id,shortform,pageid,wikipedia_summary,wikipedia_url
339,Costa Rica,7,Claudia Dobles Camargo,http://www.wikidata.org/entity/Q51544231,wd:Q51544231,57099899,"Claudia Vanessa Dobles Camargo (born 19 November 1980) is a Costa Rican architect and urban planner. Dobles, the wife of President Carlos Alvarado Quesada, has served as the First Lady of Costa Rica since 8 May 2018. She is the first person from San Carlos to hold the position of first lady.",https://en.wikipedia.org/wiki/Claudia_Dobles_Camargo
346,Croatia,65,Marcus Vipsanius Agrippa,http://www.wikidata.org/entity/Q48174,wd:Q48174,19747,"Marcus Vipsanius Agrippa (; 63 BC  – 12 BC) was a Roman general, statesman, and architect who was a close friend, son-in-law, and lieutenant to the Roman emperor Augustus. He was responsible for the construction of some of the most notable buildings in history, including the original Pantheon, and is well known for his important military victories, notably the Battle of Actium in 31 BC against the forces of Mark Antony and Cleopatra. 
Born to a plebeian family of equestrian rank in 63 BC, in an uncertain location in Roman Italy, he met the future emperor Augustus, then known as Octavian, at Apollonia, in Illyria. Following the assassination of Octavian's great-uncle Julius Caesar in 44 BC, Octavian returned to Italy. Around this time, he was elected tribune of the plebs. Agrippa served as a military commander, fighting alongside Octavian and Caesar's former general and right-hand man Mark Antony in the Battle of Philippi. In 40 BC, he became the Praetor Urbanus (Urban Prefect) of Rome, managing the administration of the city. He played a major role in the Second Triumvirate's war against Lucius Antonius and Fulvia, respectively the brother and wife of Mark Antony. In 39 or 38 BC, Agrippa was appointed governor of Transalpine Gaul. In 38 BC he put down a rising of the Aquitanians and fought the Germanic tribes. He was consul for 37 BC, well below the usual minimum age of 43, to oversee the preparations for warfare against Sextus Pompey, who had cut off grain shipments to Rome.
Agrippa defeated Pompey in the battles of Mylae and Naulochus in 36 BC. In 33 BC, he served as Curule aedile. Agrippa commanded the victorious Octavian's fleet at the Battle of Actium in 31 BC. Following the victory at Actium, Octavian became emperor, and took the title of Augustus, while Agrippa remained as his close friend and lieutenant. Agrippa assisted Augustus in making Rome ""a city of marble."" Agrippa renovated aqueducts to provide Roman citizens from every social class access to the highest quality public services, and was responsible for the creation of many baths, porticoes, and gardens. He was also awarded powers almost as great as those of Augustus. He had veto power over the acts of the Senate and the power to present laws for approval by the People. He died in 12 BC at the age of 50–51. Augustus honored his memory with a magnificent funeral and spent over a month in mourning. His remains were placed in Augustus' own mausoleum.
Agrippa was also known as a writer, especially on geography. Under his supervision, Julius Caesar's design of having a complete survey of the empire made was accomplished. From the materials at hand he constructed a circular chart, which was engraved on marble by Augustus and afterwards placed in the colonnade built by his sister Vipsania Polla. Agrippa was also husband to Julia the Elder (who had later married the second Emperor Tiberius), and was the maternal grandfather of Caligula and the maternal great-grandfather of the Emperor Nero.",https://en.wikipedia.org/wiki/Marcus_Vipsanius_Agrippa
373,Cuba,7,Ricardo Porro,http://www.wikidata.org/entity/Q1453813,wd:Q1453813,31073104,"Ricardo Porro Hidalgo (November 1925 – 25 December 2014) was a Cuban-born architect. He graduated in architecture from the Universidad de la Habana (University of Havana) in 1949 and built this year his first project Villa Armenteros in Havana, following which he spent two years in post-graduate studies at the Institute of Urbanism at the Sorbonne.",https://en.wikipedia.org/wiki/Ricardo_Porro
390,Cyprus,10,Hermodorus of Salamis,http://www.wikidata.org/entity/Q1035625,wd:Q1035625,17424172,"Hermodorus of Salamis was an ancient Greek architect from Salamis, Cyprus who was highly active in ancient Rome between 146 BC and 102 BC, where his work includes the Temple of Jupiter Stator (2nd century BC) and the Temple of Mars. He also inspired Vitruvius and led the construction of the Navalia.",https://en.wikipedia.org/wiki/Hermodorus_of_Salamis
392,Czech Republic,58,Adolf Loos,http://www.wikidata.org/entity/Q44323,wd:Q44323,53604,"Adolf Franz Karl Viktor Maria Loos
(German pronunciation: [ˈaːdɔlf loːs]; 10 December 1870 – 23 August 1933) was an Austrian architect and influential European theorist of modern architecture. His essay Ornament and Crime advocated smooth and clear surfaces in contrast to the lavish decorations of the fin de siècle, as well as the more modern aesthetic principles of the Vienna Secession, exemplified in his design of Looshaus, Vienna. Loos became a pioneer of modern architecture and contributed a body of theory and criticism of Modernism in architecture and design and developed the ""Raumplan"" (literally spatial plan) method of arranging interior spaces, exemplified in Villa Müller in Prague.
Loos had three tumultuous marriages that all ended in divorce. He suffered from poor health, including an inherited hearing affliction. He was convicted as a pedophile in 1928 for exploiting girls from poor families, aged 8 to 10. He died aged 62 on 23 August 1933 in Kalksburg near Vienna.",https://en.wikipedia.org/wiki/Adolf_Loos
418,Côte d'Ivoire,8,Pierre Fakhoury,http://www.wikidata.org/entity/Q3384954,wd:Q3384954,13196904,"Pierre Fakhoury (born in Dabou, 
Côte d'Ivoire) is a Lebanese/Ivorian architect. He graduated at the School of Architecture at Tournai, Belgium.
His notable work includes the Basilica of Our Lady of Peace in Yamoussoukro, Côte d'Ivoire. Since 1983, Fakhoury has been involved in the relocation of the capital of Côte d'Ivoire from Abidjan to Yamoussoukro.",https://en.wikipedia.org/wiki/Pierre_Fakhoury
422,Denmark,39,Nicolai Abildgaard,http://www.wikidata.org/entity/Q319854,wd:Q319854,21949,"Nicolai Abraham Abildgaard (11 September 1743 – 4 June 1809) was a Danish neoclassical and royal history painter, sculptor, architect, and professor of painting, mythology, and anatomy at the New Royal Danish Academy of Art in Copenhagen, Denmark. Many of his works were in the royal Christiansborg Palace (some destroyed by fire 1794), Fredensborg Palace, and Levetzau Palace at Amalienborg.",https://en.wikipedia.org/wiki/Nicolai_Abildgaard
442,Dominican Republic,11,Carlos de la Mota,http://www.wikidata.org/entity/Q2939521,wd:Q2939521,41080795,"Carlos de la Mota (October 19, 1974, Concepcion de la Vega, Dominican Republic) is a Dominican architect, actor and singer. His acting career began in 2003 and he received critical acclaim for his role in the telenovela Destilando Amor, as Britishman James O'Brian.",https://en.wikipedia.org/wiki/Carlos_de_la_Mota
452,Ecuador,38,Sixto Durán-Ballén,http://www.wikidata.org/entity/Q177182,wd:Q177182,744505,"Sixto Alfonso Durán-Ballén Cordovez (July 14, 1921 – November 15, 2016) was an Ecuadorian political figure and architect. He served as Mayor of Quito between 1970 and 1978. In 1951, he co-founded a political party, the Social Christian Party. In 1991, he left the Social Christian Party and formed a new conservative group, the Republican Union Party (PUR), before running for president for the third time in 1992.Durán-Ballén was elected as President of Ecuador in 1992. He served as congressman in 1984 and again in 1998. he helped to modernize the Ecuadorian economy while facing challenges from the World Bank and oversaw and resolved the Cenepa War during the last years of his presidency. He received positive ratings, upon leaving office four years later on August 10, 1996. His presidency was seen favorably by the public polls, but received mixed opinions from scholars.",https://en.wikipedia.org/wiki/Sixto_Dur%C3%A1n_Ball%C3%A9n
464,Egypt,29,Senenmut,http://www.wikidata.org/entity/Q328732,wd:Q328732,546188,"Senenmut (Ancient Egyptian: sn-n-mwt, sometimes spelled Senmut, Senemut, or Senmout) was an 18th Dynasty ancient Egyptian architect and government official. His name translates literally as ""mother's brother.""",https://en.wikipedia.org/wiki/Senenmut
481,El Salvador,3,Rubén Martínez,http://www.wikidata.org/entity/Q14838817,wd:Q14838817,58170588,"Rubén Martínez Bulnes (born July 7, 1929) is a Salvadoran architect and sculptor. He is considered the author of the country's most prolific sculptural art.",https://en.wikipedia.org/wiki/Rub%C3%A9n_Mart%C3%ADnez_Bulnes
484,Estonia,12,Georg Kuphaldt,http://www.wikidata.org/entity/Q67490,wd:Q67490,22607616,"Georg Friedrich Ferdinand Kuphaldt (Latvian: Georgs Frīdrīhs Ferdinands Kūfalts) (6 June 1853 in Plön, Holstein – 14 April 1938 in Berlin, Germany) was an influential German landscape architect, gardener and dendrologist of the Russian Empire.At the age of 27, Kuphaldt was promoted to the perhaps most prestigeful position in his career as director of the city gardens and parks in Riga. The following almost 35 years he was in charge of establishing and developing the newly created administration of the city's gardens and parks, of which structures has been preserved until today. In the period from 1880 to 1914 he was also involved in planning parks and gardens throughout the Russian Empire. Some of the most renowned works of Kuphaldt are the gardens of the Winter Palace and Oranienbaum in Saint Petersburg as well as locations in Nizhny Novgorod, Dagomys in Sochi, Tsarskoye Selo and Catharinenthal Palace in Reval (now Tallinn).",https://en.wikipedia.org/wiki/Georg_Kuphaldt
502,Fiji,3,Ron Sang,http://www.wikidata.org/entity/Q7364357,wd:Q7364357,38493081,"Ronald Fong Sang  (11 July 1938 – 11 June 2021) was a New Zealand architect, art collector, art exhibitor and publisher of New Zealand art books.",https://en.wikipedia.org/wiki/Ron_Sang
504,Finland,86,Alvar Aalto,http://www.wikidata.org/entity/Q82840,wd:Q82840,2009,"Hugo Alvar Henrik Aalto (pronounced [ˈhuːɡo ˈɑlʋɑr ˈhenrik ˈɑːlto]; 3 February 1898 – 11 May 1976) was a Finnish architect and designer. His work includes architecture, furniture, textiles and glassware, as well as sculptures and paintings. He never regarded himself as an artist, seeing painting and sculpture as ""branches of the tree whose trunk is architecture."" Aalto's early career ran in parallel with the rapid economic growth and industrialization of Finland during the first half of the 20th century. Many of his clients were industrialists, among them the Ahlström-Gullichsen family. The span of his career, from the 1920s to the 1970s, is reflected in the styles of his work, ranging from Nordic Classicism of the early work, to a rational International Style Modernism during the 1930s to a more organic modernist style from the 1940s onwards. 
Typical for his entire career is a concern for design as a Gesamtkunstwerk, a total work of art, in which he – together with his first wife Aino Aalto – would design the building, and give special treatment to the interior surfaces, furniture, lamps and glassware. His furniture designs are considered Scandinavian Modern, in the sense of a concern for materials, especially wood, and simplification but also technical experimentation, which led him to receiving patents for various manufacturing processes, such as bent wood. As a designer he is celebrated as the inventor of bent plywood furniture. The Alvar Aalto Museum, designed by Aalto himself, is located in what is regarded as his home city Jyväskylä.",https://en.wikipedia.org/wiki/Alvar_Aalto
523,France,170,Le Corbusier,http://www.wikidata.org/entity/Q4724,wd:Q4724,17900,"Charles-Édouard Jeanneret (6 October 1887 – 27 August 1965), known as Le Corbusier (UK:  lə kor-BEW-zee-ay, US:  lə KOR-boo-ZYAY, -⁠SYAY, French: [lə kɔʁbyzje]; roughly, ""the crow-like one""), was a Swiss-French architect, designer, painter, urban planner, writer, and one of the pioneers of what is now regarded as modern architecture. He was born in Switzerland and became a French citizen in 1930. His career spanned five decades, and he designed buildings in Europe, Japan, India, and North and South America.
Dedicated to providing better living conditions for the residents of crowded cities, Le Corbusier was influential in urban planning, and was a founding member of the Congrès International d'Architecture Moderne (CIAM). Le Corbusier prepared the master plan for the city of Chandigarh in India, and contributed specific designs for several buildings there, especially the government buildings.
On 17 July 2016, seventeen projects by Le Corbusier in seven countries were inscribed in the list of UNESCO World Heritage Sites as The Architectural Work of Le Corbusier, an Outstanding Contribution to the Modern Movement.Le Corbusier remains a controversial figure. Some of his urban planning ideas have been criticized for their indifference to pre-existing cultural sites, societal expression and equity, and his ties with fascism, antisemitism and the dictator Benito Mussolini have resulted in some continuing contention.",https://en.wikipedia.org/wiki/Le_Corbusier
552,Georgia,31,Zurab Tsereteli,http://www.wikidata.org/entity/Q1358703,wd:Q1358703,6870129,"Zurab Konstantinovich Tsereteli (Georgian: ზურაბ კონსტანტინეს ძე წერეთელი, Russian: Зураб Константинович Церетели; born 4 January 1934) is a Georgian-Russian painter, sculptor and architect known for large-scale and at times controversial monuments. Tsereteli has served as the President of the Russian Academy of Arts since 1997.",https://en.wikipedia.org/wiki/Zurab_Tsereteli
564,Ghana,16,David Adjaye,http://www.wikidata.org/entity/Q1173530,wd:Q1173530,3975088,"Sir David Frank Adjaye   (born 22 September 1966) is a Ghanaian-British architect. He is known for having designed many notable buildings around the world, including the  National Museum of African American History and Culture in Washington, D.C. Adjaye was knighted in the 2017 New Year Honours for services to architecture. He is the recipient of the 2021 Royal Gold Medal, making him the first African recipient and one of the youngest recipients.",https://en.wikipedia.org/wiki/David_Adjaye
585,Greece,106,El Greco,http://www.wikidata.org/entity/Q301,wd:Q301,140639,"Domḗnikos Theotokópoulos (Greek: Δομήνικος Θεοτοκόπουλος [ðoˈminikos θeotoˈkopulos]; 1 October 1541 –  7 April 1614), most widely known as El Greco (""The Greek""), was a Greek painter, sculptor and architect of the Spanish Renaissance. ""El Greco"" was a nickname, and the artist normally signed his paintings with his full birth name in Greek letters, Δομήνικος Θεοτοκόπουλος (Domḗnikos Theotokópoulos), often adding the word Κρής (Krḗs), which means Cretan.
El Greco was born in the Kingdom of Candia (modern Crete), which was at that time part of the Republic of Venice, Italy, and the center of Post-Byzantine art. He trained and became a master within that tradition before traveling at age 26 to Venice, as other Greek artists had done. In 1570, he moved to Rome, where he opened a workshop and executed a series of works. During his stay in Italy, El Greco enriched his style with elements of Mannerism and of the Venetian Renaissance taken from a number of great artists of the time, notably Tintoretto. In 1577, he moved to Toledo, Spain, where he lived and worked until his death. In Toledo, El Greco received several major commissions and produced his best-known paintings, such as View of Toledo and Opening of the Fifth Seal.
El Greco's dramatic and expressionistic style was met with puzzlement by his contemporaries but found appreciation by the 20th century. El Greco is regarded as a precursor of both Expressionism and Cubism, while his personality and works were a source of inspiration for poets and writers such as Rainer Maria Rilke and Nikos Kazantzakis. El Greco has been characterized by modern scholars as an artist so individual that he belongs to no conventional school. He is best known for tortuously elongated figures and often fantastic or phantasmagorical pigmentation, marrying Byzantine traditions with those of Western painting.",https://en.wikipedia.org/wiki/El_Greco
615,Guatemala,6,Teddy Cruz,http://www.wikidata.org/entity/Q17350521,wd:Q17350521,45468222,"Teddy Cruz (born 1962 in Guatemala City, Guatemala) is an American architect, urbanist, Professor in Ancient Architecture and Urbanism in the Visual Arts Department at the University of California, San Diego. Cruz studied at Rafael Landivar University in Guatemala City, Guatemala, but moved to the United States at the age of 20, continuing his education at California State Polytechnic University, San Luis Obispo, and the Harvard Graduate School of Design in Cambridge, Massachusetts.
Cruz is the founder and president of Estudio Teddy Cruz + Fonna Forman, a research-based political and architectural practice based in San Diego, in partnership with University of California, San Diego political theorist, Fonna Forman. Cruz and Forman lead a variety of urban curatorial initiatives, including The Civic Innovation Lab in the City of San Diego to rethink public space and civic engagement; the UCSD Cross-Border Initiative to promote research and practice focused on regional territories of poverty; and the UCSD Community Stations, to foster corridors of knowledge exchange between the university and marginalized communities. Additionally, they collaborated with former Bogota Mayor Antanas Mockus to develop the Bi-national Citizenship Culture Survey, an unprecedented protocol that surveyed cross-border civic infrastructure, public trust and social norms, to generate new shared urban policies between the municipalities of San Diego and Tijuana, as well as collaborative strategies for cross-border urban intervention.
Cruz's architectural and intellectual projects have been exhibited at internationally renowned venues, including: the Tijuana Cultural Center, Museum of Contemporary Art San Diego, Carnegie Museum of Art, Walker Art Center, San Francisco Art Institute, Casa de America in Madrid, Spain, and Small Scale, Big Change: New Architectures of Social Engagement at the Museum of Modern Art.  Apart from his design work, Cruz's project at UCSD, Community Stations, champions the mutual exchange of knowledge between universities and communities, the latter of which he feels have their own valuable resources and assets that are often overlooked.",https://en.wikipedia.org/wiki/Teddy_Cruz
620,Haiti,4,Charles Frédéric Chassériau,http://www.wikidata.org/entity/Q2959137,wd:Q2959137,31400032,"Baron Charles Frédéric Chassériau du Chiron (29 January 1802 – 11 January 1896) was a French architect and painter, who served as chief architect of the cities of Marseille, Algiers, in Algeria; and Cairo, in Egypt. He is particularly known for having designed the seafront of the city of Algiers.",https://en.wikipedia.org/wiki/Charles_Fr%C3%A9d%C3%A9ric_Chass%C3%A9riau
626,Hungary,57,Ernő Rubik,http://www.wikidata.org/entity/Q186089,wd:Q186089,335331,"Ernő Rubik (Hungarian: [ˈrubik ˈɛrnøː]; born 13 July 1944) is a Hungarian inventor, architect and professor of architecture. He is best known for the invention of mechanical puzzles including the Rubik's Cube (1974), Rubik's Magic, Rubik's Magic: Master Edition, and Rubik's Snake.While Rubik became famous for inventing the Rubik's Cube and his other puzzles, much of his recent work involves the promotion of science in education. Rubik is involved with several organizations such as Beyond Rubik's Cube, the Rubik Learning Initiative and the Judit Polgar Foundation all of whose aim is to engage students in science, mathematics, and problem solving at a young age.",https://en.wikipedia.org/wiki/Ern%C5%91_Rubik
651,Iceland,15,Guðjón Samúelsson,http://www.wikidata.org/entity/Q1238310,wd:Q1238310,5948246,"Guðjón Samúelsson (16 April 1887 – 25 April 1950) was a State Architect of Iceland, and the first Icelander to be educated in architecture. He's been described as one of Iceland's most influential architects. His notable designs include the main building of the University of Iceland, the National Theatre of Iceland, the Landakot Roman Catholic Cathedral in Reykjavík, and the Church of Akureyri. His final and most recognized work is the Hallgrímskirkja church, which was commissioned in 1937.",https://en.wikipedia.org/wiki/Gu%C3%B0j%C3%B3n_Sam%C3%BAelsson
666,India,25,Balkrishna Doshi,http://www.wikidata.org/entity/Q380449,wd:Q380449,2250207,"Balkrishna Vithaldas Doshi OAL (born 26 August 1927) is an Indian architect. He is considered to be an important figure of Indian architecture and noted for his contributions to the evolution of architectural discourse in India. Having worked under Le Corbusier and Louis Kahn, he is a pioneer of modernist and brutalist architecture in India.
His more noteworthy designs include the IIM Bangalore, IIM Udaipur, NIFT Delhi, Amdavad ni Gufa, CEPT University, and the Aranya Low Cost Housing development in Indore which was awarded the Aga Khan Award for Architecture.In 2018, he became the first Indian architect to receive the Pritzker Architecture Prize, which is considered one of the most prestigious prizes in architecture. He has also been awarded the Padma Shri and the Padma Bhushan. He has been awarded the Royal Institute of British Architects' Royal Gold Medal for 2022.",https://en.wikipedia.org/wiki/B._V._Doshi
688,Indonesia,9,Wolff Schoemaker,http://www.wikidata.org/entity/Q17919,wd:Q17919,28185273,"Charles Prosper Wolff Schoemaker (25 July 1882 – 22 May 1949) was a Dutch architect who designed several distinguished Art Deco buildings in Bandung, Indonesia, including the Villa Isola and Hotel Preanger. He has been described as ""the Frank Lloyd Wright of Indonesia,"" and Wright had a considerable influence on Schoemaker's modernist designs. Although he was primarily known as an architect, he was also a painter and sculptor.",https://en.wikipedia.org/wiki/Charles_Prosper_Wolff_Schoemaker
702,Iran,64,Nasir al-Din al-Tusi,http://www.wikidata.org/entity/Q302835,wd:Q302835,33642424,"Muhammad ibn Muhammad ibn al-Hasan al-Tūsī (Persian: محمد ابن محمد ابن حسن طوسی 18 February 1201 – 26 June 1274), better known as Nasir al-Din al-Tusi (Persian: نصیر الدین طوسی; or simply Tusi  in the West), was a Persian polymath, architect, philosopher, physician, scientist, and theologian. Nasir al-Din al-Tusi was a well published author, writing on subjects of math, engineering, prose, and mysticism. Additionally, al-Tusi made several scientific advancements. In astronomy, al-Tusi created very accurate tables of planetary motion, an updated planetary model, and critiques of Ptolemaic astronomy. He also made strides in logic, mathematics but especially trigonometry, biology, and chemistry. Nasir al-Din al-Tusi left behind a great legacy as well. Some consider Tusi one of the greatest scientists of medieval Islam, since he is often considered the creator of trigonometry as a mathematical discipline in its own right.
The  Muslim scholar Ibn Khaldun (1332–1406) considered Tusi to be the greatest of the later Persian scholars. There is also reason to believe that he may have influenced Copernican heliocentrism. Nasir also proposed a relationship between humans and animals with some holding a higher level or awareness hinting at an evolutionary theory (though markedly different from modern evolutionary theory). 

",https://en.wikipedia.org/wiki/Nasir_al-Din_al-Tusi
