,country,number,item,item_id,shortform,pageid,wikidata_description,wikipedia_summary,wikipedia_url
642,Libya,100,Eratosthenes,http://www.wikidata.org/entity/Q43182,wd:Q43182,46117,"greek mathematician, geographer, poet, astronomer, librarian and music theorist","Eratosthenes of Cyrene (; Greek: Ἐρατοσθένης [eratostʰénɛːs]; c. 276 BC – c. 195/194 BC) was a Greek polymath: a mathematician, geographer, poet, astronomer, and music theorist. He was a man of learning, becoming the chief librarian at the Library of Alexandria. His work is comparable to what is now known as the study of geography, and he introduced some of the terminology still used today.He is best known for being the first person known to calculate the circumference of the Earth, which he did by using the extensive survey results he could access in his role at the Library; his calculation was remarkably accurate. He was also the first to calculate Earth's axial tilt, which also proved to have remarkable accuracy. He created the first global projection of the world, incorporating parallels and meridians based on the available geographic knowledge of his era.
Eratosthenes was the founder of scientific chronology; he endeavoured to revise the dates of the main events of the semi-mythological Trojan War, dating the Sack of Troy to 1183 BC. In number theory, he introduced the sieve of Eratosthenes, an efficient method of identifying prime numbers.
He was a figure of influence in many fields. According to an entry in the Suda (a 10th-century encyclopedia), his critics scorned him, calling him Beta (the second letter of the Greek alphabet) because he always came in second in all his endeavours. Nonetheless, his devotees nicknamed him Pentathlos after the Olympians who were well rounded competitors, for he had proven himself to be knowledgeable in every area of learning. Eratosthenes yearned to understand the complexities of the entire world.",https://en.wikipedia.org/wiki/Eratosthenes
646,Liechtenstein,27,Franz Joseph I,http://www.wikidata.org/entity/Q452240,wd:Q452240,1004564,"8th Prince of Liechtenstein, 1772-1781 (1726-1781)","Franz Joseph I, Prince of Liechtenstein, born Franz de Paula Josef Johann Nepomuk Andreas (19 November 1726 – 18 August 1781), was the Prince of Liechtenstein from 1772 until his death.","https://en.wikipedia.org/wiki/Franz_Joseph_I,_Prince_of_Liechtenstein"
654,Lithuania,70,Władysław II Jagiełło,http://www.wikidata.org/entity/Q54049,wd:Q54049,42586,Grand Duke of Lithuania and King of Poland (1362-1434),"Jogaila (Jogaila), later Władysław II Jagiełło (Polish pronunciation: [vwaˈdɨswaf jaˈɡʲɛwːɔ] (listen)) (c. 1352/1362 – 1 June 1434) was Grand Duke of Lithuania (1377–1434) and then King of Poland (1386–1434), first alongside his wife Jadwiga until 1399, and then sole ruler of Poland. He ruled in Lithuania from 1377. Born a pagan, in 1386 he converted to Catholicism and was baptized as Władysław in Kraków, married the young Queen Jadwiga, and was crowned King of Poland as Władysław II Jagiełło. In 1387 he converted Lithuania to Christianity. His own reign in Poland started in 1399, upon the death of Queen Jadwiga, lasted a further thirty-five years, and laid the foundation for the centuries-long Polish–Lithuanian union. He was a member of the Jagiellonian dynasty in Poland that bears his name and was previously also known as the Gediminid dynasty in the Grand Duchy of Lithuania. The dynasty ruled both states until 1572, and became one of the most influential dynasties in late medieval and early modern Europe. During his reign, the Polish-Lithuanian state was the largest state in the Christian world.Jogaila was the last pagan ruler of medieval Lithuania. After he became King of Poland, as a result of the Union of Krewo, the newly formed Polish-Lithuanian union confronted the growing power of the Teutonic Knights. The allied victory at the Battle of Grunwald in 1410, followed by the Peace of Thorn, secured the Polish and Lithuanian borders and marked the emergence of the Polish–Lithuanian alliance as a significant force in Europe. The reign of Władysław II Jagiełło extended Polish frontiers and is often considered the beginning of Poland's Golden Age.",https://en.wikipedia.org/wiki/W%C5%82adys%C5%82aw_II_Jagie%C5%82%C5%82o
658,Luxembourg,85,Gabriel Lippmann,http://www.wikidata.org/entity/Q133232,wd:Q133232,2352712,Luxembourgish physicist nationalized French (1845-1921),"Jonas Ferdinand Gabriel Lippmann (16 August 1845 – 13 July 1921) was a Franco-Luxembourgish physicist and inventor, and Nobel laureate in physics for his method of reproducing colours photographically based on the phenomenon of interference.",https://en.wikipedia.org/wiki/Gabriel_Lippmann
662,Madagascar,37,Ranavalona III,http://www.wikidata.org/entity/Q233326,wd:Q233326,271544,last sovereign of the Kingdom of Madagascar (1861-1917),"Ranavalona III (Malagasy pronunciation: [ranˈfalunə̥]; 22 November 1861 – 23 May 1917) was the last sovereign of the Kingdom of Madagascar. She ruled from 30 July 1883 to 28 February 1897 in a reign marked by ultimately futile efforts to resist the colonial designs of the government of France. As a young woman, she was selected from among several Andriana qualified to succeed Queen Ranavalona II upon her death. Like both preceding queens, Ranavalona entered a political marriage with a member of the Hova elite named Rainilaiarivony, who largely oversaw the day-to-day governance of the kingdom and managed its foreign affairs in his role as prime minister. Ranavalona tried to stave off colonization by strengthening trade and diplomatic relations with foreign powers throughout her reign, but French attacks on coastal port towns and an assault on the capital city of Antananarivo led to the capture of the royal palace in 1895, ending the sovereignty and political autonomy of the centuries-old kingdom.
Ranavalona and her court were initially permitted to remain as symbolic figureheads, but the outbreak of a popular resistance movement called the menalamba rebellion, and the discovery of anti-French political intrigues at court led the French to exile her to the island of Réunion in 1897. Rainilaiarivony died that same year, and Ranavalona was relocated to a villa in Algiers, along with several members of her family. The queen, her family, and the servants accompanying her were provided an allowance and enjoyed a comfortable standard of living, including occasional trips to Paris for shopping and sightseeing. Ranavalona was never permitted to return home to Madagascar, however, despite her repeated requests. She died of an embolism at her villa in Algiers in 1917 at age 55. Her remains were buried in Algiers but were disinterred 21 years later and shipped to Madagascar, where they were placed within the tomb of Queen Rasoherina on the grounds of the Rova of Antananarivo.",https://en.wikipedia.org/wiki/Ranavalona_III
672,Malawi,14,John Chilembwe,http://www.wikidata.org/entity/Q644659,wd:Q644659,1698971,independence leader in Malawi,"John Chilembwe (1871 – 3 February 1915) was a Baptist pastor and educator, who trained as a minister in the United States, returning to Nyasaland in 1901. He was an early figure in the resistance to colonialism in Nyasaland (Malawi), opposing both the treatment of Africans working in agriculture on European-owned plantations and the colonial government's failure to promote the social and political advancement of Africans. Soon after the outbreak of the First World War, Chilembwe organised an unsuccessful uprising against colonial rule. Today, Chilembwe is celebrated as a hero of independence, and John Chilembwe Day is observed annually on 15 January in Malawi.",https://en.wikipedia.org/wiki/John_Chilembwe
673,Malaysia,24,James Brooke,http://www.wikidata.org/entity/Q441276,wd:Q441276,162745,White Rajah of Sarawak (1803-1868),"Sir James Brooke, Rajah of Sarawak  (29 April 1803 – 11 June 1868), was a British soldier and adventurer who founded the Raj of Sarawak in Borneo. He ruled as the first White Rajah of Sarawak from 1841 until his death in 1868.
Brooke was born and raised during the Company Raj of the British East India Company in India. After a few years of education in England, he served in the Bengal Army, was wounded, and resigned his commission. He then bought a ship and sailed out to the Malay Archipelago where, by helping to crush a rebellion, he became governor of Sarawak. He then vigorously suppressed piracy in the region and, in the ensuing turmoil, restored the Sultan of Brunei to his throne, for which the Sultan made Brooke the Rajah of Sarawak. He ruled until his death.
Brooke was not without detractors and was criticised in the British Parliament and officially investigated in Singapore for his anti-piracy measures. He was, however, honoured and feted in London for his activities in Southeast Asia. The naturalist Alfred Russel Wallace was one of many visitors whose published work spoke of his hospitality and achievements.",https://en.wikipedia.org/wiki/James_Brooke
678,Maldives,1,Muhammad Thakurufaanu Al Auzam,http://www.wikidata.org/entity/Q6932757,wd:Q6932757,534900,Sultan of the Maldive Islands,"As-Sulṭaan al-Ghaazee Muhammad Thakurufaanu al-A'uẓam (Dhivehi: އައްސުލްޠާން އަލްޣާޒީ މުޙައްމަދު ތަކުރުފާނު އަލްއަޢުޡަމް) (death August 26, 1585) or As-Sultan Ghazi Muhammad Bodu Thakurufaanu ruled over the Maldive Islands from 1573 to 1585 AD. He was a captain, environmentalist and a military strategist.He is considered as the national hero of the Maldives for driving out the Portuguese who ruled over the Maldives from 1558-1573 after killing Sultan Ali VI in Malé. His victory is commemorated in the Maldives as Qaumee Dhuvas or National Day. He was also the first Maldivian king to form the 'Lashkaru (a unified military body).",https://en.wikipedia.org/wiki/Muhammad_Thakurufaanu_al-Auzam
679,Mali,34,Yusuf ibn Tashfin,http://www.wikidata.org/entity/Q369981,wd:Q369981,1853388,The leader of Almoravid empire from 1061 to 1106,"Yusuf ibn Tashfin, also Tashafin, Teshufin, (Arabic: يوسف بن تاشفين ناصر الدين بن تالاكاكين الصنهاجي, romanized: Yūsuf ibn Tāshfīn Naṣr al-Dīn ibn Tālākakīn al-Ṣanhājī; reigned c. 1061 – 1106) was leader of the Berber Almoravid empire. He co-founded the city of Marrakesh and led the Muslim forces in the Battle of Sagrajas. Ibn Tashfin came to al-Andalus from Africa to help the Muslims fight against Alfonso VI, eventually achieving victory and promoting an Islamic system in the region. In 1061 he took the title “amir al-Mu'minin” recognising the suzerainty of the Abbasid Caliphate whom he became a vassal of. He was married to Zaynab an-Nafzawiyyah, whom he reportedly trusted politically.

",https://en.wikipedia.org/wiki/Yusuf_ibn_Tashfin
684,Malta,22,Girolamo Cassar,http://www.wikidata.org/entity/Q907536,wd:Q907536,42060518,Architect who designed many buildings in Valletta,"Girolamo Cassar (Maltese: Ġlormu Cassar, c. 1520 – c. 1592) was a Maltese architect and military engineer. He was the resident engineer of the Order of St. John, and was admitted into the Order in 1569. He was involved in the construction of Valletta, initially as an assistant to Francesco Laparelli, before taking over the project himself. He designed many public, religious and private buildings in the new capital city, including Saint John's Co-Cathedral, the Grandmaster's Palace and the auberges. He was the father of Vittorio Cassar, another architect and engineer.",https://en.wikipedia.org/wiki/Girolamo_Cassar
697,Mauritania,34,Yusuf ibn Tashfin,http://www.wikidata.org/entity/Q369981,wd:Q369981,1853388,The leader of Almoravid empire from 1061 to 1106,"Yusuf ibn Tashfin, also Tashafin, Teshufin, (Arabic: يوسف بن تاشفين ناصر الدين بن تالاكاكين الصنهاجي, romanized: Yūsuf ibn Tāshfīn Naṣr al-Dīn ibn Tālākakīn al-Ṣanhājī; reigned c. 1061 – 1106) was leader of the Berber Almoravid empire. He co-founded the city of Marrakesh and led the Muslim forces in the Battle of Sagrajas. Ibn Tashfin came to al-Andalus from Africa to help the Muslims fight against Alfonso VI, eventually achieving victory and promoting an Islamic system in the region. In 1061 he took the title “amir al-Mu'minin” recognising the suzerainty of the Abbasid Caliphate whom he became a vassal of. He was married to Zaynab an-Nafzawiyyah, whom he reportedly trusted politically.

",https://en.wikipedia.org/wiki/Yusuf_ibn_Tashfin
699,Mauritius,18,Charles-Édouard Brown-Séquard,http://www.wikidata.org/entity/Q725855,wd:Q725855,1311821,Mauritian physiologist and neurologist,"Charles-Édouard Brown-Séquard FRS (8 April 1817 – 2 April 1894) was a Mauritian physiologist and neurologist who, in 1850, became the first to describe what is now called Brown-Séquard syndrome.",https://en.wikipedia.org/wiki/Charles-%C3%89douard_Brown-S%C3%A9quard
703,Mexico,89,Emiliano Zapata,http://www.wikidata.org/entity/Q41718,wd:Q41718,86692,Mexican revolutionary (1879-1919),"Emiliano Zapata Salazar (Spanish pronunciation: [emiˈljãno saˈpata]; 8 August 1879 – 10 April 1919) was a Mexican revolutionary. He was a leading figure in the Mexican Revolution of 1910–1920, the main leader of the people's revolution in the Mexican state of Morelos, and the inspiration of the agrarian movement called Zapatismo.
Zapata was born in the rural village of Anenecuilco in Morelos State, in an era when peasant communities came under increasing pressure from the small-landowning class who monopolized land and water resources for sugar-cane production with the support of dictator Porfirio Díaz (President 1877-1880 and 1884–1911). Zapata early on participated in political movements against Díaz and the landowning hacendados, and when the Revolution broke out in 1910 he was thus positioned as a central leader of the peasant revolt in Morelos. Cooperating with a number of other peasant leaders, he formed the Liberation Army of the South, of which he soon became the undisputed leader. Zapata's forces contributed to the fall of Díaz, defeating the Federal Army in the Battle of Cuautla (May 1911), but when the revolutionary leader Francisco I. Madero became president he disavowed the role of the Zapatistas, denouncing them as simple bandits.
In November 1911 Zapata promulgated the Plan de Ayala, which called for substantial land reforms, redistributing lands to the peasants. Madero sent the Federal Army to root out the Zapatistas in Morelos. Madero's generals employed a scorched-earth policy, burning villages and forcibly removing their inhabitants, and drafting many men into the Army or sending them to forced-labor camps in southern Mexico. Such actions strengthened Zapata's standing among the peasants, and Zapata succeeded in driving the forces of Madero (led by Victoriano Huerta) out of Morelos. In a coup against Madero in February 1913, Huerta took power in Mexico, but a coalition of Constitutionalist forces in northern Mexico led by Venustiano Carranza, Álvaro Obregón and Francisco ""Pancho"" Villa ousted him in July 1914 with the support of Zapata's troops. Zapata did not recognize the authority that Carranza asserted as leader of the revolutionary movement, continuing his adherence to the Plan de Ayala.
In the aftermath of the revolutionaries' victory over Huerta, they attempted to sort out power relations in the Convention of Aguascalientes (October to November 1914). Zapata and Villa broke with Carranza, and Mexico descended into a civil war among the winners. Dismayed with the alliance with Villa, Zapata focused his energies on rebuilding society in Morelos (which he now controlled), instituting the land reforms of the Plan de Ayala. As Carranza consolidated his power and defeated Villa in 1915, Zapata initiated guerrilla warfare against the Carrancistas, who in turn invaded Morelos, employing once again scorched-earth tactics to oust the Zapatista rebels. Zapata once again re-took Morelos in 1917 and held most of the state against Carranza's troops until he was killed in an ambush in April 1919.
Article 27 of the 1917 Mexican Constitution was drafted in response to Zapata's agrarian demands.After his death, Zapatista generals aligned with Obregón against Carranza and helped drive Carranza from power (1920). In 1920 Zapatistas managed to obtain powerful posts in the government of Morelos after Carranza's fall. They instituted many of the land reforms envisioned by Zapata in Morelos.
Zapata remains an iconic figure in Mexico, used both as a nationalist symbol as well as a symbol of the neo-Zapatista movement.",https://en.wikipedia.org/wiki/Emiliano_Zapata
711,Moldova,54,Anton Rubinstein,http://www.wikidata.org/entity/Q87567,wd:Q87567,152755,"Russian pianist, composer and conductor","Anton Grigoryevich Rubinstein (Russian: Антон Григорьевич Рубинштейн, tr. Anton Grigor'evič Rubinštejn; 28 November [O.S. 16 November] 1829 – 20 November [O.S. 8 November] 1894) was a Russian pianist, composer and conductor who became a pivotal figure in Russian culture when he founded the Saint Petersburg Conservatory. He was the elder brother of Nikolai Rubinstein, who founded the Moscow Conservatory.
As a pianist, Rubinstein ranks among the great 19th-century keyboard virtuosos. He became most famous for his series of historical recitals—seven enormous, consecutive concerts covering the history of piano music. Rubinstein played this series throughout Russia and Eastern Europe and in the United States when he toured there.
Although best remembered as a pianist and educator (most notably in the latter as the composition teacher of Tchaikovsky), Rubinstein was also a prolific composer throughout much of his life. He wrote 20 operas, the best known of which is The Demon. He composed many other works, including five piano concertos, six symphonies and many solo piano works along with a substantial output of works for chamber ensemble.",https://en.wikipedia.org/wiki/Anton_Rubinstein
712,Monaco,61,Eleanor of Aquitaine,http://www.wikidata.org/entity/Q178525,wd:Q178525,9962,Queen consort of France; Queen consort of England; suo jure Duchess of Aquitaine; patroness,"Eleanor of Aquitaine (c. 1122 – 1 April 1204; French: Aliénor d'Aquitaine, pronounced [alienɔʀ dakitɛn]) was Queen of France from 1137 to 1152 as the wife of King Louis VII, Queen of England from 1154 to 1189 as the wife of King Henry II, and Duchess of Aquitaine in her own right from 1137 until her death in 1204. As the heir of the House of Poitiers, rulers in southwestern France, she was one of the wealthiest and most powerful women in western Europe during the High Middle Ages. She was patron of literary figures such as Wace, Benoît de Sainte-Maure, and Bernart de Ventadorn. She was also known to have led armies several times in her life and was a key leading figure of the unsuccessful Second Crusade.
Eleanor was the daughter of William X, Duke of Aquitaine. She became duchess upon her father's death in April 1137, and three months later she married Louis, son of her guardian King Louis VI of France. A few weeks later, Prince Louis became the French king. They had two daughters, Marie and Alix. As queen of France, Eleanor participated in the unsuccessful Second Crusade. Soon afterwards, she sought an annulment of her marriage, but her request was rejected by Pope Eugene III. Eventually, Louis agreed to an annulment, as 15 years of marriage had not produced a son. The marriage was annulled on 21 March 1152 on the grounds of consanguinity within the fourth degree. Their daughters were declared legitimate, custody was awarded to Louis, and Eleanor's lands were restored to her.
As soon as the annulment was granted, Eleanor became engaged to her third cousin Henry, Duke of Normandy. The couple married on Whitsun, 18 May 1152. Henry and Eleanor became king and queen of England in 1154. They had five sons and three daughters. However, Henry and Eleanor eventually became estranged. Henry imprisoned her in 1173 for supporting the revolt of their eldest son, Henry, against him. She was not released until 6 July 1189, when her husband died and their third son, Richard I, ascended the throne. As queen dowager, Eleanor acted as regent while Richard went on the Third Crusade. She lived well into the reign of her youngest son, John.",https://en.wikipedia.org/wiki/Eleanor_of_Aquitaine
713,Mongolia,182,Genghis Khan,http://www.wikidata.org/entity/Q720,wd:Q720,17414699,founder and first khan of the Mongol Empire,"Genghis Khan (c. 1158–1162 – August 18, 1227), born Temüjin, was the founder and first Great Khan (Emperor) of the Mongol Empire, which became the largest contiguous empire in history after his death. He came to power by uniting many of the nomadic tribes of Northeast Asia, and, after being proclaimed the universal ruler of the Mongols, or Genghis Khan, he launched the Mongol invasions, which ultimately conquered most of Eurasia, reaching as far west as Poland and as far south as Egypt. His major campaigns include those against the Qara Khitai, Khwarezmia and the Western Xia and Jin dynasties, and his generals conducted further raids into medieval Georgia, the Kievan Rus', and Volga Bulgaria.
Genghis Khan and his empire have a fearsome reputation in local histories. Many medieval chroniclers and modern historians describe Genghis Khan's conquests as wholesale destruction on an unprecedented scale, causing great demographic changes and a drastic decline of population as a result of mass exterminations and famine. A conservative estimate amounts to about four million civilians (whereas other figures range from forty to sixty million) who died as a consequence of Genghis Khan's military campaigns. In contrast, Buddhist Uyghurs of the kingdom of Qocho, who willingly left the Qara Khitai empire to become Mongol vassals, viewed him as a liberator. Genghis Khan was also portrayed positively by early Renaissance sources out of respect for the great spread of culture, technology and ideas under the Mongol Empire. By the end of the Great Khan's life, the Mongol Empire occupied a substantial portion of Central Asia and China. Due to his exceptional military successes, Genghis Khan is often considered to be one of the greatest conquerors of all time.Beyond his military accomplishments, Genghis Khan also advanced the Mongol Empire in other ways. He decreed the adoption of the Uyghur script as the Mongol Empire's writing system. He also practised meritocracy and encouraged religious tolerance in the Mongol Empire, unifying the nomadic tribes of Northeast Asia. Present-day Mongolians regard him as the founding father of Mongolia. He is also credited with bringing the Silk Road under one cohesive political environment. This brought relatively easy communication and trade between Northeast Asia, Muslim Southwest Asia, and Christian Europe, expanding the cultural horizons of all three areas.",https://en.wikipedia.org/wiki/Genghis_Khan
716,Montenegro,45,Nicholas I of Montenegro,http://www.wikidata.org/entity/Q283255,wd:Q283255,817515,King of Montenegro,"Nikola I Petrović-Njegoš (Serbian Cyrillic: Никола I Петровић-Његош; 7 October [O.S. 25 September] 1841 – 1 March 1921) was the ruler of Montenegro from 1860 to 1918, reigning as prince from 1860 to 1910 and as the country's first and only king from 1910 to 1918.

",https://en.wikipedia.org/wiki/Nicholas_I_of_Montenegro
734,Morocco,139,Ibn Battuta,http://www.wikidata.org/entity/Q7331,wd:Q7331,15229,14th century Muslim Moroccan scholar and explorer,"Abu Abdullah Muhammad ibn Battutah (; 24 February 1304 – 1368/1369), commonly known as Ibn Battuta, was an Arab-Berber Maghrebi scholar and explorer who travelled extensively in the lands of Afro-Eurasia, largely in the lands of Dar al-Islam, travelling more than any other explorer in pre-modern history, totalling around 117,000 km (73,000 mi), surpassing Zheng He with about 50,000 km (31,000 mi) and Marco Polo with 24,000 km (15,000 mi). Over a period of thirty years, Ibn Battuta visited most of southern Eurasia, including Central Asia, Southeast Asia, South Asia, China, and the Iberian Peninsula. Near the end of his life, he dictated an account of his journeys, titled A Gift to Those Who Contemplate the Wonders of Cities and the Marvels of Travelling, but commonly known as The Rihla.

",https://en.wikipedia.org/wiki/Ibn_Battuta
735,Mozambique,11,Mdungazwe Nxumalo,http://www.wikidata.org/entity/Q1554673,wd:Q1554673,2460284,king of the Gaza Empire,"Ngungunyane, also known as Mdungazwe Ngungunyane Nxumalo, N'gungunhana, or Gungunhana Reinaldo Frederico Gungunhana, (c. 1850 – 23 December 1906) was a tribal king and vassal of the Portuguese Empire, who rebelled, was defeated by General Joaquim Mouzinho de Albuquerque and lived out the rest of his life in exile, first in Lisbon, but later on the island of Terceira, in the Azores.
Gungunhana was the last dynastic emperor of the Empire of Gaza, a territory now part of Mozambique. Nicknamed the Lion of Gaza, he reigned from around 1884 to 28 December 1895, the day he was imprisoned by Joaquim Mouzinho de Albuquerque in the fortified village of Chaimite. Because he was already known to the European press, the Portuguese colonial administration decided to exile him, rather than send him to face a firing squad, as would normally be the case. He was transported to Lisbon, accompanied by his son Godide and other dignitaries. After a brief stay at the Fort of Monsanto, he was transferred to the Azores, where he would die eleven years later.",https://en.wikipedia.org/wiki/Gungunhana
