,country,number,item,item_id,shortform,pageid,wikidata_description,wikipedia_summary,wikipedia_url
860,Papua New Guinea,3,Howard Walter,http://www.wikidata.org/entity/Q5921201,wd:Q5921201,38544038,American hymn writer (1883-1918),"Howard Arnold Walter (August 19, 1883 – November 1, 1918) was an American Congregationalist minister, author, and hymnwriter.
Born in New Britain, Connecticut on August 19, 1883, Howard Arnold Walter was the son of Henry S. Walter, superintendent of the Stanley Rule & Level Company.  Walter graduated from Princeton University in 1905, and in 1906, he traveled to the Empire of Japan to teach English at Waseda University.  There he wrote his mother a poem on his philosophy of life (""My Creed""), which became the hymn ""I Would Be True"" years after she submitted it to Harper's Magazine.  When Walter returned to the US, he studied at Hartford Seminary, was ordained a Congregationalist minister, and was an assistant minister in Asylum Hill, Connecticut for three years.Walter married Marguerite B. Darlington on November 21, 1910 in a Brooklyn, New York service officiated by James Henry Darlington.  On November 17, 1911, Marion D. Walter was born to the family in Hartford, Connecticut.  In 1913, the family traveled to Lahore in the British Raj to allow Walter to teach and proselyte the Mohammedans there.  Two years later on April 7, 1914, Ruth A. Walter was born in Lahore.Walter died of the Spanish flu in Lahore on November 1, 1918; he was buried there in the Indian Christian Cemetery, plot 211.  His book The Religious Life of India: The Ahmadīya Movement was published posthumously.  On May 29, 1938, Dorothy Walker Bush had ""My Creed"" inscribed in the confirmation Bible of her son and future US president, George H. W. Bush.",https://en.wikipedia.org/wiki/Howard_Walter
861,Paraguay,43,Francisco Solano López,http://www.wikidata.org/entity/Q37677,wd:Q37677,451975,2nd President of Paraguay (1827-1870),"Francisco Solano López Carrillo (24 July 1827 – 1 March 1870) was President of Paraguay from 1862 until his death in 1870. He was the eldest son of Juana Pabla Carrillo and of President Carlos Antonio López, Francisco's predecessor.
At a very young age he served in the Paraguayan Army fighting against Juan Manuel de Rosas in the sporadic hostilities sustained by Paraguay and Argentina during the Platine Wars. After the downfall of Rosas, he became Ambassador of Paraguay, as Minister Plenipotentiary, in several European countries from 1853 to 1855. At his return in Asunción, he was appointed Vice-President of the Supreme Government of his father Carlos, and then assumed the Presidency when his father died.
He is one of the most controversial figures in South American history, particularly because of the Paraguayan War, known in the Plate Basin as ""Guerra de la Triple Alianza"".
From one perspective, his ambitions were the main reason for the outbreak of the war while other arguments maintain he was a fierce champion of the independence of South American nations against foreign rule and interests. He resisted until the very end and was killed in action during the Battle of Cerro Corá, which marked the end of the war.",https://en.wikipedia.org/wiki/Francisco_Solano_L%C3%B3pez
881,People's Republic of China,282,Confucius,http://www.wikidata.org/entity/Q4604,wd:Q4604,5823,"Chinese teacher, editor, politician and philosopher","Confucius ( kən-FEW-shəs; Chinese: 孔夫子; pinyin: Kǒng Fūzǐ, ""Master Kǒng""; or commonly 孔子; Kǒngzǐ; c. 551–479 BCE) was a Chinese philosopher, poet and politician of the Spring and Autumn period who was traditionally considered the paragon of Chinese sages. Confucius's teachings and philosophy underpin East Asian culture and society, remaining influential across China and East Asia to this day.His philosophical teachings, called Confucianism, emphasized personal and governmental morality, correctness of social relationships, justice, kindness, and sincerity. Confucianism was part of the Chinese social fabric and way of life; to Confucians, everyday life was the arena of religion. His followers competed with many other schools during the Hundred Schools of Thought era, only to be suppressed in favor of the Legalists during the Qin dynasty. Following the victory of Han over Chu after the collapse of Qin, Confucius's thoughts received official sanction in the new government. During the Tang and Song dynasties, Confucianism developed into a system known in the West as Neo-Confucianism, and later as New Confucianism.
Confucius is traditionally credited with having authored or edited many of the Chinese classic texts, including all of the Five Classics, but modern scholars are cautious of attributing specific assertions to Confucius himself. Aphorisms concerning his teachings were compiled in the Analects, but only many years after his death.
Confucius's principles have commonality with Chinese tradition and belief. With filial piety, he championed strong family loyalty, ancestor veneration, and respect of elders by their children and of husbands by their wives, recommending family as a basis for ideal government. He espoused the well-known principle ""Do not do unto others what you do not want done to yourself"", the Golden Rule.",https://en.wikipedia.org/wiki/Confucius
901,Peru,56,Bernardo O'Higgins,http://www.wikidata.org/entity/Q28930,wd:Q28930,303199,Chilean independence leader (1778-1842),"Bernardo O'Higgins Riquelme (Spanish pronunciation: [beɾˈnaɾðo oˈ(x)iɣins] (listen); August 20, 1778 – October 24, 1842) was a Chilean independence leader who freed Chile from Spanish rule in the Chilean War of Independence. He was a wealthy landowner of Basque-Spanish and Irish ancestry. Although he was the second Supreme Director of Chile (1817–1823), he is considered one of Chile's founding fathers, as he was the first holder of this title to head a fully independent Chilean state.
He was Captain General of the Chilean Army, Brigadier of the United Provinces of the Río de la Plata, General Officer of Gran Colombia and Grand Marshal of Peru.",https://en.wikipedia.org/wiki/Bernardo_O%27Higgins
902,Philippines,81,José Rizal,http://www.wikidata.org/entity/Q1500,wd:Q1500,25084169,Filipino nationalist and writer (1861-1896),"José Protasio Rizal Mercado y Alonso Realonda (Spanish: [xoˈse riˈsal]; June 19, 1861 – December 30, 1896) was a Filipino nationalist, writer and polymath during the tail end of the Spanish colonial period of the Philippines. He is considered as the national hero (pambansang bayani) of the Philippines. An ophthalmologist by profession, Rizal became a writer and a key member of the Filipino Propaganda Movement, which advocated political reforms for the colony under Spain.
He was executed by the Spanish colonial government for the crime of rebellion after the Philippine Revolution, inspired in part by his writings, broke out. Though he was not actively involved in its planning or conduct, he ultimately approved of its goals which eventually led to Philippine independence.
He is widely considered one of the greatest heroes of the Philippines and has been recommended to be so honored by an officially empaneled National Heroes Committee. However, no law, executive order or proclamation has been enacted or issued officially proclaiming any Filipino historical figure as a national hero. He was the author of the novels Noli Me Tángere and El filibusterismo, and a number of poems and essays.",https://en.wikipedia.org/wiki/Jos%C3%A9_Rizal
903,Poland,190,Nicolaus Copernicus,http://www.wikidata.org/entity/Q619,wd:Q619,323592,"Renaissance-era mathematician, astronomer, and clergyman who formulated the heliocentric model of the Universe","Nicolaus Copernicus (; Polish: Mikołaj Kopernik; Middle Low German: Niclas Koppernigk, modern: Nikolaus Kopernikus; 19 February 1473 – 24 May 1543) was a Renaissance polymath, active as a mathematician, astronomer, and Catholic canon, who formulated a model of the universe that placed the Sun rather than Earth at its center. In all likelihood, Copernicus developed his model independently of Aristarchus of Samos, an ancient Greek astronomer who had formulated such a model some eighteen centuries earlier.The publication of Copernicus' model in his book De revolutionibus orbium coelestium (On the Revolutions of the Celestial Spheres), just before his death in 1543, was a major event in the history of science, triggering the Copernican Revolution and making a pioneering contribution to the Scientific Revolution.Copernicus was born and died in Royal Prussia, a region that had been part of the Kingdom of Poland since 1466. A polyglot and polymath, he obtained a doctorate in canon law and was a mathematician, astronomer, physician, classics scholar, translator, governor, diplomat, and economist. In 1517 he derived a quantity theory of money—a key concept in economics—and in 1519 he formulated an economic principle that later came to be called Gresham's law.",https://en.wikipedia.org/wiki/Nicolaus_Copernicus
923,Portugal,168,Ferdinand Magellan,http://www.wikidata.org/entity/Q1496,wd:Q1496,19914843,Portuguese explorer in the service of Spain,"Ferdinand Magellan ( or ; Portuguese: Fernão de Magalhães, IPA: [fɨɾˈnɐ̃w dɨ mɐɣɐˈʎɐ̃jʃ]; Spanish: Fernando de Magallanes, IPA: [feɾˈnando ðe maɣaˈʎanes]; 4 February 1480 – 27 April 1521) was a Portuguese explorer and a subject of the Hispanic Monarchy from 1518. He is best known for having planned and led the 1519 Spanish expedition to the East Indies across the Pacific Ocean to open a maritime trade route, during which he discovered the interoceanic passage bearing thereafter his name and achieved the first European navigation from the Atlantic to Asia. While on this voyage, Magellan was killed in the Battle of Mactan in 1521 in the present-day Philippines, but some of the expedition's surviving members, in one of the two remaining ships, subsequently completed the first circumnavigation of the Earth when they returned to Spain in 1522.Born 4 February 1480 into a family of minor Portuguese nobility, Magellan became a skilled sailor and naval officer in service of the Portuguese Crown in Asia. King Manuel I of Portugal refused to support Magellan's plan to reach the Maluku Islands (the ""Spice Islands"") by sailing westwards around the American continent. Facing some criminal offences, Magellan left Portugal and proposed the same expedition to King Charles I of Spain, who accepted it. Consequently, many in Portugal considered him a traitor and he never returned.  In Seville, he married, fathered two children, and organised the expedition. For his allegiance to the Hispanic Monarchy, in 1518, Magellan was appointed admiral of the Spanish Fleet and given command of the expedition – the five-ship Armada of Molucca. He was also made Commander of the Order of Santiago, one of the highest military ranks of the Spanish Empire.Granted special powers and privileges by the King, he led the Armada from Sanlucar de Barrameda, southwest across the Atlantic Ocean, to the eastern coast of South America, and down to Patagonia. Despite a series of storms and mutinies, the expedition successfully passed through the Strait of Magellan into the Mar del Sur, which Magellan renamed the ""Peaceful Sea"" (the modern Pacific Ocean). The expedition reached Guam and, shortly after, the Philippine islands. There Magellan was killed in the Battle of Mactan in April 1521. Under the command of captain Juan Sebastian Elcano, the expedition later reached the Spice Islands. To navigate back to Spain and avoid seizure by the Portuguese, the expedition's two remaining ships split, one attempting, unsuccessfully, to reach New Spain by sailing eastwards across the Pacific, while the other, commanded by Elcano, sailed westwards via the Indian Ocean and up the Atlantic coast of Africa, finally arriving at the expedition's port of departure and thereby completing the first complete circuit of the globe.
While in the Kingdom of Portugal's service, Magellan had already reached the Malay Archipelago in Southeast Asia on previous voyages traveling east (from 1505 to 1511–1512). By visiting this area again but now traveling west, Magellan achieved a nearly complete personal circumnavigation of the globe for the first time in history.",https://en.wikipedia.org/wiki/Ferdinand_Magellan
941,Qatar,32,Zayd ibn Harithah,http://www.wikidata.org/entity/Q34418,wd:Q34418,2186845,Sahabah,"Zayd ibn Harithah (Arabic: زَيْد ٱبْن حَارِثَة, Zayd ibn Ḥārithah) (c. 581–629 CE), was an early Muslim, sahabah and the adopted son (before adoption was prohibited) of the Islamic prophet, Muhammad.
He is commonly regarded as the fourth person to have accepted Islam, after Muhammad's wife Khadija, Muhammad's cousin Ali, and Muhammad's close companion Abu Bakr, Zayd was a slave in Khadija's household for several years, but Muhammad later freed and legally adopted Zayd as his own son.
Zayd was a commander in the early Muslim army and led several early military expeditions during the lifetime of Muhammad. Zayd led his final expedition in September 629 C.E, and set out to raid the Byzantine city of Bosra. However the Muslim army was intercepted by Byzantine forces and Zayd was subsequently killed at the Battle of Mu'tah.
Zayd was therefore married to two prominent women of Muhammad's household, including his cousin Zaynab and his mother's servant Umm Ayman.

",https://en.wikipedia.org/wiki/Zayd_ibn_Harithah
949,Republic of Ireland,206,Oscar Wilde,http://www.wikidata.org/entity/Q30875,wd:Q30875,22614,Irish writer and poet (1854-1900),"Oscar Fingal O'Flahertie Wills Wilde (16 October 1854 – 30 November 1900) was an Irish poet and playwright. After writing in different forms throughout the 1880s, he became one of the most popular playwrights in London in the early 1890s. He is best remembered for his epigrams and plays, his novel The Picture of Dorian Gray, and the circumstances of his criminal conviction for gross indecency for consensual homosexual acts in ""one of the first celebrity trials"", imprisonment, and early death from meningitis at age 46.
Wilde's parents were Anglo-Irish intellectuals in Dublin. A young Wilde learned to speak fluent French and German. At university, Wilde read Greats; he demonstrated himself to be an exceptional classicist, first at Trinity College Dublin, then at Oxford. He became associated with the emerging philosophy of aestheticism, led by two of his tutors, Walter Pater and John Ruskin. After university, Wilde moved to London into fashionable cultural and social circles.
As a spokesman for aestheticism, he tried his hand at various literary activities: he published a book of poems, lectured in the United States and Canada on the new ""English Renaissance in Art"" and interior decoration, and then returned to London where he worked prolifically as a journalist. Known for his biting wit, flamboyant dress and glittering conversational skill, Wilde became one of the best-known personalities of his day. At the turn of the 1890s, he refined his ideas about the supremacy of art in a series of dialogues and essays, and incorporated themes of decadence, duplicity, and beauty into what would be his only novel, The Picture of Dorian Gray (1890). The opportunity to construct aesthetic details precisely, and combine them with larger social themes, drew Wilde to write drama. He wrote Salome (1891) in French while in Paris but it was refused a licence for England due to an absolute prohibition on the portrayal of Biblical subjects on the English stage. Unperturbed, Wilde produced four society comedies in the early 1890s, which made him one of the most successful playwrights of late-Victorian London.
At the height of his fame and success, while The Importance of Being Earnest (1895) was still being performed in London, Wilde prosecuted the Marquess of Queensberry for criminal libel. The Marquess was the father of Wilde's lover, Lord Alfred Douglas. The libel trial unearthed evidence that caused Wilde to drop his charges and led to his own arrest and trial for gross indecency with men. After two more trials he was convicted and sentenced to two years' hard labour, the maximum penalty, and was jailed from 1895 to 1897. During his last year in prison, he wrote De Profundis (published posthumously in 1905), a long letter which discusses his spiritual journey through his trials, forming a dark counterpoint to his earlier philosophy of pleasure. On his release, he left immediately for France, and never returned to Ireland or Britain. There he wrote his last work, The Ballad of Reading Gaol (1898), a long poem commemorating the harsh rhythms of prison life.",https://en.wikipedia.org/wiki/Oscar_Wilde
965,Republic of the Congo,4,Prosper Philippe Augouard,http://www.wikidata.org/entity/Q8331271,wd:Q8331271,43096964,French priest (1852-1921),"Prosper Philippe Augouard , C.S.Sp. (17 September 1852 – 3 October 1921) was a French Catholic priest, missionary, and explorer of Africa.",https://en.wikipedia.org/wiki/Prosper_Philippe_Augouard
966,Romania,83,Vlad III,http://www.wikidata.org/entity/Q43715,wd:Q43715,716868,Prince of Wallachia,"Vlad III, commonly known as Vlad the Impaler (Romanian: Vlad Țepeș [ˈvlad ˈtsepeʃ]) or Vlad Dracula (; Romanian: Vlad Drăculea [ˈdrəkule̯a]; 1428/31 – 1476/77), was Voivode of Wallachia three times between 1448 and his death in 1476/77. He is often considered one of the most important rulers in Wallachian history and a national hero of Romania.He was the second son of Vlad Dracul, who became the ruler of Wallachia in 1436. Vlad and his younger brother, Radu, were held as hostages in the Ottoman Empire in 1442 to secure their father's loyalty. Vlad's father and eldest brother, Mircea, were murdered after John Hunyadi, regent-governor of Hungary, invaded Wallachia in 1447. Hunyadi installed Vlad's second cousin, Vladislav II, as the new voivode. Hunyadi launched a military campaign against the Ottomans in the autumn of 1448, and Vladislav accompanied him. Vlad broke into Wallachia with Ottoman support in October, but Vladislav returned and Vlad sought refuge in the Ottoman Empire before the end of the year. Vlad went to Moldavia in 1449 or 1450, and later to Hungary.
Relations between Hungary and Vladislav later deteriorated, and in 1456 Vlad invaded Wallachia with Hungarian support. Vladislav died fighting against him. Vlad began a purge among the Wallachian boyars to strengthen his position. He came into conflict with the Transylvanian Saxons, who supported his opponents, Dan and Basarab Laiotă (who were Vladislav's brothers), and Vlad's illegitimate half-brother, Vlad the Monk. Vlad plundered the Saxon villages, taking the captured people to Wallachia where he had them impaled (which inspired his cognomen). Peace was restored in 1460.
The Ottoman Sultan, Mehmed II, ordered Vlad to pay homage to him personally, but Vlad had the Sultan's two envoys captured and impaled. In February 1462, he attacked Ottoman territory, massacring tens of thousands of Turks and Bulgarians. Mehmed launched a campaign against Wallachia to replace Vlad with Vlad's younger brother, Radu. Vlad attempted to capture the sultan at Târgoviște during the night of 16–17 June 1462. The sultan and the main Ottoman army left Wallachia, but more and more Wallachians deserted to Radu. Vlad went to Transylvania to seek assistance from Matthias Corvinus, King of Hungary, in late 1462, but Corvinus had him imprisoned.
Vlad was held in captivity in Visegrád from 1463 to 1475. During this period, anecdotes about his cruelty started to spread in Germany and Italy. He was released at the request of Stephen III of Moldavia in the summer of 1475. He fought in Corvinus's army against the Ottomans in Bosnia in early 1476. Hungarian and Moldavian troops helped him to force Basarab Laiotă (who had dethroned Vlad's brother, Radu) to flee from Wallachia in November. Basarab returned with Ottoman support before the end of the year. Vlad was killed in battle before 10 January 1477. Books describing Vlad's cruel acts were among the first bestsellers in the German-speaking territories. In Russia, popular stories suggested that Vlad was able to strengthen his central government only through applying brutal punishments, and a similar view was adopted by most Romanian historians in the 19th century. Vlad's patronymic inspired the name of Bram Stoker's literary vampire, Count Dracula.",https://en.wikipedia.org/wiki/Vlad_the_Impaler
972,Russia,251,Leo Tolstoy,http://www.wikidata.org/entity/Q7243,wd:Q7243,18622119,Russian writer (1828-1910),"Count Lev Nikolayevich Tolstoy (; Russian: Лев Николаевич Толстой, IPA: [ˈlʲef nʲɪkɐˈla(j)ɪvʲɪtɕ tɐlˈstoj] (listen); 9 September [O.S. 28 August] 1828 –  20 November [O.S. 7 November] 1910), usually referred to in English as Leo Tolstoy, was a Russian writer who is regarded as one of the greatest authors of all time. He received nominations for the Nobel Prize in Literature every year from 1902 to 1906 and for the Nobel Peace Prize in 1901, 1902, and 1909. That he never won is a major controversy.Born to an aristocratic Russian family in 1828, Tolstoy's notable works include the novels War and Peace (1869) and Anna Karenina (1878), often cited as pinnacles of realist fiction. He first achieved literary acclaim in his twenties with his semi-autobiographical trilogy, Childhood, Boyhood, and Youth (1852–1856), and Sevastopol Sketches (1855), based upon his experiences in the Crimean War. His fiction includes dozens of short stories and several novellas such as The Death of Ivan Ilyich (1886), Family Happiness (1859), ""After the Ball"" (1911), and Hadji Murad (1912). He also wrote plays and numerous philosophical essays.
In the 1870s, Tolstoy experienced a profound moral crisis, followed by what he regarded as an equally profound spiritual awakening, as outlined in his non-fiction work A Confession (1882). His literal interpretation of the ethical teachings of Jesus, centering on the Sermon on the Mount, caused him to become a fervent Christian anarchist and pacifist. His ideas on nonviolent resistance, expressed in such works as The Kingdom of God Is Within You (1894), had a profound impact on such pivotal 20th-century figures as Mahatma Gandhi and Martin Luther King Jr. He also became a dedicated advocate of Georgism, the economic philosophy of Henry George, which he incorporated into his writing, particularly Resurrection (1899).",https://en.wikipedia.org/wiki/Leo_Tolstoy
992,Rwanda,6,Mutara II Rwogera,http://www.wikidata.org/entity/Q323582,wd:Q323582,962583,Rwandan king,"Mutara II Rwogera was the King of Rwanda from 1830 to his death in June 1853. Under his rule and that of his successor Kigeli IV Rwabugiri, the kingdom reached its pinnacle of power. 
After 1 June 1853, King Mutara II Rwogera died of an illness, but a non-governmental organization prevented Abiru from informing Queen Nyiramavugo Nyiramongi about his death, a non-governmental organization because he had refused to drink and should not stay after the king. 
The Mutara dynasty completed the planned conquest of Gisaka, a struggling country. Rwabugili, inherited his father's kingdom, and did a great job of restoring it.

",https://en.wikipedia.org/wiki/Mutara_II_Rwogera
