country,number,item,item_id,shortform,pageid,wikidata_description
Australia,102.0,Julia Gillard,http://www.wikidata.org/entity/Q41563,wd:Q41563,519437,Prime Minister of Australia from 2010 to 2013
Australia,89.0,Kevin Rudd,http://www.wikidata.org/entity/Q43135,wd:Q43135,380965,26th Prime Minister of Australia
Australia,87.0,Scott Morrison,http://www.wikidata.org/entity/Q7436908,wd:Q7436908,14521782,Prime Minister of Australia from 2018 to 2022
Australia,80.0,John Howard,http://www.wikidata.org/entity/Q51330,wd:Q51330,4689709,Prime Minister of Australia from 1996 to 2007
Australia,78.0,Tony Abbott,http://www.wikidata.org/entity/Q348577,wd:Q348577,556739,prime minister of Australia from 2013 to 2015
Australia,74.0,Malcolm Turnbull,http://www.wikidata.org/entity/Q927550,wd:Q927550,314742,Prime Minister of Australia from 2015 to 2018
Australia,62.0,Peter Singer,http://www.wikidata.org/entity/Q211539,wd:Q211539,23721,Australian philosopher
Australia,62.0,Howard Florey,http://www.wikidata.org/entity/Q137106,wd:Q137106,40494,Australian pathologist (1898-1968)
Australia,57.0,Gough Whitlam,http://www.wikidata.org/entity/Q23333,wd:Q23333,12454,"Australian politician, 21st Prime Minister of Australia (1916-2014)"
Australia,57.0,Bob Hawke,http://www.wikidata.org/entity/Q269372,wd:Q269372,4059,"Australian politician, 23rd Prime Minister of Australia (1929-2019)"
Australia,57.0,Anthony Albanese,http://www.wikidata.org/entity/Q335697,wd:Q335697,556745,Prime Minister of Australia since 2022
Australia,56.0,Edmund Barton,http://www.wikidata.org/entity/Q23342,wd:Q23342,146365,"Australian politician, first Prime Minister of Australia and founding justice of the High Court of Australia (1849-1920)"
Australia,55.0,Yanis Varoufakis,http://www.wikidata.org/entity/Q40688,wd:Q40688,33247894,Greek economist and politician
Greece,55.0,Yanis Varoufakis,http://www.wikidata.org/entity/Q40688,wd:Q40688,33247894,Greek economist and politician
Australia,53.0,Paul Keating,http://www.wikidata.org/entity/Q242654,wd:Q242654,23767,"Australian politician, 24th Prime Minister of Australia"
Azerbaijan,116.0,Ilham Aliyev,http://www.wikidata.org/entity/Q57371,wd:Q57371,22765442,4th president of the Republic of Azerbaijan
Azerbaijan,116.0,Attila,http://www.wikidata.org/entity/Q36724,wd:Q36724,841,5th-century ruler of the Hunnic Empire
Georgia,116.0,Attila,http://www.wikidata.org/entity/Q36724,wd:Q36724,841,5th-century ruler of the Hunnic Empire
Azerbaijan,113.0,Garry Kasparov,http://www.wikidata.org/entity/Q28614,wd:Q28614,12810,Russian chess grandmaster and activist
Croatia,113.0,Garry Kasparov,http://www.wikidata.org/entity/Q28614,wd:Q28614,12810,Russian chess grandmaster and activist
Azerbaijan,92.0,Serzh Sargsyan,http://www.wikidata.org/entity/Q612803,wd:Q612803,4829258,"Armenian politician, 3rd President of Armenia"
Azerbaijan,84.0,Heydar Aliyev,http://www.wikidata.org/entity/Q157451,wd:Q157451,399787,Soviet and Azerbaijani politician (1923–2003)
Azerbaijan,69.0,Robert Kocharyan,http://www.wikidata.org/entity/Q613051,wd:Q613051,313188,second President of Armenia
Azerbaijan,53.0,Ivan Bagramyan,http://www.wikidata.org/entity/Q48112,wd:Q48112,8900317,Marshal of the Soviet Union (1897-1982)
Belarus,139.0,Alexander Lukashenko,http://www.wikidata.org/entity/Q2866,wd:Q2866,156589,President of Belarus since 1994
Belarus,120.0,Shimon Peres,http://www.wikidata.org/entity/Q57410,wd:Q57410,48569,Israeli politician who served as Prime Minister and then President of Israel (1923-201כ6)
Israel,120.0,Shimon Peres,http://www.wikidata.org/entity/Q57410,wd:Q57410,48569,Israeli politician who served as Prime Minister and then President of Israel (1923-201כ6)
Belarus,92.0,Menachem Begin,http://www.wikidata.org/entity/Q130873,wd:Q130873,20767,Israeli politician and former Prime Minister (1913-1992)
Israel,92.0,Menachem Begin,http://www.wikidata.org/entity/Q130873,wd:Q130873,20767,Israeli politician and former Prime Minister (1913-1992)
Poland,92.0,Menachem Begin,http://www.wikidata.org/entity/Q130873,wd:Q130873,20767,Israeli politician and former Prime Minister (1913-1992)
Belarus,78.0,Zhores Alferov,http://www.wikidata.org/entity/Q183279,wd:Q183279,42212,Soviet-Russian physicist (1930–2019)
Belarus,75.0,Sviatlana Tsikhanouskaya,http://www.wikidata.org/entity/Q97010473,wd:Q97010473,64613100,"Belarusian politician, educator, and pro-democracy activist"
Belarus,72.0,Felix Dzerzhinsky,http://www.wikidata.org/entity/Q188570,wd:Q188570,37794,Bolshevik revolutionary and founder of the first Soviet secret police organs (1877-1926)
Belarus,72.0,Andrei Gromyko,http://www.wikidata.org/entity/Q184267,wd:Q184267,375567,Soviet diplomat
Belarus,68.0,Tadeusz Kościuszko,http://www.wikidata.org/entity/Q191479,wd:Q191479,140367,"Polish and American military leader, National Hero of Poland and United States of America (1746-1817)"
Belarus,67.0,Chaim Weizmann,http://www.wikidata.org/entity/Q172183,wd:Q172183,189474,Zionist leader and first president of Israel (1874–1952)
Israel,67.0,Chaim Weizmann,http://www.wikidata.org/entity/Q172183,wd:Q172183,189474,Zionist leader and first president of Israel (1874–1952)
Belarus,67.0,Yitzhak Shamir,http://www.wikidata.org/entity/Q184351,wd:Q184351,168208,Seventh Prime Minister of Israel (1915-2012)
Israel,67.0,Yitzhak Shamir,http://www.wikidata.org/entity/Q184351,wd:Q184351,168208,Seventh Prime Minister of Israel (1915-2012)
Belarus,51.0,Ales Bialiatski,http://www.wikidata.org/entity/Q118263,wd:Q118263,31971174,"Belarusian activist, Nobel laureate"
Bosnia and Herzegovina,86.0,Radovan Karadžić,http://www.wikidata.org/entity/Q123923,wd:Q123923,18603629,"Bosnian Serb politician, psychiatrist and poet convicted of genocide"
Bosnia and Herzegovina,74.0,Boris Tadić,http://www.wikidata.org/entity/Q483290,wd:Q483290,544276,3rd President of Serbia
Serbia,74.0,Boris Tadić,http://www.wikidata.org/entity/Q483290,wd:Q483290,544276,3rd President of Serbia
Bosnia and Herzegovina,71.0,Alija Izetbegović,http://www.wikidata.org/entity/Q183848,wd:Q183848,196318,"Bosnian politician, lawyer, philosopher and author (1925–2003)"
Bosnia and Herzegovina,60.0,Zoran Đinđić,http://www.wikidata.org/entity/Q157131,wd:Q157131,195237,Serbian politician (1952−2003)
Bosnia and Herzegovina,53.0,Branko Crvenkovski,http://www.wikidata.org/entity/Q157111,wd:Q157111,394996,President of the Republic of North Macedonia
Bosnia and Herzegovina,53.0,Ante Pavelić,http://www.wikidata.org/entity/Q36965,wd:Q36965,331643,Croatian fascist general and military dictator (1889-1959)
Bosnia and Herzegovina,52.0,Dragan Đokanović,http://www.wikidata.org/entity/Q147057,wd:Q147057,19592877,Bosnian politician of Serbian origin
Serbia,52.0,Dragan Đokanović,http://www.wikidata.org/entity/Q147057,wd:Q147057,19592877,Bosnian politician of Serbian origin
Brazil,164.0,Pelé,http://www.wikidata.org/entity/Q12897,wd:Q12897,24953,Brazilian footballer (1940–2022)
Brazil,139.0,Jair Bolsonaro,http://www.wikidata.org/entity/Q10304982,wd:Q10304982,46603496,Brazilian politician and 38th President of Brazil
Brazil,138.0,Luiz Inácio Lula da Silva,http://www.wikidata.org/entity/Q37181,wd:Q37181,99328,35th & 39th president of Brazil
Brazil,106.0,Ronaldinho,http://www.wikidata.org/entity/Q39444,wd:Q39444,524577,Brazilian association football player
Spain,106.0,Ronaldinho,http://www.wikidata.org/entity/Q39444,wd:Q39444,524577,Brazilian association football player
Brazil,95.0,Oscar Niemeyer,http://www.wikidata.org/entity/Q134165,wd:Q134165,48372,Brazilian architect (1907-2012)
Brazil,77.0,Jorge Amado,http://www.wikidata.org/entity/Q184440,wd:Q184440,421320,Brazilian writer (1912-2001)
Brazil,77.0,Michel Temer,http://www.wikidata.org/entity/Q463533,wd:Q463533,22139241,President of Brazil from 2016 to 2018
Brazil,75.0,Pedro II of Brazil,http://www.wikidata.org/entity/Q156774,wd:Q156774,81473,2nd and final Emperor of Brazil (r. 1831–89)
Brazil,74.0,Romário,http://www.wikidata.org/entity/Q178649,wd:Q178649,615807,Senator from Rio de Janeiro and former footballer
Brazil,73.0,Getúlio Vargas,http://www.wikidata.org/entity/Q156844,wd:Q156844,23809308,President of Brazil (1882-1954)
Brazil,65.0,Bebeto,http://www.wikidata.org/entity/Q204825,wd:Q204825,1129210,Brazilian association football player
Brazil,64.0,Juscelino Kubitschek,http://www.wikidata.org/entity/Q155824,wd:Q155824,314055,President of Brazil from 1956 to 1961
Brazil,60.0,Eduardo Riedel,http://www.wikidata.org/entity/Q112407628,wd:Q112407628,72075247,Brazilian politician
Brazil,58.0,Fernando Henrique Cardoso,http://www.wikidata.org/entity/Q230578,wd:Q230578,82491,President of Brazil from 1995 to 2002
Brazil,57.0,João Havelange,http://www.wikidata.org/entity/Q207358,wd:Q207358,579541,Brazilian businessman and athlete (1916-2016)
Brazil,57.0,Deodoro da Fonseca,http://www.wikidata.org/entity/Q200812,wd:Q200812,367760,President of Brazil (1827-1892)
Brazil,57.0,Itamar Franco,http://www.wikidata.org/entity/Q485946,wd:Q485946,365451,Brazilian politician (1930-2011)
Brazil,52.0,Fernando Collor de Mello,http://www.wikidata.org/entity/Q236503,wd:Q236503,68997,President of Brazil from 1990 to 1992
Bulgaria,72.0,Boyko Borisov,http://www.wikidata.org/entity/Q57775,wd:Q57775,42103819,Bulgarian politician
Bulgaria,69.0,Rumen Radev,http://www.wikidata.org/entity/Q26257557,wd:Q26257557,51575780,President of Bulgaria
Bulgaria,68.0,Georgi Dimitrov,http://www.wikidata.org/entity/Q155074,wd:Q155074,411093,former General Secretary of the Bulgarian Communist Party
Bulgaria,68.0,Maximinus Thrax,http://www.wikidata.org/entity/Q1777,wd:Q1777,28030743,Roman Emperor (173-238)
Greece,68.0,Maximinus Thrax,http://www.wikidata.org/entity/Q1777,wd:Q1777,28030743,Roman Emperor (173-238)
Turkey,68.0,Maximinus Thrax,http://www.wikidata.org/entity/Q1777,wd:Q1777,28030743,Roman Emperor (173-238)
Bulgaria,66.0,Ahmed III,http://www.wikidata.org/entity/Q199482,wd:Q199482,1529,politician and Sultan from 1703 of the Ottoman Empire (1673-1736)
Bulgaria,65.0,Todor Zhivkov,http://www.wikidata.org/entity/Q28517,wd:Q28517,276706,former General Secretary of the Bulgarian Communist Party
Bulgaria,65.0,Georgi Parvanov,http://www.wikidata.org/entity/Q57261,wd:Q57261,392310,4th President of Bulgaria 2002-2012
Bulgaria,64.0,Belisarius,http://www.wikidata.org/entity/Q174943,wd:Q174943,23476714,6th century Byzantine general instrumental in reconquest of much of the former Roman Mediterranean territories (505-565)
Bulgaria,62.0,Ivan Vazov,http://www.wikidata.org/entity/Q310630,wd:Q310630,411828,Bulgarian writer and poet (1850-1921)
Bulgaria,62.0,Flavius Aetius,http://www.wikidata.org/entity/Q185476,wd:Q185476,75831,5th century Roman general
Bulgaria,60.0,Marcian,http://www.wikidata.org/entity/Q178004,wd:Q178004,53739,Eastern Roman (Byzantine) emperor (390-457)
Greece,60.0,Marcian,http://www.wikidata.org/entity/Q178004,wd:Q178004,53739,Eastern Roman (Byzantine) emperor (390-457)
Turkey,60.0,Marcian,http://www.wikidata.org/entity/Q178004,wd:Q178004,53739,Eastern Roman (Byzantine) emperor (390-457)
Bulgaria,59.0,Simeon II of Bulgaria,http://www.wikidata.org/entity/Q1060355,wd:Q1060355,237012,Bulgarian ruler and politician
Bulgaria,58.0,Ferdinand I of Bulgaria,http://www.wikidata.org/entity/Q151667,wd:Q151667,69571,Bulgarian ruler
Bulgaria,55.0,Phocas,http://www.wikidata.org/entity/Q31556,wd:Q31556,44318,emperor of Byzantine Empire (547-610)
Greece,55.0,Phocas,http://www.wikidata.org/entity/Q31556,wd:Q31556,44318,emperor of Byzantine Empire (547-610)
Bulgaria,55.0,Boris III of Bulgaria,http://www.wikidata.org/entity/Q159585,wd:Q159585,56152,Bulgarian ruler
Bulgaria,55.0,Simeon I of Bulgaria,http://www.wikidata.org/entity/Q192264,wd:Q192264,339877,First Emperor of the Bulgars from 893 to 927
Bulgaria,53.0,Rosen Plevneliev,http://www.wikidata.org/entity/Q295212,wd:Q295212,27881798,Bulgarian politician
Bulgaria,52.0,Irina Bokova,http://www.wikidata.org/entity/Q230850,wd:Q230850,22351888,Bulgarian diplomat
Bulgaria,52.0,Tiberius II Constantine,http://www.wikidata.org/entity/Q31491,wd:Q31491,252345,Byzantine Emperor (520-582)
Greece,52.0,Tiberius II Constantine,http://www.wikidata.org/entity/Q31491,wd:Q31491,252345,Byzantine Emperor (520-582)
Chile,157.0,Pablo Neruda,http://www.wikidata.org/entity/Q34189,wd:Q34189,7673195,Chilean poet and politician (1904–1973)
Chile,119.0,Salvador Allende,http://www.wikidata.org/entity/Q440,wd:Q440,51487,28th president of Chile (1908–1973)
Chile,118.0,Augusto Pinochet,http://www.wikidata.org/entity/Q368,wd:Q368,18933396,"Dictator, General, politician of Chile (1915-2006)"
Chile,113.0,Michelle Bachelet,http://www.wikidata.org/entity/Q320,wd:Q320,986814,President of Chile from 2006 to 2010 and 2014 to 2018
Chile,86.0,Sebastián Piñera,http://www.wikidata.org/entity/Q306,wd:Q306,1889736,35th and 37th president of Chile
Chile,70.0,Gabriel Boric,http://www.wikidata.org/entity/Q16297876,wd:Q16297876,47329497,President of Chile
Chile,57.0,Bernardo O'Higgins,http://www.wikidata.org/entity/Q28930,wd:Q28930,303199,Chilean independence leader (1778-1842)
Peru,57.0,Bernardo O'Higgins,http://www.wikidata.org/entity/Q28930,wd:Q28930,303199,Chilean independence leader (1778-1842)
Chile,56.0,Víctor Jara,http://www.wikidata.org/entity/Q125133,wd:Q125133,88401,"Chilean teacher, theatre director, poet, singer-songwriter, and political activist (1932-1973)"
Colombia,100.0,Pablo Escobar,http://www.wikidata.org/entity/Q187447,wd:Q187447,161570,Colombian drug lord (1949–1993)
Colombia,96.0,Juan Manuel Santos,http://www.wikidata.org/entity/Q57311,wd:Q57311,9743046,former president of Colombia
Colombia,60.0,Felipe González,http://www.wikidata.org/entity/Q156799,wd:Q156799,273228,Prime Minister of Spain from 1982 to 1996
Colombia,55.0,Álvaro Uribe Vélez,http://www.wikidata.org/entity/Q187413,wd:Q187413,243680,President of Colombia from 2002 to 2010
Colombia,55.0,Iván Duque,http://www.wikidata.org/entity/Q17478000,wd:Q17478000,57023855,Former President of Colombia
Croatia,119.0,Josip Broz Tito,http://www.wikidata.org/entity/Q9161,wd:Q9161,16567,Yugoslav revolutionary and statesman (1892−1980)
Croatia,106.0,Kolinda Grabar-Kitarović,http://www.wikidata.org/entity/Q3176299,wd:Q3176299,1528309,Croatian politician and diplomat
Croatia,90.0,Diocletian,http://www.wikidata.org/entity/Q43107,wd:Q43107,8580,Augustus of the Eastern Roman Empire (244-311)
Croatia,73.0,Franjo Tuđman,http://www.wikidata.org/entity/Q183703,wd:Q183703,168300,"Croatian politician, soldier and president (1922-1999)"
Croatia,70.0,Stjepan Mesić,http://www.wikidata.org/entity/Q146496,wd:Q146496,331105,"politician, lawyer and former Croatian president"
Croatia,69.0,Ivo Josipović,http://www.wikidata.org/entity/Q57258,wd:Q57258,22691176,"Croatian politician, third President of Croatia"
Croatia,66.0,Zoran Milanović,http://www.wikidata.org/entity/Q57687,wd:Q57687,11558916,Croatian politician
Croatia,66.0,Otto von Habsburg,http://www.wikidata.org/entity/Q76343,wd:Q76343,148301,German politician and Crown Prince of Austria (1912-2011)
Croatia,65.0,Valens,http://www.wikidata.org/entity/Q172471,wd:Q172471,32519,Roman emperor from 364 to 378
Croatia,65.0,Julius Nepos,http://www.wikidata.org/entity/Q103860,wd:Q103860,51189,Roman emperor (430-480)
Croatia,65.0,Marcus Vipsanius Agrippa,http://www.wikidata.org/entity/Q48174,wd:Q48174,19747,ancient Roman statesman and general
Croatia,62.0,János Kádár,http://www.wikidata.org/entity/Q200850,wd:Q200850,441860,former General Secretary of the Hungarian Socialist Workers' Party
Hungary,62.0,János Kádár,http://www.wikidata.org/entity/Q200850,wd:Q200850,441860,former General Secretary of the Hungarian Socialist Workers' Party
Croatia,61.0,Quintillus,http://www.wikidata.org/entity/Q185844,wd:Q185844,148785,Roman emperor
Serbia,61.0,Quintillus,http://www.wikidata.org/entity/Q185844,wd:Q185844,148785,Roman emperor
Croatia,60.0,Andrej Plenković,http://www.wikidata.org/entity/Q11685764,wd:Q11685764,40129899,Prime Minister of Croatia
Croatia,58.0,Ivo Sanader,http://www.wikidata.org/entity/Q56220,wd:Q56220,399851,"Croatian politician, former Prime Minister"
Croatia,54.0,Jadranka Kosor,http://www.wikidata.org/entity/Q57611,wd:Q57611,1265589,Croatian politician
Denmark,120.0,Theodor Mommsen,http://www.wikidata.org/entity/Q25351,wd:Q25351,85762,German classical scholar and historian (1817–1903)
Denmark,102.0,Margrethe II of Denmark,http://www.wikidata.org/entity/Q102139,wd:Q102139,58925,Queen of Denmark
Denmark,85.0,Anders Fogh Rasmussen,http://www.wikidata.org/entity/Q46052,wd:Q46052,275811,former Prime Minister of Denmark and NATO secretary general
Denmark,75.0,Cnut the Great,http://www.wikidata.org/entity/Q134128,wd:Q134128,40501,"10th and 11th-century King of Denmark, Norway, and England"
Denmark,71.0,Constantine II of Greece,http://www.wikidata.org/entity/Q151773,wd:Q151773,160199,King of Greece from 1964 to 1973
Greece,71.0,Constantine II of Greece,http://www.wikidata.org/entity/Q151773,wd:Q151773,160199,King of Greece from 1964 to 1973
Denmark,70.0,Mette Frederiksen,http://www.wikidata.org/entity/Q5015,wd:Q5015,26040044,27th and current prime minister of Denmark
Denmark,67.0,Helle Thorning-Schmidt,http://www.wikidata.org/entity/Q57652,wd:Q57652,1728975,"Danish politician, former Danish Prime Minister"
Denmark,66.0,Lars Løkke Rasmussen,http://www.wikidata.org/entity/Q182397,wd:Q182397,20502322,Danish politician
Denmark,66.0,Haakon VII of Norway,http://www.wikidata.org/entity/Q154927,wd:Q154927,64956,King of Norway from 1905 to 1957 (1872-1957)
Denmark,65.0,George I of Greece,http://www.wikidata.org/entity/Q17142,wd:Q17142,187387,King of Greece ( 1863–1913)
Greece,65.0,George I of Greece,http://www.wikidata.org/entity/Q17142,wd:Q17142,187387,King of Greece ( 1863–1913)
Denmark,62.0,Frederick IX of Denmark,http://www.wikidata.org/entity/Q151312,wd:Q151312,151454,King of Denmark 1947-1972
Denmark,62.0,Olav V of Norway,http://www.wikidata.org/entity/Q154912,wd:Q154912,66068,King of Norway (1903-1991)
Denmark,61.0,Christian IX of Denmark,http://www.wikidata.org/entity/Q151305,wd:Q151305,85667,King of Denmark 1863–1906
Denmark,59.0,Fredrik Bajer,http://www.wikidata.org/entity/Q191016,wd:Q191016,320918,Danish politician (1837-1922)
Denmark,58.0,Christian IV of Denmark,http://www.wikidata.org/entity/Q153586,wd:Q153586,150876,King of Denmark and Norway (1577-1648)
Denmark,57.0,Margaret I of Denmark,http://www.wikidata.org/entity/Q202266,wd:Q202266,58726,"Queen of Denmark, Norway, and Sweden"
Denmark,57.0,Sweyn I of Denmark,http://www.wikidata.org/entity/Q181896,wd:Q181896,40406,"King of Denmark, England, and Norway"
Denmark,57.0,Christian X of Denmark,http://www.wikidata.org/entity/Q156617,wd:Q156617,72708,King of Denmark and Iceland
Denmark,57.0,Christian I of Denmark,http://www.wikidata.org/entity/Q153940,wd:Q153940,174698,Scandinavian monarch under the Kalmar Union (1426-1481)
Sweden,57.0,Christian I of Denmark,http://www.wikidata.org/entity/Q153940,wd:Q153940,174698,Scandinavian monarch under the Kalmar Union (1426-1481)
Denmark,56.0,Queen Alexandra of the United Kingdom,http://www.wikidata.org/entity/Q152260,wd:Q152260,48918,Queen Consort of the United Kingdom (1901 - 1910)
Denmark,54.0,Frederick V of Denmark,http://www.wikidata.org/entity/Q156187,wd:Q156187,196670,King of Denmark and Norway
Denmark,54.0,Harald Bluetooth,http://www.wikidata.org/entity/Q201041,wd:Q201041,42419,King of Denmark and Norway
Denmark,53.0,Hjalmar Schacht,http://www.wikidata.org/entity/Q151691,wd:Q151691,390771,German politician and economist
Denmark,53.0,Frederick III of Denmark,http://www.wikidata.org/entity/Q157812,wd:Q157812,150914,King of Denmark and Norway from 1648 to 1670
Denmark,53.0,Frederik VIII of Denmark,http://www.wikidata.org/entity/Q152756,wd:Q152756,150916,King of Denmark from 1906 to 1912
Denmark,53.0,Harthacanute,http://www.wikidata.org/entity/Q190091,wd:Q190091,40259,King of England and Denmark
Denmark,52.0,Christian VII of Denmark,http://www.wikidata.org/entity/Q156572,wd:Q156572,150888,King of Denmark and Norway (1749-1808)
Denmark,52.0,Frederick VII of Denmark,http://www.wikidata.org/entity/Q94941,wd:Q94941,171789,King of Denmark (1808-1863)
Denmark,52.0,Maria Feodorovna (Dagmar of Denmark),http://www.wikidata.org/entity/Q153601,wd:Q153601,20540,Wife of Alexander III of Russia (1847–1928)
Denmark,51.0,Christian II of Denmark,http://www.wikidata.org/entity/Q154460,wd:Q154460,150846,"King of Denmark, Norway and Sweden"
Denmark,51.0,Christian VIII of Denmark,http://www.wikidata.org/entity/Q157781,wd:Q157781,150891,"King of Norway 1814, King of Denmark 1839-1848"
Egypt,146.0,Cleopatra,http://www.wikidata.org/entity/Q635,wd:Q635,60827,queen of the Ptolemaic Kingdom of Egypt from 51 to 30 BC
Egypt,135.0,Hosni Mubarak,http://www.wikidata.org/entity/Q34105,wd:Q34105,51884,Egyptian president and politician (1928-2020)
Egypt,119.0,Gamal Abdel Nasser,http://www.wikidata.org/entity/Q39524,wd:Q39524,51879,2nd President of Egypt from 1956 to 1970
Egypt,117.0,Anwar Sadat,http://www.wikidata.org/entity/Q42013,wd:Q42013,49522,3rd president of Egypt (1970–81)
Egypt,113.0,Mohamed Morsi,http://www.wikidata.org/entity/Q4631,wd:Q4631,32253721,5th President of Egypt (1951-2019)
Egypt,106.0,Tutankhamon,http://www.wikidata.org/entity/Q12154,wd:Q12154,30437,14th century BCE (18th dynasty) Egyptian pharaoh
Egypt,100.0,Abdel Fattah el-Sisi,http://www.wikidata.org/entity/Q307871,wd:Q307871,36703624,6th president of Egypt
Egypt,100.0,Nefertiti,http://www.wikidata.org/entity/Q40930,wd:Q40930,90050,"Egyptian queen and Great Royal Wife (chief consort) of Akhenaten, an Egyptian Pharaoh"
Egypt,88.0,Boutros Boutros-Ghali,http://www.wikidata.org/entity/Q1257,wd:Q1257,211193,Secretary-General of the United Nations from 1992 to 1996
Egypt,86.0,Hatshepsut,http://www.wikidata.org/entity/Q129234,wd:Q129234,60832,5th Pharaoh of the Eighteenth Dynasty of Egypt (c. 1479 BC - 1458 BC)
Egypt,83.0,Rudolf Heß,http://www.wikidata.org/entity/Q75866,wd:Q75866,29684300,German Nazi leader (1894-1987)
Egypt,79.0,Mohamed ElBaradei,http://www.wikidata.org/entity/Q133308,wd:Q133308,171776,"Egyptian law scholar and diplomat, former Director General of the International Atomic Energy Agency, and Nobel Peace Prize recipient"
Egypt,66.0,Filippo Tommaso Marinetti,http://www.wikidata.org/entity/Q216582,wd:Q216582,11801,"Italian poet and editor, founder of the Futurist movement (1876-1944)"
Egypt,63.0,Amenhotep III,http://www.wikidata.org/entity/Q42606,wd:Q42606,253776,ninth Pharaoh of the Eighteenth dynasty of Egypt
Egypt,62.0,Seti I,http://www.wikidata.org/entity/Q157918,wd:Q157918,237521,The second pharaoh of Ancient Egypt's 19th dynasty
Egypt,60.0,Mohamed Naguib,http://www.wikidata.org/entity/Q104392,wd:Q104392,350297,Egyptian revolutionary and President of Egypt (1901–1984)
Egypt,60.0,Nawal El Saadawi,http://www.wikidata.org/entity/Q238514,wd:Q238514,30874241,Egyptian feminist writer (1931-2021)
Egypt,58.0,Farouk I of Egypt,http://www.wikidata.org/entity/Q213001,wd:Q213001,52023,King of Egypt and the Sudan from 1936 to 1952
Egypt,58.0,Sneferu,http://www.wikidata.org/entity/Q189371,wd:Q189371,18085095,pharaoh and founder of the 4th dynasty of Ancient Egypt
Egypt,56.0,Sayyid Qutb,http://www.wikidata.org/entity/Q211379,wd:Q211379,23839057,"Egyptian author, educator, poet, and politician (1906—1966)"
Egypt,56.0,Caesarion,http://www.wikidata.org/entity/Q39589,wd:Q39589,75097,"last Ptolemaic Pharaoh of Egypt, son of Cleopatra and Julius Caesar"
Egypt,52.0,Muhammad Abduh,http://www.wikidata.org/entity/Q311826,wd:Q311826,1149684,"Egyptian Islamic jurist, religious scholar and liberal reformer (1849-1905)"
Egypt,52.0,Hassan al-Banna,http://www.wikidata.org/entity/Q230291,wd:Q230291,23616636,Egyptian Islamic leader and politician (1906—1949)
Egypt,51.0,Merneptah,http://www.wikidata.org/entity/Q158043,wd:Q158043,1168295,fourth pharaoh of the 19th Dynasty of Egypt
Estonia,89.0,Kersti Kaljulaid,http://www.wikidata.org/entity/Q12366816,wd:Q12366816,51801264,Estonian politician and president of Estonia 2016–2021
Estonia,81.0,Kaja Kallas,http://www.wikidata.org/entity/Q11869065,wd:Q11869065,45349361,Estonian politician
Estonia,75.0,Toomas Hendrik Ilves,http://www.wikidata.org/entity/Q57289,wd:Q57289,1193320,fourth president of Estonia
Sweden,75.0,Toomas Hendrik Ilves,http://www.wikidata.org/entity/Q57289,wd:Q57289,1193320,fourth president of Estonia
Estonia,72.0,Alfred Rosenberg,http://www.wikidata.org/entity/Q75849,wd:Q75849,50050,"Baltic German architect, Nazi politician and ideologue (1893-1946)"
Estonia,59.0,Jüri Ratas,http://www.wikidata.org/entity/Q2621730,wd:Q2621730,3722808,Estonian politician
Estonia,56.0,Andrus Ansip,http://www.wikidata.org/entity/Q57640,wd:Q57640,1708682,Estonian chemist and politician
Estonia,54.0,Konstantin Päts,http://www.wikidata.org/entity/Q299114,wd:Q299114,1065429,Estonian politician
Estonia,53.0,Lennart Meri,http://www.wikidata.org/entity/Q153149,wd:Q153149,379531,"Estonian writer, filmmaker and politician; President of Estonia in 1992–2001"
Estonia,53.0,Arnold Rüütel,http://www.wikidata.org/entity/Q194000,wd:Q194000,341466,former President of Estonia
Estonia,51.0,Patriarch Alexius II,http://www.wikidata.org/entity/Q151040,wd:Q151040,304995,"15th Patriarch of Moscow and all the Rus', the primate of the Russian Orthodox Church (1929-2008)"
Finland,95.0,Sauli Niinistö,http://www.wikidata.org/entity/Q29207,wd:Q29207,1042690,President of Finland since 2012
Finland,92.0,Martti Ahtisaari,http://www.wikidata.org/entity/Q29230,wd:Q29230,164603,President of Finland from 1994 to 2000
Finland,92.0,Sanna Marin,http://www.wikidata.org/entity/Q16986436,wd:Q16986436,52829655,Finnish politician and the 46th Prime Minister of Finland
Finland,88.0,Tarja Halonen,http://www.wikidata.org/entity/Q29213,wd:Q29213,30797,11th President of Finland
Finland,81.0,Carl Gustaf Emil Mannerheim,http://www.wikidata.org/entity/Q152306,wd:Q152306,164614,Finnish military leader and statesman (1867–1951)
