country,number,item,item_id,shortform,pageid,wikidata_description
Finland,73.0,Urho Kekkonen,http://www.wikidata.org/entity/Q179858,wd:Q179858,32048,eighth President of Finland (1900–1986)
Finland,63.0,Mauno Koivisto,http://www.wikidata.org/entity/Q29021,wd:Q29021,164615,President of Finland (1923–2017)
Finland,62.0,Mari Kiviniemi,http://www.wikidata.org/entity/Q105068,wd:Q105068,23095332,Finnish politician
Finland,60.0,Juho Kusti Paasikivi,http://www.wikidata.org/entity/Q202171,wd:Q202171,164616,7th President of Finland (1870-1956)
Finland,54.0,Matti Vanhanen,http://www.wikidata.org/entity/Q182043,wd:Q182043,252252,Finnish politician and the 40th prime minister of Finland
Finland,53.0,Kaarlo Juho Ståhlberg,http://www.wikidata.org/entity/Q214029,wd:Q214029,164619,President of Finland (1865-1952)
Finland,52.0,Pehr Evind Svinhufvud,http://www.wikidata.org/entity/Q209439,wd:Q209439,164620,President of Finland (1861–1944)
Finland,52.0,Jyrki Katainen,http://www.wikidata.org/entity/Q57638,wd:Q57638,1039797,Finnish politician
Finland,51.0,Matti Nykänen,http://www.wikidata.org/entity/Q16849,wd:Q16849,484742,Finnish ski jumper (1963-2019)
Finland,51.0,Risto Ryti,http://www.wikidata.org/entity/Q209435,wd:Q209435,164618,President of Finland (1889–1956)
Greece,235.0,Mustafa Kemal Atatürk,http://www.wikidata.org/entity/Q5152,wd:Q5152,1329090,founding father of the Republic of Turkey (1881-1938)
Turkey,235.0,Mustafa Kemal Atatürk,http://www.wikidata.org/entity/Q5152,wd:Q5152,1329090,founding father of the Republic of Turkey (1881-1938)
Greece,232.0,Alexander the Great,http://www.wikidata.org/entity/Q8409,wd:Q8409,783,king of Macedonia and conqueror of Achaemenid Persia (356–323 BC)
Greece,197.0,Pythagoras,http://www.wikidata.org/entity/Q10261,wd:Q10261,23275,6th century BC Greek philosopher and mystic
Greece,148.0,Plutarch,http://www.wikidata.org/entity/Q41523,wd:Q41523,24517,late 1st/early 2nd century Greek philosopher and historian
Greece,122.0,"Prince Philip, Duke of Edinburgh",http://www.wikidata.org/entity/Q80976,wd:Q80976,62093,"member of the British royal family, husband of Queen Elizabeth II (1921–2021)"
Greece,113.0,Pericles,http://www.wikidata.org/entity/Q80398,wd:Q80398,36812,"Athenian statesman, orator and general (c. 495 – 429 BC)"
Greece,109.0,Solon,http://www.wikidata.org/entity/Q133337,wd:Q133337,58230,Athenian legislator
Greece,91.0,Alexis Tsipras,http://www.wikidata.org/entity/Q312015,wd:Q312015,15702073,Prime Minister of Greece (2015; 2015–2019)
Greece,81.0,Nikos Kazantzakis,http://www.wikidata.org/entity/Q214622,wd:Q214622,51418,Greek writer and philosopher (1883-1957)
Greece,79.0,Leonidas I,http://www.wikidata.org/entity/Q44228,wd:Q44228,94111,King of Sparta from c. 489 BC to 480 BC
Greece,76.0,Themistocles,http://www.wikidata.org/entity/Q179552,wd:Q179552,31069,Athenian politician and general (c. 524–459 BC)
Greece,70.0,Seleucus I Nicator,http://www.wikidata.org/entity/Q184176,wd:Q184176,84554,general of Alexander and founder of the Seleucid dynasty
Greece,69.0,Alcibiades,http://www.wikidata.org/entity/Q187982,wd:Q187982,61322,Athenian statesman
Greece,67.0,Kyriakos Mitsotakis,http://www.wikidata.org/entity/Q552751,wd:Q552751,2780816,Prime Minister of Greece
Greece,67.0,Muhammad Ali of Egypt,http://www.wikidata.org/entity/Q182781,wd:Q182781,38094479,Albanian Ottoman commander and Wali of Egypt and Sudan (1769–1849)
Greece,66.0,Nana Mouskouri,http://www.wikidata.org/entity/Q154662,wd:Q154662,1196068,Greek singer
Greece,65.0,Karolos Papoulias,http://www.wikidata.org/entity/Q57303,wd:Q57303,1272686,Greek jurist and politician(1929-2021)
Greece,65.0,Ptolemy II Philadelphus,http://www.wikidata.org/entity/Q39576,wd:Q39576,84099,king of the Ptolemaic dynasty in Egypt (308-246 B.C.)
Greece,63.0,Hayreddin Barbarossa,http://www.wikidata.org/entity/Q200582,wd:Q200582,5412763,Ottoman admiral
Greece,62.0,Giorgos Papandreou,http://www.wikidata.org/entity/Q151917,wd:Q151917,357285,"Greek politician, president of the Socialist International"
Greece,62.0,Prokopis Pavlopoulos,http://www.wikidata.org/entity/Q3407316,wd:Q3407316,4024308,16th President of the Greek Republic
Greece,62.0,Alcaeus of Mytilene,http://www.wikidata.org/entity/Q212872,wd:Q212872,1577,ancient Greek poet
Greece,62.0,Katerina Sakellaropoulou,http://www.wikidata.org/entity/Q57415743,wd:Q57415743,62836868,"Greek judge, 7th President of Greece"
Greece,61.0,Mikis Theodorakis,http://www.wikidata.org/entity/Q151976,wd:Q151976,155035,Greek composer (1925–2021)
Greece,60.0,Eleftherios Venizelos,http://www.wikidata.org/entity/Q205545,wd:Q205545,305256,Greek politician; Prime Minister 1910–20 and 1928–33
Greece,59.0,Loukas Papademos,http://www.wikidata.org/entity/Q164281,wd:Q164281,2807634,Greek economist and Prime Minister
Greece,59.0,Irene of Athens,http://www.wikidata.org/entity/Q206737,wd:Q206737,74213,Empress of Byzantine Empire (752-803)
Greece,56.0,George II of Greece,http://www.wikidata.org/entity/Q152935,wd:Q152935,160203,King of Greece (1922-1947)
Greece,55.0,Antonis Samaras,http://www.wikidata.org/entity/Q57806,wd:Q57806,1478639,Greek politician
Greece,55.0,Epaminondas,http://www.wikidata.org/entity/Q190436,wd:Q190436,82489,Theban general and statesman (d. 362 BC)
Greece,55.0,Constantine I of Greece,http://www.wikidata.org/entity/Q152099,wd:Q152099,160204,King of Greece (1913- 1922)
Greece,53.0,Melina Mercouri,http://www.wikidata.org/entity/Q228611,wd:Q228611,193870,"Greek actress, singer and politician. Minister of Culture of Greece (1920-1994)"
Greece,52.0,Konstantinos Karamanlis,http://www.wikidata.org/entity/Q156806,wd:Q156806,351050,"Prime Minister of Greece intermittently between 1955-80, President from 1980-85, 1990-95"
Greece,52.0,Andreas Papandreou,http://www.wikidata.org/entity/Q219256,wd:Q219256,357210,Greek economist and politician (1919–1996)
Greece,52.0,Olympias,http://www.wikidata.org/entity/Q223134,wd:Q223134,81735,mother of Alexander the Great
Greece,52.0,Mahpeyker Kösem Sultan,http://www.wikidata.org/entity/Q61127,wd:Q61127,5341022,"Haseki Sultan of Ahmed, mother, Valide Sultan and Regent of Murad IV and Ibrahim I, grandmother and Regent of Mehmed IV"
Greece,52.0,Ptolemy III Euergetes,http://www.wikidata.org/entity/Q39602,wd:Q39602,60839,Egyptian pharaoh
Greece,51.0,Ioannis Kapodistrias,http://www.wikidata.org/entity/Q220430,wd:Q220430,15767974,"Greek politician and diplomat, first Governor of the modern Greek state (1776–1831)"
Greece,51.0,Peleus,http://www.wikidata.org/entity/Q178641,wd:Q178641,38419,mythical character
Greece,51.0,Paul I of Greece,http://www.wikidata.org/entity/Q155394,wd:Q155394,160201,King of Greece  (1947 - 1964)
Hungary,99.0,Viktor Orbán,http://www.wikidata.org/entity/Q57641,wd:Q57641,750582,Prime Minister of Hungary (1998–2002; 2010–present)
Hungary,78.0,Albert Szent-Györgyi,http://www.wikidata.org/entity/Q180468,wd:Q180468,240540,Hungarian biochemist who won the Nobel Prize in Physiology or Medicine in 1937
Hungary,78.0,Joseph Pulitzer,http://www.wikidata.org/entity/Q173417,wd:Q173417,184194,American publisher of Democratic newspapers (1847-1911)
Hungary,76.0,János Áder,http://www.wikidata.org/entity/Q57467,wd:Q57467,23086949,President of Hungary (2012–2022)
Hungary,72.0,"Charles VI, Holy Roman Emperor",http://www.wikidata.org/entity/Q150665,wd:Q150665,151094,18th century Habsburg Holy Roman Emperor
Hungary,71.0,Imre Nagy,http://www.wikidata.org/entity/Q177917,wd:Q177917,62022,Hungarian politician (died 1958)
Hungary,67.0,Stephen I of Hungary,http://www.wikidata.org/entity/Q177903,wd:Q177903,29594,11th-century king of Hungary and saint
Hungary,66.0,György Lukács,http://www.wikidata.org/entity/Q151523,wd:Q151523,43069535,"Hungarian marxist politician, philosopher and literary critic (1885–1971)"
Hungary,64.0,"Ferdinand III, Holy Roman Emperor",http://www.wikidata.org/entity/Q150575,wd:Q150575,151087,Emperor of the Holy Roman Empire (1608-1657)
Hungary,62.0,Miklós Horthy,http://www.wikidata.org/entity/Q117144,wd:Q117144,51307,Regent of Hungary from 1920 to 1944
Hungary,60.0,Elizabeth Báthory,http://www.wikidata.org/entity/Q170846,wd:Q170846,126090,Hungarian countess
Hungary,59.0,Lajos Kossuth,http://www.wikidata.org/entity/Q157040,wd:Q157040,383576,Hungarian politician
Hungary,59.0,Jadwiga I of Poland,http://www.wikidata.org/entity/Q53449,wd:Q53449,16419,Queen of Poland (1384–1399)
Hungary,59.0,Geiseric,http://www.wikidata.org/entity/Q152127,wd:Q152127,26257742,King of the Vandals and Alans
Hungary,57.0,Mátyás Rákosi,http://www.wikidata.org/entity/Q207631,wd:Q207631,847908,former First Secretary of the Hungarian Working People's Party
Serbia,57.0,Mátyás Rákosi,http://www.wikidata.org/entity/Q207631,wd:Q207631,847908,former First Secretary of the Hungarian Working People's Party
Hungary,56.0,Béla Kun,http://www.wikidata.org/entity/Q151646,wd:Q151646,179859,"Hungarian Communist revolutionary and politician, the de facto leader of the Hungarian Soviet Republic in 1919, People's Commissar of Foreign Affairs"
Romania,56.0,Béla Kun,http://www.wikidata.org/entity/Q151646,wd:Q151646,179859,"Hungarian Communist revolutionary and politician, the de facto leader of the Hungarian Soviet Republic in 1919, People's Commissar of Foreign Affairs"
Hungary,56.0,László Sólyom,http://www.wikidata.org/entity/Q152335,wd:Q152335,2006306,politician and former President of Hungary
Hungary,55.0,Pál Schmitt,http://www.wikidata.org/entity/Q184810,wd:Q184810,1800646,"President of Hungary, olympic champion"
Hungary,55.0,Louis I of Hungary,http://www.wikidata.org/entity/Q53998,wd:Q53998,38740,"King of Hungary, Poland and Croatia"
Hungary,54.0,Ferenc Gyurcsány,http://www.wikidata.org/entity/Q191337,wd:Q191337,945404,Prime Minister of Hungary from 2004 to 2009
Hungary,52.0,Katalin Novák,http://www.wikidata.org/entity/Q21995345,wd:Q21995345,58023845,"Hungarian politician, President of Hungary (2022–)"
Hungary,51.0,Ilona Staller,http://www.wikidata.org/entity/Q49941,wd:Q49941,36762,"Hungarian-born Italian pornographic actress, singer and politician"
Hungary,51.0,Louis II of Hungary,http://www.wikidata.org/entity/Q157092,wd:Q157092,46209,"King of Hungary, Croatia and Bohemia (1506-1526)"
Iran,140.0,Mahmoud Ahmadinejad,http://www.wikidata.org/entity/Q34448,wd:Q34448,7907317,6th President of Iran from 2005 to 2013
Iran,129.0,Cyrus the Great,http://www.wikidata.org/entity/Q8423,wd:Q8423,800012,founder of the Achaemenid Empire
Iran,121.0,Ruhollah Khomeini,http://www.wikidata.org/entity/Q38823,wd:Q38823,26232,Iranian politician and religious leader (1900–1989)
Iran,119.0,Hassan Rouhani,http://www.wikidata.org/entity/Q348144,wd:Q348144,38481813,Former President of Iran
Iran,117.0,Hammurabi,http://www.wikidata.org/entity/Q36359,wd:Q36359,14358,sixth king of Babylonia
Iran,113.0,Ali Khamenei,http://www.wikidata.org/entity/Q57336,wd:Q57336,385653,Supreme Leader of Iran since 1989
Iran,106.0,Mohammad Khatami,http://www.wikidata.org/entity/Q180795,wd:Q180795,193208,5th President of Iran
Iran,104.0,Shirin Ebadi,http://www.wikidata.org/entity/Q131152,wd:Q131152,337976,"Iranian lawyer, human rights activist, and Nobel Peace Prize recipient"
Iran,99.0,Mohammad Reza Pahlavi,http://www.wikidata.org/entity/Q128245,wd:Q128245,20065598,Shah of Iran from 1941 to 1979
Iran,93.0,Harun al-Rashid,http://www.wikidata.org/entity/Q131002,wd:Q131002,78388,5th Abbasid caliph (r. 786–809)
Iran,86.0,Xerxes I,http://www.wikidata.org/entity/Q129165,wd:Q129165,46289,King of Kings of Achaemenid Empire from 486 to 465 BC
Iran,77.0,Akbar Hashemi Rafsanjani,http://www.wikidata.org/entity/Q186111,wd:Q186111,399536,Fourth president of Iran from 1989 to 1997
Iran,73.0,Nader Shah,http://www.wikidata.org/entity/Q192868,wd:Q192868,23386500,Shah of Iran (1688-1747; ruled 1736-1747)
Iran,72.0,Reza Shah,http://www.wikidata.org/entity/Q182921,wd:Q182921,250811,Shah of Iran from 1925 to 1941
Iran,72.0,Ismail I,http://www.wikidata.org/entity/Q214559,wd:Q214559,544668,Shah of Iran
Iran,65.0,Ardashir I,http://www.wikidata.org/entity/Q371319,wd:Q371319,841099,Founder of the Sassanid Empire (180-242)
Iran,63.0,Abulhassan Banisadr,http://www.wikidata.org/entity/Q273866,wd:Q273866,399571,"Iranian politician and economist, and Iran's first President"
Iran,62.0,Mohammad Mosaddegh,http://www.wikidata.org/entity/Q123037,wd:Q123037,216440,former Prime Minister of Iran (1882–1967)
Iran,60.0,Moshe Katsav,http://www.wikidata.org/entity/Q181832,wd:Q181832,243060,"Israeli politician, 8th president of Israel"
Israel,60.0,Moshe Katsav,http://www.wikidata.org/entity/Q181832,wd:Q181832,243060,"Israeli politician, 8th president of Israel"
Iran,58.0,Khosrow I,http://www.wikidata.org/entity/Q207381,wd:Q207381,140475,Iranian sovereign
Iran,57.0,Shapur I,http://www.wikidata.org/entity/Q191455,wd:Q191455,140700,ruler of the Sasanian Empire from c.240 to c.270
Iran,55.0,Shapur II,http://www.wikidata.org/entity/Q234860,wd:Q234860,140702,Shah of Persia
Iran,53.0,Mohammad-Ali Rajai,http://www.wikidata.org/entity/Q310592,wd:Q310592,399557,Iranian Prime Minister and President of Iran (1933-1981)
Iran,53.0,Farah Pahlavi,http://www.wikidata.org/entity/Q164111,wd:Q164111,30875988,Former Empress Consort of Iran
Iran,53.0,Rashid-al-Din Hamadani,http://www.wikidata.org/entity/Q328782,wd:Q328782,564579,Persian physician and historian (1247-1318)
Iran,53.0,Fat'h-Ali Shah Qajar,http://www.wikidata.org/entity/Q175299,wd:Q175299,858154,Shah of Persia (1772-1834)
Iran,52.0,Masoud Barzani,http://www.wikidata.org/entity/Q315927,wd:Q315927,8122677,Iraqi Kurdish politician
Iran,52.0,Tahmasp I,http://www.wikidata.org/entity/Q298410,wd:Q298410,535230,Safavid Shah of Iran from 1524 to 1576
Iran,51.0,Yazdegerd III,http://www.wikidata.org/entity/Q208463,wd:Q208463,140677,Last Sasanian King of Iran (r. 632–651)
Israel,140.0,Benjamin Netanyahu,http://www.wikidata.org/entity/Q43723,wd:Q43723,56472,Prime Minister of Israel
Israel,133.0,Solomon,http://www.wikidata.org/entity/Q37085,wd:Q37085,28329,king of Israel and son of David
Israel,122.0,David Ben-Gurion,http://www.wikidata.org/entity/Q37610,wd:Q37610,67765,"Israeli politician, Zionist leader, prime minister of Israel (1886–1973)"
Poland,122.0,David Ben-Gurion,http://www.wikidata.org/entity/Q37610,wd:Q37610,67765,"Israeli politician, Zionist leader, prime minister of Israel (1886–1973)"
Israel,120.0,Golda Meir,http://www.wikidata.org/entity/Q42992,wd:Q42992,66578,Prime Minister of Israel from 1969 to 1974
Ukraine,120.0,Golda Meir,http://www.wikidata.org/entity/Q42992,wd:Q42992,66578,Prime Minister of Israel from 1969 to 1974
Israel,115.0,Ariel Sharon,http://www.wikidata.org/entity/Q60206,wd:Q60206,2944,prime minister of Israel and Israeli general (1928-2014)
Israel,104.0,Yizhak Rabin,http://www.wikidata.org/entity/Q34060,wd:Q34060,43983,"Israeli politician, statesman and general (1922-1995)"
Israel,91.0,Mahmoud Abbas,http://www.wikidata.org/entity/Q127998,wd:Q127998,232595,Palestinian statesman
Israel,85.0,Naftali Bennett,http://www.wikidata.org/entity/Q39318,wd:Q39318,39754840,13th Prime Minister of Israel
Israel,82.0,Ehud Olmert,http://www.wikidata.org/entity/Q93181,wd:Q93181,848569,"Israeli politician, prime minister of Israel"
Israel,72.0,Reuven Rivlin,http://www.wikidata.org/entity/Q455854,wd:Q455854,2334667,Former President of the State of Israel
Israel,67.0,Moshe Dayan,http://www.wikidata.org/entity/Q188783,wd:Q188783,90142,Israeli military leader and politician (1915–1981)
Israel,67.0,Yair Lapid,http://www.wikidata.org/entity/Q1396120,wd:Q1396120,2448072,Israeli politician
Israel,65.0,Ehud Barak,http://www.wikidata.org/entity/Q125731,wd:Q125731,168212,Prime Minister of Israel from 1999 to 2001 (born 1942)
Israel,62.0,Tzipi Livni,http://www.wikidata.org/entity/Q151796,wd:Q151796,3218946,Israeli politician
Israel,62.0,Isaac Herzog,http://www.wikidata.org/entity/Q983258,wd:Q983258,4645588,Israeli politician (born 1960)
Israel,59.0,Roman Abramovich,http://www.wikidata.org/entity/Q171428,wd:Q171428,353535,"Russian oligarch, and politician"
Portugal,59.0,Roman Abramovich,http://www.wikidata.org/entity/Q171428,wd:Q171428,353535,"Russian oligarch, and politician"
Israel,59.0,Herod Antipas,http://www.wikidata.org/entity/Q192950,wd:Q192950,356714,1st century AD tetrarch of Galilee and Perea
Israel,57.0,Rehoboam,http://www.wikidata.org/entity/Q211663,wd:Q211663,26022,First King of Judah
Israel,54.0,Levi Eshkol,http://www.wikidata.org/entity/Q191123,wd:Q191123,182540,"Israeli statesman, a founder of the Israeli Labor Party and Prime Minister (1895-1969)"
Israel,54.0,Moshe Sharett,http://www.wikidata.org/entity/Q208477,wd:Q208477,216912,"Israeli politician, prime minister of Israel (1894-1965)"
Israel,54.0,Avigdor Lieberman,http://www.wikidata.org/entity/Q58311,wd:Q58311,1704303,Minister of Finance of the State of Israel
Israel,54.0,Hezekiah,http://www.wikidata.org/entity/Q244912,wd:Q244912,14005,King of Judah
Israel,51.0,Chaim Herzog,http://www.wikidata.org/entity/Q295141,wd:Q295141,364916,"Israeli politician, 6th president of Israel (1918-1997)"
Israel,51.0,Mohammed Amin al-Husseini,http://www.wikidata.org/entity/Q164745,wd:Q164745,204121,Palestinian Arab nationalist and Muslim leader (1897–1974)
Israel,51.0,Josiah,http://www.wikidata.org/entity/Q313228,wd:Q313228,623231,King of Judah
Latvia,76.0,Catherine I of Russia,http://www.wikidata.org/entity/Q15208,wd:Q15208,44239,Empress of Russia from 1725 to 1727
Latvia,58.0,Valdis Zatlers,http://www.wikidata.org/entity/Q182673,wd:Q182673,11400799,President of Latvia
Latvia,57.0,Vaira Vīķe-Freiberga,http://www.wikidata.org/entity/Q151301,wd:Q151301,319793,6th President of Latvia
Latvia,55.0,Raimonds Vējonis,http://www.wikidata.org/entity/Q2416022,wd:Q2416022,4241484,ninth president of Latvia
Latvia,51.0,Valdis Dombrovskis,http://www.wikidata.org/entity/Q57630,wd:Q57630,1484768,11th Prime Minister of Latvia
Lithuania,92.0,Józef Piłsudski,http://www.wikidata.org/entity/Q885,wd:Q885,66951,"Polish politician, First Marshall, and Prime Minister (1867–1935)"
Lithuania,86.0,Dalia Grybauskaitė,http://www.wikidata.org/entity/Q57379,wd:Q57379,22851884,President of Lithuania between 2009 and 2019
Lithuania,70.0,Władysław II Jagiełło,http://www.wikidata.org/entity/Q54049,wd:Q54049,42586,Grand Duke of Lithuania and King of Poland (c. 1352/1362-1434)
Lithuania,64.0,Valdas Adamkus,http://www.wikidata.org/entity/Q153167,wd:Q153167,559085,6th President of Lithuania
Lithuania,63.0,Gitanas Nausėda,http://www.wikidata.org/entity/Q9268379,wd:Q9268379,58519561,President of Lithuania since 2019
Lithuania,59.0,Ingrida Šimonytė,http://www.wikidata.org/entity/Q437096,wd:Q437096,41899866,Lithuanian politician
Lithuania,54.0,Vytautas,http://www.wikidata.org/entity/Q218186,wd:Q218186,599923,Grand Duke of Lithuania
Lithuania,53.0,Algirdas Brazauskas,http://www.wikidata.org/entity/Q212751,wd:Q212751,394993,Lithuanian politician (1932-2010)
Lithuania,51.0,Antanas Smetona,http://www.wikidata.org/entity/Q296950,wd:Q296950,398679,First President of Lithuania from 4 April 1919 until 19 June 1920
Luxembourg,93.0,Jean-Claude Juncker,http://www.wikidata.org/entity/Q57661,wd:Q57661,393865,Prime Minister of Luxembourg and President of the European Commission (born 1954)
Luxembourg,70.0,"Henri, Grand Duke of Luxembourg",http://www.wikidata.org/entity/Q16004,wd:Q16004,348759,Grand Duke (head of state) of the Grand Duchy of Luxembourg
Luxembourg,69.0,Robert Schuman,http://www.wikidata.org/entity/Q15981,wd:Q15981,374183,Luxembourgish-born German-French statesman and Venerable (1886-1963)
Luxembourg,63.0,Vercingetorix,http://www.wikidata.org/entity/Q178953,wd:Q178953,32802,"protohistoric chieftain of the Arverni tribe, defeated by Julius Caesar during the Gallic wars"
Luxembourg,61.0,Xavier Bettel,http://www.wikidata.org/entity/Q561213,wd:Q561213,22357485,Luxembourgian politician
Luxembourg,55.0,Majorian,http://www.wikidata.org/entity/Q191956,wd:Q191956,75155,Western Roman Emperor (420-461)
Luxembourg,53.0,John of Bohemia,http://www.wikidata.org/entity/Q155167,wd:Q155167,38197,Czech king and warrior (1296–1346)
Morocco,97.0,Mohammed VI,http://www.wikidata.org/entity/Q57553,wd:Q57553,226113,King of Morocco (1999–)
Morocco,95.0,Abdelaziz Bouteflika,http://www.wikidata.org/entity/Q57308,wd:Q57308,385658,President of Algeria
Morocco,74.0,Dominique de Villepin,http://www.wikidata.org/entity/Q131660,wd:Q131660,164662,95th Prime Minister of France
Morocco,66.0,Hassan II,http://www.wikidata.org/entity/Q69103,wd:Q69103,410355,King of Morocco from 1961 to 1999
Morocco,58.0,Jean-Luc Mélenchon,http://www.wikidata.org/entity/Q5829,wd:Q5829,20298042,French politician (born 1951)
Morocco,57.0,Abd el-Krim,http://www.wikidata.org/entity/Q202650,wd:Q202650,319028,Moroccan political and military leader (1882-1963)
New Zealand,157.0,Ernest Rutherford,http://www.wikidata.org/entity/Q9123,wd:Q9123,9603,New Zealand-born British physicist (1871–1937)
New Zealand,97.0,Jacinda Ardern,http://www.wikidata.org/entity/Q3606816,wd:Q3606816,20436507,Prime Minister of New Zealand (2017–2023)
New Zealand,71.0,John Key,http://www.wikidata.org/entity/Q57783,wd:Q57783,1075887,Prime Minister of New Zealand from 2008 to 2016
New Zealand,70.0,Helen Clark,http://www.wikidata.org/entity/Q180383,wd:Q180383,22838615,Prime Minister of New Zealand from 1999 to 2008
New Zealand,52.0,Bill English,http://www.wikidata.org/entity/Q4384608,wd:Q4384608,351592,Prime Minister of New Zealand from 2016 to 2017
Pakistan,153.0,Akbar,http://www.wikidata.org/entity/Q8597,wd:Q8597,18945005,3rd Mughal emperor from 1556 to 1605
Pakistan,133.0,Benazir Bhutto,http://www.wikidata.org/entity/Q34413,wd:Q34413,193737,11th and 13th Prime Minister of Pakistan
Pakistan,126.0,Chanakya,http://www.wikidata.org/entity/Q9045,wd:Q9045,481604,Ancient Indian statesman and philosopher
Pakistan,105.0,Manmohan Singh,http://www.wikidata.org/entity/Q41914,wd:Q41914,606490,Prime Minister of India from 2004 to 2014
India,105.0,Manmohan Singh,http://www.wikidata.org/entity/Q41914,wd:Q41914,606490,Prime Minister of India from 2004 to 2014
Pakistan,103.0,Muhammad Iqbal,http://www.wikidata.org/entity/Q484141,wd:Q484141,34348533,"South Asian Muslim writer, philosopher, and politician"
Pakistan,100.0,Pervez Musharraf,http://www.wikidata.org/entity/Q40495,wd:Q40495,24260,leader of Pakistan from 1999 to 2008
India,101.0,Pervez Musharraf,http://www.wikidata.org/entity/Q40495,wd:Q40495,24260,leader of Pakistan from 1999 to 2008
Pakistan,94.0,Shah Jahan,http://www.wikidata.org/entity/Q83672,wd:Q83672,28752,17th century Mughal Emperor
Pakistan,92.0,Sheikh Hasina,http://www.wikidata.org/entity/Q52183,wd:Q52183,623439,"Prime Minister of Bangladesh (1996–2001, 2009–present)"
Pakistan,90.0,Imran Khan,http://www.wikidata.org/entity/Q155164,wd:Q155164,413184,22nd Prime Minister of Pakistan from 2018 to 2022
Pakistan,87.0,Sheikh Mujibur Rahman,http://www.wikidata.org/entity/Q191375,wd:Q191375,246089,Founding father of the People's Republic of Bangladesh
Pakistan,86.0,Zulfiqar Ali Bhutto,http://www.wikidata.org/entity/Q131355,wd:Q131355,401102,Fourth President and ninth Prime Minister of Pakistan (1928-1979)
Pakistan,84.0,Asif Ali Zardari,http://www.wikidata.org/entity/Q57373,wd:Q57373,993655,Pakistani politician
Pakistan,78.0,Nawaz Sharif,http://www.wikidata.org/entity/Q134068,wd:Q134068,374012,"Former Pakistani three time Prime Minister, businessman and politician"
Pakistan,65.0,Abdul Hamid,http://www.wikidata.org/entity/Q3246667,wd:Q3246667,23209007,president of Bangladesh since 2013
Pakistan,65.0,Muhammad Zia-ul-Haq,http://www.wikidata.org/entity/Q200499,wd:Q200499,235340,Longest reigning dictator of Pakistan (1924-1988)
Pakistan,63.0,Mamnoon Hussain,http://www.wikidata.org/entity/Q14257286,wd:Q14257286,40027538,"Pakistani textile businessman, politician, and former president"
Pakistan,61.0,Ayub Khan,http://www.wikidata.org/entity/Q190071,wd:Q190071,230351,President of Pakistan from 1958 to 1969
Pakistan,58.0,Liaquat Ali Khan,http://www.wikidata.org/entity/Q295713,wd:Q295713,461913,First Prime Minister of the Islamic Republic Of Pakistan (1895–1951)
Pakistan,56.0,Shehbaz Sharif,http://www.wikidata.org/entity/Q2096387,wd:Q2096387,6502561,23rd Prime Minister of Pakistan
Pakistan,54.0,Yousaf Raza Gillani,http://www.wikidata.org/entity/Q152052,wd:Q152052,7829224,Pakistani politician
Pakistan,54.0,Yahya Khan,http://www.wikidata.org/entity/Q333981,wd:Q333981,34360,former Pakistani president (1917–1980)
Pakistan,53.0,Arif Alvi,http://www.wikidata.org/entity/Q4790529,wd:Q4790529,21120727,Pakistani politician
Pakistan,52.0,Gulzarilal Nanda,http://www.wikidata.org/entity/Q317769,wd:Q317769,435592,Prime Minister of India (1898-1998)
Pakistan,51.0,Zillur Rahman,http://www.wikidata.org/entity/Q57485,wd:Q57485,21493599,19th President of Bangladesh (1929-2013)
Pakistan,51.0,Khaleda Zia,http://www.wikidata.org/entity/Q234814,wd:Q234814,393763,Bangladeshi prime minister from 1991 to 1996 and 2001 to 2006
Peru,115.0,Mario Vargas Llosa,http://www.wikidata.org/entity/Q39803,wd:Q39803,163278,Peruvian novelist and writer
Spain,115.0,Mario Vargas Llosa,http://www.wikidata.org/entity/Q39803,wd:Q39803,163278,Peruvian novelist and writer
Peru,80.0,Javier Pérez de Cuéllar,http://www.wikidata.org/entity/Q1259,wd:Q1259,326080,5th Secretary-General of the United Nations (1920-2020)
Peru,74.0,Alberto Fujimori,http://www.wikidata.org/entity/Q133040,wd:Q133040,148483,President of Peru (1990-2000)
Peru,72.0,Alan García,http://www.wikidata.org/entity/Q167211,wd:Q167211,335166,Peruvian politician
Peru,63.0,Ollanta Humala,http://www.wikidata.org/entity/Q57254,wd:Q57254,5099278,President of Peru
Peru,57.0,Pedro Castillo,http://www.wikidata.org/entity/Q103838608,wd:Q103838608,49637220,President of Peru from 2021 to 2022
Peru,51.0,Martín Vizcarra Cornejo,http://www.wikidata.org/entity/Q24030720,wd:Q24030720,51682201,President of Peru from 2018 to 2020
