country,number,item,item_id,shortform,pageid,wikidata_description
Portugal,118.0,António Guterres,http://www.wikidata.org/entity/Q311440,wd:Q311440,471806,Secretary-General of the United Nations
Portugal,87.0,António de Oliveira Salazar,http://www.wikidata.org/entity/Q151394,wd:Q151394,26301553,Prime Minister of Portugal (1889-1970)
Portugal,80.0,José Manuel Durão Barroso,http://www.wikidata.org/entity/Q15849,wd:Q15849,354436,Portuguese politician and teacher (born 1956)
Portugal,76.0,Pedro I of Brazil,http://www.wikidata.org/entity/Q939,wd:Q939,81480,Emperor of Brazil (1822–31) and King of Portugal (1826)
Portugal,68.0,Aníbal Cavaco Silva,http://www.wikidata.org/entity/Q57398,wd:Q57398,19596391,Portuguese politician (born 1939)
Portugal,68.0,John XXI,http://www.wikidata.org/entity/Q172916,wd:Q172916,23830,pope (1276-1277)
Portugal,66.0,António Costa,http://www.wikidata.org/entity/Q610788,wd:Q610788,853050,Prime Minister of Portugal
Portugal,65.0,Afonso I of Portugal,http://www.wikidata.org/entity/Q587697,wd:Q587697,1657,First King of Portugal (1143–1185)
Portugal,64.0,Prince Henry the Navigator,http://www.wikidata.org/entity/Q182897,wd:Q182897,14092,Portuguese prince patron of voyages of exploration (1394-1460)
Portugal,63.0,Marcelo Rebelo de Sousa,http://www.wikidata.org/entity/Q6756617,wd:Q6756617,1652059,Portuguese politician and academic
Portugal,59.0,Mário Soares,http://www.wikidata.org/entity/Q156781,wd:Q156781,357440,President of Portugal (1924–2017)
Portugal,59.0,Pedro III of Portugal,http://www.wikidata.org/entity/Q964094,wd:Q964094,3081928,king of Portugal
Portugal,58.0,Xanana Gusmão,http://www.wikidata.org/entity/Q11509,wd:Q11509,55986,former President and Prime Minister of East Timor
Portugal,57.0,Samora Moisés Machel,http://www.wikidata.org/entity/Q219918,wd:Q219918,317574,1st President of Mozambique (1933–1986)
Portugal,56.0,Anne of Austria,http://www.wikidata.org/entity/Q151209,wd:Q151209,80395,"Queen, consort of Louis XIII, King of France, lived (1601-1666)"
Portugal,56.0,Manuel I of Portugal,http://www.wikidata.org/entity/Q191231,wd:Q191231,144835,King of Portugal from 1495 to 1521
Portugal,55.0,José Sócrates,http://www.wikidata.org/entity/Q182367,wd:Q182367,1021741,Prime Minister of Portugal from 2005 to 2011
Portugal,54.0,Manuel II of Portugal,http://www.wikidata.org/entity/Q154308,wd:Q154308,181547,King of Portugal
Portugal,53.0,António Egas Moniz,http://www.wikidata.org/entity/Q273219,wd:Q273219,694829,Portuguese neurosurgeon (1874-1955)
Portugal,53.0,John I of Portugal,http://www.wikidata.org/entity/Q201575,wd:Q201575,153575,King of Portugal (1358-1433)
Portugal,53.0,Maria I of Portugal,http://www.wikidata.org/entity/Q773874,wd:Q773874,254379,Portuguese monarch
Portugal,53.0,João VI of Portugal,http://www.wikidata.org/entity/Q676301,wd:Q676301,153578,"King of Portugal, Brazil and the Algarves, claimant emperor of Brazil (1767-1826)"
Portugal,51.0,John III,http://www.wikidata.org/entity/Q216789,wd:Q216789,147123,King of Portugal (r. 1521-1557)
Portugal,51.0,José I of Portugal,http://www.wikidata.org/entity/Q1058391,wd:Q1058391,254366,King of Portugal from 1750 to 1777
Romania,107.0,Nicolae Ceaușescu,http://www.wikidata.org/entity/Q80504,wd:Q80504,49562,Romanian communist leader from 1965 to 1989
Romania,85.0,Vlad III,http://www.wikidata.org/entity/Q43715,wd:Q43715,716868,15th-century ruler of Wallachia
Romania,83.0,Klaus Iohannis,http://www.wikidata.org/entity/Q701484,wd:Q701484,1724462,president of Romania from 2014-
Romania,82.0,Mihai Eminescu,http://www.wikidata.org/entity/Q184935,wd:Q184935,194842,"Romanian poet, novelist and journalist (1850-1889)"
Romania,79.0,Traian Băsescu,http://www.wikidata.org/entity/Q57279,wd:Q57279,1092982,4th President of Romania from 2004 to 2014
Romania,77.0,Alaric I,http://www.wikidata.org/entity/Q102371,wd:Q102371,1570,King of the Visigoths
Romania,74.0,Maia Sandu,http://www.wikidata.org/entity/Q15071069,wd:Q15071069,40796149,President of Moldova
Romania,67.0,Matthias Corvinus,http://www.wikidata.org/entity/Q188634,wd:Q188634,272105,"King of Hungary and Bohemia, Duke of Austria (1443-1490)"
Romania,65.0,Ion Antonescu,http://www.wikidata.org/entity/Q152030,wd:Q152030,37261,"prime minister and conducător of Romania during World War II, executed for war crimes (1882-1946)"
Romania,61.0,Ion Iliescu,http://www.wikidata.org/entity/Q189575,wd:Q189575,189451,Russian politician; second president of Romania
Romania,60.0,Michael I of Romania,http://www.wikidata.org/entity/Q930013,wd:Q930013,37256,"King of Romania (1927-1930, 1940-1947)"
Romania,59.0,Nicolae Nasoc,http://www.wikidata.org/entity/Q57478,wd:Q57478,35094181,4th President of Moldova 2012–2016
Romania,56.0,Stephen Báthory,http://www.wikidata.org/entity/Q54030,wd:Q54030,28407,King of Poland and Grand Duke of Lithuania (1576–1586)
Romania,55.0,Victor Ponta,http://www.wikidata.org/entity/Q57692,wd:Q57692,23324667,Prime minister of Romania 2012-2015
Romania,55.0,Emil Boc,http://www.wikidata.org/entity/Q267857,wd:Q267857,3740238,Romanian politician (1966-)
Romania,52.0,George Enescu,http://www.wikidata.org/entity/Q77177,wd:Q77177,319074,Romanian composer
Serbia,141.0,Constantine the Great,http://www.wikidata.org/entity/Q8413,wd:Q8413,7236,Roman emperor from 306 to 337 and first to convert to Christianity
Serbia,96.0,Slobodan Milošević,http://www.wikidata.org/entity/Q47139,wd:Q47139,25862556,Yugoslavian and Serbian politician (1941−2006)
Serbia,83.0,Aleksandar Vučić,http://www.wikidata.org/entity/Q222031,wd:Q222031,13349267,President of Serbia
Serbia,81.0,Yingluck Shinawatra,http://www.wikidata.org/entity/Q57670,wd:Q57670,31770637,Thai businesswoman and politician
Serbia,81.0,Aurelian,http://www.wikidata.org/entity/Q46780,wd:Q46780,43413,Roman Emperor (214-275)
Serbia,74.0,Decius,http://www.wikidata.org/entity/Q1830,wd:Q1830,75147,Roman Emperor (201-251)
Serbia,72.0,Constantius II,http://www.wikidata.org/entity/Q46418,wd:Q46418,6746,Roman emperor (317-361)
Serbia,71.0,Tomislav Nikolić,http://www.wikidata.org/entity/Q57431,wd:Q57431,717905,former president of Serbia
Serbia,69.0,Filip Vujanović,http://www.wikidata.org/entity/Q57542,wd:Q57542,725701,Montenegrin politician
Serbia,69.0,Hashim Thaçi,http://www.wikidata.org/entity/Q57634,wd:Q57634,3626980,Kosovo politician
Serbia,67.0,Claudius Gothicus,http://www.wikidata.org/entity/Q46762,wd:Q46762,44393,Roman Emperor from 268 to 270 (213–270)
Serbia,65.0,Maximian,http://www.wikidata.org/entity/Q46768,wd:Q46768,75088,Roman emperor
Serbia,64.0,Ana Brnabić,http://www.wikidata.org/entity/Q26258815,wd:Q26258815,54310335,Prime Minister of Serbia
Serbia,62.0,Jovian,http://www.wikidata.org/entity/Q34074,wd:Q34074,144811,Roman Emperor from 363 to 364 (331-364)
Serbia,62.0,Probus,http://www.wikidata.org/entity/Q187068,wd:Q187068,74635,3rd-century Roman Emperor (232-282)
Serbia,57.0,Gratian,http://www.wikidata.org/entity/Q189108,wd:Q189108,74655,Roman emperor from 367 to 383
Serbia,56.0,Vojislav Koštunica,http://www.wikidata.org/entity/Q33031,wd:Q33031,424674,Serbian politician
Serbia,55.0,Hostilian,http://www.wikidata.org/entity/Q46837,wd:Q46837,147751,Roman emperor
Serbia,53.0,Maximinus Daza,http://www.wikidata.org/entity/Q189095,wd:Q189095,76953,Roman emperor (270-313)
South Africa,271.0,Nelson Mandela,http://www.wikidata.org/entity/Q8023,wd:Q8023,21492751,First President of South Africa and anti-apartheid activist (1918–2013)
South Africa,99.0,Jacob Zuma,http://www.wikidata.org/entity/Q57282,wd:Q57282,1103138,4th President of South Africa (2009–2018)
South Africa,97.0,Thabo Mbeki,http://www.wikidata.org/entity/Q101547,wd:Q101547,31350,"South African politician, former President of South Africa"
South Africa,85.0,Cyril Ramaphosa,http://www.wikidata.org/entity/Q1148669,wd:Q1148669,1089194,President of South Africa
South Africa,82.0,F. W. de Klerk,http://www.wikidata.org/entity/Q151813,wd:Q151813,11479,7th state president of South Africa from 1989 to 1994
South Africa,76.0,Steve Biko,http://www.wikidata.org/entity/Q214473,wd:Q214473,28320,anti-apartheid activist in South Africa (1946-1977)
South Africa,59.0,Albert John Mvumbi Luthuli,http://www.wikidata.org/entity/Q212955,wd:Q212955,311414,South African politician
South Africa,57.0,P. W. Botha,http://www.wikidata.org/entity/Q212286,wd:Q212286,383252,South African prime minister (1916–2006)
South Africa,57.0,Winnie Madikizela-Mandela,http://www.wikidata.org/entity/Q239062,wd:Q239062,33683,South African activist and politician (1936-2018)
South Africa,56.0,Kgalema Motlanthe,http://www.wikidata.org/entity/Q152327,wd:Q152327,7120307,"President of South Africa, Deputy President of the ruling African National Congress (ANC) and Secretary-General of the African National Congress"
Sweden,118.0,Dag Hammarskjöld,http://www.wikidata.org/entity/Q1267,wd:Q1267,236428,"Swedish diplomat, economist, and author (1905-1961)"
Sweden,86.0,Olof Palme,http://www.wikidata.org/entity/Q53713,wd:Q53713,54132,Swedish Prime Minister (1927-1986)
Sweden,78.0,Stefan Löfven,http://www.wikidata.org/entity/Q2740012,wd:Q2740012,34502762,"Swedish politician, Prime Minister of Sweden between 2014–2021"
Sweden,77.0,Kristina I of Sweden,http://www.wikidata.org/entity/Q52937,wd:Q52937,49613,"Queen of Sweden (1626-1689), ruled from 1632 until abdication in 1654"
Sweden,77.0,Charles XIV John of Sweden,http://www.wikidata.org/entity/Q52927,wd:Q52927,38585,King of Sweden and Norway between 1818–1844. Prince of Ponte Corvo 1806–1810 and French field marshal
Sweden,75.0,Carl XII of Sweden,http://www.wikidata.org/entity/Q52934,wd:Q52934,104944,King of Sweden
Sweden,75.0,Gunnar Myrdal,http://www.wikidata.org/entity/Q152452,wd:Q152452,743437,Swedish economist (1898-1987)
Sweden,73.0,Fredrik Reinfeldt,http://www.wikidata.org/entity/Q52920,wd:Q52920,379860,32nd Prime Minister of Sweden
Sweden,69.0,Gustav I of Sweden,http://www.wikidata.org/entity/Q52947,wd:Q52947,49109,King of Sweden from 1523 to 1560
Sweden,69.0,Alva Myrdal,http://www.wikidata.org/entity/Q152437,wd:Q152437,64749,Swedish sociologist and politician (1902-1986)
Sweden,68.0,Gustaf V of Sweden,http://www.wikidata.org/entity/Q52890,wd:Q52890,104658,King of Sweden from 1907 to 1950
Sweden,68.0,Magdalena Andersson,http://www.wikidata.org/entity/Q4935873,wd:Q4935873,41178429,"Prime Minister of Sweden from 2021 to 2022, Swedish politician and economist"
Sweden,67.0,Sigismund III Vasa,http://www.wikidata.org/entity/Q52940,wd:Q52940,52608,"King of Poland, Grand Duke of Lithuania and king of the Polish–Lithuanian Commonwealth (1566-1632) (r.1587-1632)"
Sweden,64.0,Gustaf VI Adolf of Sweden,http://www.wikidata.org/entity/Q52878,wd:Q52878,26651222,"King of Sweden from 1950-1973; anthropologist, art historian, collector and archaeologist"
Sweden,64.0,Charles XV of Sweden,http://www.wikidata.org/entity/Q52925,wd:Q52925,39946,King of Sweden and Norway between 1859-1872
Sweden,63.0,Oscar II of Sweden,http://www.wikidata.org/entity/Q52924,wd:Q52924,104650,King of Sweden from 1872 to 1907 and Norway from 1872 to 1905
Sweden,63.0,Hjalmar Branting,http://www.wikidata.org/entity/Q53620,wd:Q53620,326110,Prime Minister of Sweden (1860-1925)
Sweden,61.0,Oscar I of Sweden,http://www.wikidata.org/entity/Q52926,wd:Q52926,38746,King of Sweden and Norway between 1844-1859
Sweden,61.0,Bridget of Sweden,http://www.wikidata.org/entity/Q204996,wd:Q204996,89340,"Swedish nun, mystic, and saint (c.1303–1373)"
Sweden,60.0,Klas Pontus Arnoldson,http://www.wikidata.org/entity/Q192618,wd:Q192618,320914,Swedish politician (1844-1916)
Sweden,59.0,Charles IX of Sweden,http://www.wikidata.org/entity/Q52939,wd:Q52939,70026,King of Sweden from 1604-1611
Sweden,59.0,Gustav III of Sweden,http://www.wikidata.org/entity/Q52930,wd:Q52930,23686385,King of Sweden from 1771 to 1792
Sweden,58.0,Oleg of Novgorod,http://www.wikidata.org/entity/Q6131983,wd:Q6131983,158410,Prince of Rus'
Sweden,58.0,Göran Persson,http://www.wikidata.org/entity/Q53747,wd:Q53747,68194,Prime Minister of Sweden from 1996 to 2006
Sweden,57.0,Carl Bildt,http://www.wikidata.org/entity/Q52922,wd:Q52922,52548,"Swedish politician, prime minister between 1991-1994, foreign minister between 2006-2014"
Sweden,57.0,Bertil Ohlin,http://www.wikidata.org/entity/Q179493,wd:Q179493,192241,Swedish economist and politician (1899-1979)
Sweden,55.0,John III of Sweden,http://www.wikidata.org/entity/Q52944,wd:Q52944,104960,Swedish king
Sweden,55.0,Charles X Gustav of Sweden,http://www.wikidata.org/entity/Q52936,wd:Q52936,104942,King of Sweden
Sweden,55.0,Queen Silvia of Sweden,http://www.wikidata.org/entity/Q152308,wd:Q152308,106393,wife and consort of King Carl XVI Gustaf of Sweden
Sweden,53.0,Charles XI of Sweden,http://www.wikidata.org/entity/Q52935,wd:Q52935,104943,King of Sweden
Sweden,53.0,Charles XIII of Sweden,http://www.wikidata.org/entity/Q52928,wd:Q52928,104784,King of Sweden (1809-1818) and King of Norway (1814-1818)
Sweden,53.0,Sven Hedin,http://www.wikidata.org/entity/Q154759,wd:Q154759,529134,"Swedish geographer, topographer, explorer, photographer, travel writer and illustrator (1865-1952)"
Sweden,53.0,"Princess Madeleine, Duchess of Hälsingland and Gästrikland",http://www.wikidata.org/entity/Q212035,wd:Q212035,439508,youngest child of King Carl XVI Gustaf and Queen Silvia of Sweden
Sweden,52.0,Gustav IV Adolf of Sweden,http://www.wikidata.org/entity/Q52929,wd:Q52929,104462,King of Sweden between 1792-1809
Sweden,52.0,Anna Lindh,http://www.wikidata.org/entity/Q208591,wd:Q208591,315471,Swedish politician (1957-2003)
Sweden,52.0,Ulf Kristersson,http://www.wikidata.org/entity/Q1780398,wd:Q1780398,3246360,Prime Minister of Sweden since 2022
Syria,133.0,Bashar al-Assad,http://www.wikidata.org/entity/Q44329,wd:Q44329,364813,President of Syria
Syria,84.0,Hafez al-Assad,http://www.wikidata.org/entity/Q118725,wd:Q118725,70843,Syrian statesman and military officer (1930–2000)
Syria,68.0,Philip the Arab,http://www.wikidata.org/entity/Q1817,wd:Q1817,144163,Roman Emperor (204-249)
Syria,58.0,Zenobia,http://www.wikidata.org/entity/Q189705,wd:Q189705,43382,3rd-century Queen of the Palmyrene Empire
Syria,58.0,Yazid I,http://www.wikidata.org/entity/Q217442,wd:Q217442,402593,second caliph of the Umayyad caliphate (646-683)
Syria,57.0,Abd ar-Rahman I,http://www.wikidata.org/entity/Q29000,wd:Q29000,2676,Founder of the Umayyad Emirate of Iberia (731-788)
Turkey,183.0,Herodotos,http://www.wikidata.org/entity/Q26825,wd:Q26825,13574,Greek historian and geographer (c.484–c.425 BC)
Turkey,168.0,Recep Tayyip Erdoğan,http://www.wikidata.org/entity/Q39259,wd:Q39259,376619,President of the Republic of Turkey since 2014
Turkey,128.0,Suleiman the Magnificent,http://www.wikidata.org/entity/Q8474,wd:Q8474,26992,Sultan of the Ottoman Empire
Turkey,112.0,Mehmed the Conqueror,http://www.wikidata.org/entity/Q34503,wd:Q34503,19046,7th Ottoman sultan
Turkey,107.0,Abdullah Gül,http://www.wikidata.org/entity/Q42852,wd:Q42852,632854,11th President of Turkey
Turkey,96.0,Osman I,http://www.wikidata.org/entity/Q83100,wd:Q83100,22492,Ottoman sultan
Turkey,91.0,Abdul Hamid II,http://www.wikidata.org/entity/Q134817,wd:Q134817,18950786,Ottoman Empire Sultan from 1876 to 1909
Turkey,84.0,Ahmet Davutoğlu,http://www.wikidata.org/entity/Q58198,wd:Q58198,3331531,Turkish politician
Turkey,83.0,Heraclius,http://www.wikidata.org/entity/Q41852,wd:Q41852,13956,Byzantine emperor from 610 to 641
Turkey,82.0,Süleyman Demirel,http://www.wikidata.org/entity/Q151729,wd:Q151729,166093,Turkish politician (1924-2015)
Turkey,82.0,Bayezid I,http://www.wikidata.org/entity/Q128358,wd:Q128358,4241,4th Sultan of the Ottoman Empire from 1389 to 1402
Turkey,82.0,Mehmed VI,http://www.wikidata.org/entity/Q162543,wd:Q162543,50217,last sultan of the Ottoman Empire
Turkey,81.0,Orhan,http://www.wikidata.org/entity/Q133168,wd:Q133168,22493,2nd Sultan of the Ottoman Empire from 1323/4 to 1362
Turkey,78.0,İsmet İnönü,http://www.wikidata.org/entity/Q183297,wd:Q183297,14618,Turkish general and statesman (1884-1973)
Turkey,77.0,Turgut Özal,http://www.wikidata.org/entity/Q180280,wd:Q180280,649579,Turkish politician (1927-1993)
Turkey,77.0,Murad I,http://www.wikidata.org/entity/Q96261,wd:Q96261,19986,Ottoman sultan
Turkey,77.0,Murad III,http://www.wikidata.org/entity/Q159934,wd:Q159934,19989,16th century Sultan of the Ottoman Empire
Turkey,76.0,Mehmed V,http://www.wikidata.org/entity/Q151494,wd:Q151494,208673,Ottoman Sultan
Turkey,76.0,Murad II,http://www.wikidata.org/entity/Q131394,wd:Q131394,19988,Sultan of the Ottoman Empire from 1421 to 1451
Turkey,76.0,Selim II,http://www.wikidata.org/entity/Q161872,wd:Q161872,28223,Ottoman sultan (1524-1574)
Turkey,75.0,Bayezid II,http://www.wikidata.org/entity/Q165983,wd:Q165983,4242,Sultan of the Ottoman Empire from 1481 to 1512
Turkey,75.0,Osman II,http://www.wikidata.org/entity/Q172056,wd:Q172056,22494,Sultan of the Ottoman Empire
Turkey,75.0,Selim III,http://www.wikidata.org/entity/Q199633,wd:Q199633,208638,Ottoman sultan (1761-1808)
Turkey,73.0,Mehmed I,http://www.wikidata.org/entity/Q168769,wd:Q168769,19987,Ottoman Sultan
Turkey,73.0,Ahmed I,http://www.wikidata.org/entity/Q114749,wd:Q114749,1527,Sultan of the Ottoman Empire (1590-1617) (r. 1603-1617)
Turkey,72.0,Mehmed III,http://www.wikidata.org/entity/Q171465,wd:Q171465,19990,Ottoman sultan
Turkey,71.0,Honorius,http://www.wikidata.org/entity/Q159798,wd:Q159798,11023,Roman emperor (395-423) (384-423)
Turkey,71.0,Cassius Dio,http://www.wikidata.org/entity/Q185223,wd:Q185223,159964,Greco-Roman statesman and historian (c. 155–c. 235)
Turkey,71.0,Abdul Hamid I,http://www.wikidata.org/entity/Q170707,wd:Q170707,2692,Ottoman sultan
Turkey,70.0,Tansu Çiller,http://www.wikidata.org/entity/Q208377,wd:Q208377,753267,"Turkish politician, who has been the first female prime minister of the country"
Turkey,70.0,Abdülmecid I,http://www.wikidata.org/entity/Q174772,wd:Q174772,18950719,Sultan of the Ottoman Empire (1823-1861)
Turkey,69.0,Celâl Bayar,http://www.wikidata.org/entity/Q151735,wd:Q151735,1132228,3rd president of Turkey
Turkey,69.0,Ahmet Necdet Sezer,http://www.wikidata.org/entity/Q165487,wd:Q165487,385641,10th President of Turkey
Turkey,69.0,Binali Yıldırım,http://www.wikidata.org/entity/Q863496,wd:Q863496,9774365,Turkish politician; 27th Prime Minister of Turkey
Turkey,68.0,Helena Augusta,http://www.wikidata.org/entity/Q170164,wd:Q170164,148645,"Roman empress as the first wife of Constantius Chlorus, and mother of Emperor Constantine the Great (250-330)"
Turkey,68.0,Mahmud I,http://www.wikidata.org/entity/Q199481,wd:Q199481,208623,Sultan of the Ottoman Empire from 1730 to 1754
Turkey,67.0,Cemal Gürsel,http://www.wikidata.org/entity/Q159161,wd:Q159161,1132212,Turkish general and politician (1895-1966)
Turkey,67.0,Mustafa II,http://www.wikidata.org/entity/Q199659,wd:Q199659,102345,Sultan of the Ottoman Empire
Turkey,65.0,Kenan Evren,http://www.wikidata.org/entity/Q216983,wd:Q216983,617363,Turkish general (1917-2015)
Turkey,65.0,Murad V,http://www.wikidata.org/entity/Q199827,wd:Q199827,178186,Ottoman Sultan
Turkey,64.0,Bülent Ecevit,http://www.wikidata.org/entity/Q192634,wd:Q192634,649534,former Prime Minister of Turkey (1925-2006)
Turkey,64.0,Osman III,http://www.wikidata.org/entity/Q199825,wd:Q199825,208625,Ottoman sultan
Turkey,63.0,Abdullah Öcalan,http://www.wikidata.org/entity/Q191530,wd:Q191530,98439,"ideologist, writer and founder of the Kurdistan Workers' Party (PKK)"
Turkey,61.0,Enver Pasha,http://www.wikidata.org/entity/Q153899,wd:Q153899,514619,"Ottoman politician, Turkish nationalist"
Turkey,60.0,Maurice,http://www.wikidata.org/entity/Q181764,wd:Q181764,64683,Byzantine Emperor (539-602)
Turkey,59.0,Fahri Korutürk,http://www.wikidata.org/entity/Q313357,wd:Q313357,914271,"Turkish admiral, ambassador and 6th President of the Republic of Turkey"
Turkey,58.0,Necmettin Erbakan,http://www.wikidata.org/entity/Q243550,wd:Q243550,1328699,Prime Minister of Turkey (1997-2000)
Austria,297.0,Adolf Hitler,http://www.wikidata.org/entity/Q352,wd:Q352,2731583,"Austrian-born German politician, dictator of Germany from 1933 until his death in 1945"
Germany,297.0,Adolf Hitler,http://www.wikidata.org/entity/Q352,wd:Q352,2731583,"Austrian-born German politician, dictator of Germany from 1933 until his death in 1945"
Austria,144.0,Arnold Schwarzenegger,http://www.wikidata.org/entity/Q2685,wd:Q2685,1806,"Austrian-American actor, bodybuilder, and politician (born 1947)"
Austria,119.0,Marie Antoinette,http://www.wikidata.org/entity/Q47365,wd:Q47365,45109,last Queen of France prior to the French Revolution
Austria,101.0,Maria Theresa of Austria,http://www.wikidata.org/entity/Q131706,wd:Q131706,48449,ruler of the Habsburg Dominions (1717-1780)
Austria,100.0,Archduke Franz Ferdinand,http://www.wikidata.org/entity/Q43063,wd:Q43063,7955693,heir presumptive to the throne of Austria-Hungary (1863–1914)
Austria,92.0,Franz Joseph I of Austria,http://www.wikidata.org/entity/Q51056,wd:Q51056,51695,Emperor of Austria and King of Hungary (1830-1916)
Austria,86.0,Sebastian Kurz,http://www.wikidata.org/entity/Q2262885,wd:Q2262885,41350919,Austrian politician
Austria,85.0,Adolf Eichmann,http://www.wikidata.org/entity/Q28085,wd:Q28085,19596649,German-Austrian SS officer and one of the major organizers of the Holocaust (1906–1962)
Austria,84.0,Heinz Fischer,http://www.wikidata.org/entity/Q11753,wd:Q11753,428411,8th president of Austria
Austria,84.0,Alexander Van der Bellen,http://www.wikidata.org/entity/Q78869,wd:Q78869,1691577,President of Austria
Austria,83.0,Kurt Waldheim,http://www.wikidata.org/entity/Q1260,wd:Q1260,17103,Austrian politician and diplomat (1918-2007)
Austria,79.0,"Joseph II, Holy Roman Emperor",http://www.wikidata.org/entity/Q76555,wd:Q76555,148313,Holy Roman Emperor from 1765 to 1790
Austria,78.0,Maximilian I,http://www.wikidata.org/entity/Q150726,wd:Q150726,39070,Holy Roman Emperor
Belgium,115.0,Charles V,http://www.wikidata.org/entity/Q32500,wd:Q32500,70716,"Habsburg monarch (1500–1558) who ruled as Holy Roman emperor in Germany and king of Castile, Leon, and Aragon in Spain"
Belgium,95.0,Ursula von der Leyen,http://www.wikidata.org/entity/Q60772,wd:Q60772,2991932,President of the European Commission since 2019
Belgium,93.0,Claude Lévi-Strauss,http://www.wikidata.org/entity/Q128126,wd:Q128126,19544151,French anthropologist and ethnologist
Belgium,89.0,Herman Van Rompuy,http://www.wikidata.org/entity/Q12983,wd:Q12983,7742342,Prime Minister of Belgium and President of the European Council (born 1947)
Belgium,86.0,Philippe I of Belgium,http://www.wikidata.org/entity/Q155004,wd:Q155004,168868,seventh king of the Belgians
Belgium,84.0,Leopold II of Belgium,http://www.wikidata.org/entity/Q12967,wd:Q12967,57731,Second King of the Belgians
Belgium,81.0,Charles Martel,http://www.wikidata.org/entity/Q3301,wd:Q3301,6452,Frankish military and political leader
Belgium,80.0,Albert II of Belgium,http://www.wikidata.org/entity/Q3911,wd:Q3911,143745,sixth king of the Belgians
Belgium,78.0,Pepin the Short,http://www.wikidata.org/entity/Q81212,wd:Q81212,2192581,King of the Franks
Belgium,76.0,Leopold I of Belgium,http://www.wikidata.org/entity/Q12971,wd:Q12971,56470,German prince who became the first King of the Belgians (1790-1865)
Canada,124.0,Justin Trudeau,http://www.wikidata.org/entity/Q3099714,wd:Q3099714,451733,Prime Minister of Canada since 2015
Canada,104.0,Stephen Harper,http://www.wikidata.org/entity/Q206,wd:Q206,241547,22nd prime minister of Canada from 2006 to 2015
Canada,82.0,Pierre Trudeau,http://www.wikidata.org/entity/Q8619,wd:Q8619,24507,15th Prime Minister of Canada (1919-2000)
People's Republic of China,209.0,Mao Zedong,http://www.wikidata.org/entity/Q5816,wd:Q5816,19527,Chairman of the Chinese Communist Party & founding father of the People's Republic of China (1893–1976)
People's Republic of China,185.0,Qin Shi Huangdi,http://www.wikidata.org/entity/Q7192,wd:Q7192,99598,first emperor of Qin Dynasty
People's Republic of China,169.0,Huang Xianfan,http://www.wikidata.org/entity/Q5208,wd:Q5208,22505048,"Chinese historian, ethnologist and educator (1899-1982)"
People's Republic of China,163.0,Xi Jinping,http://www.wikidata.org/entity/Q15031,wd:Q15031,2017814,General Secretary of the Chinese Communist Party
People's Republic of China,161.0,Tenzin Gyatso,http://www.wikidata.org/entity/Q17293,wd:Q17293,20238168,14th Dalai Lama
People's Republic of China,154.0,Jackie Chan,http://www.wikidata.org/entity/Q36970,wd:Q36970,144936,"Hong Kong actor, singer and martial artist"
People's Republic of China,137.0,Sun Yat-sen,http://www.wikidata.org/entity/Q8573,wd:Q8573,88483,"Chinese statesman, physician, and revolutionary (1866–1925)"
People's Republic of China,127.0,Chiang Kai-shek,http://www.wikidata.org/entity/Q16574,wd:Q16574,6859,Chinese politician and military leader (1887–1975)
People's Republic of China,123.0,Deng Xiaoping,http://www.wikidata.org/entity/Q16977,wd:Q16977,8205,Chinese politician and paramount leader from 1978 to 1989
People's Republic of China,118.0,Hu Jintao,http://www.wikidata.org/entity/Q15029,wd:Q15029,151210,former General Secretary of the Chinese Communist Party (CCP)
People's Republic of China,98.0,Jiang Zemin,http://www.wikidata.org/entity/Q16597,wd:Q16597,95871,Paramount leader of China from 1989 to 2002
People's Republic of China,95.0,Empress Dowager Cixi,http://www.wikidata.org/entity/Q47842,wd:Q47842,264799,Chinese empress (1835-1908)
People's Republic of China,95.0,Zhou Enlai,http://www.wikidata.org/entity/Q17410,wd:Q17410,50444,1st Premier of the People's Republic of China from 1949 to 1976
People's Republic of China,88.0,Li Keqiang,http://www.wikidata.org/entity/Q18111,wd:Q18111,1454147,premier of China since 2013
People's Republic of China,84.0,Wen Jiabao,http://www.wikidata.org/entity/Q16628,wd:Q16628,213059,former Premier of the People's Republic of China
