country,number,item,item_id,shortform,pageid,wikidata_description,wikipedia_summary,wikipedia_url
Czech Republic,48,Julius Fučík,http://www.wikidata.org/entity/Q142059,wd:Q142059,314909,Czech journalist and revolutionary,"Julius Fučík (Czech: [ˈjulɪjus ˈfutʃiːk]) (23 February 1903 – 8 September 1943) was a Czech journalist, critic, writer, an active member of Communist Party of Czechoslovakia, and part of the forefront of the anti-Nazi resistance. He was imprisoned, tortured, and executed by the Nazis.
The composer Luigi Nono wrote a musical piece titled Julius Fučík based on the journalist's diary Notes from the Gallows and meant it as a tribute to his resilience in the face of Nazi aggression.",https://en.wikipedia.org/wiki/Julius_Fu%C4%8D%C3%ADk_(journalist)
Côte d'Ivoire,6,Venance Konan,http://www.wikidata.org/entity/Q2536087,wd:Q2536087,46855295,Ivorian journalist and writer,"Venance Konan (born 12 December 1958, in Bocanda), is an Ivorian journalist and writer. His journalistic talents have earned him several awards by the prestigious Ebony. He was propelled to the front of the literary scene in 2003 with his bestseller Prisonniers de la haine.",https://en.wikipedia.org/wiki/Venance_Konan
Democratic Republic of the Congo,5,Douce Namwezi N'Ibamba,http://www.wikidata.org/entity/Q102292209,wd:Q102292209,66333406,Congolese journalist,"Douce Namwezi N'Ibamba (born 11 February 1989) is a journalist, radio producer and social entrepreneur from the Democratic Republic of the Congo, who empowers women through education and training, with a particular emphasis on gender equality and menstrual hygiene.",https://en.wikipedia.org/wiki/Douce_Namwezi_N%27Ibamba
Dominica,2,Mario Alvarez Dugan,http://www.wikidata.org/entity/Q6764523,wd:Q6764523,20777783,Dominican Republic journalist (1931-2008),"Mario Virgilio Álvarez Dugan (9 April 1931 – 13 December 2008) was a Dominican editor and journalist who served as the head editor of Hoy, a newspaper published in his hometown of Santo Domingo, from 1988 until his death in 2008.Álvarez Dugan began his career as a sports commentator and announcer. He became the general editor of Deportes in 1958. Additionally, he founded and managed two now defunct Dominican equestrian magazines, Handicap and El Enllave.Álvarez Dugan joined the staff of the El Caribe in 1966, later serving as the newspaper's chief editor during the 1970s. He also worked within the management of the El Nacional, but left that particular paper in 1988 to become editor of Hoy. He remained editor of Hoy until his death in 2008.He was inducted into the Dominican sports hall of fame in 1993. Álvarez Dugan authored several sports related books on administrative corruption in athletics, sports anecdotes and the history of baseball in the Dominican Republic.Álvarez Dugan died at a hospital in Santo Domingo, just days after he was admitted suffering from heart problems. He was 77 years old. He was survived by his wife, Altagracia Matilde Soto Peguero, and the couple's three children, including Dominican table tennis player, Mario Virgilio Álvarez Soto.Leonel Fernández, the President of the Dominican Republic, attended Álvarez Dugan's funeral. Fernández paid tribute to him saying, ""Don Mario Álvarez Dugan contributed to influence the spirit of Dominicans as a society,"" and said that he influenced public opinion with balance, good sense and wisdom.",https://en.wikipedia.org/wiki/Mario_%C3%81lvarez_Dugan
Dominican Republic,7,Nuria Piera,http://www.wikidata.org/entity/Q6047184,wd:Q6047184,41751489,journalist,"Nuria Esperanza Piera Gainza (born 29 June 1960) is a Dominican journalist specializing in investigative journalism. Piera is CEO of NCDN, a news production company in CDN (channel 37); she is also owner of Provideo.",https://en.wikipedia.org/wiki/Nuria_Piera
East Timor,9,Christopher Wenner,http://www.wikidata.org/entity/Q5113407,wd:Q5113407,1938519,British-East Timorese journalist and TV presenter,"Max Christopher Wenner, known as Christopher Wenner and later as Max Stahl (6 December 1954 – 28 October 2021), was a British journalist and television presenter. He was best known for filming an East Timorese demonstration and its aftermath that became known as the Santa Cruz massacre. His coverage of East Timor's struggle for independence is listed in Unesco's Memory of the World register as a ""turning point"" in the birth of a new nation.",https://en.wikipedia.org/wiki/Christopher_Wenner
Egypt,22,Mona Eltahawy,http://www.wikidata.org/entity/Q2895624,wd:Q2895624,1809170,journalist,"Mona Eltahawy (Arabic: منى الطحاوى, IPA: [ˈmonæ (ʔe)t.tˤɑˈħɑːwi]; born August 1, 1967) is a freelance Egyptian-American journalist and social commentator based in New York City. She has written essays and op-eds for publications worldwide on Egypt and the Islamic world, on topics including women's issues and Muslim political and social affairs. Her work has appeared in The Washington Post, The New York Times, Christian Science Monitor, and the Miami Herald among others. Headscarves and Hymens, Eltahawy's first book, was published in May 2015. Eltahawy has been a guest analyst on U.S. radio and television news shows. She is among people who spearheaded the Mosque Me Too movement by using the hashtag #MosqueMeToo.Eltahawy has spoken publicly at universities, panel discussions and interfaith gatherings on human rights and reform in the Islamic world, feminism and Egyptian Muslim–Christian relations, among other concerns.",https://en.wikipedia.org/wiki/Mona_Eltahawy
El Salvador,18,Roque Dalton Garcia,http://www.wikidata.org/entity/Q539461,wd:Q539461,1468073,Salvadoran journalist and poet (1935-1975),"Roque Antonio Dalton García (San Salvador, El Salvador, 14 May 1935 – Quezaltepeque, El Salvador, 10 May 1975), born Roque Antonio García, better known as Roque Dalton, was a Salvadoran poet, essayist, journalist, communist activist, and intellectual. He is considered one of Latin America's most compelling poets. He wrote emotionally strong, sometimes sarcastic, and image-loaded works dealing with life, death, love, and politics.
Even though he never received an academic degree, he took part in higher education at the University of Chile and the University of El Salvador, where he studied law. He also visited the National Autonomous University of Mexico. While in Chile, he began to study Marxism and on returning to El Salvador, he became a significant player in local politics. He began working with poetry after helping found the University Literary Circle. He joined the Communist Party of El Salvador. He was imprisoned in 1959 and 1960 for inciting revolt during the presidency of José María Lemus.
In 1961, he was exiled from El Salvador, spending 1961 in Mexico, then moving to Cuba – where most of his poetry was published and where he completed his development as an author, but also in Mexico and Czechoslovakia. In Cuba, he became involved in the culture and received military training after the Bay of Pigs Invasion. After returning to El Salvador in 1965, he was arrested and interrogated by an agent of the Central Intelligence Agency. In 1969, he returned to Cuba and then Prague to work as correspondent for The International Review: Problems of Peace and Socialism. In the same year, he won the Poetry Prize Casa de las Américas for his book Taberna y otros lugares.
After leaving Cuba, Dalton became involved in El Salvador's civil war, joining the People's Revolutionary Army (ERP) in 1973. In the ERP, he found himself in a serious internal dispute with leader Alejandro Rivas Mira, who was becoming an influential leader of the armed group. As a consequence, the leadership of the ERP decided to execute him.He is remembered for his bohemian lifestyle and the jovial, irreverent personality reflected in his literary work, as well as his commitment to social causes in El Salvador. His work is diverse, going beyond the influences of his Marxist beliefs. He is considered one of the most influential Salvadoran writers. Posthumously, he has received recognition as ""Hijo Meritísimo"" and ""Poeta Meritísimo"" by the Salvadoran government and an honorary doctorate degree from the Universidad de El Salvador.",https://en.wikipedia.org/wiki/Roque_Dalton
Eritrea,6,Ruth Simon,http://www.wikidata.org/entity/Q2477210,wd:Q2477210,15452297,Eritrean journalist,Ruth Simon (born c. 1962) is an Eritrean journalist.,https://en.wikipedia.org/wiki/Ruth_Simon
Ethiopia,8,Katarina Sandström,http://www.wikidata.org/entity/Q4976955,wd:Q4976955,26488432,Swedish television journalist,"Anna Hiruth Katarina Sandström Borglund (born 20 March 1974 in Addis Ababa, Ethiopia) is a Swedish television news presenter and journalist.She has several times been nominated for and won awards for best news anchor and for best spoken Swedish on television. She has led the evening news broadcast Rapport on SVT since 2000.In parallel with work on Rapport, Sandström also has participated in major events such as the SVT broadcasts from the Nobel Banquet, One year with the Royal Family (annual broadcast with the Swedish Royal Family on New Year's Eve) and National election coverage in 2006. She has previously worked on the radio news broadcast Dagens Eko (""Echo of the day"") and newspaper Västerbotten Folkblad, a local newspaper for northern Sweden.",https://en.wikipedia.org/wiki/Katarina_Sandstr%C3%B6m
Fiji,2,Brian Widlake,http://www.wikidata.org/entity/Q4965632,wd:Q4965632,28289455,British television journalist (1931-2017),"Ben Nicholas (stepson)
Susanna Nicholas (stepdaughter)
Nigel Brian Windsor Widlake (13 April 1931 – 2 January 2017) was a British journalist, broadcaster and presenter.",https://en.wikipedia.org/wiki/Brian_Widlake
France,162,Octave Mirbeau,http://www.wikidata.org/entity/Q23441,wd:Q23441,153994,"French journalist, art critic, travel writer, pamphleteer, novelist, and playwright (1848-1917)","Octave Mirbeau (16 February 1848 – 16 February 1917) was a French novelist, art critic, travel writer, pamphleteer, journalist and playwright, who achieved celebrity in Europe and great success among the public, whilst still appealing to the literary and artistic avant-garde with highly transgressive novels that explored violence, abuse and psychological detachment. His work has been translated into 30 languages.

",https://en.wikipedia.org/wiki/Octave_Mirbeau
Gabon,3,Patrick N'Guema N'Dong,http://www.wikidata.org/entity/Q3369733,wd:Q3369733,13502456,Franco-Gabonese journalist,"Patrick N'Guema N'Dong (1957 – 23 December 2021) was a French-Gabonese journalist on Gabon's Africa N°1 radio station, which is transmitted through French Africa and France. He was known for his two programs devoted to the occult sciences, parapsychology, and traditional African religions.",https://en.wikipedia.org/wiki/Patrick_N%27Guema_N%27Dong
Georgia,27,Georgiy Gongadze,http://www.wikidata.org/entity/Q263598,wd:Q263598,743401,Ukrainian journalist,"Georgiy Ruslanovich Gongadze (Ukrainian: Георгій Русланович Ґонґадзе; Georgian: გიორგი ღონღაძე; 21 May 1969 – 17 September 2000) was a Ukrainian journalist and film director who was kidnapped and murdered in 2000 near Kyiv. He founded the internet newspaper Ukrayinska Pravda along with Olena Prytula in 2000.
The circumstances of his death became a national scandal and a focus for protests against the government of the then President, Leonid Kuchma. During the Cassette Scandal, audiotapes were released on which Kuchma, Volodymyr Lytvyn and other top-level administration officials are heard discussing the need to silence Gongadze for his online news reports about high-level corruption. Former Interior Minister Yuriy Kravchenko died of two gunshots to the head on 4 March 2005, just hours before he was to begin providing testimony as a witness in the case. Kravchenko was the superior of the four policemen who were charged with Gongadze's murder soon after Kravchenko's death. The official ruling of suicide was doubted by media reports.Three former officials of the Ukrainian Interior Ministry's foreign surveillance department and criminal intelligence unit (Valeriy Kostenko, Mykola Protasov and Oleksandr Popovych) accused of his murder were arrested in March 2005 and a fourth one (Oleksiy Pukach, the former chief of the unit) in July 2009. A court in Ukraine sentenced Protasov to a sentence of 13 years and Kostenko and Popovych to 12-year terms March 2008 (the trial had begun January 2006) for the murder. Gongadze's family believe the trial had failed to bring the masterminds behind the killing to justice. No one has yet been charged with giving the order for Gongadze's murder.",https://en.wikipedia.org/wiki/Georgiy_Gongadze
Ghana,10,Komla Dumor,http://www.wikidata.org/entity/Q14786031,wd:Q14786031,30604980,BBC journalist (1972-2014),Komla Afeke Dumor (3 October 1972 – 18 January 2014) was a Ghanaian journalist who worked for BBC World News and was the main presenter of its programme Focus on Africa.,https://en.wikipedia.org/wiki/Komla_Dumor
Greece,24,Matilde Serao,http://www.wikidata.org/entity/Q384594,wd:Q384594,1594268,"Italian journalist and writer, editor","Matilde Serao (Italian pronunciation: [maˈtilde seˈraːo]; Greek: Ματθίλδη Σεράο; 7 March 1856 – 25 July 1927) was a Greek-born Italian journalist and novelist. She was the first woman called to edit an Italian newspaper, Il Corriere di Roma and later Il Giorno. Serao was also the co-founder and editor of the newspaper Il Mattino, and the author of several novels. She never won the Nobel Prize in Literature despite being nominated on six occasions.",https://en.wikipedia.org/wiki/Matilde_Serao
Grenada,2,Alister Hughes,http://www.wikidata.org/entity/Q4727341,wd:Q4727341,35517159,Grenadian journalist and poet (1919-2005),"Alister Earl Hewitson Hughes (21 January 1919 – 28 February 2005) was a Grenadian journalist and poet.He was born on 21 January 1919 in St. Georges, Grenada, and died on 28 February 2005. He was the Editor of the Grenada Newsletter from 1972 to 1994.",https://en.wikipedia.org/wiki/Alister_Hughes
Guinea,3,Fatoumata Kaba,http://www.wikidata.org/entity/Q5437946,wd:Q5437946,1588336,Guinean journalist,"Fatoumata Lejeune-Kaba (born 1969) is a Guinean journalist who works for the UNHCR as Communications Officer.
Kaba was educated in the United States, attending the Woodrow Wilson High School and Montgomery College in Maryland and graduating with a degree in journalism. She returned to Guinea in 1992, working for Guinean Radio and Television and CNN; in 1998, she became a correspondent for Reuters news agency. Subsequently, she worked for the Communications Unit of the United Nations Development Programme before joining the United Nations High Commission for Refugees (UNHCR) in 2000.On February 25, 2002, Kaba was appointed as the delegate of the UNHCR for the Democratic Republic of the Congo, the Republic of the Congo, the Central African Republic, Gabon, Cameroon, and Uganda; she was based in Kinshasa. She was also in Ivory Coast or Côte d'Ivoire after that. She is currently in Geneva as the Communications Officer covering Central, East, West and Southern Africa and Statistics.",https://en.wikipedia.org/wiki/Fatoumata_Kaba
Guyana,4,Asha Blake,http://www.wikidata.org/entity/Q4804494,wd:Q4804494,7922342,American journalist,"Asha Blake is a five-time Emmy Award-winning television news journalist.  Her US-based career has spanned anchoring ABC and NBC network newscasts, daytime- and entertainment-based talk shows, and local news anchoring at flagship news stations KNBC and KTLA. In 1999, Blake co-hosted NBC's Later Today, a spinoff of the Today Show, with Jodi Applegate and Florence Henderson.",https://en.wikipedia.org/wiki/Asha_Blake
Haiti,46,Michaëlle Jean,http://www.wikidata.org/entity/Q128933,wd:Q128933,594891,Canadian journalist and 27th Governor General of Canada,"Michaëlle Jean  (French: [mika.ɛl ʒɑ̃]; born September 6, 1957) is a Canadian former journalist who served from 2005 to 2010 as Governor General of Canada, the 27th since Canadian Confederation. She is the first Haitian Canadian and Black person to hold this office.
Jean was the third secretary-general of the Organisation internationale de la Francophonie from 2015 until 2019. She was the first woman to hold the position and held the position until the end of 2018.
Jean was a refugee from Haiti—coming to Canada in 1968—and was raised in the town of Thetford Mines, Quebec. After receiving a number of university degrees, Jean worked as a journalist and broadcaster for Radio-Canada and the Canadian Broadcasting Corporation (CBC), as well as also undertaking charity work, mostly in the field of assisting victims of domestic violence. In 2005, she was appointed governor general by Queen Elizabeth II, on the recommendation of Prime Minister Paul Martin, to replace Adrienne Clarkson as vicereine and she occupied the post until succeeded by David Johnston in 2010. Early in her tenure, comments of hers recorded in some of the film works by her husband, Jean-Daniel Lafond, were construed as supporting Quebec sovereignty and her holding of dual citizenship caused doubt about her loyalties. But Jean denied separatist leanings, renounced her citizenship of France (acquired through her marriage), and eventually became a respected vicereine noted for her attention to the Canadian Forces, Aboriginal Canadians, and the arts, especially youth involvement in them. In 2010, Jean was appointed to a four-year term as the Special Envoy for Haiti for the United Nations Educational, Scientific, and Cultural Organization.Michaëlle Jean was sworn in as a member of the Queen's Privy Council for Canada on September 26, 2012.",https://en.wikipedia.org/wiki/Micha%C3%ABlle_Jean
Honduras,12,Argentina Díaz Lozano,http://www.wikidata.org/entity/Q5703629,wd:Q5703629,47320877,Honduran journalist and novelist,"Argentina Díaz Lozano (b.December 5,1909 – d.August 13, 1999) was the pseudonym for the Honduran writer Argentina Bueso Mejía. She was a journalist and novelist, who wrote in the romantic style with feminist themes. She won numerous awards for her books, including the  Golden Quetzel from Guatemala, the Honduran National Literature Prize Ramón Rosa"" and the ""Order Cruzeiro do Sud"" from Brazil. She was admitted to the Academia Hondureña de la Lengua and is the only Central American woman whose work has officially contended for a Nobel Prize for Literature.",https://en.wikipedia.org/wiki/Argentina_D%C3%ADaz_Lozano
Hungary,92,Theodor Herzl,http://www.wikidata.org/entity/Q44003,wd:Q44003,8233758,"Austro-Hungarian Jewish journalist, playwright, political activist, writer and the father of modern political Zionism","Theodor Herzl (; German: [ˈhɛɐtsl̩]; Hebrew: תֵּאוֹדוֹר הֶרְצְל, Te'odor Hertzel; Hungarian: Herzl Tivadar; 2 May 1860 – 3 July 1904) or Hebrew name given at his brit milah Binyamin Ze'ev, was an Austro-Hungarian Jewish journalist, playwright, political activist, and writer who was the father of modern political Zionism. Herzl formed the Zionist Organization and promoted Jewish immigration to Palestine in an effort to form a Jewish state.
Although he died before Israel's establishment, he is known in Hebrew as חוֹזֵה הַמְדִינָה, Chozeh HaMedinah lit. ""Visionary of the State"". Herzl is specifically mentioned in the Israeli Declaration of Independence and is officially referred to as ""the spiritual father of the Jewish State"", i.e. the visionary who gave a concrete, practicable platform and framework to political Zionism. However, he was not the first Zionist theoretician or activist; scholars, many of them religious such as rabbis Yehuda Bibas, Zvi Hirsch Kalischer and Judah Alkalai, promoted a range of proto-Zionist ideas before him.",https://en.wikipedia.org/wiki/Theodor_Herzl
Iceland,13,Kristinn Hrafnsson,http://www.wikidata.org/entity/Q956043,wd:Q956043,30007557,Icelandic journalist,Kristinn Hrafnsson (born 25 June 1962) is an Icelandic investigative journalist who is editor-in-chief of WikiLeaks. He was the spokesperson for WikiLeaks between 2010 and 2017.,https://en.wikipedia.org/wiki/Kristinn_Hrafnsson
India,45,Aravind Adiga,http://www.wikidata.org/entity/Q296299,wd:Q296299,18655143,Indian journalist and author,"Aravind Adiga (born 23 October 1974) is an Indian writer and journalist. His debut novel, The White Tiger, won the 2008 Man Booker Prize.",https://en.wikipedia.org/wiki/Aravind_Adiga
Indonesia,17,Mochtar Lubis,http://www.wikidata.org/entity/Q2570788,wd:Q2570788,17713707,Indonesian Batak journalist and novelist,"Mochtar Lubis
([moxˈtar luˈbɪs]; 7 March 1922 – 2 July 2004) was an Indonesian Batak journalist and novelist who co-founded Indonesia Raya and monthly literary magazine ""Horison"". His novel Senja di Jakarta (Twilight in Jakarta in English) was the first Indonesian novel to be translated into English. He was a critic of Sukarno and was imprisoned by him.",https://en.wikipedia.org/wiki/Mochtar_Lubis
Iran,25,Neda Agha-Soltan,http://www.wikidata.org/entity/Q326474,wd:Q326474,23349647,Iranian musician and journalist,error,error
Iran,24,Masih Alinejad,http://www.wikidata.org/entity/Q6783266,wd:Q6783266,17093549,Iranian-American journalist and writer,"Masih Alinejad (Persian: مسیح علی‌نژاد, born Masoumeh Alinejad-Ghomi (Persian: معصومه علی‌نژاد قمی), September 11, 1976) is an Iranian-American journalist, author, and women's rights activist. Alinejad currently works as a presenter/producer at VOA Persian Service, a correspondent for Radio Farda, a frequent contributor to Manoto television, and a contributing editor to IranWire.Alinejad focuses on criticism of human rights under the Islamic Republic of Iran, with a special focus on women's rights. She now lives in exile in New York City, and has won several awards, including the 2015 Geneva Summit for Human Rights and Democracy women's rights award, the Omid Journalism Award from the Mehdi Semsar Foundation, and a ""Highly Commended"" AIB Media Excellence Award.In 2019, Alinejad sued the Iranian government in a U.S. federal court for harassment against her and her family. She released a book in 2018 called The Wind in My Hair that deals with her experiences growing up in Iran, where she writes girls ""are raised to keep their heads low, to be unobtrusive as possible, and to be meek"". In 2021, U.S. prosecutors charged that she was the target of a kidnapping plot by the Iranian government.",https://en.wikipedia.org/wiki/Masih_Alinejad
Iraq,40,Muntadhar al-Zaidi,http://www.wikidata.org/entity/Q205360,wd:Q205360,20700771,Iraqi journalist,"Muntadhar al-Zaidi (Arabic: منتظر الزيدي Muntaẓar az-Zaydī; born 15 January 1979) is an Iraqi broadcast journalist who served as a correspondent for Iraqi-owned, Egyptian-based Al-Baghdadia TV.  As of February 2011, al-Zaidi works with a Lebanese TV channel.On 16 November 2007, al-Zaidi was kidnapped by unknown assailants in Baghdad. He was also previously twice arrested by the United States Armed Forces. On 14 December 2008, al-Zaidi  threw his shoes at then-U.S. President George W. Bush during a Baghdad press conference while shouting, ""This is a farewell kiss from the Iraqi people, you dog."" Al-Zaidi suffered injuries as he was taken into custody and some sources said he was tortured during his initial detention. There were calls throughout the Middle East to place the shoes in an Iraqi museum, but the shoes were later destroyed by U.S. and Iraqi security forces.
Al-Zaidi's shoeing inspired many similar incidents of political protest around the world.Following the incident, Al-Zaidi was represented by the head of the Iraqi Bar Association at trial. On 20 February 2009, al-Zaidi received a 90-minute trial by the Central Criminal Court of Iraq. On 12 March 2009, he was sentenced to three years in prison for assaulting a foreign head of state during an official visit. On 7 April, the sentence was reduced from three years to one year. He was released on 15 September 2009 for good behavior after spending nine months in jail. After his release, Al-Zaidi was treated for injuries received in prison and later said he planned to ""build orphanages, a children's hospital, and medical and orthopaedic centres offering free treatment and manned by Iraqi doctors and medical staff.""",https://en.wikipedia.org/wiki/Muntadhar_al-Zaidi
Israel,33,Daniel Pearl,http://www.wikidata.org/entity/Q357936,wd:Q357936,202851,American journalist,"Daniel Pearl (October 10, 1963 – February 1, 2002) was an American journalist who worked for The Wall Street Journal. He was kidnapped and later decapitated by terrorists in Pakistan.
Pearl was born in Princeton, New Jersey, and raised in Encino, Los Angeles, to a Jewish family of mixed European and West Asian origins; his father is of Polish Jewish descent and his mother was an Iraqi Jew from Baghdad. After attending Stanford University, Pearl embarked on a career in journalism. He was working as the South Asia Bureau Chief of The Wall Street Journal, based in Mumbai, India. Infamously, he was kidnapped when he went to Pakistan as part of an investigation into the alleged links between British citizen Richard Reid (known as the ""shoe bomber"") and al-Qaeda. Pearl was killed by his captors.Ahmed Omar Saeed Sheikh, a British national of Pakistani origin, was sentenced to death by hanging for Pearl's abduction and murder in 2002, but his conviction was overturned by a Pakistani court in the summer of 2020. Researchers have also connected Al-Qaeda member Saif al-Adel with the kidnapping.",https://en.wikipedia.org/wiki/Daniel_Pearl
