country,number,item,item_id,shortform,pageid,wikidata_description,wikipedia_summary,wikipedia_url
Italy,80,Italo Calvino,http://www.wikidata.org/entity/Q154756,wd:Q154756,14937,Italian journalist and writer (1923-1985),"Italo Calvino (, also US: , Italian: [ˈiːtalo kalˈviːno]; 15 October 1923 – 19 September 1985) was an Italian writer and journalist. His best known works include the Our Ancestors trilogy (1952–1959), the Cosmicomics collection of short stories (1965), and the novels Invisible Cities (1972) and If on a winter's night a traveler (1979).
Admired in Britain, Australia and the United States, he was the most translated contemporary Italian writer at the time of his death.Italo Calvino is buried in the garden cemetery of Castiglione della Pescaia, in Tuscany.",https://en.wikipedia.org/wiki/Italo_Calvino
Jamaica,9,Amy Jacques Garvey,http://www.wikidata.org/entity/Q481874,wd:Q481874,1291830,Jamaican journalist and political activist,"Amy Euphemia Jacques Garvey (31 December 1895 – 25 July 1973) was the Jamaican-born second wife of Marcus Garvey, and a journalist and activist in her own right. She was one of the pioneering female Black journalists and publishers of the 20th century.",https://en.wikipedia.org/wiki/Amy_Jacques_Garvey
Jordan,5,Jumana Ghunaimat,http://www.wikidata.org/entity/Q22687372,wd:Q22687372,59563759,Jordanian journalist,Jumana Ghunaimat (Arabic: جمانة غنيمات; born 4 December 1973) is a Jordanian journalist and was Jordan's Minister of State for Media Affairs and Government Spokesperson. She is currently Jordan's ambassador to Morocco.,https://en.wikipedia.org/wiki/Jumana_Ghunaimat
Kazakhstan,10,Yelena Masyuk,http://www.wikidata.org/entity/Q4284421,wd:Q4284421,32026759,Russian journalist,Yelena Vasilyevna Masyuk (Russian: Елена Васильевна Масюк) (born 24 January 1966) is a Russian television journalist known for her coverage of the First and Second Chechen Wars.,https://en.wikipedia.org/wiki/Yelena_Masyuk
Kenya,10,Mohamed Amin,http://www.wikidata.org/entity/Q3182608,wd:Q3182608,1713541,Kenyan photojournalist,"Mohamed ""Mo"" Amin  (29 August 1943 – 23 November 1996) was a Kenyan photojournalist.
Amin's filming of Michael Buerk's report of the 1984 Ethiopian famine brought international attention to the crisis and eventually helped start the charity wave that resulted in Live Aid concerts.
Amin died in November 1996 when his flight Ethiopian Airlines Flight 961 was hijacked and crashed into the Indian Ocean near Grande Comore.",https://en.wikipedia.org/wiki/Mohamed_Amin
Kosovo,19,Arbana Xharra,http://www.wikidata.org/entity/Q19668240,wd:Q19668240,45641807,Albanian investigative journalist,Arbana Xharra is an Albanian investigative journalist from Kosovo. She has won numerous awards for her reporting and was a 2015 recipient of the International Women of Courage Award from the US State Department.,https://en.wikipedia.org/wiki/Arbana_Xharra
Kuwait,7,Hidaya Sultan al-Salem,http://www.wikidata.org/entity/Q22003053,wd:Q22003053,48372528,Kuwaiti journalist,"Hidaya Sultan al-Salem, (Arabic: هدايه سلطان السالم, 1936 – 20 March 2001), sometimes transliterated as Hedaya, was a Kuwaiti journalist and author, who owned and edited the one of Kuwait's earliest political magazines al-Majalis in Kuwait City, Kuwait. She was Kuwait's first female to serve as an editor of a publication. She was a feminist and secularist, and she campaigned against corruption and on behalf of women's rights and suffrage in Kuwait. She was the first journalist to be killed in Kuwait since the Committee to Protect Journalists began recording these acts in 1992.",https://en.wikipedia.org/wiki/Hidaya_Sultan_al-Salem
Kyrgyzstan,7,Hamid Ismailov,http://www.wikidata.org/entity/Q3126428,wd:Q3126428,5196045,Uzbekistani journalist and writer,"Hamid Ismailov (Russian: Хамид Исмайлов) (Uzbek: Hamid Ismoilov / Ҳамид Исмоилов or Абдулҳамид Исмоил) born May 5, 1954 in Tokmok, Kyrgyzstan, is an Uzbek journalist and writer who was forced to flee Uzbekistan in 1992 and came to the United Kingdom, where he took a job with the BBC World Service. He left the BBC on 30 April 2019 after 25 years of service. His works are banned in Uzbekistan.

",https://en.wikipedia.org/wiki/Hamid_Ismailov
Latvia,16,Ilze Jaunalksne,http://www.wikidata.org/entity/Q16357999,wd:Q16357999,43537747,Latvian journalist,"Ilze Jaunalksne (also Ilze Jaunalksne-Rēdere, born November 19, 1976 in Jūrmala) is a Latvian journalist and an author and anchor of the TV3 Latvia current affairs program Nekā personīga (Nothing Personal) since 2008. From 2005 to 2008 she was an anchor for the Latvian Television channel LTV1 current affairs program De Facto.In March 2006 on De Facto, she broke the story of Latvian national political leaders from various different parties buying votes. Her reporting on this caused a minister to be forced to resign, and some high-ranking political figures to be indicted. In retaliation, her phone was illegally tapped and transcripts of her conversations released to the media by her opponents in the government.In response to this invasion of her privacy, Jaunalksne took the government to court for defamation of character, which was the first such case in Latvia. She won, with the Latvian Financial Police being ordered to pay her 100,000 lats ($187,000) in damages for illegally recording her calls and making the transcripts public, and the Finance Ministry and State Revenue Service being found guilty of invading her privacy.She received a 2007 International Women of Courage award. However, she could not attend the ceremonies since she was about to give birth.In 2019 Jaunalksne married fellow journalist Gundars Rēders. In 2021 she was awarded the Order of the Three Stars 4th Class.",https://en.wikipedia.org/wiki/Ilze_Jaunalksne
Lebanon,14,Samir Kassir,http://www.wikidata.org/entity/Q713162,wd:Q713162,1983583,Lebanese journalist (1960-2005),"Samir Kassir (Arabic: سمير قصير, 5 May 1960 – 2 June 2005) was a Lebanese-Palestinian journalist of An-Nahar and professor of history at Saint-Joseph University, who was an advocate of democracy and prominent opponent of the Syrian occupation of Lebanon. He was assassinated in 2005 as part of a series of assassinations of anti-Syria Lebanese political figures such as Rafic Hariri and George Hawi.",https://en.wikipedia.org/wiki/Samir_Kassir
Liberia,12,Hans Massaquoi,http://www.wikidata.org/entity/Q73033,wd:Q73033,2086851,American journalist and author,"Hans-Jürgen Massaquoi (January 19, 1926 – January 19, 2013) was a German-American journalist and author. He was born in Hamburg, Germany, to a German mother and a Liberian father of Vai ethnicity, the grandson of Momulu Massaquoi, the consul general of Liberia in Germany at the time.",https://en.wikipedia.org/wiki/Hans_Massaquoi
Libya,18,Mohammed Nabbous,http://www.wikidata.org/entity/Q461341,wd:Q461341,31230768,Libyan journalist (1983-2011),"Mohamed ""Mo"" Nabbous (محمد نبوس ‎; 27 February 1983 – 19 March 2011) was a Libyan information technologist, blogger, businessperson and civilian journalist who created and founded Libya Alhurra TV.
At the outbreak of the Libyan Civil War, Nabbous was the founder of Libya Alhurra TV, the first independent broadcast news organization since Gaddafi took power in Libya. Libya Alhurra TV was established in Benghazi, Libya on 19 February 2011 and started broadcasting online when Nabbous established a two-way satellite connection in the wake of a complete Internet blackout imposed by the Gaddafi government after the 17 February protests.Nabbous was shot by a sniper and killed on 19 March 2011 while reporting on attempts by government forces to fight revolutionaries and attack civilians in Benghazi. Hours after the death of Nabbous, international coalition airplanes entered Libyan airspace to enforce a no-fly zone authorized by United Nations Security Council Resolution 1973. In the last weeks of his life, Nabbous focused on bringing international attention to the humanitarian crisis unfolding in Libya. His death was widely reported by CNN and various media outlets. Prior to the establishment of Libya Alhurra TV, Nabbous operated a number of businesses in Benghazi city.",https://en.wikipedia.org/wiki/Mohammed_Nabbous
Lithuania,22,Józef Sękowski,http://www.wikidata.org/entity/Q1229486,wd:Q1229486,2615688,Russian journalist,"Osip Ivanovich Senkovsky (Russian: О́сип Ива́нович Сенко́вский), born Józef Julian Sękowski (31 March [O.S. 19 March] 1800 in Antagonka, near Vilnius – 16 March [O.S. 4 March] 1858 in Saint Petersburg), was a Polish-Russian orientalist, journalist, and entertainer.",https://en.wikipedia.org/wiki/Osip_Senkovsky
Luxembourg,13,Philip Crowther,http://www.wikidata.org/entity/Q104903561,wd:Q104903561,66424528,british-German-Luxembourgian journalist,"Philip Crowther is a British–German–Luxembourgish journalist, notable for being a polyglot. He has publicly fluently spoken in French, Spanish, Portuguese, English, German, and Luxembourgish. He is the White House correspondent for France 24, international affiliate correspondent for the Associated Press, and is a member of the White House Correspondents' Association.",https://en.wikipedia.org/wiki/Philip_Crowther
Madagascar,12,Jean Hatzfeld,http://www.wikidata.org/entity/Q764937,wd:Q764937,47652243,French journalist,Jean Hatzfeld is a French author and journalist who wrote extensively about the Bosnian War and the Rwandan Genocide in Rwanda.,https://en.wikipedia.org/wiki/Jean_Hatzfeld
Malawi,2,Gregory Gondwe,http://www.wikidata.org/entity/Q5606940,wd:Q5606940,37834005,Malawian freelance journalist,"Vitus-Gregory Gondwe is a Malawian journalist, editor and media consultant. He also runs his own social, music and business analysis blog. He is known for his investigative stories. He also writes on Business news. He has been a contributor to several newspapers in Malawi, and has worked for the Malawi Broadcasting Corporation as correspondent. He is a Malawi correspondent for the Associated Press, as well as a regular correspondent for BizCommunity and BiztechAfrica. He has contributed to a number of news sources worldwide since 1993. He also regularly writes about freedom of Press and the media industry.",https://en.wikipedia.org/wiki/Gregory_Gondwe
Malaysia,12,Rosihan Anwar,http://www.wikidata.org/entity/Q4992140,wd:Q4992140,14671860,"Contemporary Indonesian journalist, editor and author (1922-2011)","Rosihan Anwar (10 May 1922 – 14 April 2011) was a renowned Indonesian journalist and author. 
Rosihan Anwar was born in Kubang Nan Dua, West Sumatra. Rosihan received his early education at HIS and MULO in Padang. He continued his studies at Algemene Middelbare School (AMS) in Yogyakarta and often participated in journalism workshops at Columbia University, New York. His career began as reporter in Asia Raja newspaper during the Japanese Invasion of Indonesia. In 1947, he founded Siasat magazine. He was also the founder and editor of Pedoman newspaper, which was twice forcibly closed by Sukarno regime (1961) and Suharto's New Order administration (1974), because of its vocal criticism of the authoritarian regime. 
Rosihan also acted in several movies such as Lagi-lagi Krisis (Crisis Again), Karmila, and Tjoet Nja’ Dien. [1]
Rosihan Anwar was not interested in power, but was more a man of conscience and culture. He wrote critiques in local and foreign media. He was one of the founders of the National Film Company (Perfani). He was well known as a writer, and published 30 books and wrote hundreds of articles, mostly in Indonesian. The last book he wrote, Petite Histoire Indonesia, is about Indonesian history.
He also translated Jose Rizal's poem My Last Farewell into Indonesian, and it was recited by the soldiers of Indonesian independence before going to battle.
Rosihan Anwar died in Jakarta on 14 April 2011, of heart failure due to old age. [2]",https://en.wikipedia.org/wiki/Rosihan_Anwar
Mali,2,Soeraedi Tahsin,http://www.wikidata.org/entity/Q16924394,wd:Q16924394,42747095,Indonesian journalist and diplomat,"Soeraedi Tahsin (died February 25, 2003 in Amsterdam), also known as Eddie Soeraedi, was an Indonesian journalist and diplomat. He was the founding editor of the publication Berita Indonesia ('Indonesian News'), the first republican newspaper in Batavia.",https://en.wikipedia.org/wiki/Soeraedi_Tahsin
Malta,45,Daphne Caruana Galizia,http://www.wikidata.org/entity/Q19646809,wd:Q19646809,53850446,Maltese journalist and blogger,"Daphne Anne Caruana Galizia (née Vella; 26 August 1964 – 16 October 2017) was a Maltese writer, journalist, blogger and anti-corruption activist, who reported on political events in Malta. In particular, she focused on investigative journalism, reporting on government corruption, nepotism, patronage, allegations of money laundering, links between Malta's online gambling industry and organized crime, Malta's citizenship-by-investment scheme, and payments from the government of Azerbaijan. Caruana Galizia's national and international reputation was built on her regular reporting of misconduct by Maltese politicians and politically exposed persons.Caruana Galizia continued to publish articles for decades, despite intimidation and threats, libel suits and other lawsuits. She was arrested by the Malta Police Force on two occasions. Caruana Galizia's investigations were published via her personal blog Running Commentary, which she set up in 2008. She was a regular columnist with The Sunday Times of Malta and later The Malta Independent. Her blog consisted of investigative reporting and commentary, some of which was regarded as personal attacks on individuals, leading to a series of legal battles. In 2016 and 2017, she revealed controversially sensitive information and allegations relating to a number of Maltese politicians and the Panama Papers scandal.On 16 October 2017, Caruana Galizia was killed close to her home when a car bomb was detonated inside her vehicle, attracting widespread local and international condemnation of the attack. In December 2017, three men were arrested in connection with the car bomb attack. Police arrested Yorgen Fenech, the owner of the Dubai-based company 17 Black, on his yacht on 20 November 2019 in connection with her murder.In April 2018, an international consortium of 45 journalists published The Daphne Project, a collaboration to complete her investigative work. The GUE/NGL Award for Journalists, Whistleblowers & Defenders of the Right to Information was established in 2018 in honour of Galizia.",https://en.wikipedia.org/wiki/Daphne_Caruana_Galizia
Mauritania,3,Naha Mint Seyyidi,http://www.wikidata.org/entity/Q2375311,wd:Q2375311,65808180,Mauritanian journalist,Naha Mint Mohamed Lemine Ould Seyyidi is a Mauritanian journalist. She is considered the first woman to work in media in Mauritania.,https://en.wikipedia.org/wiki/Naha_Mint_Seyyidi
Mauritius,12,Nathacha Appanah,http://www.wikidata.org/entity/Q467796,wd:Q467796,3842335,Mauritian journalist and novelist,"Nathacha Devi Pathareddy Appanah (born 24 May 1973 in Mahébourg, Mauritius) is a Mauritian-French author. She spent most of her teenage years in Mauritius and also worked as a journalist/columnist at Le Mauricien and Week-End Scope before emigrating to France. She was a contributor to poetry and news section during her tenure in the magazines.
Since 1998, Nathacha Appanah is well known as an active writer. Her first book Les Rochers de Poudre d'Or  (published by Éditions Gallimard) received the ""Prix RFO du livre"". The book was based on the arrival of Indian indentured workers in Mauritius. Her other works like The Last Brother, detailing struggles during Nazi attack and migration to Czechoslovakia, and Tropic of Violence, based on children on the streets of Mayotte, are critically acclaimed.",https://en.wikipedia.org/wiki/Nathacha_Appanah
Mexico,33,Elena Poniatowska,http://www.wikidata.org/entity/Q261397,wd:Q261397,2405983,Mexican polish journalist and writer,"Hélène Elizabeth Louise Amélie Paula Dolores Poniatowska Amor (born May 19, 1932), known professionally as Elena Poniatowska (audio ) is a French-born Mexican journalist and author, specializing in works on social and political issues focused on those considered to be disenfranchised especially women and the poor. She was born in Paris to upper-class parents, including her mother whose family fled Mexico during the Mexican Revolution. She left France for Mexico when she was ten to escape the Second World War. When she was eighteen and without a university education, she began writing for the newspaper Excélsior, doing interviews and society columns. Despite the lack of opportunity for women from the 1950s to the 1970s, she wrote about social and political issues in newspapers, books in both fiction and nonfiction form. Her best known work is La noche de Tlatelolco (The night of Tlatelolco, the English translation was entitled ""Massacre in Mexico"") about the repression of the 1968 student protests in Mexico City. Due to her left wing views, she has been nicknamed ""the Red Princess"". She is considered to be ""Mexico's grande dame of letters"" and is still an active writer.",https://en.wikipedia.org/wiki/Elena_Poniatowska
Moldova,18,Natalia Morari,http://www.wikidata.org/entity/Q468198,wd:Q468198,15110996,Moldovan journalist,"Natalia Morari (Romanian: Natalia Morari, Russian: Наталья Григорьевна Морарь; born 12 January 1984 in Kotovsk, Moldavian SSR) is a Moldovan investigative journalist for the Russian magazine New Times. She was a permanent resident of Russia until she was expelled in December 2007, presumably for exposing corruption in Russia. Born in Moldova, she moved to Russia in 2002 to study sociology at the Moscow State University, which she graduated in 2007. Morari applied for Russian citizenship, which she was supposed to get in April 2008, but the citizenship was denied citing national security reasons.She has a son named Rem, who was born on 12 April 2021.",https://en.wikipedia.org/wiki/Natalia_Morar
Mongolia,5,Bolor-Erdene Khaltar,http://www.wikidata.org/entity/Q71943140,wd:Q71943140,62172884,Mongol journalist,"Bolor-Erdene Khaltar (born August 15, 1975 in Ulaanbaatar, Mongolia) is a Mongolian author and journalist. She studied at the National University of Mongolia during 1995 and graduated from the journalism department of the College of Literature in 2000.After graduation she started working at  newspapers such as ""Public Law"", ""Today"", ""The Word"", ""News of the Century"" and the agency ""Irmuun"". She is a freelance journalist and writer.She received the top literary prize of Mongolia ""The Golden Feather"" in 2009, with her book entitled You and me (psychological stories) and was then awarded for her book Khishigt for children in 2011. In 2019, her novella for youth Khishigt was published in France with the revised title Khishigt Mongol.",https://en.wikipedia.org/wiki/Bolor-Erdene_Khaltar
Morocco,19,Katherine Pancol,http://www.wikidata.org/entity/Q291235,wd:Q291235,8969119,"journalist, novelist","Katherine Pancol (born 22 October 1954) is a French journalist and novelist. Her books have been translated into some 30 languages, and sold millions of copies worldwide. In the United States, she is known as the author of The Yellow Eyes of Crocodiles (Penguin, 2013) and its sequel, The Slow Waltz of Turtles (Penguin, 2016), both translated by William Rodarmor.",https://en.wikipedia.org/wiki/Katherine_Pancol
Mozambique,10,Carlos Cardoso,http://www.wikidata.org/entity/Q968260,wd:Q968260,4895017,Mozambican journalist (1951-2000),Carlos Cardoso (1951 – 22 November 2000) was a Mozambican journalist. His murder in 2000 followed his newspaper's investigation into corruption in the privatisation of Mozambique's biggest bank.,https://en.wikipedia.org/wiki/Carlos_Cardoso_(journalist)
Myanmar,8,Thein Pe Myint,http://www.wikidata.org/entity/Q4453772,wd:Q4453772,5961432,Burmese journalist (1914-1978),"Thein Pe Myint (Burmese: သိန်းဖေမြင့် [θéɪɰ̃ pʰè mjɪ̰ɰ̃]; also Thakin Thein Pe (သခင် သိန်းဖေ [θəkʰɪ̀ɰ̃ θéɪɰ̃ pʰè]); 10 July 1914 – 15 January 1978) was a Burmese politician, writer and journalist. A writer of several politically and socially prominent books and the founder of an influential newspaper The Botataung, Thein Pe Myint was a leading Marxist intellectual and was an important player in the Burmese independence movement and postwar politics.

",https://en.wikipedia.org/wiki/Thein_Pe_Myint
Namibia,8,Gwen Lister,http://www.wikidata.org/entity/Q540913,wd:Q540913,11138988,Namibian journalist,"Gwen Lister (born 5 December 1953 in East London, South Africa) is a Namibian journalist, publisher, anti-apartheid  and press freedom activist.",https://en.wikipedia.org/wiki/Gwen_Lister
Nepal,6,Kiran Chetry,http://www.wikidata.org/entity/Q166178,wd:Q166178,1892441,Former American television broadcast journalist,"Kiran Carrie Chetry (Nepali: किरण क्षेत्री, born August 26, 1974) is a former  Nepali American television broadcast journalist who, until 2011, was a cable news anchor for CNN's American Morning. From 2001 to 2007 she reported—and then anchored—cable news at Fox News.",https://en.wikipedia.org/wiki/Kiran_Chetry
Netherlands,25,Tim Krabbé,http://www.wikidata.org/entity/Q352975,wd:Q352975,5195827,Dutch journalist and novelist,"Tim Krabbé (born 13 April 1943) is a Dutch journalist, novelist and chess player.
Krabbé was born in Amsterdam. His writing has appeared in most major periodicals in the Netherlands. Once a competitive cyclist, he is known to Dutch readers for his novel De Renner (The Rider), first published in 1978 and translated into English in 2002, of which The Guardian's Matt Seaton wrote: ""Nothing better is ever likely to be written on the subjective experience of cycle-racing"". English readers know him primarily for The Vanishing (Dutch: Spoorloos, literally: ""Traceless"" or ""Without a Trace""), the translation of his 1984 novel Het Gouden Ei (The Golden Egg), which was made into an acclaimed 1988 Dutch film for which Krabbé co-wrote a script. A poorly received American remake was made in 1993. In 1997 he published De grot, translated as The Cave and published in the U.S. in 2000. In 2009, he wrote the ""Boekenweekgeschenk"", called Een Tafel vol Vlinders.
Krabbé is a strong chess player who competed in two Dutch Chess Championships in 1967 and 1971. He maintains a chess website, and is renowned for his writings on the subject, in particular on chess problems; for instance, one of his publications is devoted to the Babson task.
Krabbé once authored a chess puzzle which featured a rook castling vertically (see joke chess problem), before this move was specifically disallowed. His FIDE rating is 2274.[1]
His father was the painter Maarten Krabbé (1908–2005) and his mother the Jewish film translator Margreet Reiss. He is the brother of actor Jeroen Krabbé and the multimedia artist/designer Mirko Krabbé, and the uncle of Martijn Krabbé, a Dutch media personality.",https://en.wikipedia.org/wiki/Tim_Krabb%C3%A9
New Zealand,18,Peter Arnett,http://www.wikidata.org/entity/Q142025,wd:Q142025,204063,journalist,"Peter Gregg Arnett  (born 13 November 1934) is a New Zealand-born American journalist. He is known for his coverage of the Vietnam War and the Gulf War. He was awarded the 1966 Pulitzer Prize in International Reporting for his work in Vietnam from 1962 to 1965, mostly reporting for the Associated Press.
Arnett also worked for National Geographic magazine, and later for various television networks, most notably for nearly two decades at CNN.  Arnett published a memoir, Live from the Battlefield: From Vietnam to Baghdad, 35 Years in the World's War Zones (1994). In March 1997, Arnett interviewed Osama bin Laden, leader of Al-Qaeda. The journalism school at the Southern Institute of Technology in New Zealand was named for Arnett.",https://en.wikipedia.org/wiki/Peter_Arnett
Nicaragua,8,Pedro Joaquín Chamorro Cardenal,http://www.wikidata.org/entity/Q706743,wd:Q706743,1169631,Nicaraguan journalist (1924-1978),"Pedro Joaquín Chamorro Cardenal (23 September 1924 – 10 January 1978) was a Nicaraguan journalist and publisher. He was the editor of La Prensa, the only significant opposition newspaper to the long rule of the Somoza family.  He is a 1977 laureate of the Maria Moors Cabot Prize of Columbia University in New York. He married Violeta Barrios de Chamorro, who later went on to become President of Nicaragua (1990-1996). In 1978, he was shot to death, one of the precipitating events of the overthrow of the Somoza regime the following year.",https://en.wikipedia.org/wiki/Pedro_Joaqu%C3%ADn_Chamorro_Cardenal
Niger,6,Mariama Keïta,http://www.wikidata.org/entity/Q57983186,wd:Q57983186,58926102,Niger journalist and feminist activist,"Mariama Keïta (1946 – 29 October 2018) was Niger's first woman journalist and feminist activist.

",https://en.wikipedia.org/wiki/Mariama_Ke%C3%AFta
Nigeria,12,Isioma Daniel,http://www.wikidata.org/entity/Q3802514,wd:Q3802514,12363167,Nigerian journalist,Isioma Nkemdilim Nkiruka Daniel (born 1981) is a Nigerian journalist whose 2002 newspaper article comment involving the Islamic prophet Muhammad sparked the Miss World riots and caused a fatwa to be issued on her life. She ultimately had to flee the country because of jihadis.,https://en.wikipedia.org/wiki/Isioma_Daniel
