country,number,item,item_id,shortform,pageid,wikidata_description,wikipedia_summary,wikipedia_url
Afghanistan,17,Mustafa Nayyem,http://www.wikidata.org/entity/Q2690181,wd:Q2690181,38144551,Ukrainian journalist,"Mustafa Masi Nayyem (Ukrainian: Мустафа Найєм, Pashto: مصطفی نعیم) is an Afghan-Ukrainian journalist, MP, and public figure who took part in Euromaidan in Ukraine. Formerly, he was a reporter for the newspaper ""Kommersant Ukraine"", the TVi channel, and the Internet newspaper Ukrayinska Pravda. He also participates in Ukrainian journalists' anti-censorship movement, ""Stop the censorship!"" (Ukrainian: Стоп цензурі!, Stop tsenzuri!), and Hromadske.TV. In the parliamentary elections on October 26, 2014, he was elected to the Ukrainian parliament on the list of Petro Poroshenko Bloc. He has been described as a reformist parliamentarian. Nayyem did not take part in the 2019 Ukrainian parliamentary election.

",https://en.wikipedia.org/wiki/Mustafa_Nayyem
Albania,19,Arbana Xharra,http://www.wikidata.org/entity/Q19668240,wd:Q19668240,45641807,Albanian investigative journalist,Arbana Xharra is an Albanian investigative journalist from Kosovo. She has won numerous awards for her reporting and was a 2015 recipient of the International Women of Courage Award from the US State Department.,https://en.wikipedia.org/wiki/Arbana_Xharra
Algeria,16,Jean Daniel,http://www.wikidata.org/entity/Q934682,wd:Q934682,9841670,French journalist and writer (1920-2020),Jean Daniel Bensaid (21 July 1920 – 19 February 2020) was a French journalist and author. He was the founder and executive editor of Le Nouvel Observateur weekly now known as L'Obs.,https://en.wikipedia.org/wiki/Jean_Daniel
Algeria,15,Franklin Loufrani,http://www.wikidata.org/entity/Q21445418,wd:Q21445418,47344828,French journalist and businessperson,error,error
Angola,29,José Eduardo Agualusa,http://www.wikidata.org/entity/Q363927,wd:Q363927,3039561,"journalist, writer","José Eduardo Agualusa Alves da Cunha (born December 13, 1960) is a Angolan journalist and writer of Portuguese and Brazilian descent. He studied agronomy and silviculture in Lisbon, Portugal. Currently he resides in the Island of Mozambique, working as a writer and journalist. He also has been working to establish a public library on the island.Agualusa writes predominantly in his native language, Portuguese. His books have been translated into twenty-five languages, most notably into English by translator Daniel Hahn, a frequent collaborator of his. Much of his writing focuses on the history of Angola.He has seen some success in English-speaking literary circles, most notably for A General Theory of Oblivion. That novel, written in 2012 and translated in 2015, was shortlisted for the 2016 Man Booker International Prize, and was the recipient of the 2017 International Dublin Literary Award.",https://en.wikipedia.org/wiki/Jos%C3%A9_Eduardo_Agualusa
Antigua and Barbuda,1,Melvin Claxton,http://www.wikidata.org/entity/Q21228553,wd:Q21228553,47913521,American journalist,"Melvin L. Claxton (born 1958) is an American journalist, author, and  entrepreneur. He has written about crime, corruption, and the abuse of political power. He is best known for his 1995 series of investigative reports on corruption in the criminal justice system in the U.S. Virgin Islands and its links to the region's crime rate. His series earned the Virgin Islands Daily News the Pulitzer Prize for Public Service in 1995. Another series by Claxton, this time on the criminal justice system in Detroit, was a finalist for a Pulitzer Prize for Public Service in 2003. Claxton has won a number of national reporting awards and his work has been honored several times by the Associated Press managing editors. He is the founder and CEO of Epic 4D, an educational video game company.",https://en.wikipedia.org/wiki/Melvin_Claxton
Armenia,12,Levon Ananyan,http://www.wikidata.org/entity/Q4064849,wd:Q4064849,4263766,Armenian journalist and translator,Levon Ananyan (Armenian: Լևոն Զաքարի Անանյան; 13 October 1946 – 2 September 2013) was an Armenian journalist and translator.,https://en.wikipedia.org/wiki/Levon_Ananyan
Australia,35,John Pilger,http://www.wikidata.org/entity/Q471546,wd:Q471546,146200,Australian journalist,"John Richard Pilger (; born 9 October 1939) is an Australian journalist, writer, scholar, and documentary filmmaker. He has been mainly based in Britain since 1962. He is also currently Visiting Professor at Cornell University in New York.Pilger is a strong critic of American, Australian, and British foreign policy, which he considers to be driven by an imperialist and colonialist agenda. Pilger has also criticised his native country's treatment of Indigenous Australians. He first drew international attention for his reports on the Cambodian genocide.His career as a documentary film maker began with The Quiet Mutiny (1970), made during one of his visits to Vietnam, and has continued with over 50 documentaries since. Other works in this form include Year Zero (1979), about the aftermath of the Pol Pot regime in Cambodia, and Death of a Nation: The Timor Conspiracy (1993). His many documentary films on indigenous Australians include The Secret Country (1985) and Utopia (2013). In the British print media, Pilger worked at the Daily Mirror from 1963 to 1986, and wrote a regular column for the New Statesman magazine from 1991 to 2014.
Pilger won Britain's Journalist of the Year Award in 1967 and 1979. His documentaries have gained awards in Britain and worldwide, including multiple BAFTA honours. The practices of the mainstream media are a regular subject in Pilger's writing.",https://en.wikipedia.org/wiki/John_Pilger
Azerbaijan,24,Khadija Ismayilova,http://www.wikidata.org/entity/Q14561644,wd:Q14561644,40210849,Azerbaijani investigative journalist and radio host,"Khadija Rovshan qizi Ismayilova, also Ismailova, (Azerbaijani: Xədicə Rövşən qızı İsmayılova, pronounced /xædiːˈdʒæ ismɑˈjɯlovɑ/; born 27 May 1976) is an Azerbaijani investigative journalist and radio host who is currently working for the Azerbaijani service of Radio Free Europe/Radio Liberty, until recently as the host of the daily debate show İşdən Sonra. She is a member of the Organized Crime and Corruption Reporting Project.Ismayilova has been targeted by Ilham Aliyev's authoritarian regime in Azerbaijan for her reporting on financial corruption among Azerbaijan's ruling elite. In December 2014, Ismayilova was arrested on charges of incitement to suicide, a charge widely criticized by human rights organizations as ludicrous. On 1 September 2015, Ismayilova was sentenced to seven and a half years in prison under charges of embezzlement and tax evasion. On 25 May 2016, the Azerbaijani supreme court ordered Ismayilova released on probation. In December 2017, Ismayilova received the Right Livelihood Award, often referred to as ""Alternative Nobel Prize"", ""for her courage and tenacity in exposing corruption at the highest levels of government through outstanding investigative journalism in the name of transparency and accountability."" Ismayilova was not allowed to travel from Azerbaijan to Sweden to receive the award.",https://en.wikipedia.org/wiki/Khadija_Ismayilova
Bahrain,5,Zakariya Rashid Hassan al-Ashiri,http://www.wikidata.org/entity/Q8065036,wd:Q8065036,33605249,Bahraini journalist,"Zakariya Rashid Hassan Al-Ashiri (Arabic: زكريا راشد حسن العشيري), also spelled Al Asheri and Aushayri, (1971– April 9, 2011), was a forty-year-old Bahraini blogger and journalist, worked as an editor and writer for a local blog news website in Al Dair, Bahrain. He was killed on April 9, 2011 while in custody of the Bahraini Government. Al-Ashiri was the first journalist in Bahrain to die in direct relation to his work since The Committee to Protect Journalists started keeping records in 1992, and he was the first to die in the Bahraini uprising (2011–present).Al-Ashiri was also the second blogger-journalist worldwide to have been killed for his blogging. Al-Ashiri follows the death two years earlier of Iranian Omid Reza Mir Sayafi, who was the first blogger to have been known to be killed for his publication. Two months after Al-Ashiri, Brazilian blogger Edinaldo Filgueira was killed in June 2011.",https://en.wikipedia.org/wiki/Zakariya_Rashid_Hassan_al-Ashiri
Bangladesh,11,Nadia Sharmeen,http://www.wikidata.org/entity/Q19636738,wd:Q19636738,45657821,journalist from Bangladesh,"Nadia Sharmeen is a Bangladeshi journalist. In 2015, she won the US State Department's International Women of Courage Award.",https://en.wikipedia.org/wiki/Nadia_Sharmeen
Barbados,57,Sue Gardner,http://www.wikidata.org/entity/Q7524,wd:Q7524,26576829,Canadian journalist & former executive director of the Wikimedia Foundation,"Sue Gardner (born May 11, 1967) is a Canadian journalist, not-for-profit executive and business executive. She was the executive director of the Wikimedia Foundation from December 2007 until May 2014, and before that was the director of the Canadian Broadcasting Corporation's website and online news outlets.
In 2012, she was ranked as the 70th-most powerful woman in the world by Forbes magazine. In 2013, she joined the board of Global Voices. In May 2015, the Tor Project announced that Gardner would be assisting the project with the development of their long-term organizational strategy. In 2018, she was announced as executive director of The Markup. Gardner left this position in May 2019.",https://en.wikipedia.org/wiki/Sue_Gardner
Belarus,109,Svetlana Aleksievich,http://www.wikidata.org/entity/Q274334,wd:Q274334,8207719,Belarusian investigative journalist and non-fiction prose writer,"Svetlana Alexandrovna Alexievich (born 31 May 1948) is a Belarusian investigative journalist, essayist and oral historian who writes in Russian. She was awarded the 2015 Nobel Prize in Literature ""for her polyphonic writings, a monument to suffering and courage in our time"". She is the first writer from Belarus to receive the award.

",https://en.wikipedia.org/wiki/Svetlana_Alexievich
Belize,3,Kalilah Enríquez,http://www.wikidata.org/entity/Q6352715,wd:Q6352715,8191334,Belizean journalist,"Kalilah Antonette Enríquez (married name Reynolds, born February 11, 1983) is a Belizean journalist and poet. She currently resides in Kingston, Jamaica, where she co-hosts the popular current affairs radio programme, Nationwide This Morning on Nationwide News Network.",https://en.wikipedia.org/wiki/Kalilah_Enr%C3%ADquez
Benin,4,Paulin Joachim,http://www.wikidata.org/entity/Q7154912,wd:Q7154912,12260093,Beninese journalist and poet (1931-2012),"Paulin Joachim (20 september 1931 –  24 november 2012 ), also known as Paulin Joachim Branco de Souza, was a Beninese poet, journalist, and editor, who later became a French citizen. He is known for his elegant language and was called ""a legend of journalism in Africa"".",https://en.wikipedia.org/wiki/Paulin_Joachim
Bhutan,3,Indra Adhikari,http://www.wikidata.org/entity/Q19742761,wd:Q19742761,39426349,Australian journalist,"Indra Adhikari (or I. P. Adhikari) is a Bhutanese journalist in exile. He was the founder of Bhutan News Service. He was a former Bhutanese refugee, forced to leave Bhutan along with his family in 1992.
He started The Shangrila Sandesh in 2001 but did not work for the paper for long. In 2004 he, along with Vidhyapati Mishra, started the Association of Press Freedom Activists (APFA) Bhutan. In 2007 they started Bhutan News Service. He worked in The Rising Nepal, The Himalayan Times, Nation Weekly and Nepalnews.com while living in Nepal as refugee.
Adhikari also taught Journalism and Development Communication for bachelor's and master's degrees in College of Journalism and Mass Communication between 2006 and 2010. He then moved to Australia under the resettlement program of the UNHCR for Bhutanese Refugees.
In Adelaide, Australia he founded Yuba Sansar, a weekly Nepali-language radio program aired through Radio Adelaide.",https://en.wikipedia.org/wiki/Indra_Adhikari
Bolivia,9,Ximena Galarza,http://www.wikidata.org/entity/Q6169259,wd:Q6169259,63365364,Bolivian journalist,"Ximena Galarza Lora (born January 14, 1972) is a Bolivian journalist. Her program was able to uncover election fraud in the 2019 Presidential and General elections. She was chosen as an International Women of Courage in March 2020 by the US Secretary of State.",https://en.wikipedia.org/wiki/Ximena_Galarza
Bosnia and Herzegovina,10,Milena Preindlsberger Mrazović,http://www.wikidata.org/entity/Q42529209,wd:Q42529209,57424267,"Austro-Hungarian journalist, writer and piano composer, editor","Milena Theresia Preindlsberger von Preindlsperg (née Mrazović; 28 December 1863 – 20 January 1927) was an Austro-Hungarian journalist, writer, and piano, composer. Mrazović is credited for introducing Bosnia and Herzegovina, where she lived for 40 years, to the German-speaking public. She was the first journalist in Bosnia and Herzegovina and the author of the first classical compositions on its soil but remains best known for the travel books she wrote during her long journeys. While horseback riding through remote mountain villages, Mrazović recorded Bosnian oral tradition and collected traditional costumes, building a valuable collection.",https://en.wikipedia.org/wiki/Milena_Mrazovi%C4%87
Botswana,9,Pelonomi Venson-Moitoi,http://www.wikidata.org/entity/Q7161670,wd:Q7161670,14599418,Motswana journalist,"Pelonomi Venson-Moitoi is a Motswana journalist and politician who served as Minister of Foreign Affairs of Botswana from 2014 until December 2018. She was appointed to the National Assembly of Botswana in 1999 as one of the four specially selected members and was re-elected in the 2004 general elections.Venson-Moitoi was the Minister of Works, Transport and Communications from 2001 to 2002 and Minister of Trade, Industry, Wildlife and Tourism from 2002 to 2004. She was appointed as the Minister of Communications, Science, and Technology in 2004. In the 2009 cabinet, Venson-Moitoi was appointed Minister of Communications, Science and Technology, and later she was appointed as Minister of Education.
On 17 December 2018, Venson-Moitoi announced that she would contest the party presidency. President Mokgweetsi Masisi sacked her from Cabinet the following day.

On 5 April 2019 she wrote a letter to Secretary General of the Botswana Democratic Party stating that she was withdrawing from the presidential election, alleging that the election was ""rigged from the beginning."" The previous day, the High Court had ruled against her request to have the elective congress postponed, agreed with opposition lawyers that she had not proved if her citizenship was by birth or descent. Her candidacy had been supported by former President Ian Khama, who slammed the ruling party, accusing them of ""cheating, intolerance and intimidation.""",https://en.wikipedia.org/wiki/Pelonomi_Venson-Moitoi
Bulgaria,22,Victoria Marinova,http://www.wikidata.org/entity/Q57076990,wd:Q57076990,58691889,Bulgarian journalist and TV host (1988-2018),Victoria Marinova (Bulgarian: Виктория Маринова; 19 August 1988 – 6 October 2018) was a Bulgarian TV host and journalist. She was raped and murdered  at age 30. Her death caused international outrage during a time of increased violence against investigative reporters.,https://en.wikipedia.org/wiki/Victoria_Marinova
Burkina Faso,3,Serge Théophile Balima,http://www.wikidata.org/entity/Q3479550,wd:Q3479550,18238339,Burkinabé journalist and diplomat,"Serge Théophile Balima  (born February 1, 1949) is a Burkinabé journalist, diplomat and professor of the University of Ouagadougou.",https://en.wikipedia.org/wiki/Serge_Th%C3%A9ophile_Balima
Burundi,6,Alexis Sinduhije,http://www.wikidata.org/entity/Q455599,wd:Q455599,17295805,Burundian journalist,"Alexis Sinduhije (born 5 May 1967) is a Burundian journalist and politician. After founding Radio Publique Africaine during the Burundi Civil War, Sinduhije received a CPJ International Press Freedom Award and was named to the Time 100 list of most influential people. In 2007, he left journalism to run for president, but was arrested in 2008 on a charge of ""insulting the president,"" Pierre Nkurunziza, drawing protests on his behalf from the U.S., U.K., and Amnesty International. He was found not guilty and released in 2009.  The film ""Kamenge, Northern Quarters"" follows Sinduhije before, during, and after his incarceration.",https://en.wikipedia.org/wiki/Alexis_Sinduhije
Cambodia,28,Dith Pran,http://www.wikidata.org/entity/Q469846,wd:Q469846,323932,Cambodian photojournalist,Dith Pran (Khmer: ឌិត ប្រន; 27 September 1942 – 30 March 2008) was a Cambodian photojournalist. He was a refugee and survivor of the Cambodian genocide and the subject of the film The Killing Fields (1984).,https://en.wikipedia.org/wiki/Dith_Pran
Cameroon,13,Henriette Ekwe Ebongo,http://www.wikidata.org/entity/Q5716092,wd:Q5716092,32250445,Cameroonian journalist and political activist,"Henriette Ekwe Ebongo (December 25, 1949) is a Cameroonian journalist, publisher and political activist. She was awarded the International Women of Courage Award in 2011.Ebongo advocates freedom of press, gender equality, human rights, and good governance. She was active in the struggle against dictatorship in the 1980s, and the current campaign against government corruption, gender discrimination and human rights abuses. During this time she has suffered repression, torture, and being taken to military court.She is the publisher of the independent weekly newspaper Babela and is a founder of the Cameroon branch of Transparency International, the anti-corruption non-governmental organization.",https://en.wikipedia.org/wiki/Henriette_Ekwe_Ebongo
Canada,57,Sue Gardner,http://www.wikidata.org/entity/Q7524,wd:Q7524,26576829,Canadian journalist & former executive director of the Wikimedia Foundation,"Sue Gardner (born May 11, 1967) is a Canadian journalist, not-for-profit executive and business executive. She was the executive director of the Wikimedia Foundation from December 2007 until May 2014, and before that was the director of the Canadian Broadcasting Corporation's website and online news outlets.
In 2012, she was ranked as the 70th-most powerful woman in the world by Forbes magazine. In 2013, she joined the board of Global Voices. In May 2015, the Tor Project announced that Gardner would be assisting the project with the development of their long-term organizational strategy. In 2018, she was announced as executive director of The Markup. Gardner left this position in May 2019.",https://en.wikipedia.org/wiki/Sue_Gardner
Cape Verde,12,Arménio Vieira,http://www.wikidata.org/entity/Q2604164,wd:Q2604164,7977467,Cape Verdean journalist,"Arménio Adroaldo Vieira e Silva (Portuguese pronunciation: [ɐɾˈmɛniu ɐdɾuˈaldu viˈejɾɐ i ˈsilvɐ]; born January 29, 1941) is a Cape Verdean writer, poet and journalist.  He began his activity during the 1960s, collaborated in SELÓ, Boletim de Cabo Verde, Vértice (Coimbra) review, Raízes, Ponto & Vírgula, Fragmentos, Sopinha de Alfabeto and others.
Three of his poems— Lisboa (1971), Quiproquo and Ser tigre— can be found on the CD Poesia de Cabo Verde e Sete Poemas de Sebastião da Gama by Afonso Dias.He won the Camões Prize in 2009 on the work O Poema, a Viagem, o Sonho.His poems were celebrated by Mito Elias (also simply as Mito) in Praia and Mindelo in 2011.He started a series of ""versions of books, poetic and miscellaneous notes"" in June 2013 with O Brumário, later Derivações do Brumário and recently Fantasmas e Fantasias do Brumário in 2014.",https://en.wikipedia.org/wiki/Arm%C3%A9nio_Vieira
Chad,13,Pape Diouf,http://www.wikidata.org/entity/Q3362788,wd:Q3362788,18447388,Senegalese journalist,"Mababa Diouf, known as Papa Diouf or Pape Diouf, (18 December 1951-31 March 2020), is a Franco-Senegalese football personality who was sports journalist, agent for football players, and later president of Olympique de Marseille from 2005 to 2009.
A descendant of a Senegalese military family, Pape Diouf arrived in France at the age of 18 and started after studying political science in the profession of sports journalism with the communist newspaper La Marseillaise in his football column and columnist of Marseille sports life including Olympique de Marseille during the 1970s and 1980s. At the end of the 1990s, he joined the daily Le Sport, which was supposed to compete with L'Équipe, but ultimately failed.
Linked to many people in football, he then became a agent for several players in the 1990s until 2004. That year, he joined the Olympique de Marseille club as general manager then chairman of the executive board before being appointed president in 2005, being the first, and only since, black president of a French professional club. He remained four years in this post before being disembarked in 2009 following internal disagreements. Although under his presidency the club did not win a trophy, it allowed him to remain in the top 5 of the French Championship standings and to regain stability despite a financially difficult period. He later took part in the creation of a journalism school in Marseille and in conferences on football and shared his life between France and Senegal. He died in Dakar at the age of 68, a victim of the COVID-19 pandemic.",https://en.wikipedia.org/wiki/Pape_Diouf
Chile,11,Beatriz Sánchez,http://www.wikidata.org/entity/Q30348857,wd:Q30348857,54467182,Chilean journalist and politician,"Beatriz de Jesús Sánchez Muñoz (born 24 December 1970) is a Chilean journalist and politician.
During the 1990s and 2000s, she worked as a political and current affairs journalist for radio stations in Chile, where she achieved high recognition for her activity. During the 2010s, she joined television, where she was the host of the Hora 20 news program on La Red.
In 2017, she ran for her country's presidential candidacy in the Broad Front primaries, achieving 68% of the preferences. In the same year, she ran as a candidate for the Broad Front in the 2017 presidential elections, where she reached third place, with a percentage higher than 20%, only two percentage points lower than her contender, Alejandro Guillier.Sánchez has obtained multiple awards for her work as a journalist. In 2014, she received the distinction as the ""best television journalist of the year"" by the Adolfo Ibáñez University. In 2016 she obtained the Raquel Correa Award by the National Association of Women Journalists of Chile.",https://en.wikipedia.org/wiki/Beatriz_S%C3%A1nchez_(journalist)
Colombia,30,Alberto Lleras Camargo,http://www.wikidata.org/entity/Q12002,wd:Q12002,755179,Colombian journalist and politician (1906-1990),"Alberto Lleras Camargo (3 July 1906 – 4 January 1990) was the 20th President of Colombia (1958–1962), and the 1st Secretary General of the Organization of American States (1948–1954). A journalist and liberal party politician, he also served as Minister of Government, Minister of Foreign Affairs, and as Minister of National Education in the administrations of President Alfonso López Pumarejo. He briefly attended the National University of Colombia in Bogotá to study politics, but dropped out later to pursue journalism.
Lleras Camargo served as congressman of Colombia. He was also a cousin of later president Carlos Lleras Restrepo. He died in 1990 after suffering a long illness.",https://en.wikipedia.org/wiki/Alberto_Lleras_Camargo
Costa Rica,4,Giannina Segnini,http://www.wikidata.org/entity/Q28503366,wd:Q28503366,62951015,Costa Rican investigative journalist,Giannina Segnini Picado (born 1970) is a Costa Rican journalist recognized for having uncovered two political scandals that led to convictions of former presidents – the ICE-Alcatel and Caja-Fischel cases. She has become a distinguished figure in Latin America for her work in investigative and data journalism.,https://en.wikipedia.org/wiki/Giannina_Segnini
Croatia,23,Marija Jurić Zagorka,http://www.wikidata.org/entity/Q291016,wd:Q291016,7822338,"Croatian journalist, novelist, dramatist","Marija Jurić (Croatian: [mǎrija jǔːritɕ]; 2 March 1873 – 30 November 1957), known by her pen name Zagorka (IPA: [zǎːɡoːrka]), was a Croatian journalist, writer and women's rights activist. She was the first female journalist in Croatia and is among the most read Croatian writers.",https://en.wikipedia.org/wiki/Marija_Juri%C4%87_Zagorka
Cuba,80,Italo Calvino,http://www.wikidata.org/entity/Q154756,wd:Q154756,14937,Italian journalist and writer (1923-1985),"Italo Calvino (, also US: , Italian: [ˈiːtalo kalˈviːno]; 15 October 1923 – 19 September 1985) was an Italian writer and journalist. His best known works include the Our Ancestors trilogy (1952–1959), the Cosmicomics collection of short stories (1965), and the novels Invisible Cities (1972) and If on a winter's night a traveler (1979).
Admired in Britain, Australia and the United States, he was the most translated contemporary Italian writer at the time of his death.Italo Calvino is buried in the garden cemetery of Castiglione della Pescaia, in Tuscany.",https://en.wikipedia.org/wiki/Italo_Calvino
Cyprus,6,Kutlu Adalı,http://www.wikidata.org/entity/Q6448488,wd:Q6448488,16988520,"journalist, poet, researcher","Kutlu Adalı (1935 in Nicosia – July 6, 1996), was a Turkish Cypriot journalist, poet, socio-political researcher, and peace advocate.",https://en.wikipedia.org/wiki/Kutlu_Adal%C4%B1
