country,number,item,rank,item_id,shortform,pageid,wikidata_description
Afghanistan,4273156,Kabul,1,http://www.wikidata.org/entity/Q5838,wd:Q5838,16826,capital of Afghanistan
Albania,430407,Tirana,1,http://www.wikidata.org/entity/Q19689,wd:Q19689,31075,capital city of Albania
Algeria,3415811,Algiers,1,http://www.wikidata.org/entity/Q3561,wd:Q3561,1644,capital city of Algeria
Andorra,22151,Andorra la Vella,1,http://www.wikidata.org/entity/Q1863,wd:Q1863,59318,capital of Andorra
Angola,2487444,Luanda,1,http://www.wikidata.org/entity/Q3897,wd:Q3897,18402,capital of Angola
Antigua and Barbuda,21926,Saint John's,1,http://www.wikidata.org/entity/Q36262,wd:Q36262,28771,capital city of Antigua and Barbuda
Argentina,3063728,Buenos Aires,1,http://www.wikidata.org/entity/Q1486,wd:Q1486,255919,capital of Argentina
Armenia,1075800,Yerevan,1,http://www.wikidata.org/entity/Q1953,wd:Q1953,34352,capital of Armenia
Australia,4840600,Sydney,1,http://www.wikidata.org/entity/Q3130,wd:Q3130,27862,"capital city of New South Wales, Australia"
Austria,1911191,Vienna,1,http://www.wikidata.org/entity/Q1741,wd:Q1741,55866,capital of and state in Austria
Azerbaijan,2181800,Baku,1,http://www.wikidata.org/entity/Q9248,wd:Q9248,4566,capital of Azerbaijan
The Bahamas,274400,Nassau,1,http://www.wikidata.org/entity/Q2467,wd:Q2467,21871,capital city of the Commonwealth of the Bahamas
Bahrain,157474,Manama,1,http://www.wikidata.org/entity/Q3882,wd:Q3882,20481,capital of Bahrain
Bangladesh,16800000,Dhaka,1,http://www.wikidata.org/entity/Q1354,wd:Q1354,56656,capital of Bangladesh
Barbados,110000,Bridgetown,1,http://www.wikidata.org/entity/Q36168,wd:Q36168,56630,capital of Barbados
Belarus,1996553,Minsk,1,http://www.wikidata.org/entity/Q2280,wd:Q2280,51593,capital and largest city of Belarus
Belgium,1218255,Brussels-Capital Region,1,http://www.wikidata.org/entity/Q240,wd:Q240,3708,federal region of Belgium
Belize,57169,Belize City,1,http://www.wikidata.org/entity/Q108223,wd:Q108223,172703,largest city in Belize
Bhutan,104000,Thimphu,1,http://www.wikidata.org/entity/Q9270,wd:Q9270,57658,capital of Bhutan
Bolivia,3151676,Santa Cruz de la Sierra,1,http://www.wikidata.org/entity/Q170688,wd:Q170688,673987,capital of the Santa Cruz department in eastern Bolivia
Bosnia and Herzegovina,275524,Sarajevo,1,http://www.wikidata.org/entity/Q11194,wd:Q11194,26786,capital city of Bosnia and Herzegovina
Botswana,231626,Gaborone,1,http://www.wikidata.org/entity/Q3919,wd:Q3919,56664,capital of Botswana
Brazil,12325232,São Paulo,1,http://www.wikidata.org/entity/Q174,wd:Q174,390875,largest city in Brazil
Brunei,50000,Bandar Seri Begawan,1,http://www.wikidata.org/entity/Q9279,wd:Q9279,56611,capital of Brunei
Bulgaria,1276434,Sofia,1,http://www.wikidata.org/entity/Q472,wd:Q472,57644,capital city of Bulgaria
Burkina Faso,2453496,Ouagadougou,1,http://www.wikidata.org/entity/Q3777,wd:Q3777,56100,capital of Burkina Faso
Burundi,658859,Bujumbura,1,http://www.wikidata.org/entity/Q3854,wd:Q3854,56631,former capital of Burundi
Cape Verde,127832,Praia,1,http://www.wikidata.org/entity/Q3751,wd:Q3751,57397,capital of Cape Verde
Cambodia,2129371,Phnom Penh,1,http://www.wikidata.org/entity/Q1850,wd:Q1850,51591,capital of Cambodia
Cameroon,2446945,Douala,1,http://www.wikidata.org/entity/Q132830,wd:Q132830,19997263,city in Cameroon
Canada,2731571,Toronto,1,http://www.wikidata.org/entity/Q172,wd:Q172,64646,"capital city of the province of Ontario, Canada"
Central African Republic,889231,Bangui,1,http://www.wikidata.org/entity/Q3832,wd:Q3832,56617,capital city of the Central African Republic
Chad,1092066,N'Djamena,1,http://www.wikidata.org/entity/Q3659,wd:Q3659,57059,capital and largest city of Chad
Chile,6257516,Santiago,1,http://www.wikidata.org/entity/Q2887,wd:Q2887,51572,capital city of Chile
People's Republic of China,24870895,Shanghai,1,http://www.wikidata.org/entity/Q8686,wd:Q8686,27643,municipality of China
Colombia,7743955,Bogotá,1,http://www.wikidata.org/entity/Q2841,wd:Q2841,211271,capital city of Colombia
Comoros,111329,Moroni,1,http://www.wikidata.org/entity/Q3901,wd:Q3901,290711,capital of Comoros
Democratic Republic of the Congo,11855000,Kinshasa,1,http://www.wikidata.org/entity/Q3838,wd:Q3838,45773,capital city of the Democratic Republic of the Congo
Republic of the Congo,1827000,Brazzaville,1,http://www.wikidata.org/entity/Q3844,wd:Q3844,52710,capital of the Republic of the Congo
Costa Rica,288054,San José,1,http://www.wikidata.org/entity/Q3070,wd:Q3070,219665,capital of Costa Rica
Ivory Coast,4980000,Abidjan,1,http://www.wikidata.org/entity/Q1515,wd:Q1515,21371767,city and the former official capital of Ivory Coast
Croatia,809268,Zagreb,1,http://www.wikidata.org/entity/Q1435,wd:Q1435,55906,capital city of Croatia
Cuba,2141652,Havana,1,http://www.wikidata.org/entity/Q1563,wd:Q1563,49719,capital and largest city of Cuba
Cyprus,330000,Nicosia,1,http://www.wikidata.org/entity/Q3856,wd:Q3856,57064,capital city of Cyprus
Czech Republic,1335084,Prague,1,http://www.wikidata.org/entity/Q1085,wd:Q1085,23844,capital city of the Czech Republic
Denmark,602481,Copenhagen,1,http://www.wikidata.org/entity/Q1748,wd:Q1748,5166,capital city of Denmark
Djibouti,562000,Djibouti,1,http://www.wikidata.org/entity/Q3604,wd:Q3604,920729,capital city of Djibouti
Dominica,16582,Roseau,1,http://www.wikidata.org/entity/Q36281,wd:Q36281,57402,capital of Dominica
Dominican Republic,2581827,Santo Domingo,1,http://www.wikidata.org/entity/Q34820,wd:Q34820,57638,capital of the Dominican Republic
Ecuador,2723665,Guayaquil,1,http://www.wikidata.org/entity/Q43509,wd:Q43509,215586,city of Ecuador
Egypt,9293612,Cairo,1,http://www.wikidata.org/entity/Q85,wd:Q85,6293,capital city of Egypt
El Salvador,567698,San Salvador,1,http://www.wikidata.org/entity/Q3110,wd:Q3110,57631,Capital of El Salvador
Equatorial Guinea,250770,Bata,1,http://www.wikidata.org/entity/Q320792,wd:Q320792,1692372,city in Equatorial Guinea
Eritrea,963000,Asmara,1,http://www.wikidata.org/entity/Q3642,wd:Q3642,56827,capital city of Eritrea
Estonia,438341,Tallinn,1,http://www.wikidata.org/entity/Q1770,wd:Q1770,31577,capital and most populous city of Estonia
Eswatini,110508,Manzini,1,http://www.wikidata.org/entity/Q495730,wd:Q495730,3341887,city in Eswatini
Ethiopia,3041002,Addis Ababa,1,http://www.wikidata.org/entity/Q3624,wd:Q3624,52593,capital city of Ethiopia
Fiji,88271,Suva,1,http://www.wikidata.org/entity/Q38807,wd:Q38807,42904,capital city of Fiji
Finland,642045,Helsinki,1,http://www.wikidata.org/entity/Q1757,wd:Q1757,13696,capital of Finland
France,2165423,Paris,1,http://www.wikidata.org/entity/Q90,wd:Q90,22989,capital and largest city of France
Gabon,797003,Libreville,1,http://www.wikidata.org/entity/Q3825,wd:Q3825,57028,capital of Gabon
The Gambia,31356,Banjul,1,http://www.wikidata.org/entity/Q3726,wd:Q3726,69666,capital of The Gambia
Georgia,1118035,Tbilisi,1,http://www.wikidata.org/entity/Q994,wd:Q994,42298,capital city of the sovereign state of Georgia
Germany,3664088,Berlin,1,http://www.wikidata.org/entity/Q64,wd:Q64,3354,"federal state, capital and largest city of Germany"
Ghana,2310939,Tamale,1,http://www.wikidata.org/entity/Q217040,wd:Q217040,615410,"city in Northern Region, Ghana"
Greece,664046,Athens,1,http://www.wikidata.org/entity/Q1524,wd:Q1524,1216,capital city of Greece
Grenada,4315,St. George's,1,http://www.wikidata.org/entity/Q41547,wd:Q41547,57646,capital of Grenada
Guatemala,2934841,Guatemala City,1,http://www.wikidata.org/entity/Q1555,wd:Q1555,11874,capital and largest city of the Republic of Guatemala
Guinea,1667864,Conakry,1,http://www.wikidata.org/entity/Q3733,wd:Q3733,56638,capital of Guinea
Guinea-Bissau,395954,Bissau,1,http://www.wikidata.org/entity/Q3739,wd:Q3739,56629,capital city of Guinea-Bissau
Guyana,200500,Georgetown,1,http://www.wikidata.org/entity/Q10717,wd:Q10717,56702,capital city of Guyana
Haiti,987310,Port-au-Prince,1,http://www.wikidata.org/entity/Q34261,wd:Q34261,57391,capital of Haiti
Hungary,1723836,Budapest,1,http://www.wikidata.org/entity/Q1781,wd:Q1781,36787,capital and largest city of Hungary
Iceland,128793,Reykjavík,1,http://www.wikidata.org/entity/Q1764,wd:Q1764,25798,capital and largest city in Iceland
India,26495000,Delhi,1,http://www.wikidata.org/entity/Q1353,wd:Q1353,37756,Indian metropolis and union territory that includes New Delhi
Indonesia,10562088,Jakarta,1,http://www.wikidata.org/entity/Q3630,wd:Q3630,16275,capital city and smallest province of Indonesia
Iran,8693706,Tehran,1,http://www.wikidata.org/entity/Q3616,wd:Q3616,57654,capital of Iran
Iraq,6960000,Baghdad,1,http://www.wikidata.org/entity/Q1530,wd:Q1530,4492,capital city of Iraq
Republic of Ireland,553165,Dublin,1,http://www.wikidata.org/entity/Q1761,wd:Q1761,8504,capital city of Ireland
Israel,919438,Jerusalem,1,http://www.wikidata.org/entity/Q1218,wd:Q1218,16043,"city in Western Asia, claimed by both Israel and the Palestinian Authority as its capital"
Italy,2872800,Rome,1,http://www.wikidata.org/entity/Q220,wd:Q220,25458,capital and largest city of Italy
Jamaica,580000,Kingston,1,http://www.wikidata.org/entity/Q34692,wd:Q34692,37408,capital of Jamaica
Japan,14047594,Tokyo,1,http://www.wikidata.org/entity/Q1490,wd:Q1490,30057,capital and most populous prefecture of Japan
Jordan,4007526,Amman,1,http://www.wikidata.org/entity/Q3805,wd:Q3805,45007,capital of Jordan
Kazakhstan,1916822,Almaty,1,http://www.wikidata.org/entity/Q35493,wd:Q35493,159577,former capital of Kazakhstan and the nation's largest city
Kenya,5545000,Nairobi,1,http://www.wikidata.org/entity/Q3870,wd:Q3870,21482,capital city of Kenya
Kiribati,63439,South Tarawa,1,http://www.wikidata.org/entity/Q131233,wd:Q131233,1039944,capital of Kiribati
Kosovo,207477,Pristina,1,http://www.wikidata.org/entity/Q25270,wd:Q25270,15839892,capital of Kosovo
Kuwait,2989000,Kuwait City,1,http://www.wikidata.org/entity/Q35178,wd:Q35178,57021,capital of Kuwait
Kyrgyzstan,1053900,Bishkek,1,http://www.wikidata.org/entity/Q9361,wd:Q9361,4554,capital of Kyrgyzstan
Laos,948487,Vientiane,1,http://www.wikidata.org/entity/Q9326,wd:Q9326,23508076,capital of Laos
Latvia,614618,Riga,1,http://www.wikidata.org/entity/Q1773,wd:Q1773,25508,capital and largest city of Latvia
Lebanon,361366,Beirut,1,http://www.wikidata.org/entity/Q3820,wd:Q3820,37428,capital of Lebanon
Lesotho,330790,Maseru,1,http://www.wikidata.org/entity/Q3909,wd:Q3909,57047,capital of Lesotho
Liberia,1021762,Monrovia,1,http://www.wikidata.org/entity/Q3748,wd:Q3748,285213,capital city of Liberia
Libya,1126000,Tripoli,1,http://www.wikidata.org/entity/Q3579,wd:Q3579,31232,capital city of Libya
Liechtenstein,5668,Vaduz,1,http://www.wikidata.org/entity/Q1844,wd:Q1844,59036,capital of Liechtenstein
Lithuania,574147,Vilnius,1,http://www.wikidata.org/entity/Q216,wd:Q216,32597,capital and largest city of Lithuania
Luxembourg,128512,Luxembourg,1,http://www.wikidata.org/entity/Q1842,wd:Q1842,57035,capital city of the country Luxembourg
Madagascar,2610000,Antananarivo,1,http://www.wikidata.org/entity/Q3915,wd:Q3915,56597,capital of Madagascar
Malawi,1895973,Blantyre,1,http://www.wikidata.org/entity/Q188693,wd:Q188693,642604,city in Malawi
Malaysia,1982100,Kuala Lumpur,1,http://www.wikidata.org/entity/Q1865,wd:Q1865,16854,capital of Malaysia
Maldives,133019,Malé,1,http://www.wikidata.org/entity/Q9347,wd:Q9347,57040,capital of Maldives
Mali,2009109,Bamako,1,http://www.wikidata.org/entity/Q3703,wd:Q3703,56606,capital of Mali
Malta,24356,Birkirkara,1,http://www.wikidata.org/entity/Q39583,wd:Q39583,661357,city in Malta
Marshall Islands,30000,Majuro,1,http://www.wikidata.org/entity/Q12919,wd:Q12919,57037,"coral atoll, capital of the Marshall Islands"
Mauritania,1077169,Nouakchott,1,http://www.wikidata.org/entity/Q3688,wd:Q3688,51592,capital of Mauritania
Mauritius,149194,Port Louis,1,http://www.wikidata.org/entity/Q3929,wd:Q3929,57378,capital of Mauritius
Mexico,8918653,Mexico City,1,http://www.wikidata.org/entity/Q1489,wd:Q1489,18987,capital city of Mexico
Federated States of Micronesia,6227,Palikir,1,http://www.wikidata.org/entity/Q42751,wd:Q42751,99394,capital of Federated States of Micronesia
Moldova,639000,Chișinău,1,http://www.wikidata.org/entity/Q21197,wd:Q21197,56635,capital of Moldova
Mongolia,1396288,Ulaanbaatar,1,http://www.wikidata.org/entity/Q23430,wd:Q23430,67397,capital of Mongolia
Montenegro,174515,Podgorica,1,http://www.wikidata.org/entity/Q23564,wd:Q23564,172136,capital city of Montenegro
Morocco,4370000,Casablanca,1,http://www.wikidata.org/entity/Q7903,wd:Q7903,7301,major city in Morocco
Mozambique,1191613,Maputo,1,http://www.wikidata.org/entity/Q3889,wd:Q3889,57044,capital of Mozambique
Myanmar,5430000,Yangon,1,http://www.wikidata.org/entity/Q37995,wd:Q37995,57404,former capital of Myanmar (Burma) and the current capital of Yangon Region
Namibia,322500,Windhoek,1,http://www.wikidata.org/entity/Q3935,wd:Q3935,57669,capital of the Republic of Namibia
Nauru,747,Yaren District,1,http://www.wikidata.org/entity/Q31026,wd:Q31026,59028,district and de facto capital of Nauru
Nepal,845767,Kathmandu,1,http://www.wikidata.org/entity/Q3037,wd:Q3037,17168,capital of Nepal
Netherlands,860124,Amsterdam,1,http://www.wikidata.org/entity/Q727,wd:Q727,844,capital and most populous city of the Netherlands
New Zealand,1470100,Auckland,1,http://www.wikidata.org/entity/Q37100,wd:Q37100,18660332,city on the North Island New Zealand
Nicaragua,174051,León,1,http://www.wikidata.org/entity/Q208151,wd:Q208151,272888,city in Nicaragua
Niger,1026848,Niamey,1,http://www.wikidata.org/entity/Q3674,wd:Q3674,57061,capital of Niger
Nigeria,14862000,Lagos,1,http://www.wikidata.org/entity/Q8673,wd:Q8673,85232,city in Nigeria
North Korea,2863000,Pyongyang,1,http://www.wikidata.org/entity/Q18808,wd:Q18808,47948,capital city of North Korea
North Macedonia,526502,Skopje,1,http://www.wikidata.org/entity/Q384,wd:Q384,29618,capital city of North Macedonia
Norway,693494,Oslo,1,http://www.wikidata.org/entity/Q585,wd:Q585,22309,capital city of Norway
Oman,1421409,Muscat,1,http://www.wikidata.org/entity/Q3826,wd:Q3826,57053,capital of Oman
Pakistan,14910352,Karachi,1,http://www.wikidata.org/entity/Q8660,wd:Q8660,17123,"Provincial capital of Sindh, Pakistan"
Palau,8744,Koror,1,http://www.wikidata.org/entity/Q527748,wd:Q527748,54848517,city and former capital of Palau
State of Palestine,515556,Gaza City,1,http://www.wikidata.org/entity/Q47492,wd:Q47492,55387,city in the Palestinian Authority
Panama,880691,Panama City,1,http://www.wikidata.org/entity/Q3306,wd:Q3306,57361,capital of Panama
Papua New Guinea,317374,Port Moresby,1,http://www.wikidata.org/entity/Q36526,wd:Q36526,57387,capital of Papua New Guinea
Paraguay,524190,Asunción,1,http://www.wikidata.org/entity/Q2933,wd:Q2933,56836,capital of Paraguay
Peru,9674755,Lima,1,http://www.wikidata.org/entity/Q2868,wd:Q2868,85423,capital of Peru
Philippines,2960048,Quezon City,1,http://www.wikidata.org/entity/Q1475,wd:Q1475,284223,city of the Philippines in Metro Manila
Poland,1790658,Warsaw,1,http://www.wikidata.org/entity/Q270,wd:Q270,32908,capital and largest city of Poland
Portugal,506654,Lisbon,1,http://www.wikidata.org/entity/Q597,wd:Q597,18091,capital city of Portugal
Qatar,1186023,Doha,1,http://www.wikidata.org/entity/Q3861,wd:Q3861,26214389,capital of Qatar
Romania,1883425,Bucharest,1,http://www.wikidata.org/entity/Q19660,wd:Q19660,36877,capital and largest city of Romania
Russia,12655050,Moscow,1,http://www.wikidata.org/entity/Q649,wd:Q649,19004,capital and most populous city of Russia
Rwanda,1156663,Kigali,1,http://www.wikidata.org/entity/Q3859,wd:Q3859,56690,capital of Rwanda
Saint Kitts and Nevis,13220,Basseterre,1,http://www.wikidata.org/entity/Q41295,wd:Q41295,56622,capital of Saint Kitts and Nevis
Saint Lucia,70000,Castries,1,http://www.wikidata.org/entity/Q41699,wd:Q41699,56633,capital of Saint Lucia
Saint Vincent and the Grenadines,25000,Kingstown,1,http://www.wikidata.org/entity/Q41474,wd:Q41474,742159,capital of Saint Vincent and the Grenadines
Samoa,37708,Apia,1,http://www.wikidata.org/entity/Q36260,wd:Q36260,56828,capital of Samoa
San Marino,4040,San Marino,1,http://www.wikidata.org/entity/Q1848,wd:Q1848,406962,capital city of San Marino
São Tomé and Príncipe,56166,São Tomé,1,http://www.wikidata.org/entity/Q3932,wd:Q3932,293236,capital city of São Tomé and Príncipe
Saudi Arabia,8002100,Riyadh,1,http://www.wikidata.org/entity/Q3692,wd:Q3692,51554,capital of Saudi Arabia
Senegal,1170791,Pikine,1,http://www.wikidata.org/entity/Q1273644,wd:Q1273644,6676092,city in Senegal
Seychelles,26450,Victoria,1,http://www.wikidata.org/entity/Q3940,wd:Q3940,670780,capital city of the Seychelles
Sierra Leone,951000,Freetown,1,http://www.wikidata.org/entity/Q3780,wd:Q3780,56661,capital of Sierra Leone
Singapore,5866139,Singapore,1,http://www.wikidata.org/entity/Q334,wd:Q334,27318,sovereign city-state in Southeast Asia
Slovakia,475503,Bratislava,1,http://www.wikidata.org/entity/Q1780,wd:Q1780,18933194,capital city of Slovakia
Slovenia,286745,Ljubljana,1,http://www.wikidata.org/entity/Q437,wd:Q437,42374,capital city of Slovenia
Solomon Islands,84520,Honiara,1,http://www.wikidata.org/entity/Q40921,wd:Q40921,23868731,"capital of Solomon Islands, on the tropical island Guadalcanal"
Somalia,2120000,Mogadishu,1,http://www.wikidata.org/entity/Q2449,wd:Q2449,60154,capital of Somalia
South Africa,4434827,Johannesburg,1,http://www.wikidata.org/entity/Q34647,wd:Q34647,58893,city in South Africa
South Korea,9668465,Seoul,1,http://www.wikidata.org/entity/Q8684,wd:Q8684,19159283,capital of South Korea
South Sudan,525953,Juba,1,http://www.wikidata.org/entity/Q1947,wd:Q1947,1514879,capital of the Republic of South Sudan
Spain,3305408,Madrid,1,http://www.wikidata.org/entity/Q2807,wd:Q2807,41188263,capital and largest city of Spain
Sri Lanka,752993,Colombo,1,http://www.wikidata.org/entity/Q35381,wd:Q35381,56636,commercial capital of Sri Lanka
Sudan,5345000,Khartoum,1,http://www.wikidata.org/entity/Q1963,wd:Q1963,17320,capital city of Sudan
Suriname,223757,Paramaribo,1,http://www.wikidata.org/entity/Q3001,wd:Q3001,57370,capital of Suriname
Sweden,975819,Stockholm,1,http://www.wikidata.org/entity/Q1754,wd:Q1754,26741,capital of Sweden
Switzerland,434008,Zürich,1,http://www.wikidata.org/entity/Q72,wd:Q72,40334603,"capital of the canton of Zürich, Switzerland"
Syria,1916781,Aleppo,1,http://www.wikidata.org/entity/Q41183,wd:Q41183,159244,"city and governorate capital of Aleppo, Syria"
Taiwan,4364124,New Taipei,1,http://www.wikidata.org/entity/Q244898,wd:Q244898,333440,"city in Taiwan, and most populous municipality of Taiwan"
Tajikistan,863400,Dushanbe,1,http://www.wikidata.org/entity/Q9365,wd:Q9365,56658,capital of Tajikistan
Tanzania,4715000,Dar es Salaam,1,http://www.wikidata.org/entity/Q1960,wd:Q1960,8500,city in Tanzania
Thailand,5696409,Bangkok,1,http://www.wikidata.org/entity/Q1861,wd:Q1861,56615,capital of Thailand
East Timor,222323,Dili,1,http://www.wikidata.org/entity/Q9310,wd:Q9310,49251,capital of East Timor
Togo,837437,Lomé,1,http://www.wikidata.org/entity/Q3792,wd:Q3792,57067,capital of Togo
Tonga,23221,Nuku'alofa,1,http://www.wikidata.org/entity/Q38834,wd:Q38834,57356,capital city of Tonga
Trinidad and Tobago,83489,Chaguanas,1,http://www.wikidata.org/entity/Q1444575,wd:Q1444575,1025800,"city in central Trinidad, Trinidad and Tobago"
Tunisia,1056247,Tunis,1,http://www.wikidata.org/entity/Q3572,wd:Q3572,57659,capital of Tunisia
Turkey,15462452,Istanbul,1,http://www.wikidata.org/entity/Q406,wd:Q406,3391396,largest city in Turkey
Turkmenistan,828100,Ashgabat,1,http://www.wikidata.org/entity/Q23438,wd:Q23438,56569,capital city of Turkmenistan
Tuvalu,6025,Funafuti,1,http://www.wikidata.org/entity/Q34126,wd:Q34126,19359782,atoll and capital of Tuvalu
Uganda,1659600,Kampala,1,http://www.wikidata.org/entity/Q3894,wd:Q3894,56689,capital of Uganda
Ukraine,2963199,Kyiv,1,http://www.wikidata.org/entity/Q1899,wd:Q1899,585629,capital and largest city of Ukraine
United Arab Emirates,2502715,Dubai,1,http://www.wikidata.org/entity/Q612,wd:Q612,211583,million city in the United Arab Emirates
United Kingdom,8908081,London,1,http://www.wikidata.org/entity/Q84,wd:Q84,17867,capital and largest city of the United Kingdom
Uruguay,1319108,Montevideo,1,http://www.wikidata.org/entity/Q1335,wd:Q1335,38261,capital city of Uruguay
Uzbekistan,2571668,Tashkent,1,http://www.wikidata.org/entity/Q269,wd:Q269,57533,capital of Uzbekistan
Vanuatu,51437,Port Vila,1,http://www.wikidata.org/entity/Q37806,wd:Q37806,57389,capital and largest city of Vanuatu
Vatican City,1000,Vatican City,1,http://www.wikidata.org/entity/Q237,wd:Q237,32408,"independent city-state enclaved within Rome, Italy under the sovereignty of the Holy See"
Venezuela,1943901,Caracas,1,http://www.wikidata.org/entity/Q1533,wd:Q1533,55289,capital of Venezuela
Vietnam,10380000,Ho Chi Minh City,1,http://www.wikidata.org/entity/Q1854,wd:Q1854,66956,city of Vietnam
Yemen,2957000,Sanaa,1,http://www.wikidata.org/entity/Q2471,wd:Q2471,18691665,capital city of Yemen
Zambia,1742979,Lusaka,1,http://www.wikidata.org/entity/Q3881,wd:Q3881,23149963,capital of Zambia
Zimbabwe,2150000,Harare,1,http://www.wikidata.org/entity/Q3921,wd:Q3921,56680,capital of Zimbabwe
