0,1,2,3,4
Venezuela,16,Merida State Symphony Orchestra,"The Mérida State Symphony Orchestra (Spanish: Orquesta Sinfónica del Estado Mérida or OSEM) is a symphony orchestra based in the Venezuelan city of Mérida. A non-profit organization, it was founded in 1991 by the Venezuelan pianist and educator José Antonio Abreu.",https://en.wikipedia.org/wiki/M%C3%A9rida_State_Symphony_Orchestra
China,2,Peking opera orchestra,"Peking opera, or Beijing opera (Chinese: 京劇; pinyin: Jīngjù), is the most dominant form of Chinese opera, which combines music, vocal performance, mime, dance and acrobatics. It arose in Beijing in the mid-Qing dynasty (1644–1912) and became fully developed and recognized by the mid-19th century. The form was extremely popular in the Qing court and has come to be regarded as one of the cultural treasures of China. Major performance troupes are based in Beijing, Tianjin and Shanghai. The art form is also preserved in Taiwan, where it is also known as Guójù (Chinese: 國劇; lit. 'National opera'). It has also spread to other regions such as the United States and Japan.Peking opera features four main role types, sheng (gentlemen), dan (women), jing (rough men), and chou (clowns). Performing troupes often have several of each variety, as well as numerous secondary and tertiary performers. With their elaborate and colorful costumes, performers are the only focal points on Peking opera's characteristically sparse stage. They use the skills of speech, song, dance and combat in movements that are symbolic and suggestive, rather than realistic. Above all else, the skill of performers is evaluated according to the beauty of their movements. Performers also adhere to a variety of stylistic conventions that help audiences navigate the plot of the production. The layers of meaning within each movement must be expressed in time with music. The music of Peking opera can be divided into the xīpí (西皮) and èrhuáng (二黄) styles. Melodies include arias, fixed-tune melodies and percussion patterns. The repertoire of Peking opera includes over 1,400 works, which are based on Chinese history, folklore and, increasingly, contemporary life.Traditional Peking opera was denounced as ""feudalistic"" and ""bourgeois"" during the Cultural Revolution (1966–1976) and replaced mostly with the revolutionary operas until the period's end. After the Cultural Revolution, these transformations were largely undone. In recent years, Peking opera has responded to sagging audience numbers by attempting reforms, including improving performance quality, adapting new performance elements, shortening works, and performing new and original plays.",https://en.wikipedia.org/wiki/Peking_opera
Cambodia,1,Angkor National Youth Orchestra,"The Angkor Youth Orchestra (ANYO) (established in 2006 or 2007) is a Cambodian youth orchestra. Its first performance was at the Angkor Wat temple complex. It is the first establishment for orchestral classical music in Cambodia since the Sangkum Reahniyum Era (1953–1970). The Orchestra is supervised by two musicians: Tep Kuntheareth and Ram Daravong.
Under the coordination of the Cambodian cabinet and with the support of Gunma Junior Orchestra and Shinichi Minami, ANYO has been receiving donations and grown gradually to become a symphony orchestra.
The previous headquarters of ANYO were at the Secondary School of Fine Arts (Cambodia). For current headquarters please check the external link.
ANYO is composed of Cambodian teachers (educated in the former USSR) and young musicians with a total number of around 60 or 70. Most of the musicians come from the Royal University of Fine Arts. Others pay to be taught music and are automatically included in ANYO. Instruments include violins, violas, cellos, double basses and clarinets.
ANYO is still recruiting new musicians and receiving new students.",https://en.wikipedia.org/wiki/Angkor_National_Youth_Orchestra
Bangladesh,5,Miles,"The mile, sometimes the international mile or statute mile to distinguish it from other miles, is a British imperial unit and United States customary unit of distance; both are based on the older English unit of length equal to 5,280 English feet, or 1,760 yards. The statute mile was standardised between the British Commonwealth and the United States by an international agreement in 1959, when it was formally redefined with respect to SI units as exactly 1,609.344 metres.
With qualifiers, mile is also used to describe or translate a wide range of units derived from or roughly equivalent to the Roman mile, such as the nautical mile (now 1.852 km exactly), the Italian mile (roughly 1.852 km), and the Chinese mile (now 500 m exactly). The Romans divided their mile into 5,000 Roman feet but the greater importance of furlongs in Elizabethan-era England meant that the statute mile was made equivalent to 8 furlongs or 5,280 feet in 1593. This form of the mile then spread across the British Empire, some successor states of which continue to employ the mile. The US Geological Survey now employs the metre for official purposes, but legacy data from its 1927 geodetic datum has meant that a separate US survey mile (6336/3937 km) continues to see some use, although it was officially phased out in 2022. While most countries replaced the mile with the kilometre when switching to the International System of Units (SI), the international mile continues to be used in some countries, such as Liberia, the United Kingdom, the United States, and a number of countries with fewer than one million inhabitants, most of which are UK or US territories or have close historical ties with the UK or US.",https://en.wikipedia.org/wiki/Mile
Belarus,32,3+2,"Christopher Juel Barriere (July 11, 1972 – November 10, 2016), professionally known as 3-2, was an American rapper and a member of southern hip hop groups Convicts, Blac Monks, Southside Playaz and Screwed Up Click. He achieved success by his time with Rap-A-Lot Records. Barriere was fatally shot in the head at a gas station in Houston.",https://en.wikipedia.org/wiki/3-2
Faroe Islands,28,Tyr,"Týr (; Old Norse: Týr, pronounced [tyːr]) is a god in Germanic mythology, a valorous and powerful member of the Æsir and patron of warriors and mythological heroes. In Norse mythology, which provides most of the surviving narratives about gods among the Germanic peoples, Týr sacrifices his hand to the monstrous wolf Fenrir, who bites it off when he realizes the gods have bound him. Týr is foretold of being consumed by the similarly monstrous dog Garmr during the events of Ragnarök.
The interpretatio romana generally renders the god as Mars, the ancient Roman war god, and it is through that lens that most Latin references to the god occur. For example, the god may be referenced as Mars Thingsus (Latin 'Mars of the Assembly [Thing]') on 3rd century Latin inscription, reflecting a strong association with the Germanic thing, a legislative body among the ancient Germanic peoples. By way of the opposite process of interpretatio germanica, Tuesday is named after Týr ('Týr's day'), rather than Mars, in English and other Germanic languages.
In Old Norse sources, Týr is alternately described as the son of the jötunn Hymir (in Hymiskviða) or of the god Odin (in Skáldskaparmál). Lokasenna makes reference to an unnamed and otherwise unknown consort, perhaps also reflected in the continental Germanic record (see Zisa).
Due to the etymology of the god's name and the shadowy presence of the god in the extant Germanic corpus, some scholars propose that Týr may have once held a more central place among the deities of early Germanic mythology.

",https://en.wikipedia.org/wiki/T%C3%BDr
Brazil,60,Sepultura,"Sepultura (Portuguese: [ˌsepuwˈtuɾɐ], ""grave"") is a Brazilian heavy metal band from Belo Horizonte. Formed in 1984 by brothers Max and Igor Cavalera, the band was a major force in the groove metal, thrash metal and death metal genres during the late 1980s and early 1990s, with their later experiments drawing influence from alternative metal, world music, nu metal, hardcore punk, and industrial metal. Sepultura has also been credited as one of the second wave of thrash metal acts from the late 1980s to early-to-mid-1990s.The band has had several lineup changes throughout its 39-year career, with Max and Igor Cavalera departing in 1996 and 2006, respectively. Sepultura's current lineup consists of vocalist Derrick Green (who replaced Max in 1997), guitarist Andreas Kisser, bassist Paulo Jr. and drummer Eloy Casagrande (who replaced Igor's successor Jean Dolabella in 2011). Since Igor Cavalera's departure in 2006, there have been no original members left in the band. Although Paulo Jr. joined Sepultura shortly after its formation in late 1984 and is the longest serving member, he did not play on any of the band's studio albums until Chaos A.D. (1993). Kisser, who replaced onetime guitarist Jairo Guedz, has appeared on all of Sepultura's albums since their second full-length Schizophrenia (1987); he also recorded bass guitar until Chaos A.D..Sepultura has released fifteen studio albums to date, the latest being Quadra (2020). Their most successful records are Beneath the Remains (1989), Arise (1991), Chaos A.D. (1993), and Roots (1996). Sepultura has sold over three million units in the United States and almost 20 million worldwide, gaining multiple gold and platinum records around the globe, including in countries as diverse as France, Australia, Indonesia, United States, Cyprus, and their native Brazil.

",https://en.wikipedia.org/wiki/Sepultura
Latvia,31,Musiqq,"Musiqq is a Latvian pop music duo from Liepāja formed by Marats Ogļezņevs and Emīls Balceris. The duo first gained exposure in June 2009 with the release of their first single “Klimata kontrole”(""Climate control""), but on October 1 their second single ""Abrakadabra"" came out, which was a radio hit in Latvia and ""SEB Musical Bank 2009"" winner. Their debut album ""Šī ir tikai mūzika""(""This is just music"") was released in March 2010, which included radio hits such as ""Abrakadabra"", ""Dzimšanas diena"" (""Birthday"") and ""Klimata kontrole"" (""Climate control""). Both singers were awarded as ""Gada Liepājnieks""(""Liepajnieks of the year"" is a prize awarded for those, who have invested their time, effort and talent into making the city a better place) in nomination ""'Music"" and received three Copyright infinity prizes, because their songs are the most played on the radio, television and concerts. Musiqq represented Latvia in 2011 Eurovision Song Contest Düsseldorf with the song ""Angel in Disguise"".They are also known as Latvian rap duo called ""Bermudu Divstūris"", which formed in 2011. The name of the rap duo is a play on Bermuda Triangle, the literal translation being ""The Bermuda Digon"". As ""Bermudu Divstūris"" the band has released three studio albums and in 2014 it received The Golden Microphine award as ""Best hip-hop or dance album"".

",https://en.wikipedia.org/wiki/Musiqq
Aruba,5,Pete Philly and Perquisite,"Pete Philly & Perquisite  was a hip hop duo  from Amsterdam, Netherlands consisting of Pedro Philip Monzón  (born May 28, 1980 in Aruba) as the MC/vocalist and Pieter ""Perquisite"" Perquin  (born 1982 in Amsterdam) as the cellist, producer and composer of all the music. Their music is best described as hip hop with influences from jazz, broken beat and soul. They usually performed live together with DJ PCM (Misha van der Winkel), Remco Keijzer on saxophone, EWI and flute, Kasper Kalf on double-bass and Ruben Hein on keys.",https://en.wikipedia.org/wiki/Pete_Philly_and_Perquisite
Spain,38,Las Ketchup,"Las Ketchup is a Spanish girl group founded by flamenco record producer Manuel ""Queco"" Ruiz. The group, which consists of sisters Lucía, Lola, and Pilar Muñoz (later to be joined by a fourth sister Rocío), is best known for the 2002 hit single, ""The Ketchup Song (Aserejé)"", a single that sold over seven million copies worldwide. The group's debut studio album, Hijas del Tomate, has sold over two million copies worldwide, but the second did not achieve the same success. 
They represented Spain at Eurovision Song Contest 2006 in Athens with the song ""Un Blodymary"". The group has not released any singles since 2006, but still performs together publicly around Spain and other countries.

",https://en.wikipedia.org/wiki/Las_Ketchup
Slovakia,25,TWiiNS,"Twiins (often stylised as TWiiNS) is a Slovak twin pop duo consisting of sisters Daniela and Veronika Nízlová. They were born on 15 May 1986 in Hronský Beňadik. They are best known for representing Slovakia in the Eurovision Song Contest 2011 with the song ""I'm Still Alive"".
The twins were background singers and dancers for Tereza Kerndlová, the Czech entry in the Eurovision Song Contest 2008. The duo is known for their cover of Italian singer Sabrina Salerno's Boys (Summertime Love) under the title Boys, Boys, Boys featuring Carlprit in January 2010.
Twiins released ""One Night Stand"" featuring Flo Rida in 2012. They performed during his shows in Germany and Miami, Florida. Twiins are working on their second English-language singing album in Los Angeles, California with American songwriter and producer Bryan Todd.",https://en.wikipedia.org/wiki/Twiins
Andorra,17,Anonymous,error,error
Turkey,38,MaNga,"Manga (Japanese: 漫画 [maŋga]) are comics or graphic novels originating from Japan. Most manga conform to a style developed in Japan in the late 19th century, and the form has a long history in earlier Japanese art. The term manga is used in Japan to refer to both comics and cartooning. Outside of Japan, the word is typically used to refer to comics originally published in the country.In Japan, people of all ages and walks of life read manga. The medium includes works in a broad range of genres: action, adventure, business and commerce, comedy, detective, drama, historical, horror, mystery, romance, science fiction and fantasy, erotica (hentai and ecchi), sports and games, and suspense, among others. Many manga are translated into other languages.Since the 1950s, manga has become an increasingly major part of the Japanese publishing industry. By 1995, the manga market in Japan was valued at ¥586.4 billion ($6–7 billion), with annual sales of 1.9 billion manga books and manga magazines in Japan (equivalent to 15 issues per person). In 2020 Japan's manga market value hit a new record of ¥612.6 billion due to the fast growth of digital manga sales as well as increase of print sales. Manga have also gained a significant worldwide audience. Beginning with the late 2010s manga started massively outselling American comics. In 2020 the North American manga market was valued at almost $250 million. According to NPD BookScan manga made up 76% of overall comics and graphic novel sales in the US in 2021. The fast growth of the North American manga market has been attributed to manga's wide availability on digital reading apps, book retailer chains such as Barnes & Noble and online retailers such as Amazon as well as the increased streaming of anime. According to Jean-Marie Bouissou, manga represented 38% of the French comics market in 2005. This is equivalent to approximately 3 times that of the United States and was valued at about €460 million ($640 million). In Europe and the Middle East, the market was valued at $250 million in 2012.Manga stories are typically printed in black-and-white—due to time constraints, artistic reasons (as coloring could lessen the impact of the artwork) and to keep printing costs low—although some full-color manga exist (e.g., Colorful). In Japan, manga are usually serialized in large manga magazines, often containing many stories, each presented in a single episode to be continued in the next issue. Collected chapters are usually republished in tankōbon volumes, frequently but not exclusively paperback books. A manga artist (mangaka in Japanese) typically works with a few assistants in a small studio and is associated with a creative editor from a commercial publishing company. If a manga series is popular enough, it may be animated after or during its run. Sometimes, manga are based on previous live-action or animated films.Manga-influenced comics, among original works, exist in other parts of the world, particularly in those places that speak Chinese (""manhua""), Korean (""manhwa""), English (""OEL manga""), and French (""manfra""), as well as in the nation of Algeria (""DZ-manga"").",https://en.wikipedia.org/wiki/Manga
Moldova,40,O-Zone,"O-Zone was a Moldovan Eurodance group that was active from 1999 to 2019. Originating in 1998 as a duo consisting of Dan Bălan and Petru Jelihovschi before the latter's departure, their official trio lineup in 1999 consisted of Dan Bălan, Radu Sîrbu, and Arsenie Todiraș.The group gained global popularity with their song ""Dragostea Din Tei"" and their subsequent album DiscO-Zone.
The group re-united in 2017 for two concerts in Chișinău and Bucharest and in 2019 for one concert in Bucharest.",https://en.wikipedia.org/wiki/O-Zone
Japan,70,AKB48,"AKB48 (pronounced A.K.B. Forty-Eight) is a Japanese idol girl group named after the Akihabara (Akiba for short) area in Tokyo, where the group's theater is located. AKB48's producer, Yasushi Akimoto, wanted to form a girl group with its own theater and performing daily so fans could always see them live (which is not the case with usual pop groups giving occasional concerts and seen on television). This ""idols you can meet"" concept includes teams which can rotate performances and perform simultaneously at several events and ""handshake"" events, where fans can meet group members. Akimoto has expanded the AKB48 concept to several girl groups in Mainland China, Japan, Indonesia, Thailand, Taiwan and the Philippines.
AKB48 have been characterized as a social phenomenon.   They are among the highest-earning musical acts in Japan, and are the fifth-best-selling girl group worldwide. For example, their 2012 sales from record and DVD/Blu-ray releases reached $226 million, earning the group the top spot in the 2012 artist ranking. As of April 2019, the group has sold over 60 million records, including over 6 million albums. At least 35 AKB48's singles have topped the Oricon Weekly Singles Chart, with at least 30 singles selling over a million copies each, making the group the highest selling musical act in Japan in terms of singles sold. Their highest selling single, ""Teacher Teacher"", sold over 3 million in 2018 according to Billboard / Soundscan. Between 2010 and 2020, AKB48's singles have occupied at least the top two spots of the Oricon Yearly Singles Chart.",https://en.wikipedia.org/wiki/AKB48
Uruguay,13,El Cuarteto de Nos,"El Cuarteto de Nos (stylized as Cuarteto de Nos) is an Uruguayan rock group formed in 1980 in Montevideo, Uruguay. Over the years, due to its particular sound that mixes elements of hip hop, alternative rock, comedy rock and Latin music, the group has developed an immense amount of popularity and praise in Latin America and Hispanic countries. 
El Cuarteto de Nos has released 16 studio albums since 1984, as well as two compilation albums on numerous record labels, including Ayuí/Tacuabé, Orfeo, Sony BMG, Koala Records, Manzana Verde, Bizarro Records, EMI, and Warner Music. They have experimented with many genres, and are one of the most important and recognized bands from Uruguay and Latin America in general. They've had two lineups with the current one formed since 2009.",https://en.wikipedia.org/wiki/El_Cuarteto_de_Nos
Germany,88,Rammstein,"Rammstein (German pronunciation: [ˈʁamʃtaɪn], lit. ""ramming stone"") is a German Neue Deutsche Härte band formed in Berlin in 1994. The band's lineup—consisting of lead vocalist Till Lindemann, lead guitarist Richard Kruspe, rhythm guitarist Paul Landers, bassist Oliver Riedel, drummer Christoph Schneider, and keyboardist Christian ""Flake"" Lorenz—has remained unchanged throughout their history, along with their approach to songwriting, which consists of Lindemann writing and singing the lyrics over instrumental pieces the rest of the band has completed beforehand. Prior to their formation, some members were associated with the punk rock acts Feeling B and First Arsch.
After winning a local contest, Rammstein was able to record demos and send them to different record labels, eventually signing with Motor Music. Working with producer Jacob Hellner, they released their debut album Herzeleid in 1995. Though the album initially sold poorly, the band gained popularity through their live performances and the album eventually reached No. 6 in Germany. Their second album, Sehnsucht, was released in 1997 and debuted at No. 1 in Germany, resulting in a worldwide tour lasting nearly four years and spawning the successful singles ""Engel"" and ""Du hast"" and the live album Live aus Berlin (1999). Following the tour, Rammstein signed with major label Universal Music and released Mutter in 2001. Six singles were released from the album, all charting in countries throughout Europe. The lead single, ""Sonne"", reached No. 2 in Germany. Rammstein released Reise, Reise in 2004 and had two more singles reach No. 2 in Germany: ""Mein Teil"" and ""Amerika""; the former song reached No. 1 in Spain, becoming their first No. 1 single.
Their fifth album, Rosenrot, was released in 2005, and the lead single, ""Benzin"", reached No. 6 in Germany. Their second live album, Völkerball, was released in 2006. The band released their sixth album, Liebe ist für alle da, in 2009, with its lead single, ""Pussy"", becoming their first No. 1 hit in Germany despite having a controversial music video that featured hardcore pornography. The band then entered a recording hiatus and toured for several years, releasing the Made in Germany greatest hits album as well as the Rammstein in Amerika and Paris live albums. After a decade without new music, Rammstein returned in 2019 with the song ""Deutschland"", which became their second No. 1 hit in Germany. Their untitled seventh studio album was released in May 2019 and reached No. 1 in 14 countries. While sheltering during COVID-19 lockdowns, the band spontaneously wrote and recorded their eighth studio album, Zeit, which was released in April 2022.
Rammstein was one of the first bands to emerge within the Neue Deutsche Härte genre, with their debut album leading the music press to coin the term, and their style of music has generally had a positive reception from music critics. Commercially, the band has been very successful, earning many No. 1 albums as well as gold and platinum certifications in countries around the world. Their grand live performances, which often feature pyrotechnics, have contributed to the growth in their popularity. Despite success, the band has been subject to some controversies, with their overall image having been criticized; for instance, the song ""Ich tu dir weh"" forced its parent album Liebe ist für alle da to be re-released in Germany with the song removed due to its sexually explicit lyrics.

",https://en.wikipedia.org/wiki/Rammstein
South Africa,43,Die Antwoord,"Die Antwoord (pronounced [di ˈantvuərt], Afrikaans for ""The Answer"") is a South African alternative hip hop group formed in Cape Town in 2008.
The group comprises rappers Watkin Tudor ""Ninja"" Jones and Anri ""Yolandi Visser"" du Toit, a male/female duo, and producers HITEK5000 and Lil2Hood. Their image revolves around the South African counterculture movement known as zef and has incorporated work by other artists associated with the movement, such as photographer Roger Ballen.
Die Antwoord has had mainstream success worldwide. Their albums and singles have charted in the top 50—if not top 10—in countries in Europe and North America, and also Australia. Their music has been featured on best-selling video games in the Far Cry franchise as well. One of their earliest songs, ""Enter the Ninja"", did well in Australia and the UK, while later songs like ""Pitbull Terrier"" and ""Ugly Boy"" did well in the US. Their 2016 album peaked at a higher chart position in nearly every country than their previous 2014 album.
In recent years, the group has been involved in several controversies, including accusations of child abuse, sexual assault and hate crimes. 

",https://en.wikipedia.org/wiki/Die_Antwoord
