0,1,2,3,4
China,279.0,Beijing,"Beijing ( bay-JING; Chinese: 北京; pinyin: běi jīng; Mandarin pronunciation:  (listen)), alternatively romanized as Peking ( pee-KING), is the capital of the People's Republic of China. It is the world's most populous national capital city, with over 21 million residents within an administrative area of 16,410.5 km2 (6336 sq. mi.). Nevertheless its built-up area, the third largest in China after Guangzhou and Shanghai, is slightly bigger, including 3 districts in Hebei (Sanhe, Dachang Hui and Zhuozhou) being conurbated but with Miyun and Pinggu Districts in Beijing not agglomerated yet. It is located in Northern China, and is governed as a municipality under the direct administration of the State Council with 16 urban, suburban, and rural districts. Beijing is mostly surrounded by Hebei Province with the exception of neighboring Tianjin to the southeast; together, the three divisions form the Jingjinji megalopolis and the national capital region of China.Beijing is a global city and one of the world's leading centres for culture, diplomacy, politics, finance, business and economics, education, research, language, tourism, media, sport, science and technology and transportation. A megacity, Beijing is the second largest Chinese city by urban population after Shanghai and is the nation's cultural, educational, and political center. It is home to the headquarters of most of China's largest state-owned companies and houses the largest number of Fortune Global 500 companies in the world, as well as the world's four biggest financial institutions by total assets. Beijing is the ""billionaire capital of the world"" with the highest number of billionaires living in the city. It is also a major hub for the national highway, expressway, railway, and high-speed rail networks. The Beijing Capital International Airport has been the second busiest in the world by passenger traffic (Asia's busiest) since 2010, and, as of 2016, the city's subway network is the busiest and longest in the world. The Beijing Daxing International Airport, a second international airport in Beijing, is the largest single-structure airport terminal in the world.Combining both modern and traditional style architectures, Beijing is one of the oldest cities in the world, with a rich history dating back over three millennia. As the last of the Four Great Ancient Capitals of China, Beijing has been the political center of the country for most of the past eight centuries, and was the largest city in the world by population for much of the second millennium CE. With mountains surrounding the inland city on three sides, in addition to the old inner and outer city walls, Beijing was strategically poised and developed to be the residence of the emperor and thus was the perfect location for the imperial capital. The city is renowned for its opulent palaces, temples, parks, gardens, tombs, walls and gates. Beijing is one of the most important tourist destinations of the world. In 2018, Beijing was the second highest earning tourist city in the world after Shanghai. Beijing is home to many national monuments and museums and has seven UNESCO World Heritage Sites—the Forbidden City, Temple of Heaven, Summer Palace, Ming Tombs, Zhoukoudian, and parts of the Great Wall and the Grand Canal—all of which are popular tourist locations. Siheyuans, the city's traditional housing style, and hutongs, the narrow alleys between siheyuans, are major tourist attractions and are common in urban Beijing.
Many of Beijing's 91 universities consistently rank among the best in the Asia-Pacific and the world. Beijing is home to the two best C9 League universities (Tsinghua and Peking) in the Asia-Pacific and emerging countries. Beijing CBD is a center for Beijing's economic expansion, with the ongoing or recently completed construction of multiple skyscrapers. Beijing's Zhongguancun area is a world leading center of scientific and technological innovation as well as entrepreneurship. Beijing has been ranked the No.1 city in the world with the largest scientific research output by the Nature Index since 2016. The city has hosted numerous international and national sporting events, the most notable being the 2008 Summer Olympics and 2008 Summer Paralympics Games. In 2022, Beijing became the first city ever to host both the Summer and Winter Olympics, and also the Summer and Winter Paralympics. Beijing hosts 175 foreign embassies as well as the headquarters of many organizations, including the Asian Infrastructure Investment Bank (AIIB), the Shanghai Cooperation Organisation (SCO), the Silk Road Fund, the Chinese Academy of Sciences, the Chinese Academy of Engineering, the Chinese Academy of Social Sciences, the Central Academy of Fine Arts, the Central Academy of Drama, the Central Conservatory of Music, and the Red Cross Society of China.",https://en.wikipedia.org/wiki/Beijing
Peru,197.0,Lima,"Lima ( LEE-mə; Spanish pronunciation: ) is the capital and the largest city of Peru. It is located in the valleys of the Chillón, Rímac and Lurín Rivers, in the desert zone of the central coastal part of the country, overlooking the Pacific Ocean. Together with the seaport of Callao, it forms a contiguous urban area known as the Lima Metropolitan Area. With a population of more than 9.7 million and more than 10.7 million in its metropolitan area, Lima is one of the largest cities in the Americas. 
Lima was named by natives in the agricultural region known by native Peruvians as Limaq. It became the capital and most important city in the Viceroyalty of Peru. Following the Peruvian War of Independence, it became the capital of the Republic of Peru (República del Perú). Around one-third of the national population lives in the metropolitan area.
Lima is home to one of the oldest institutions of higher learning in the New World. The National University of San Marcos, founded on 12 May 1551, during the Viceroyalty of Peru, is the first officially established and the oldest continuously functioning university in the Americas.
Nowadays, the city is considered to be the political, cultural, financial and commercial center of the country. Internationally, it is one of the thirty most populated urban agglomerations in the world. Due to its geostrategic importance, the Globalization and World Cities Research Network has categorized it as a ""beta"" tier city.
Jurisdictionally, the metropolis extends mainly within the province of Lima and in a smaller portion, to the west, within the Constitutional Province of Callao, where the seaport and the Jorge Chávez Airport are located. Both provinces have regional autonomy since 2002.
In October 2013, Lima was chosen to host the 2019 Pan American Games; these games were held at venues in and around Lima, and were the largest sporting event ever hosted by the country. It also hosted the APEC Meetings of 2008 and 2016, the Annual Meetings of the International Monetary Fund and the World Bank Group in October 2015,  the United Nations Climate Change Conference in December 2014, and the Miss Universe 1982 contest.",https://en.wikipedia.org/wiki/Lima
Philippines,188.0,Manila,"Manila ( mə-NIH-lə, Spanish: ; Filipino: Maynila, pronounced ), officially the City of Manila (Filipino: Lungsod ng Maynila, locally ), is capital of the Philippines, and its second-most populous city. It is highly urbanized and as of 2019 was the world's most densely populated city proper. It was the first chartered city in the country, designated as such by the Philippine Commission Act 183 of July 31, 1901. It became autonomous with the passage of Republic Act No. 409, ""The Revised Charter of the City of Manila,"" on June 18, 1949. Manila, Mexico City, and Madrid are considered the world's original set of global cities because Manila's commercial networks were the first to extend across the Pacific Ocean and connect Asia with the Spanish Americas. When this was accomplished, it marked the first time in world history that an uninterrupted chain of trade routes circling the planet had been established. Manila is the second most natural-disaster-afflicted capital city in the world after Tokyo. It is among the most populous and fastest growing cities in Southeast Asia.The Spanish city of Manila was founded on June 24, 1571, by Spanish conquistador Miguel López de Legazpi. This is regarded as the city's official founding date; however, a Tagalog-fortified polity called Maynilà had already existed on the site, dating back as far as 1258. It is the name of this old polity from which the Spanish and English name Manila derives. After the defeat of the polity's last indigenous Rajah, Sulayman III, in the Battle of Bangkusay, a fortified Spanish city called Intramuros was built directly on top of the site of old Maynilà. Manila was the seat of power for most of the country's colonial rulers and was known as the ""Queen City of the Pacific."" It was one of the three oldest royal Spanish cities in the Philippines in the Spanish East Indies, along with Iloilo and Naga. Today, it is home to many historic sites, some of which were built during the 16th century.
The term ""Manila"" is commonly used to refer to the whole metropolitan area, the greater metropolitan area or the city proper. The officially defined metropolitan area, called Metro Manila, the ""capital region"" of the Philippines, includes the much larger Quezon City and the Makati Central Business District. It is the most populous region in the country, one of the most populous urban areas in the world, and is one of the wealthiest regions in Southeast Asia. The city proper was home to 1,846,513 people in 2020,  and is the historic core of a built-up area that extends well beyond its administrative limits. With 71,263 people per square kilometer, Manila is the most densely populated city proper in the world. Manila is located on the eastern shore of Manila Bay, on the island of Luzon. The Pasig River flows through the middle of the city, dividing it into the north and south sections. The city comprises 16 administrative districts and is divided into six political districts for the purposes of its representation in the Congress of the Philippines and the election of city council members. In 2018, the Globalization and World Cities Research Network listed Manila as an ""Alpha-"" global city and ranked it seventh in economic performance globally and second regionally (behind Delhi, India in the latter case), while the Global Financial Centres Index ranks Manila 79th in the world.

",https://en.wikipedia.org/wiki/Manila
Poland,263.0,Warsaw,"Warsaw (Polish: Warszawa,  (listen)), officially the Capital City of Warsaw, is the capital and largest city of Poland. The metropolis stands on the River Vistula in east-central Poland and its population is officially estimated at 1.8 million residents within a greater metropolitan area of 3.1 million residents, which makes Warsaw the 7th most-populous capital city in the European Union. The city area measures 517 km2 (200 sq mi) and comprises 18 boroughs, while the metropolitan area covers 6,100 km2 (2,355 sq mi). Warsaw is an alpha− global city, a major cultural, political and economic hub, and the country's seat of government. Its historical Old Town was designated a UNESCO World Heritage Site.
Warsaw traces its origins to a small fishing town in Masovia. The city rose to prominence in the late 16th century, when Sigismund III decided to move the Polish capital and his royal court from Kraków. Warsaw served as the de facto capital of the Polish–Lithuanian Commonwealth until 1795, and subsequently as the seat of Napoleon's Duchy of Warsaw. The 19th century and its Industrial Revolution brought a demographic boom which made it one of the largest and most densely-populated cities in Europe. Known then for its elegant architecture and boulevards, Warsaw was bombed and besieged at the start of World War II in 1939. Much of the historic city was destroyed and its diverse population decimated by the Ghetto Uprising in 1943, the general Warsaw Uprising in 1944 and systematic razing.
Warsaw is served by two international airports, the busiest being Warsaw Chopin and the smaller Warsaw Modlin intended for low-cost carriers. Major public transport services operating in the city include the Warsaw Metro, buses, urban-light railway and an extensive tram network. In 2012, the Economist Intelligence Unit ranked Warsaw as the 32nd most liveable city in the world. In 2017, the city came 4th in the ""Business-friendly"", 8th in ""Human capital and life style"" and topped the quality of life rankings in the region. The city is a significant centre of research and development, business process outsourcing, and information technology outsourcing. The Warsaw Stock Exchange is the largest and most important in Central and Eastern Europe. Frontex, the European Union agency for external border security as well as ODIHR, one of the principal institutions of the Organization for Security and Cooperation in Europe have their headquarters in Warsaw. Jointly with Frankfurt and Paris, Warsaw features one of the highest number of skyscrapers in the European Union, while Varso Place is the tallest building in the EU as of 2022.The city hosts the Polish Academy of Sciences, National Philharmonic Orchestra, University of Warsaw, the Warsaw University of Technology, the National Museum, Zachęta Art Gallery and the Warsaw Grand Theatre, the largest of its kind in the world. The reconstructed Old Town, which represents examples of nearly every European architectural style and historical period, was listed as a World Heritage Site by UNESCO in 1980. Other main architectural attractions include the Royal Castle and the iconic King Sigismund's Column, the Wilanów Palace, the Palace on the Isle, St. John's Cathedral, Main Market Square, as well as numerous churches and mansions along the Royal Route. Warsaw possesses thriving arts and club scenes, gourmet restaurants and large urban green spaces, with around a quarter of the city's area occupied by parks.",https://en.wikipedia.org/wiki/Warsaw
Portugal,242.0,Lisbon,"Lisbon (; Portuguese: Lisboa  (listen)) is the capital and the largest city of Portugal, with an estimated population of 544,851 within its administrative limits in an area of 100.05 km2. Lisbon's urban area extends beyond the city's administrative limits with a population of around 2.7 million people, being the 10th-most populous urban area in the European Union. About 3 million people live in the Lisbon metropolitan area, which represents approximately 27% of the country's population. It is mainland Europe's westernmost capital city and the only one along the Atlantic coast. Lisbon lies in the western Iberian Peninsula on the Atlantic Ocean and the River Tagus. The westernmost portions of its metro area, the Portuguese Riviera, form the westernmost point of Continental Europe, culminating at Cabo da Roca.
Lisbon is recognised as an alpha-level global city because of its importance in finance, commerce, media, entertainment, arts, international trade, education and tourism. Lisbon is one of two Portuguese cities (alongside Porto) to be recognised as a global city. Lisbon is home to three companies in the Global 2000. It is one of the major economic centres on the continent, with a growing financial sector and one of the largest container ports on Europe's Atlantic coast. Additionally, Humberto Delgado Airport served 29 million passengers in 2018, being the busiest airport in Portugal, the third busiest in the Iberian Peninsula and the 20th busiest in Europe. The motorway network and the high-speed rail system of Alfa Pendular links the main cities of Portugal to Lisbon. The city is the ninth-most-visited city in Southern Europe, after Istanbul, Rome, Barcelona, Milan, Athens, Venice, Madrid and Florence with 3,539,400 tourists in 2018. The Lisbon region has a higher GDP PPP per capita than any other region in Portugal. Its GDP amounts to US$110.3 billion and thus $32,434 per capita. The city occupies the 40th place of highest gross earnings in the world. Most of the headquarters of multinational corporations in Portugal are located in the Lisbon area. It is also the political centre of the country, as its seat of government and residence of the head of state.
Lisbon is one of the oldest cities in the world, and the second-oldest European capital city (after Athens), predating other modern European capitals by centuries. Julius Caesar made it a municipium called Felicitas Julia, adding to the name Olissipo. After the fall of the Roman Empire it was ruled by a series of Germanic tribes from the 5th century; later it was captured by the Moors in the 8th century. In 1147 Afonso Henriques conquered the city and since then it has been the political, economic and cultural centre of Portugal.",https://en.wikipedia.org/wiki/Lisbon
Qatar,171.0,Doha,"Doha (Arabic: الدوحة, romanized: ad-Dawḥa  or ad-Dōḥa) is the capital and most populous city of Qatar. It has a population of 2,382,000 (2018). The city is located on the coast of the Persian Gulf in the east of the country, north of Al Wakrah and south of Al Khor. It is Qatar's fastest growing city, with over 80% of the nation's population living in Doha or its surrounding suburbs. It is the political and economic center of the country.Doha was founded in the 1820s as an offshoot of Al Bidda. It was officially declared as the country's capital in 1971, when Qatar gained independence from being a British protectorate. As the commercial capital of Qatar and one of the emergent financial centers in the Middle East, Doha is considered a beta-level global city by the Globalization and World Cities Research Network. Doha accommodates Education City, an area devoted to research and education, and Hamad Medical City, an administrative area of medical care. It also includes Doha Sports City, or Aspire Zone, an international sports destination that includes Khalifa International Stadium, a stadium for the  2022 FIFA World Cup; Hamad Aquatic Centre; and the Aspire Dome.
The city was host to the first ministerial-level meeting of the Doha Development Round of World Trade Organization negotiations. It was also selected as host city of a number of sporting events, including the 2006 Asian Games, the 2011 Pan Arab Games and most of the games at the 2011 AFC Asian Cup. In December 2011, the World Petroleum Council held the 20th World Petroleum Conference in Doha. Additionally, the city hosted the 2012 UNFCCC Climate Negotiations and is set to host the 2022 FIFA World Cup.The city also hosted the 140th Inter-Parliamentary Union Assembly in April 2019.",https://en.wikipedia.org/wiki/Doha
Ireland,218.0,Dublin,"Dublin (; Irish: Baile Átha Cliath, pronounced  or ) is the capital and largest city of Ireland. Situated on a bay on the east coast, at the mouth of the River Liffey, it is in the province of Leinster and the Eastern and Midland Region. It is bordered on the south by the Dublin Mountains, a part of the Wicklow Mountains range. At the 2016 census, it had an urban area population of 1,173,179, while the population of the traditional County Dublin as a whole was 1,347,359. The population of the Greater Dublin Area was 1,904,806.There is archaeological debate regarding precisely where and when Dublin originated, with a settlement established by the Gaels during or before the 7th century CE, and a second, Viking, settlement, following. As the small Kingdom of Dublin, the city grew, and it became Ireland's principal settlement following the Norman invasion. The city expanded rapidly from the 17th century and was briefly the second largest city in the British Empire after the Acts of Union in 1800. Following independence in 1922, Dublin became the capital of the Irish Free State, later renamed Ireland in 1937.
Dublin is a contemporary and historical centre for Irish education, arts and culture, administration and industry. As of 2018 the city was listed by the Globalization and World Cities Research Network (GaWC) as a global city, with a ranking of ""Alpha minus"", which places it as one of the top thirty cities in the world.",https://en.wikipedia.org/wiki/Dublin
Republic of the Congo,157.0,Brazzaville,"Brazzaville (French pronunciation: ​, Kongo: Kintamo, Nkuna, Kintambo, Ntamo, Mavula, Tandala, Mfwa, Mfua, Mfoa; Teke: M'fa, Mfaa, Mfa) is the capital and largest city of the Republic of the Congo (Congo Republic). Constituting the financial and administrative centre of the country, it is located on the north side of the Congo River, opposite Kinshasa, the capital city of the Democratic Republic of the Congo (DR Congo). 
The population of the capital is estimated to exceed 1.8 million residents, comprising more than a third of the national populace. Some 40% are employed in non-agricultural professions. During World War II, Brazzaville was also the capital of Free France between 1940 and 1942.
In 2013, Brazzaville was designated a City of Music by UNESCO; since then it has also been a member of the Creative Cities Network.

",https://en.wikipedia.org/wiki/Brazzaville
Romania,221.0,Bucharest,"Bucharest (UK:  BOO-kə-REST, US:  -⁠rest; Romanian: București  (listen)) is the capital and largest city of Romania, as well as its cultural, industrial, and financial centre. It is located in the southeast of the country, on the banks of the Dâmbovița River, less than 60 km (37.3 mi) north of the Danube River and the Bulgarian border.
Bucharest was first mentioned in documents in 1459. It became the capital of Romania in 1862 and is the centre of Romanian media, culture, and art. Its architecture is a mix of historical (mostly Eclectic, but also Neoclassical and Art Nouveau), interbellum (Bauhaus, Art Deco and Romanian Revival architecture), communist era and modern. In the period between the two World Wars, the city's elegant architecture and the sophistication of its elite earned Bucharest the nickname of 'Paris of the East' (Romanian: Parisul Estului) or 'Little Paris' (Romanian: Micul Paris). Although buildings and districts in the historic city centre were heavily damaged or destroyed by war, earthquakes, and even Nicolae Ceaușescu's program of systematization, many survived and have been renovated. In recent years, the city has been experiencing an economic and cultural boom. It is one of the fastest-growing high-tech cities in Europe, according to the Financial Times, CBRE, TechCrunch, and others. UiPath, a global startup founded in Bucharest, has reached over $35 billion in valuation. Since 2019, Bucharest hosts the largest high tech summit in Southeast Europe (Romania Blockchain Summit).In 2016, the historical city centre was listed as 'endangered' by the World Monuments Watch. In 2017, Bucharest was the European city with the highest growth of tourists who stay over night, according to the Mastercard Global Index of Urban Destinations. As for the past two consecutive years, 2018 and 2019, Bucharest ranked as the European destination with the highest potential for development according to the same study.According to the 2011 census, 1,883,425 inhabitants live within the city limits. Adding the satellite towns around the urban area, the proposed metropolitan area of Bucharest would have a population of 2.27 million people. In 2020, the government used 2.5 million people as the basis for pandemic reports. Bucharest is the fourth largest city in the European Union by population within city limits, after Berlin, Madrid, and Rome, just ahead of Paris.
Economically, Bucharest is the most prosperous city in Romania. The city has a number of large convention facilities, educational institutes, cultural venues, traditional 'shopping arcades' and recreational areas.
The city proper is administratively known as the 'Municipality of Bucharest' (Municipiul București), and has the same administrative level as that of a national county, being further subdivided into six sectors, each governed by a local mayor.",https://en.wikipedia.org/wiki/Bucharest
