0,1,2,3,4,5,6,7,8
Poland,66,Battle of Grunwald,http://www.wikidata.org/entity/Q33570,wd:Q33570,26194781.0,1410 battle between the Teutonic Knights and Poland–Lithuania,"The Battle of Grunwald, Battle of Žalgiris, or First Battle of Tannenberg, was fought on 15 July 1410 during the Polish–Lithuanian–Teutonic War. The alliance of the Crown of the Kingdom of Poland and the Grand Duchy of Lithuania, led respectively by King Władysław II Jagiełło (Jogaila), and Grand Duke Vytautas, decisively defeated the German Teutonic Order, led by Grand Master Ulrich von Jungingen. Most of the Teutonic Order's leadership were killed or taken prisoner. 
Although defeated, the Teutonic Order withstood the subsequent siege of the Malbork Castle and suffered minimal territorial losses at the Peace of Thorn (1411), with other territorial disputes continuing until the Treaty of Melno in 1422. The order, however, never recovered their former power, and the financial burden of war reparations caused internal conflicts and an economic downturn in the lands controlled by them. The battle shifted the balance of power in Central and Eastern Europe and marked the rise of the Polish–Lithuanian union as the dominant regional political and military force.The battle was one of the largest in medieval Europe. The battle is viewed as one of the most important victories in the histories of Poland and Lithuania. It is also commemorated in Ukraine and Belarus. It has been used as a source of romantic legends and national pride, becoming a larger symbol of struggle against foreign invaders. During the 20th century, the battle was used in Nazi German and Soviet propaganda campaigns. Only in recent decades have historians moved towards a dispassionate, scholarly assessment of the battle, reconciling the previous narratives, which differed widely by nation.",https://en.wikipedia.org/wiki/Battle_of_Grunwald
Portugal,41,Battle of Guadalete,http://www.wikidata.org/entity/Q504172,wd:Q504172,163031.0,battle between the Visigothic Kingdom and the Umayyad Caliphate; decisive Umayyad victory leads to the fall of the Visigothic Kingdom and the Umayyad conquest of the peninsula,"The Battle of Guadalete was the first major battle of the Umayyad conquest of Hispania, fought in 711 at an unidentified location in what is now southern Spain between the Christian Visigoths under their king, Roderic, and the invading forces of the Muslim Umayyad Caliphate, composed mainly of Berbers and some Arabs under the commander Ṭāriq ibn Ziyad. The battle was significant as the culmination of a series of Berber attacks and the beginning of the Umayyad conquest of Hispania. Roderic was killed in the battle, along with many members of the Visigothic nobility, opening the way for the capture of the Visigothic capital of Toledo.",https://en.wikipedia.org/wiki/Battle_of_Guadalete
Qatar,16,Operation Praying Mantis,http://www.wikidata.org/entity/Q2026308,wd:Q2026308,797593.0,1988 U.S. naval offensive against Iran during the Iran-Iraq War,"Operation Praying Mantis was an attack on 18 April 1988 by the United States Armed Forces within Iranian territorial waters in retaliation for the Iranian naval mining of the Persian Gulf during the Iran–Iraq War and the subsequent damage to an American warship.
On 14 April, the guided missile frigate USS Samuel B. Roberts struck a mine while deployed in the Persian Gulf as part of Operation Earnest Will, the 1987–88 convoy missions in which U.S. warships escorted reflagged Kuwaiti oil tankers to protect them from Iranian attacks. The explosion blew a 4.5 m (15-foot) hole in the Samuel B. Roberts's hull and nearly sank it. The crew saved their ship with no loss of life, and the Samuel B. Roberts was towed to Dubai, United Arab Emirates on 16 April. After the mining, U.S. Navy Explosive Ordnance Disposal (EOD) divers recovered other mines in the area. When the serial numbers were found to match those of mines seized along with the Iran Ajr the previous September, U.S. military officials planned a retaliatory operation against Iranian targets in the Persian Gulf.
The attack by the U.S. helped pressure Iran to agree to a ceasefire with Iraq later that summer, ending the eight-year conflict between the Persian Gulf neighbors.On 6 November 2003, the International Court of Justice ruled that ""the actions of the United States of America against Iranian oil platforms on 19 October 1987 (Operation Nimble Archer) and 18 April 1988 (Operation Praying Mantis) cannot be justified as measures necessary to protect the essential security interests of the United States of America."" However, the International Court of Justice dismissed Iran's claim that the attack by the United States Navy was a breach of the 1955 Treaty of Amity between the two countries as it only pertained to vessels, not platforms.This battle was the largest of the five major U.S. naval surface engagements since the Second World War, which also include the Battle of Chumonchin Chan during the Korean War, the Gulf of Tonkin incident and the Battle of Dong Hoi during the Vietnam War, and the Action in the Gulf of Sidra in 1986. It also marked the U.S. Navy's first exchange of anti-ship missiles with opposing ships and the only occasion since World War II on which the US Navy sank a major surface combatant.

",https://en.wikipedia.org/wiki/Operation_Praying_Mantis
Republic of Ireland,50,Battle of the Atlantic,http://www.wikidata.org/entity/Q157627,wd:Q157627,57765.0,longest continuous military campaign in World War II,"The Battle of the Atlantic, the longest continuous military campaign in World War II, ran from 1939 to the defeat of Nazi Germany in 1945, covering a major part of the naval history of World War II. At its core was the Allied naval blockade of Germany, announced the day after the declaration of war, and Germany's subsequent counter-blockade. The campaign peaked from mid-1940 through to the end of 1943.
The Battle of the Atlantic pitted U-boats and other warships of the German Kriegsmarine (Navy) and aircraft of the Luftwaffe (Air Force) against the Royal Navy, Royal Canadian Navy, United States Navy, and Allied merchant shipping. Convoys, coming mainly from North America and predominantly going to the United Kingdom and the Soviet Union, were protected for the most part by the British and Canadian navies and air forces. These forces were aided by ships and aircraft of the United States beginning September 13, 1941. The Germans were joined by submarines of the Italian Regia Marina (Royal Navy) after Germany's Axis ally Italy entered the war on June 10, 1940.
As an island country, the United Kingdom was highly dependent on imported goods. Britain required more than a million tons of imported material per week in order to survive and fight. In essence, the Battle of the Atlantic involved a tonnage war; the Allied struggle to supply Britain, and the Axis attempt to stem the flow of merchant shipping that enabled Britain to keep fighting. Rationing in the United Kingdom was also used with the aim of reducing demand, by reducing wastage and increasing domestic production and equality of distribution. From 1942 onward, the Axis also sought to prevent the build-up of Allied supplies and equipment in the UK in preparation for the invasion of occupied Europe. The defeat of the U-boat threat was a prerequisite for pushing back the Axis in Western Europe. The outcome of the battle was a strategic victory for the Allies—the German blockade failed—but at great cost: 3,500 merchant ships and 175 warships were sunk in the Atlantic for the loss of 783 U-boats (the majority of them Type VII submarines) and 47 German surface warships, including 4 battleships (Bismarck,  Scharnhorst,  Gneisenau, and Tirpitz), 9 cruisers, 7 raiders, and 27 destroyers. Of the U-boats, 519 were sunk by British, Canadian, or other UK-based forces, 175 were destroyed by American forces, 15 were destroyed by the Soviets, and 73 were scuttled by their crews before the end of the war for various reasons. This front ended up being highly significant for the German war effort: Germany spent more money on producing naval vessels than it did every type of ground vehicle combined, including tanks.The Battle of the Atlantic has been called the ""longest, largest, and most complex"" naval battle in history. The campaign started immediately after the European War began, during the so-called ""Phoney War"", and lasted more than five years, until the German surrender in May 1945. It involved thousands of ships in more than 100 convoy battles and perhaps 1,000 single-ship encounters, in a theatre covering millions of square miles of ocean. The situation changed constantly, with one side or the other gaining advantage, as participating countries surrendered, joined and even changed sides in the war, and as new weapons, tactics, counter-measures and equipment were developed by both sides. The Allies gradually gained the upper hand, overcoming German surface-raiders by the end of 1942 and defeating the U-boats by mid-1943, though losses due to U-boats continued until the war's end. British Prime Minister Winston Churchill later wrote ""The only thing that really frightened me during the war was the U-boat peril. I was even more anxious about this battle than I had been about the glorious air fight called the 'Battle of Britain'.""",https://en.wikipedia.org/wiki/Battle_of_the_Atlantic
Romania,25,Battle of Karánsebes,http://www.wikidata.org/entity/Q2309898,wd:Q2309898,30059430.0,friendly fire incident during the Austro–Turkish War of 1787–1791,"The Battle of Karánsebes (Hungarian: Karánsebesi csata; German: Rückzug von Karánsebes; Romanian: Bătălia de la Caransebeș; Turkish: Şebeş Muharebesi) was a friendly fire incident in the Austrian army, supposedly occurring during the night of 21–22 September 1788, during the Austro-Turkish War of 1787–1791.

",https://en.wikipedia.org/wiki/Battle_of_Kar%C3%A1nsebes
Russia,105,Battle of Stalingrad,http://www.wikidata.org/entity/Q38789,wd:Q38789,4284.0,major battle of World War II,"The Battle of Stalingrad (German: Schlacht von Stalingrad [ˈʃlaxt fɔn ˈʃtaːlɪnˌgʁaːt]; Russian: Сталинградская битва, tr. Stalingradskaya bitva, IPA: [stəlʲɪnˈɡrat͡skəjə ˈbʲitvə]; 23 August 1942 – 2 February 1943) was a major battle on the Eastern Front of World War II where Nazi Germany and its allies unsuccessfully fought the Soviet Union for control of the city of Stalingrad (later renamed Volgograd) in Southern Russia. The battle was marked by fierce close-quarters combat and direct assaults on civilians in air raids, with the battle epitomizing urban warfare. The Battle of Stalingrad was the deadliest battle to take place during the Second World War. Today, the Battle of Stalingrad is universally regarded as the turning point in the European Theatre of war, as it forced the Oberkommando der Wehrmacht (German High Command) to withdraw considerable military forces from other areas in occupied Europe to replace German losses on the Eastern Front, ending with the rout of the six field armies of Army Group B, including the destruction of Nazi Germany's 6th Army and an entire corps of its 4th Panzer Army. The victory at Stalingrad energized the Red Army and shifted the balance of power in the favour of the Soviets.
Stalingrad was strategically important to both sides as a major industrial and transport hub on the Volga River. Whoever controlled Stalingrad would have access to the oil fields of the Caucasus and would gain control of the Volga. Germany, already operating on dwindling fuel supplies, focused its efforts on moving deeper into Soviet territory and taking the oil fields at any cost. On 4 August, the Germans launched an offensive by using the 6th Army and elements of the 4th Panzer Army. The attack was supported by intense Luftwaffe bombing that reduced much of the city to rubble. The battle degenerated into house-to-house fighting as both sides poured reinforcements into the city. By mid-November, the Germans, at great cost, had pushed the Soviet defenders back into narrow zones along the west bank of the river.
On 19 November, the Red Army launched Operation Uranus, a two-pronged attack targeting the Romanian armies protecting the 6th Army's flanks. The Axis flanks were overrun and the 6th Army was cut off and surrounded in the Stalingrad area. Adolf Hitler was determined to hold the city at all costs and forbade the 6th Army from attempting a breakout; instead, attempts were made to supply it by air and to break the encirclement from the outside. The Soviets were successful in denying the Germans the ability to resupply through the air which strained the German forces to their breaking point. Nevertheless, the German forces were determined to continue their advance and heavy fighting continued for another two months. On 2 February 1943, the German 6th Army, having exhausted their ammunition and food, finally capitulated after over five months of fighting, making it the first of Hitler's field armies to surrender during World War II.

",https://en.wikipedia.org/wiki/Battle_of_Stalingrad
Rwanda,1,Q97654681,http://www.wikidata.org/entity/Q97654681,wd:Q97654681,,,--,--
Saint Kitts and Nevis,50,Battle of the Atlantic,http://www.wikidata.org/entity/Q157627,wd:Q157627,57765.0,longest continuous military campaign in World War II,"The Battle of the Atlantic, the longest continuous military campaign in World War II, ran from 1939 to the defeat of Nazi Germany in 1945, covering a major part of the naval history of World War II. At its core was the Allied naval blockade of Germany, announced the day after the declaration of war, and Germany's subsequent counter-blockade. The campaign peaked from mid-1940 through to the end of 1943.
The Battle of the Atlantic pitted U-boats and other warships of the German Kriegsmarine (Navy) and aircraft of the Luftwaffe (Air Force) against the Royal Navy, Royal Canadian Navy, United States Navy, and Allied merchant shipping. Convoys, coming mainly from North America and predominantly going to the United Kingdom and the Soviet Union, were protected for the most part by the British and Canadian navies and air forces. These forces were aided by ships and aircraft of the United States beginning September 13, 1941. The Germans were joined by submarines of the Italian Regia Marina (Royal Navy) after Germany's Axis ally Italy entered the war on June 10, 1940.
As an island country, the United Kingdom was highly dependent on imported goods. Britain required more than a million tons of imported material per week in order to survive and fight. In essence, the Battle of the Atlantic involved a tonnage war; the Allied struggle to supply Britain, and the Axis attempt to stem the flow of merchant shipping that enabled Britain to keep fighting. Rationing in the United Kingdom was also used with the aim of reducing demand, by reducing wastage and increasing domestic production and equality of distribution. From 1942 onward, the Axis also sought to prevent the build-up of Allied supplies and equipment in the UK in preparation for the invasion of occupied Europe. The defeat of the U-boat threat was a prerequisite for pushing back the Axis in Western Europe. The outcome of the battle was a strategic victory for the Allies—the German blockade failed—but at great cost: 3,500 merchant ships and 175 warships were sunk in the Atlantic for the loss of 783 U-boats (the majority of them Type VII submarines) and 47 German surface warships, including 4 battleships (Bismarck,  Scharnhorst,  Gneisenau, and Tirpitz), 9 cruisers, 7 raiders, and 27 destroyers. Of the U-boats, 519 were sunk by British, Canadian, or other UK-based forces, 175 were destroyed by American forces, 15 were destroyed by the Soviets, and 73 were scuttled by their crews before the end of the war for various reasons. This front ended up being highly significant for the German war effort: Germany spent more money on producing naval vessels than it did every type of ground vehicle combined, including tanks.The Battle of the Atlantic has been called the ""longest, largest, and most complex"" naval battle in history. The campaign started immediately after the European War began, during the so-called ""Phoney War"", and lasted more than five years, until the German surrender in May 1945. It involved thousands of ships in more than 100 convoy battles and perhaps 1,000 single-ship encounters, in a theatre covering millions of square miles of ocean. The situation changed constantly, with one side or the other gaining advantage, as participating countries surrendered, joined and even changed sides in the war, and as new weapons, tactics, counter-measures and equipment were developed by both sides. The Allies gradually gained the upper hand, overcoming German surface-raiders by the end of 1942 and defeating the U-boats by mid-1943, though losses due to U-boats continued until the war's end. British Prime Minister Winston Churchill later wrote ""The only thing that really frightened me during the war was the U-boat peril. I was even more anxious about this battle than I had been about the glorious air fight called the 'Battle of Britain'.""",https://en.wikipedia.org/wiki/Battle_of_the_Atlantic
Saint Lucia,50,Battle of the Atlantic,http://www.wikidata.org/entity/Q157627,wd:Q157627,57765.0,longest continuous military campaign in World War II,"The Battle of the Atlantic, the longest continuous military campaign in World War II, ran from 1939 to the defeat of Nazi Germany in 1945, covering a major part of the naval history of World War II. At its core was the Allied naval blockade of Germany, announced the day after the declaration of war, and Germany's subsequent counter-blockade. The campaign peaked from mid-1940 through to the end of 1943.
The Battle of the Atlantic pitted U-boats and other warships of the German Kriegsmarine (Navy) and aircraft of the Luftwaffe (Air Force) against the Royal Navy, Royal Canadian Navy, United States Navy, and Allied merchant shipping. Convoys, coming mainly from North America and predominantly going to the United Kingdom and the Soviet Union, were protected for the most part by the British and Canadian navies and air forces. These forces were aided by ships and aircraft of the United States beginning September 13, 1941. The Germans were joined by submarines of the Italian Regia Marina (Royal Navy) after Germany's Axis ally Italy entered the war on June 10, 1940.
As an island country, the United Kingdom was highly dependent on imported goods. Britain required more than a million tons of imported material per week in order to survive and fight. In essence, the Battle of the Atlantic involved a tonnage war; the Allied struggle to supply Britain, and the Axis attempt to stem the flow of merchant shipping that enabled Britain to keep fighting. Rationing in the United Kingdom was also used with the aim of reducing demand, by reducing wastage and increasing domestic production and equality of distribution. From 1942 onward, the Axis also sought to prevent the build-up of Allied supplies and equipment in the UK in preparation for the invasion of occupied Europe. The defeat of the U-boat threat was a prerequisite for pushing back the Axis in Western Europe. The outcome of the battle was a strategic victory for the Allies—the German blockade failed—but at great cost: 3,500 merchant ships and 175 warships were sunk in the Atlantic for the loss of 783 U-boats (the majority of them Type VII submarines) and 47 German surface warships, including 4 battleships (Bismarck,  Scharnhorst,  Gneisenau, and Tirpitz), 9 cruisers, 7 raiders, and 27 destroyers. Of the U-boats, 519 were sunk by British, Canadian, or other UK-based forces, 175 were destroyed by American forces, 15 were destroyed by the Soviets, and 73 were scuttled by their crews before the end of the war for various reasons. This front ended up being highly significant for the German war effort: Germany spent more money on producing naval vessels than it did every type of ground vehicle combined, including tanks.The Battle of the Atlantic has been called the ""longest, largest, and most complex"" naval battle in history. The campaign started immediately after the European War began, during the so-called ""Phoney War"", and lasted more than five years, until the German surrender in May 1945. It involved thousands of ships in more than 100 convoy battles and perhaps 1,000 single-ship encounters, in a theatre covering millions of square miles of ocean. The situation changed constantly, with one side or the other gaining advantage, as participating countries surrendered, joined and even changed sides in the war, and as new weapons, tactics, counter-measures and equipment were developed by both sides. The Allies gradually gained the upper hand, overcoming German surface-raiders by the end of 1942 and defeating the U-boats by mid-1943, though losses due to U-boats continued until the war's end. British Prime Minister Winston Churchill later wrote ""The only thing that really frightened me during the war was the U-boat peril. I was even more anxious about this battle than I had been about the glorious air fight called the 'Battle of Britain'.""",https://en.wikipedia.org/wiki/Battle_of_the_Atlantic
Saint Vincent and the Grenadines,3,Capture of Saint Vincent,http://www.wikidata.org/entity/Q5037055,wd:Q5037055,28803747.0,Part of the American Revolutionary War,"The Capture of Saint Vincent was a French invasion that took place between 16 and 18 June 1779 during the American Revolutionary War. A French force commander named Charles-Marie de Trolong du Rumain landed on the island of Saint Vincent in the West Indies and quickly took over much of the British-controlled part of the island, assisted by local Black Caribs who held the northern part of the island.
British Governor Valentine Morris and military commander Lieutenant Colonel George Etherington disagreed on how to react and ended up surrendering without significant resistance. Both leaders were subjected to inquiries over the surrender. The period of French control began by capturing the island, which resulted in a solidified Black Carib control over northern parts of the island. The area remained under Carib control until the Second Carib War of 1795.",https://en.wikipedia.org/wiki/Capture_of_Saint_Vincent
Samoa,2,First Battle of Vailele,http://www.wikidata.org/entity/Q5452544,wd:Q5452544,,,--,--
San Marino,13,battle of San Marino,http://www.wikidata.org/entity/Q2280517,wd:Q2280517,24210681.0,WWII battle,"The Battle of San Marino was an engagement on 17–20 September 1944 during the Italian Campaign of the Second World War, in which German Army forces occupied the neutral Republic of San Marino, and were then attacked by Allied forces. It is also sometimes known as the Battle of Monte Pulito.
San Marino had declared its neutrality earlier in the war, and had remained broadly unaffected by events in Europe until 1943, when Allied forces had advanced a sizable distance up the Italian Peninsula. A major German defensive position, the Gothic Line, ran across the peninsula a short distance south of the Sammarinese border, and in late June, the country was bombed by the Royal Air Force, killing 35 people, in the belief that the German Army had taken up positions on its territory. In Operation Olive, launched in late August, a strong Allied force attacked at the very eastern end of the line, aiming to pass through Rimini—just east of San Marino—and break out onto the plains north of the city. Whilst San Marino was southwest of Rimini, the plan was for it to be bypassed entirely. In response to the Allied movements, the Germans sent a small force into San Marino to guard their lines of communication and act as artillery observers.

After a few days, the main thrust of the offensive was halted south of Rimini by strong resistance and severe weather, and the British and Indian flanking forces began to push westwards, taking the frontline towards San Marino. On 17 September the 4th Indian Infantry Division attacked forces of the 278. Infanterie-Division holding two hills just across the Sammarinese border; after heavy fighting to gain control of the hills, the situation stabilised on the 19th, and Allied forces began to push into the city of San Marino itself. The city was captured by the afternoon of 20 September, and the 4th Indian Division left the country on the 21st, leaving it under the control of the local defence forces.",https://en.wikipedia.org/wiki/Battle_of_San_Marino
