0,1,2,3,4
Dominica,3,Exile One,"Exile One is a cadence musical group founded by Gordon Henderson in the 1970s with musicians invited over from Dominica, to be based in Guadeloupe. The band was influential in the development of Caribbean music. It became famous throughout the Caribbean, Europe, Africa and the Indian Ocean. Exile One opened the way for numerous Cadence-Lypso artists as well as for Zouk.",https://en.wikipedia.org/wiki/Exile_One
Malawi,1,The Very Best,error,error
Albania,2,Thunder Way,"Thor: Love and Thunder is a 2022 American superhero film based on Marvel Comics featuring the character Thor. Produced by Marvel Studios and distributed by Walt Disney Studios Motion Pictures, it is the sequel to Thor: Ragnarok (2017) and the 29th film in the Marvel Cinematic Universe (MCU). The film was directed by Taika Waititi, who co-wrote the screenplay with Jennifer Kaytin Robinson, and stars Chris Hemsworth as Thor alongside Christian Bale, Tessa Thompson, Jaimie Alexander, Waititi, Russell Crowe, and Natalie Portman. In the film, Thor attempts to find inner peace, but must return to action and recruit Valkyrie (Thompson), Korg (Waititi), and Jane Foster (Portman)—who is now the Mighty Thor—to stop Gorr the God Butcher (Bale) from eliminating all gods.
Hemsworth and Waititi had discussed plans for a sequel to Ragnarok by January 2018. Love and Thunder was announced in July 2019, with Hemsworth, Waititi, and Thompson all set to return, as well as Portman who did not appear in Ragnarok. Waititi wanted to differentiate Love and Thunder from Ragnarok, seeking to make a romance film and 1980s-inspired adventure. He adapted elements from Jason Aaron's run on the Mighty Thor comic book, which sees Foster take on the mantle and powers of Thor whilst under treatment for cancer. Robinson joined to contribute to the script in February 2020, and further casting was revealed later that year including the appearance of the Guardians of the Galaxy. Production was expected to begin in late 2020 but was delayed by the COVID-19 pandemic. Filming ultimately began in January 2021 in Sydney, Australia with Barry Idoine as the director of photography, and concluded at the beginning of June. The post-production process included 4 editors and a score composed by Michael Giacchino and Nami Melumad, as well as visual effects provided by 23 companies. The film’s production budget of $250 million made it one of the most-expensive films ever made.
Thor: Love and Thunder premiered at the El Capitan Theatre in Hollywood on June 23, 2022, and was released in the United States on July 8, as part of Phase Four of the MCU. The film received praise for its light-hearted nature, and the performances of Hemsworth, Bale and Portman, while criticism was aimed at the screenplay, tonal inconsistency, visual effects, and Gorr's underdeveloped characterization; many critics deemed the film inferior to Ragnarok. Love and Thunder grossed over $760 million worldwide, making it the eighth-highest-grossing film of 2022.

",https://en.wikipedia.org/wiki/Thor:_Love_and_Thunder
Argentina,19,Suater,"The 2019–2020 northwestern Syria offensive, codenamed ""Dawn of Idlib 2,"" was a military operation launched by the armed forces of the Syrian Arab Republic, Russia, Iran, Hezbollah and other allied militias against Syrian opposition and allied fighters of the Syrian National Army, Hayat Tahrir al-Sham, Rouse the Believers Operations Room, the Turkistan Islamic Party, and other rebel and Salafi jihadist forces in Idlib and surrounding governorates during the Syrian civil war. The offensive began on 19 December 2019 and saw Russian-backed pro-Syrian government forces clash with Turkish-backed opposition groups along with leaving 980,000 civilians displaced.By February 2020, pro-government forces had encircled several Turkish observation posts that had been established throughout Idlib. On 27 February, after intermittent deadly clashes between Turkish and Syrian forces, Turkey formally intervened in the offensive and announced the beginning of Operation Spring Shield with the aim of pushing Syrian government forces back to pre-offensive frontlines.On 5 March 2020, a meeting took place between Turkish President Recep Tayyip Erdoğan and Russian President Vladimir Putin in which they agreed on a ceasefire beginning on 6 March that established a six-kilometer secure corridor along the M4 Highway. The ceasefire also called for joint Turkish–Russian patrols along the highway beginning on 15 March.",https://en.wikipedia.org/wiki/Northwestern_Syria_offensive_(December_2019%E2%80%93March_2020)
Syria,2,Arab Youth Philharmonic Orchestra,"The Arab Youth Philharmonic Orchestra is the first pan-Arab youth orchestra, created in 2006. It has so far given concerts in Syria and Germany. The major aim of the orchestra is to encourage pan-Arab cultural exchange and promote global cultural understanding while preparing the young musicians to their professional careers.",https://en.wikipedia.org/wiki/Arab_Youth_Philharmonic_Orchestra
Greece,28,Koza Mostra,"Koza Mostra is a Greek rock band founded by Ilias Kozas in 2011. It consists of Ilias Kozas (vocals, classical and electric guitar), Stelios Tsompanidis (drums, backing vocals), Tasos Korkovelos (keyboards, backing vocals), Dimitris Christonis (bass guitar), Tasos Gentzis (saxophone, backing vocals) and Petros Lagontzos (electric guitar, backing vocals). The band fuses ska, punk, and rock music together with the style of traditional Greek folk music such as Macedonian Greek music and rebetiko. They are also known for performing in kilts or fustanella.They represented Greece in the Eurovision Song Contest 2013 with Agathonas Iakovidis and the song ""Alcohol Is Free"", coming 6th in the final.Their maiden album Keep up the Rhythm, that was released on 2013, reached triple Platinum certification from Greek music industry authority IFPI.
In late 2017, they released their second album entitled Corrida.",https://en.wikipedia.org/wiki/Koza_Mostra
Eritrea,1,Eriam Sisters,The EriAm Sisters are an Eritrean American musical group consisting of three sisters.,https://en.wikipedia.org/wiki/EriAm_Sisters
Afghanistan,4,Kabul Dreams,"Kabul Dreams is a rock band from Afghanistan, established in 2008 in Kabul. The band consists of Sulyman Qardash (lead singer and guitarist), Siddique Ahmed (bassist) and Jai Dhar (drummer). The band is managed by Alykhan Kaba. Kabul Dreams has paved the way for a modest but growing rock scene in Afghanistan, rebuilding itself after decades of war. The band’s motivation to perform came from their own love for music, but also from a public hunger for a new life after war – a life that included new music and art.",https://en.wikipedia.org/wiki/Kabul_Dreams
Nepal,3,1974 AD,"1974 AD is a Nepali rock band, formed in Kathmandu, Nepal in the early 1990s. They experiment with various genres of music including Nepali folk, ragas, rock, funk, blues and jazz. 1974 AD are amongst the most successful recording artists in Nepal. Most of their albums are ranked amongst the top-ten best-selling albums according to Hits FM of Nepal. In 2000, their concert, 'Rock Yatra,' was watched by more than 60,000 people, the largest attendance for a concert in Nepal.Songs and albums produced by 1974 AD are usually in the Nepali language. Lyrics include themes of patriotism, Nepali virtues, unity, love and nationalism. There is a lot of variety in the music of 1974 AD. They have successfully tried various genres of music. Their songs, like ""Nepali,"" ""Sambodhan,"" ""Pahilo Junima,"" ""Parelima,"" ""Samjhi Baschu"" and ""Chudaina Timro Mayale"" and others, were some of the biggest hits in Nepalese music. The song ""Nepali Ho"" from their highest selling album Satabdi has been received as the most patriotic commercial song till date.",https://en.wikipedia.org/wiki/1974_AD
United Arab Emirates,2,Desert Heat,error,error
Trinidad & Tobago,2,Kes,error,error
Somalia,2,Dur-Dur,"""Dur dur d'être bébé !"", which was retitled ""Dur dur d'être bébé! (It's Hard to Be a Baby)"" for its American audience, is a 1992 song recorded by French singer Jordy Lemoine, credited as Jordy. The first single from his debut album, Pochette Surprise (1992), it was released in September 1992 and achieved success across the world, particularly in France. The single reached number one in Belgium, France, Hong Kong, Italy, Greece and Spain.",https://en.wikipedia.org/wiki/Dur_dur_d%27%C3%AAtre_b%C3%A9b%C3%A9_!
Zimbabwe,2,Four Brothers,"Four Brothers is a 2005 American action film directed by John Singleton. The film stars Mark Wahlberg, Tyrese Gibson, André Benjamin and Garrett Hedlund as four adopted brothers who set out to avenge the murder of their adoptive mother. The film was shot in Detroit, Michigan and the Greater Toronto Area. It has been described as blaxploitation-influenced. Released on August 12, 2005, the film received mixed reviews from critics and grossed $92 million worldwide.",https://en.wikipedia.org/wiki/Four_Brothers_(film)
Malaysia,7,M-girls,"M-Girls (simplified Chinese: 四个女生; traditional Chinese: 四個女生; pinyin: sì gè nǚ shēng; Jyutping: Sei3 Go3 Neoi5 Saang1; Pe̍h-ōe-jī: Sì-ê Lú-seng) is a Malaysian girl group consisting of Queenzy Cheng, Crystal Ong, Angeline Khoo, and Cass Chin. The group was formed in 2001.
Although M-Girls studio albums have been officially released in many different parts of the world, the group has been a longstanding victim to piracy and unlicensed, illegal distribution. As a result, the group's music company, Starmedia, decided to stop producing additional M-Girls albums in 2014. This announcement came out during the release of the Chinese New Year album ""True Happiness"" (真歡喜) in February 2014, weeks after the release of their EP, ""My Way"".In 2015, M-Girls released one last CNY album, 新春佳期 (New Spring Holiday), through Starmedia. Afterwards, the group later on decided to part ways with the music company and established their own company, MG Entertainment. This new company's first album release was entitled 年來了 (The New Year is Coming), which came out in 2016.As of 2017, the members of M-Girls are taking a break from working together as a group and would not be producing any albums together. Instead, everyone is currently pursuing solo projects and endeavors for the time being.",https://en.wikipedia.org/wiki/M-Girls
Botswana,5,Wrust,"Wrust is a death metal band from Gaborone, Botswana. The band was formed in 2000.",https://en.wikipedia.org/wiki/Wrust
Angola,5,Neblina,"Pico da Neblina (Portuguese pronunciation: [ˈpiku dɐ neˈblĩnɐ], literally translatable to Mist Peak) is the highest peak in Brazil, 2,995.3 metres (9,827 ft) above sea level, in the Serra da Neblina, part of the Serra do Imeri, a section of the Guiana Highlands on the Brazil-Venezuela border. As determined by a border survey expedition in 1962, its summit lies just within Brazilian territory, at a horizontal distance of only 687 m (2,254 ft) from the Venezuelan border at Pico 31 de Março. It's a common misconception to refer to this mountain as the highest point in South America outside the Andes while ignoring the Sierra Nevada de Santa Marta in Colombia.
As the peak's name suggests, it is shrouded in dense clouds most of the time. It was first ascended in 1965 by members of a Brazilian Army expedition.

",https://en.wikipedia.org/wiki/Pico_da_Neblina
Cape Verde,1,Finason,"Maria Inácia Gomes Correia (18 July 1925 – 4 February 2011) was a Cape Verdean traditional singer of finaçon. She began singing at age 17, and recorded three albums and multiple singles throughout her career, either as a solo artist or as part of a duo. Gomes also performed at festivals in Cape Verde and abroad. A book about her was published in 1985. Gomes was illiterate and could not write her own songs, which were improvised and recorded on Compact Discs.",https://en.wikipedia.org/wiki/N%C3%A1cia_Gomes
Paraguay,3,Revolber,"Revolber is an alternative rock/rap/funk/pop band from Paraguay, created in 1999. The band's first name was ""Revolver"" but the name had to be changed because of legal issues. They got the name from the Beatles album Revolver.",https://en.wikipedia.org/wiki/Revolber
Guinea-Bissau,6,Super Mama Djombo,"Super Mama Djombo is a band from Guinea Bissau who sing in Guinea-Bissau Creole. The band was formed in the mid-1960s, at a Boy Scout camp, when the members were only children (the youngest was six years old). Mama Djombo is the name of a spirit that many fighters appealed to for protection during Guinea-Bissau's War of Independence.In 1974, the politically conscious band leader Adriano Atchutchi joined. The group became immensely popular in the young country, which had gained its independence the same year. They would often play at President Luís Cabral's public speeches, and their concerts were broadcast live on radio.In 1978, the group traveled to Cuba and appeared on the eleventh youth music festival in Havana. Early in 1980, they went to Lisbon and recorded six hours of material. The first album Na cambança was released the same year, and the song Pamparida, which was based on a children's song, became a huge hit throughout West Africa. In 1980 Cabral was overthrown, and the new regime under João Bernardo Vieira no longer supported the band. They had fewer opportunities to perform, and broke up in 1986. However, the soundtrack to Flora Gomes' film Udju Azul di Yonta (The blue eyes of Yonta) (1993) was recorded by Adriano Atchutchi and other members of the original band under the name of Super Mama Djombo.In 2012, Super Mama Djombo toured Europe appearting at Afrika Festival Hertme. The band included several of the original members, drummer Zé Manel, guitarist Miguelinho N'Simba, percussionist Armando Vaz Pereira and Djon Motta, together with new members such as solo guitarist Fernando Correia from the band Freaky Sound. Although Adriano Atchutchi, the original lead composer and bandleader, is not part of the current line up, the military coup in April resulted in him having to leave his post as a provincial governor when the military took over the functions of the government, so he was able to attend rehearsals to help the band prepare for the tour. The band said they hoped the tour would ""show people that Guinea-Bissau's loudest sound is not that of gunfire, but that of music.""",https://en.wikipedia.org/wiki/Super_Mama_Djombo
Ethiopia,1,Walias Band,"Walias Band (sometimes spelled Wallias Band; Amharic: ዋሊያስ ባንድ) were an Ethiopian jazz and funk band active from the early 1970s until the early 1990s. Formed by members of the Venus Band, Walias backed up many prominent singers with a hard polyrhythmic funk sound influenced by western artists like King Curtis, Junior Walker and Maceo Parker. In 1977 they recorded one of the few albums of Ethiopian instrumental music in collaboration with vibraphonist Mulatu Astatke, whose role as a bandleader and composer was also a major influence on Ethiopian popular music.",https://en.wikipedia.org/wiki/Walias_Band
Qatar,1,Asgard Legionnaires,"The music of Qatar is based on sea folk poetry, song and dance.  Traditional dances in Doha are performed on Friday afternoons; one such dance is the Ardah, a stylized martial dance performed by two rows of dancers who are accompanied by an array of percussion instruments, including al-ras (a large drum whose leather is heated by an open fire), tambourines and cymbals with small drums. Other folk instruments include the oud and rebaba, both string instruments, as well as the ney.",https://en.wikipedia.org/wiki/Music_of_Qatar
Western Sahara,1,Tiris,error,error
Palestinian Territories,1,Turab,"Abū Turāb (Arabic: أبو تراب) or Father of Dust, is a title attributed to Ali ibn Abi Talib, the fourth Muslim
Caliph, who is seen by twelver Imamiyah Shia as the first of their 12 Imams. According to authentic narrations the title ""Abu Turab"" Kunya (Arabic) was given to Ali ibn Abi Talib by Prophet Muhammad, when he found Ali sleeping while covered with dust.
The narration is present in Sahih Muslim Vol. 1. 
Ali bin Abi Talib was sleeping in a Mosque (Masjid) and his clothing was covered with dust, then Prophet Muhammad entered the Mosque and saw Ali lying asleep, and the Prophet said twice, ""Get up, Abu Turab."" The title ""Abu Turab"" recalls this moment.
Abu Turab means ""Father of Soil/Dust"". There is a verse in Quran that says,' Indeed, We have warned you of a near punishment on the Day when a man will observe what his hands have put forth and the disbeliever will say, ""Oh, I wish that I were dust!"" 'According to Vaglieri this title might have been given to him by his enemies, and fictitious narrations have emerged in the following centuries to give this title an honorable appearance.The earliest non-islamic source where this nickname for ʿAli b. Abī Ṭālib appears is in George of Reshʿaina in 680 AD.",https://en.wikipedia.org/wiki/Abu_Turab
Czech Republic,29,Lake Malawi,"Lake Malawi, also known as Lake Nyasa in Tanzania and Lago Niassa in Mozambique, is an African Great Lake and the southernmost lake in the East African Rift system, located between Malawi, Mozambique and Tanzania.
It is the fifth largest fresh water lake in the world by volume, the ninth largest lake in the world by area—and the third largest and second deepest lake in Africa. Lake Malawi is home to more species of fish than any other lake in the world, including at least 700 species of cichlids. The Mozambique portion of the lake was officially declared a reserve by the Government of Mozambique on June 10, 2011, while in Malawi a portion of the lake is included in Lake Malawi National Park.Lake Malawi is a meromictic lake, meaning that its water layers do not mix. The permanent stratification of Lake Malawi's water and the oxic-anoxic boundary (relating to oxygen in the water) are maintained by moderately small chemical and thermal gradients.",https://en.wikipedia.org/wiki/Lake_Malawi
Burundi,1,Best Life Music,"The following list of best-selling music artists includes those music acts from the 20th century to the present with claims of 75 million or more record sales worldwide. This information cannot be listed officially, as there is no organization that has recorded global music sales.
The tables are listed with each artist's claimed sales figure(s) and their total independently certified units and are ranked in descending order by claimed sales. If two or more artists have the same claimed sales, they are then ranked by certified units. The claimed sales figure and the total of certified units (for each country) within the provided sources include sales of albums, singles, compilation-albums, music videos as well as downloads of singles and full-length albums. Sales figures, such as those from SoundScan, which are sometimes published by Billboard magazine, have not been included in the certified units column.

",https://en.wikipedia.org/wiki/List_of_best-selling_music_artists
Cyprus,22,Minus One,"In mathematics, −1 (negative one or minus one) is the additive inverse of 1, that is, the number that when added to 1 gives the additive identity element, 0. It is the negative integer greater than negative two (−2) and less than 0.

",https://en.wikipedia.org/wiki/%E2%88%921
Hungary,26,AWS,"Amazon Web Services, Inc. (AWS) is a subsidiary of Amazon that provides on-demand cloud computing platforms and APIs to individuals, companies, and governments, on a metered, pay-as-you-go basis. Often times, clients will use this in combination with autoscaling (a process that allows a client to use more compute in times of high application usage, and then scale down to reduce costs when there is less traffic). These cloud computing web services provide various services related to networking, compute, storage, middleware, IOT and other processing capacity, as well as software tools via AWS server farms.  This frees clients from managing, scaling, and patching hardware and operating systems. 
One of the foundational services is Amazon Elastic Compute Cloud (EC2), which allows users to have at their disposal a virtual cluster of computers, with extremely high availability, which can be interacted with over the internet via REST APIs, a CLI or the AWS console.  AWS's virtual computers emulate most of the attributes of a real computer, including hardware central processing units (CPUs) and graphics processing units (GPUs) for processing; local/RAM memory; hard-disk/SSD storage; a choice of operating systems; networking; and pre-loaded application software such as web servers, databases, and customer relationship management (CRM).
AWS services are delivered to customers via a network of AWS server farms located throughout the world. Fees are based on a combination of usage (known as a ""Pay-as-you-go"" model), hardware, operating system, software, or networking features chosen by the subscriber required availability, redundancy, security, and service options. Subscribers can pay for a single virtual AWS computer, a dedicated physical computer, or clusters of either. Amazon provides select portions of security for subscribers (e.g. physical security of the data centers) while other aspects of security are the responsibility of the subscriber (e.g. account management, vulnerability scanning, patching). AWS operates from many global geographical regions including seven in North America.Amazon markets AWS to subscribers as a way of obtaining large-scale computing capacity more quickly and cheaply than building an actual physical server farm. All services are billed based on usage, but each service measures usage in varying ways. As of 2021 Q4, AWS has 33% market share for cloud infrastructure while the next two competitors Microsoft Azure and Google Cloud have 21%, and 10% respectively, according to Synergy Group.

",https://en.wikipedia.org/wiki/Amazon_Web_Services
Malta,23,Firelight,"Firelight is a 1997 period romance film written and directed by William Nicholson and starring Sophie Marceau and Stephen Dillane. Written by William Nicholson, the film is about a woman who agrees to bear the child of an anonymous English landowner in return for payment to resolve her father's debts. When the child is born, the woman gives up the child as agreed. Seven years later, the woman is hired as a governess to a girl on a remote Sussex estate, whose father is the anonymous landowner. Filmed on location in Firle, England and Calvados, France, the film premiered at the Deauville American Film Festival on 14 September 1997. Firelight was Nicholson's first film as a director.",https://en.wikipedia.org/wiki/Firelight
Jordan,5,El Morabba3,"El Morabba3 (Arabic: المربّع meaning ""The Square"") is an Arabic rock band from Amman, Jordan, formed in 2009.",https://en.wikipedia.org/wiki/El_Morabba3
Greenland,6,Nanook,"In Inuit religion, Nanook (; Inuktitut: ᓇᓄᖅ [naˈnuq], lit. ""polar bear"") was the master of bears, meaning he decided if hunters deserved success in finding and hunting bears and punished violations of taboos. The word was popularized by Nanook of the North, the first feature-length documentary.The Inuit believed that Nanook, the polar bear, was powerful and mighty, and they thought that he was ""almost man."" The Inuit hunters would worship this great bear because they believed that he decided if the hunters would be successful. “In the past, the Inuit ate polar bear meat and used the fur to make warm trousers for men and kamiks (soft boots) for women”. Respect was given to Nanook by the hunter hanging the bear's hide in a special section of his igloo, where it would stay for several days. They would also offer the bear's spirit weapons and other hunting tools if it was a male, and needle cases, scrapers (used to scrape the fat off hides) and knives if it was female. “Native people believed that polar bears allowed themselves to be killed in order to obtain the souls of the tools (tatkoit), which they would take with them into the hereafter.” “Legend says that if a dead polar bear was treated properly by the hunter, it would share the good news with other bears so they would be eager to be killed by him. Bears would stay away from hunters who failed to pay respect.”

",https://en.wikipedia.org/wiki/Nanook
Benin,3,Helsinki-Cotonou Ensemble,"Helsinki-Cotonou Ensemble is a Finnish–Beninese afrobeat and funk band. Its leading lights are the Finnish guitarist Janne Halonen and the Beninese singer, percussionist and saxophonist Noël Saïzonou.",https://en.wikipedia.org/wiki/Helsinki-Cotonou_Ensemble
