0,1,2,3,4
Kyrgyzstan,170.0,Bishkek,"Bishkek (In Kyrgyz and Russian: Бишкек), IPA: ), formerly Pishpek and Frunze, is the capital and largest city of Kyrgyzstan. Bishkek is also the administrative centre of the Chüy Region. The region surrounds the city, although the city itself is not part of the region but rather a region-level unit of Kyrgyzstan. It is also near the Kazakhstan–Kyrgyzstan border. Its population was 1,074,075 in 2021.In 1825, the Khanate of Kokand established the fortress of ""Pishpek"" to control local caravan routes and to collect tribute from Kyrgyz tribes. On 4 September 1860, with the approval of the Kyrgyz, Russian forces led by Colonel Apollon Zimmermann destroyed the fortress. Nowadays the fortress ruins can be found little bit north from the Jibek jolu street, nearby the new main mosque. In 1868, a Russian settlement was established on the site of the fortress under its original name, ""Pishpek."" It lay within the General Governorship of Russian Turkestan and its Semirechye Oblast.
In 1925, the Kara-Kirghiz Autonomous Oblast was established in Russian Turkestan, promoting Pishpek to its capital. In 1926, the Communist Party of the Soviet Union renamed the city ""Frunze,"" after the Bolshevik military leader Mikhail Frunze (1885–1925), who was born there. In 1936, the city of Frunze became the capital of the Kirghiz Soviet Socialist Republic, during the final stages of national delimitation in the Soviet Union. In 1991, the Kyrgyz parliament changed the capital's name to ""Bishkek.""
Bishkek is situated at an altitude of about 800 metres (2,600 ft), just off the northern fringe of the Kyrgyz Ala-Too Range, an extension of the Tian Shan mountain range. These mountains rise to a height of 4,895 metres (16,060 ft). North of the city, a fertile and gently undulating steppe extends far north into neighbouring Kazakhstan. The river Chüy drains most of the area. Bishkek is connected to the Turkestan–Siberia Railway by a spur line.
Bishkek is a city of wide boulevards and marble-faced public buildings combined with numerous Soviet-style apartment blocks surrounding interior courtyards. There are also thousands of smaller, privately built houses, mostly outside the city centre. Streets follow a grid pattern, with most flanked on both sides by narrow irrigation channels, watering innumerable trees to provide shade in the hot summers.",https://en.wikipedia.org/wiki/Bishkek
Laos,159.0,Vientiane,"Vientiane ( vi-EN-ti-AHN, French: ; Lao: ວຽງຈັນ, Viangchan, pronounced ) is the capital and largest city of Laos. Vientiane is divided  administratively into 9 cities with a total area of only approx. 3,920 square kilometres and is located on the banks of the Mekong, close to the Thai border. Vientiane was the administrative capital during French rule and, due to economic growth in recent times, is now the economic center of Laos. The city had a population of 948,477 as of the 2020 Census.
Vientiane is noted as the home of the most significant national monuments in Laos – That Luang – which is a known symbol of Laos and an icon of Buddhism in Laos. Other significant Buddhist temples in Laos can be found there as well, such as Haw Phra Kaew, which formerly housed the Emerald Buddha.
The city hosted the 25th Southeast Asian Games in December 2009, celebrating 50 years of the Southeast Asian Games.

",https://en.wikipedia.org/wiki/Vientiane
Latvia,211.0,Riga,"Riga (; Latvian: Rīga  (listen), Livonian: Rīgõ, Russian: Рига) is the capital of Latvia and is home to 614,618 inhabitants (2021), which is a third of Latvia's population. Being significantly larger than other cities of Latvia, Riga is the country's primate city. It is also the largest city in the three Baltic states and is home to one tenth of the three Baltic states' combined population. The city lies on the Gulf of Riga at the mouth of the Daugava river where it meets the Baltic Sea. Riga's territory covers 307.17 km2 (118.60 sq mi) and lies 1–10 m (3 ft 3 in – 32 ft 10 in) above sea level, on a flat and sandy plain.Riga was founded in 1201 and is a former Hanseatic League member. Riga's historical centre is a UNESCO World Heritage Site, noted for its Art Nouveau/Jugendstil architecture and 19th century wooden architecture. Riga was the European Capital of Culture in 2014, along with Umeå in Sweden. Riga hosted the 2006 NATO Summit, the Eurovision Song Contest 2003, the 2006 IIHF Men's World Ice Hockey Championships, 2013 World Women's Curling Championship and the 2021 IIHF World Championship. It is home to the European Union's office of European Regulators for Electronic Communications (BEREC). In 2017, it was named the European Region of Gastronomy.
In 2016, Riga received over 1.4 million visitors. The city is served by Riga International Airport, the largest and busiest airport in the Baltic states. Riga is a member of Eurocities, the Union of the Baltic Cities (UBC) and Union of Capitals of the European Union (UCEU).",https://en.wikipedia.org/wiki/Riga
Lebanon,196.0,Beirut,"Beirut is the capital and largest city  of  Lebanon. As of 2014, Greater Beirut has a population of 2.4 million, which makes it the third-largest city in the Levant region. The city is situated on a peninsula at the midpoint of Lebanon's Mediterranean coast. Beirut has been inhabited for more than 5,000 years, and was one of Phoenicia's most prominent city states, making it one of the oldest cities in the world (see Berytus). The first historical mention of Beirut is found in the Amarna letters from the New Kingdom of Egypt, which date to the 14th century BC.
Beirut is Lebanon's seat of government and plays a central role in the Lebanese economy, with many banks and corporations based in the city. Beirut is an important seaport for the country and region, and rated a Beta + World City by the Globalization and World Cities Research Network. Beirut was severely damaged by the Lebanese Civil War and the massive explosion in the Port of Beirut. Its cultural landscape underwent major reconstruction.",https://en.wikipedia.org/wiki/Beirut
Lesotho,141.0,Maseru,"Maseru is the capital and largest city of Lesotho. It is also the capital of the Maseru District. Located on the Caledon River, Maseru lies directly on the Lesotho–South Africa border. Maseru had a population of 330,760 in the 2016 census. The city was established as a police camp and assigned as the capital after the country became a British protectorate in 1869. When the country achieved independence in 1966, Maseru retained its status as capital. The name of the city is a Sesotho word meaning ""red sandstones"".

",https://en.wikipedia.org/wiki/Maseru
Liberia,147.0,Monrovia,"Monrovia  is the capital city of the West African country of Liberia. Founded in 1822, it is located on Cape Mesurado on the Atlantic coast, and is the country's most populous city. As of the 2008 census, with 1,010,970 residents, it was home to 29% of Liberia’s total population. Monrovia is also the country’s economic, financial and cultural center. Its economy is primarily centered on its harbor and its role as the seat of Liberia's government.",https://en.wikipedia.org/wiki/Monrovia
Libya,171.0,Tripoli,"Tripoli (; Arabic: طرابلس, Ṭarābulus; Berber languages: ⵜⵔⵢⴱⵓⵍⵙ) is the capital and largest city of Libya, with a population of about 1.1 million people in 2019. It is located in the northwest of Libya on the edge of the desert, on a point of rocky land projecting into the Mediterranean Sea and forming a bay. It includes the port of Tripoli and the country's largest commercial and manufacturing center. It is also the site of the University of Tripoli. The vast Bab al-Azizia barracks, which includes the former family estate of Muammar Gaddafi, is also located in the city. Colonel Gaddafi largely ruled the country from his residence in this barracks.
Tripoli was founded in the 7th century BC by the Phoenicians, who gave it the Libyco-Berber name Oyat (Punic: 𐤅𐤉‬‬𐤏‬𐤕‬, Wyʿt) before passing into the hands of the Greek rulers of Cyrenaica as Oea (Greek: Ὀία, Oía). Due to the city's long history, there are many sites of archeological significance in Tripoli. Tripoli may also refer to the sha'biyah (top-level administrative division in the Libyan system), the Tripoli District.
In the Arab World, Tripoli is also known as Tripoli-of-the-West (Arabic: طرابلس الغرب Ṭarābulus al-Gharb), to distinguish it from its sister city Tripoli, Lebanon, known in Arabic as Ṭarābulus al-Sham (طرابلس الشام), meaning 'Levantine Tripoli'. It is affectionately called ""The Mermaid of the Mediterranean"" (عروسة البحر ʿArūsat al-Baḥr; lit: 'bride of the sea'), describing its turquoise waters and its whitewashed buildings. Tripoli is a Greek name that means 'Three Cities', introduced in Western European languages through the Italian Tripoli. In Arabic, it is called طرابلس, Ṭarābulus (pronunciation ; Libyan Arabic: Ṭrābləs, pronunciation ; Berber: Ṭrables, from Ancient Greek: Τρίπολις Trípolis, from Ancient Greek: Τρεις Πόλεις, romanized: Treis Póleis, lit. 'three cities').

",https://en.wikipedia.org/wiki/Tripoli
Liechtenstein,170.0,Vaduz,"Vaduz (; German pronunciation:  or , High Alemannic pronunciation: ) is the capital of Liechtenstein and also the seat of the national parliament. The city, which is located along the Rhine River, has 5,696 residents. The most prominent landmark of Vaduz is Vaduz Castle, being perched atop a steep hill in the middle of the city. It is home to the reigning prince of Liechtenstein and the Liechtenstein princely family. The city's distinctive architecture is also displayed in landmarks such as the Cathedral of St. Florin, Government House, City Hall, the National Art Gallery, as well as the National Museum. Although Vaduz is the best-known town in the principality internationally, it is not the largest; neighbouring Schaan has a larger population.",https://en.wikipedia.org/wiki/Vaduz
Lithuania,217.0,Vilnius,"Vilnius ( VIL-nee-əs, Lithuanian:  (listen); see also other names) is the capital and largest city of Lithuania, with a population of 592,389 as of 2022. The population of Vilnius's functional urban area, which stretches beyond the city limits, is estimated at 706,832 (as of 2019), while according to the Vilnius territorial health insurance fund, there were 732,421 permanent inhabitants as of October 2020 in Vilnius city and Vilnius district municipalities combined. Vilnius is in southeastern Lithuania and is the second-largest city in the Baltic states. It is the seat of Lithuania's national government and the Vilnius District Municipality.
Vilnius is classified as a Gamma global city according to GaWC studies, and is known for the architecture in its Old Town, declared a UNESCO World Heritage Site in 1994. Before World War II, Vilnius was one of the largest Jewish centres in Europe. Its Jewish influence has led to its nickname ""the Jerusalem of Lithuania"". Napoleon called it ""the Jerusalem of the North"" as he was passing through in 1812. In 2009, Vilnius was the European Capital of Culture, together with Linz, Austria. In 2021, Vilnius was named among top-25 fDi's Global Cities of the Future – one of the most forward-thinking cities with the greatest potential in the World.",https://en.wikipedia.org/wiki/Vilnius
Luxembourg,155.0,Luxembourg,"Luxembourg (Luxembourgish: Lëtzebuerg; French: Luxembourg; German: Luxemburg), also known as Luxembourg City (Luxembourgish: Stad Lëtzebuerg or d'Stad; French: Ville de Luxembourg; German: Stadt Luxemburg or Luxemburg-Stadt), is the capital city of the Grand Duchy of Luxembourg and the country's most populous commune. Standing at the confluence of the Alzette and Pétrusse rivers in southern Luxembourg, the city lies at the heart of Western Europe, situated 213 km (132 mi) by road from Brussels, 372 km (231 mi) from Paris, and 209 km (130 mi) from Cologne. The city contains Luxembourg Castle, established by the Franks in the Early Middle Ages, around which a settlement developed.
As of 31 December 2021, Luxembourg City has a population of 128,514 inhabitants, which is more than three times the population of the country's second most populous commune (Esch-sur-Alzette). The city's population consists of 160 nationalities. Foreigners represent 70% of the city's population, whilst Luxembourgers represent 30% of the population; the number of foreign-born residents in the city rises steadily each year.In 2022, Luxembourg was ranked as having the first-highest per capita GDP in the world at $137,950(PPP), with the city having developed into a banking and administrative centre. In the 2019 Mercer worldwide survey of 231 cities, Luxembourg was placed first for personal safety, while it was ranked 18th for quality of living.Luxembourg is one of the de facto capitals of the European Union (alongside Brussels, Frankfurt and Strasbourg), as it is the seat of several institutions, agencies and bodies, including the Court of Justice of the European Union, the European Court of Auditors, the Secretariat of the European Parliament, the European Public Prosecutor's Office, the European Investment Bank, the European Investment Fund, the European Stability Mechanism, as well as amongst other European Commission departments and services, Eurostat. The Council of the European Union meets in the city for three months annually.",https://en.wikipedia.org/wiki/Luxembourg_City
Madagascar,153.0,Antananarivo,"Antananarivo (French: Tananarive, pronounced ), also known by its colonial shorthand form Tana, is the capital and largest city of Madagascar. The administrative area of the city, known as Antananarivo-Renivohitra (""Antananarivo-Mother Hill"" or ""Antananarivo-Capital""), is the capital of Analamanga region. The city sits at 1,280 m (4,199 ft) above sea level in the center of the island, the highest national capital by elevation among the island countries. It has been the country's largest population center since at least the 18th century. The presidency, National Assembly, Senate and Supreme Court are located there, as are 21 diplomatic missions and the headquarters of many national and international businesses and NGOs. It has more universities, nightclubs, art venues, and medical services than any city on the island. Several national and local sports teams, including the championship-winning national rugby team, the Makis are based here.
Antananarivo was historically the capital of the Merina people, who continue to form the majority of the city's 1,275,207 (2018 Census) inhabitants. The surrounding urban areas have a total metropolitan population approaching three million. All eighteen Malagasy ethnic groups, as well as residents of Chinese, Indian, European and other origins, are represented in the city. It was founded circa 1610, when the Merina King Andrianjaka (1612–1630) expelled the Vazimba inhabitants of the village of Analamanga. Declaring it the site of his capital, Andrianjaka built a rova (fortified royal dwelling) that expanded to become the royal palaces of the Kingdom of Imerina. The city retained the name Analamanga until the reign of King Andriamasinavalona (1675–1710), who renamed it Antananarivo (""City of the Thousand"") in honor of Andrianjaka's soldiers.
The city served as the capital of the Kingdom of Imerina until 1710, when Imerina split into four warring quadrants. Antananarivo became the capital of the southern quadrant until 1794, when King Andrianampoinimerina of Ambohimanga captured the province and restored it as capital of a united Kingdom of Imerina, also bringing neighboring ethnic groups under Merina control. These conquests continued under his son, Radama I, who eventually controlled over two-thirds of the island, leading him to be considered the King of Madagascar by European diplomats. Antananarivo remained the island's capital after Madagascar was colonized by the French in 1897, and after independence in 1960.
The city is now managed by the Commune Urbaine d'Antananarivo (CUA) under the direction of its President of the Special Delegation, Ny Havana Andriamanjato, appointed in March 2014. Limited funds and mismanagement have hampered consecutive CUA efforts to manage overcrowding and traffic, waste management, pollution, security, public water and electricity, and other challenges linked to explosive population growth. Major historic landmarks and attractions in the city include the reconstructed royal palaces and the Andafiavaratra Palace, the tomb of Rainiharo, Tsimbazaza Zoo, Mahamasina Stadium, Lake Anosy, four 19th-century martyr churches, and the Museum of Art and Archaeology.",https://en.wikipedia.org/wiki/Antananarivo
Malawi,139.0,Lilongwe,"Lilongwe (UK: , US: , Chewa: ) is the capital and most populated city of the African country of Malawi. It has a population of 989,318 as of the 2018 Census, up from a population of 674,448 in 2008. In 2020 that figure was 1,122,000. The city is located in the central region of Malawi, in the district of the same name, near the borders with Mozambique and Zambia, and it is an important economic and transportation hub for central Malawi. It is named after the Lilongwe River.",https://en.wikipedia.org/wiki/Lilongwe
Malaysia,191.0,Kuala Lumpur,"Kuala Lumpur (Malaysian pronunciation: ), officially the Federal Territory of Kuala Lumpur (Malay: Wilayah Persekutuan Kuala Lumpur) and colloquially referred to as KL, is a federal territory and the capital city of Malaysia. It is the largest city in Malaysia, covering an area of 243 km2 (94 sq mi) with an estimated population of 1.73 million as of 2016. Greater Kuala Lumpur, also known as the Klang Valley, is an urban agglomeration of 7.564 million people as of 2018. It is among the fastest growing metropolitan regions in Southeast Asia, both in population and economic development.
The city serves as the cultural, financial, and economic centre of Malaysia. It is also home to the Parliament of Malaysia, and the Istana Negara, the official residence of the Yang di-Pertuan Agong (monarch of Malaysia). Kuala Lumpur first developed around 1857 as a town serving the tin mines of the region and served as the capital of Selangor from 1880 until 1978. Kuala Lumpur was the founding capital of the Federation of Malaya and its successor Malaysia, and the city remained the seat of the executive and judicial branches of the Malaysian federal government until these were relocated to Putrajaya in early 1999. However, some sections of the political bodies still remain in Kuala Lumpur.
Kuala Lumpur is one of the three federal territories of Malaysia, enclaved within the state of Selangor, on the central west coast of Peninsular Malaysia. Since the 1990s, the city has played host to many international sporting, political and cultural events including the 1998 Commonwealth Games and the 2017 Southeast Asian Games. Kuala Lumpur has undergone rapid development in recent decades and is home to the tallest twin buildings in the world, the Petronas Towers, which have since become an iconic symbol of Malaysian development.
It has a comprehensive road system supported by an extensive range of public transport networks, such as mass rapid transit (MRT), light rapid transit (LRT), monorail, commuter rail, public buses, hop on & hop off buses (free of charge) and airport rail links. Kuala Lumpur is one of the leading cities in the world for tourism and shopping, the 6th most-visited city in the world in 2019. The city houses three of the world's ten largest shopping malls.Kuala Lumpur ranks 70th in the world and second in Southeast Asia for Economist Intelligence Unit's Global Liveability Ranking and ninth in ASPAC and second in Southeast Asia for KPMG's Leading Technology Innovation Hub 2021. Kuala Lumpur was named World Book Capital 2020 by UNESCO.",https://en.wikipedia.org/wiki/Kuala_Lumpur
Maldives,143.0,Malé,"Malé (, locally ; Dhivehi: މާލެ) is the capital and most populous city of the Maldives. With a population of 252,768 and an area of 8.30 square kilometres (3.20 sq mi), it is also one of the most densely populated cities in the world. The city is geographically located at the southern edge of North Malé Atoll (Kaafu Atoll). Administratively, the city consists of a central island, an airport island, and four other islands governed by the Malé City Council.
Traditionally it was the King's Island, from where the ancient royal dynasties ruled and where the palace was located. The city was then called Mahal. Formerly it was a walled city surrounded by fortifications and gates (doroshi). The Royal Palace (Gan'duvaru) was destroyed along with the picturesque forts (koshi) and bastions (buruzu) when the city was remodelled under President Ibrahim Nasir's rule in the aftermath of the abolition of the monarchy in 1968. However, the Malé Friday Mosque remains. In recent years, the island has been considerably expanded through land-filling operations. Over the years, Malé has been the center of political protests and milestone events.",https://en.wikipedia.org/wiki/Mal%C3%A9
Mali,167.0,Bamako,"Bamako (Bambara: ߓߡߊ߬ߞߐ߬ Bàmakɔ̌, Fula: 𞤄𞤢𞤥𞤢𞤳𞤮 Bamako) is the capital and largest city of Mali, with a 2009 population of 1,810,366 and an estimated 2020 population of 2.71 million. It is located on the Niger River, near the rapids that divide the upper and middle Niger valleys in the southwestern part of the country. 
Bamako is the nation's administrative centre. The city proper is a cercle in its own right. Bamako's river port is located in nearby Koulikoro, along with a major regional trade and conference center. Bamako is the seventh-largest West African urban center after Lagos, Abidjan, Kano, Ibadan, Dakar, and Accra. Locally manufactured goods include textiles, processed meat, and metal goods as well as mining. Commercial fishing occurs on the Niger River.
The name Bamako (ߓߡߊ߬ߞߐ߬ Bàmakɔ̌ in Bambara) comes from the Bambara word meaning ""crocodile river"".",https://en.wikipedia.org/wiki/Bamako
Malta,162.0,Valletta,"Valletta (, Maltese: il-Belt Valletta, Maltese pronunciation: ) is the administrative unit and capital of Malta. Located on the main island, between Marsamxett Harbour to the west and the Grand Harbour to the east, its population within administrative limits in 2014 was 6,444. According to the data from 2020 by Eurostat, the Functional Urban Area and metropolitan region covered the whole island and has a population of 480 134. Valletta is the southernmost capital of Europe, and at just 0.61 square kilometres (0.24 sq mi), it is the European Union's smallest capital city.Valletta's 16th-century buildings were constructed by the Knights Hospitaller. The city was named after Jean Parisot de Valette, who succeeded in defending the island from an Ottoman invasion during the Great Siege of Malta. The city is Baroque in character, with elements of Mannerist, Neo-Classical and Modern architecture, though the Second World War left major scars on the city, particularly the destruction of the Royal Opera House. The city was officially recognised as a World Heritage Site by UNESCO in 1980. Today, with 320 monuments, is one of the most dense monuments areas in the world. Sometimes called an ""open-air museum"". Valletta was chosen the European Capital of Culture 2018. Valletta is also the sunniest city in Europe.The city is noted for its fortifications, consisting of bastions, curtains and cavaliers, along with the beauty of its Baroque palaces, gardens and churches.",https://en.wikipedia.org/wiki/Valletta
Marshall Islands,112.0,Majuro,"Majuro (; Marshallese: Mājro ) is the capital and largest city of the Marshall Islands. It is also a large coral atoll of 64 islands in the Pacific Ocean. It forms a legislative district of the Ratak (Sunrise) Chain of the Marshall Islands. The atoll has a land area of 9.7 square kilometres (3.7 sq mi) and encloses a lagoon of 295 square kilometres (114 sq mi). As with other atolls in the Marshall Islands, Majuro consists of narrow land masses. It has a tropical trade wind climate, with an average temperature of 27 °C (81 °F).
Majuro has been inhabited by humans for at least 2,000 years and was first settled by the Austronesian ancestors of the modern day Marshallese people. In 1885, the Marshall Islands were annexed by the German Empire and Majuro became their first and primary trading post. The city has also been under Japanese and American administration. After the Marshall Islands broke away from the Federated States of Micronesia in 1978 to form the Republic of the Marshall Islands, Majuro became the new country's capital and meeting place of the Nitijeļā, supplanting the former capital of Jaluit.
The main population center, Delap-Uliga-Djarrit (DUD), is made up of three contiguous motus and has a population of 20,301 people as of 2012. Majuro has a port, shopping district, and various hotels. Majuro has an international airport with scheduled international flights to Hawaii, Federated States of Micronesia, Kiribati, Guam, and Nauru, and flights to domestic destinations around the country. Its economy is primarily service sector dominated.",https://en.wikipedia.org/wiki/Majuro
