0,1,2,3,4,5,6,7,8
Iran,47,Muslim conquest of Persia,http://www.wikidata.org/entity/Q887684,wd:Q887684,1275748.0,historical event,"The Muslim conquest of Persia, also known as the Arab conquest of Iran, was carried out by the Rashidun Caliphate from 633 to 654 AD and led to the fall of the Sasanian Empire as well as the eventual decline of the Zoroastrian religion.
The rise of the Muslims in Arabia coincided with an unprecedented political, social, economic, and military weakness in Persia. Once a major world power, the Sasanian Empire had exhausted its human and material resources after decades of warfare against the Byzantine Empire. The Sasanian state's internal political situation quickly deteriorated after the execution of King Khosrow II in 628. Subsequently, ten new claimants were enthroned within the next four years. Following the Sasanian civil war of 628–632, the empire was no longer centralized.
Arab Muslims first attacked Sasanian territory in 633, when Khalid ibn al-Walid invaded Mesopotamia (then known as the Sasanian province of Asōristān; roughly corresponding to modern-day Iraq), which was the political and economic centre of the Sasanian state. Following the transfer of Khalid to the Byzantine front in the Levant, the Muslims eventually lost their holdings to Sasanian counterattacks. The second Muslim invasion began in 636, under Sa'd ibn Abi Waqqas, when a key victory at the Battle of al-Qadisiyyah led to the permanent end of Sasanian control west of modern-day Iran. For the next six years, the Zagros Mountains, a natural barrier, marked the border between the Rashidun Caliphate and the Sasanian Empire. In 642, Umar ibn al-Khattab, then-Caliph of the Muslims, ordered a full-scale invasion of Persia by the Rashidun army, which led to the complete conquest of the Sasanian Empire by 651. Directing from Medina, a few thousand kilometres away, Umar's quick conquest of Persia in a series of well-coordinated, multi-pronged attacks became his greatest triumph, contributing to his reputation as a great military and political strategist. In 644, prior to the complete annexation of Persia by the Arab Muslims, Umar was assassinated by Abu Lu'lu'a Firuz, a Persian craftsman who was captured in battle and brought to Arabia as a slave.
Some Iranian historians have defended their forebears using Arab sources to illustrate that ""contrary to the claims of some historians, Iranians, in fact, fought long and hard against the invading Arabs."" By 651, most of the urban centres in Iranian lands, with the notable exception of the Caspian provinces (Tabaristan and Transoxiana), had come under the domination of Arab Muslim forces. Many localities fought against the invaders; although Arabs had established hegemony over most of the country, many cities rose in rebellion by killing their Arab governors or attacking their garrisons. Eventually, Arab military reinforcements quashed the Iranian insurgencies and imposed complete Islamic control. The Islamization of Iran was gradual and incentivized in various ways over a period of centuries with some Iranians never converting and widespread cases of Zoroastrian scriptures being burnt and priests being executed, particularly in areas that experienced violent resistance. The Persians began to reassert themselves by maintaining the Persian language and Iranian culture. Islam became the dominant religion in Iran by the late Middle Ages.",https://en.wikipedia.org/wiki/Muslim_conquest_of_Persia
Iraq,59,Battle of Gaugamela,http://www.wikidata.org/entity/Q179670,wd:Q179670,241926.0,decisive battle of Alexander the Great's invasion of the Persian Achaemenid Empire,"The Battle of Gaugamela (; Ancient Greek: Γαυγάμηλα, romanized: Gaugámela), also called the Battle of Arbela (Ancient Greek: Ἄρβηλα, romanized: Árbela), took place in 331 BC between the forces of the Army of Macedon under Alexander the Great and the Persian Army under King Darius III. It was the second and final battle between the two kings, and is considered to be the final blow to the Achaemenid Empire, resulting in its complete conquest by Alexander.The fighting took place in Gaugamela, which literally meant ""The Camel's House"", a village on the banks of the river Bumodus. The area today would be considered modern-day Erbil, Iraq, according to Urbano Monti's world map. Alexander's army was heavily outnumbered and modern historians say that ""the odds were enough to give the most experienced veteran pause"". Despite the overwhelming odds, Alexander's army emerged victorious due to the employment of superior tactics and the clever usage of light infantry forces. It was a decisive victory for the League of Corinth, and it led to the fall of the Achaemenid Empire and of Darius III.",https://en.wikipedia.org/wiki/Battle_of_Gaugamela
Israel,58,Battle of Hattin,http://www.wikidata.org/entity/Q233568,wd:Q233568,194908.0,"Victory of Saladin against Crusader states, 1187","The Battle of Hattin took place on 4 July 1187, between the Crusader states of the Levant and the forces of the Ayyubid sultan Saladin. It is also known as the Battle of the Horns of Hattin, due to the shape of the nearby extinct volcano of that name.
The Muslim armies under Saladin captured or killed the vast majority of the Crusader forces, removing their capability to wage war. As a direct result of the battle, Muslims once again became the eminent military power in the Holy Land, re-capturing Jerusalem and most of the other Crusader-held cities and castles. These Christian defeats prompted the Third Crusade, which began two years after the Battle of Hattin.",https://en.wikipedia.org/wiki/Battle_of_Hattin
Italy,65,Battle of Actium,http://www.wikidata.org/entity/Q160387,wd:Q160387,5008.0,decisive confrontation of the Final War of the Roman Republic,"The Battle of Actium was a naval battle fought between a maritime fleet of Octavian led by Marcus Agrippa and the combined fleets of both Mark Antony and Cleopatra VII Philopator. The battle took place on 2 September 31 BC in the Ionian Sea, near the former Roman colony of Actium, Greece, and was the climax of over a decade of rivalry between Octavian and Antony. 
In early 31 BC, the year of the battle, Antony and Cleopatra were temporarily stationed in Greece. Mark Antony possessed 500 ships and 70,000 infantry, and made his camp at Actium, and Octavian, with 400 ships and 80,000 infantry, arrived from the north and occupied Patrae and Corinth, where he managed to cut Antony’s southward communications with Egypt (via the Peloponnese) with help from Marcus Agrippa. Octavian previously gained a preliminary victory in Greece, where his navy successfully ferried troops across the Adriatic Sea under the command of Marcus Agrippa. Octavian landed on mainland Greece, opposite of the island of Corcyra (modern Corfu) and proceeded south, on land. 
Trapped on both land and sea, portions of Antony's army deserted and fled to Octavian's side (daily), and Octavian's forces became comfortable enough to make preparations for battle. Antony's fleet sailed through the bay of Actium on the western coast of Greece, in a desperate attempt to break free of the naval blockade. It was there that Antony's fleet faced the much larger fleet of smaller, more manoeuvrable ships under commanders Gaius Sosius and Agrippa. Antony and his remaining forces were spared only due to a last-ditch effort by Cleopatra's fleet that had been waiting nearby. Octavian pursued them and defeated their forces in Alexandria on 1 August 30 BC—after which Antony and Cleopatra committed suicide. 
Octavian's victory enabled him to consolidate his power over Rome and its dominions. He adopted the title of Princeps (""first citizen""), and in 27 BC was awarded the title of Augustus (""revered"") by the Roman Senate. This became the name by which he was known in later times. As Augustus, he retained the trappings of a restored Republican leader, but historians generally view his consolidation of power and the adoption of these honorifics as the end of the Roman Republic and the beginning of the Roman Empire.",https://en.wikipedia.org/wiki/Battle_of_Actium
Ivory Coast,10,Battle of Guinea,http://www.wikidata.org/entity/Q3772937,wd:Q3772937,29653746.0,battle between a Portuguese fleet and a Castilian fleet in the context of the War of the Castilian Succession,"The Battle of Guinea took place on the Gulf of Guinea, in western Africa, 1478, between a Portuguese fleet and a Castilian fleet in the context of the War of the Castilian Succession.
The outcome of the battle of Guinea was decisive for Portugal, continuing its dominance of the Atlantic Ocean, and reaching a very favourable sharing of the Atlantic and territories disputed with Castile in the Peace of Alcáçovas (1479). All with the exception of the Canary Islands stayed under Portuguese control: Guinea, Cape Verde, Madeira, Azores and the exclusive right of conquering the Kingdom of Fez. Portugal also won exclusive rights over the lands discovered or that were to be discovered south of the Canary Islands.",https://en.wikipedia.org/wiki/Battle_of_Guinea
Jamaica,50,Battle of the Atlantic,http://www.wikidata.org/entity/Q157627,wd:Q157627,57765.0,longest continuous military campaign in World War II,"The Battle of the Atlantic, the longest continuous military campaign in World War II, ran from 1939 to the defeat of Nazi Germany in 1945, covering a major part of the naval history of World War II. At its core was the Allied naval blockade of Germany, announced the day after the declaration of war, and Germany's subsequent counter-blockade. The campaign peaked from mid-1940 through to the end of 1943.
The Battle of the Atlantic pitted U-boats and other warships of the German Kriegsmarine (Navy) and aircraft of the Luftwaffe (Air Force) against the Royal Navy, Royal Canadian Navy, United States Navy, and Allied merchant shipping. Convoys, coming mainly from North America and predominantly going to the United Kingdom and the Soviet Union, were protected for the most part by the British and Canadian navies and air forces. These forces were aided by ships and aircraft of the United States beginning September 13, 1941. The Germans were joined by submarines of the Italian Regia Marina (Royal Navy) after Germany's Axis ally Italy entered the war on June 10, 1940.
As an island country, the United Kingdom was highly dependent on imported goods. Britain required more than a million tons of imported material per week in order to survive and fight. In essence, the Battle of the Atlantic involved a tonnage war; the Allied struggle to supply Britain, and the Axis attempt to stem the flow of merchant shipping that enabled Britain to keep fighting. Rationing in the United Kingdom was also used with the aim of reducing demand, by reducing wastage and increasing domestic production and equality of distribution. From 1942 onward, the Axis also sought to prevent the build-up of Allied supplies and equipment in the UK in preparation for the invasion of occupied Europe. The defeat of the U-boat threat was a prerequisite for pushing back the Axis in Western Europe. The outcome of the battle was a strategic victory for the Allies—the German blockade failed—but at great cost: 3,500 merchant ships and 175 warships were sunk in the Atlantic for the loss of 783 U-boats (the majority of them Type VII submarines) and 47 German surface warships, including 4 battleships (Bismarck,  Scharnhorst,  Gneisenau, and Tirpitz), 9 cruisers, 7 raiders, and 27 destroyers. Of the U-boats, 519 were sunk by British, Canadian, or other UK-based forces, 175 were destroyed by American forces, 15 were destroyed by the Soviets, and 73 were scuttled by their crews before the end of the war for various reasons. This front ended up being highly significant for the German war effort: Germany spent more money on producing naval vessels than it did every type of ground vehicle combined, including tanks.The Battle of the Atlantic has been called the ""longest, largest, and most complex"" naval battle in history. The campaign started immediately after the European War began, during the so-called ""Phoney War"", and lasted more than five years, until the German surrender in May 1945. It involved thousands of ships in more than 100 convoy battles and perhaps 1,000 single-ship encounters, in a theatre covering millions of square miles of ocean. The situation changed constantly, with one side or the other gaining advantage, as participating countries surrendered, joined and even changed sides in the war, and as new weapons, tactics, counter-measures and equipment were developed by both sides. The Allies gradually gained the upper hand, overcoming German surface-raiders by the end of 1942 and defeating the U-boats by mid-1943, though losses due to U-boats continued until the war's end. British Prime Minister Winston Churchill later wrote ""The only thing that really frightened me during the war was the U-boat peril. I was even more anxious about this battle than I had been about the glorious air fight called the 'Battle of Britain'.""",https://en.wikipedia.org/wiki/Battle_of_the_Atlantic
Japan,62,Battle of Iwo Jima,http://www.wikidata.org/entity/Q180182,wd:Q180182,60027.0,major battle in which US Forces captured the island of Iwo Jima from Japan during World War II,"The Battle of Iwo Jima (19 February – 26 March 1945) was a major battle in which the United States Marine Corps (USMC) and United States Navy (USN) landed on and eventually captured the island of Iwo Jima from the Imperial Japanese Army (IJA) during World War II. The American invasion, designated Operation Detachment, had the purpose of capturing the island with its two airfields: South Field and Central Field.
The Japanese Army positions on the island were heavily fortified, with a dense network of bunkers, hidden artillery positions, and 18 km (11 mi) of tunnels. The American ground forces were supported by extensive naval artillery and had complete air supremacy provided by U.S. Navy and Marine Corps aviators throughout the battle. The five-week battle saw some of the fiercest and bloodiest fighting of the Pacific War.
The Japanese combat deaths numbered three times the number of American deaths, but uniquely among Pacific War Marine battles, the American total casualties (dead and wounded) exceeded those of the Japanese. Of the 21,000 Japanese soldiers on Iwo Jima at the beginning of the battle, only 216 were taken prisoner, some of whom were captured only because they had been knocked unconscious or otherwise disabled. Most of the remainder were killed in action, but it has been estimated that as many as 3,000 continued to resist within the various cave systems for many days afterwards until they eventually succumbed to their injuries or surrendered weeks later. Despite the fighting and severe casualties on both sides, the American victory was assured from the start. Overwhelming American superiority in numbers and arms, air supremacy, the impossibility of Japanese retreat or reinforcement, and sparse food and supplies for the Japanese, permitted no plausible circumstance in which the Japanese could have won the battle.The action was controversial, with retired Chief of Naval Operations William V. Pratt stating that the island was useless to the Army as a staging base, and useless to the Navy as a fleet base. The Japanese continued to have early-warning radar from Rota island, which was never invaded, and Iwo Jima's captured air field was barely used. Experiences with previous Pacific island battles suggested that the island would be well-defended and thus casualties would be significant. Joe Rosenthal's Associated Press photograph of the raising of the U.S. flag at the top of the 169 m (554 ft) Mount Suribachi by five U.S. Marines and one Navy corpsman became a famous image of the battle and the American war effort in the Pacific.",https://en.wikipedia.org/wiki/Battle_of_Iwo_Jima
Jordan,55,Battle of Yarmouk,http://www.wikidata.org/entity/Q194226,wd:Q194226,266811.0,battle of the Arab–Byzantine wars,"The Battle of the Yarmuk (also spelled Yarmouk) was a major battle between the army of the Byzantine Empire and the Muslim forces of the Rashidun Caliphate. The battle consisted of a series of engagements that lasted for six days in August 636, near the Yarmouk River, along what are now the borders of Syria–Jordan and Syria-Israel, southeast of the Sea of Galilee. The result of the battle was a complete Muslim victory that ended Byzantine rule in Syria. The Battle of the Yarmuk is regarded as one of the most decisive battles in military history, and it marked the first great wave of early Muslim conquests after the death of the Islamic prophet Muhammad, heralding the rapid advance of Islam into the then-Christian Levant.
To check the Arab advance and to recover lost territory, Emperor Heraclius had sent a massive expedition to the Levant in May 636. As the Byzantine army approached, the Arabs tactically withdrew from Syria and regrouped all their forces at the Yarmuk plains close to the Arabian Peninsula, where they were reinforced, and defeated the numerically superior Byzantine army. The battle is widely regarded to be Khalid ibn al-Walid's greatest military victory and cemented his reputation as one of the greatest tacticians and cavalry commanders in history.",https://en.wikipedia.org/wiki/Battle_of_the_Yarmuk
Kazakhstan,46,Battle of Talas,http://www.wikidata.org/entity/Q492415,wd:Q492415,458455.0,751 battle between the Abbasid Caliphate and the Chinese Tang dynasty,"The Battle of Talas or Battle of Artlakh (Chinese: 怛羅斯戰役; pinyin: Dáluósī Zhànyì; Arabic: معركة نهر طلاس, romanized: Maʿrakat nahr Ṭalās, Persian: نبرد طراز Nabard-i Tarāz) was a military encounter and engagement between the Abbasid Caliphate along with its ally, the Tibetan Empire, against the Chinese Tang dynasty. In July 751 AD, Tang and Abbasid forces met in the valley of the Talas River to vie for control over the Syr Darya region of central Asia. According to Chinese sources, after several days of stalemate, the Karluk Turks, originally allied to the Tang dynasty, defected to the Abbasid Army and tipped the balance of power, resulting in a Tang rout.
The defeat marked the end of the Tang westward expansion and resulted in Islamic control of Transoxiana for the next 400 years. However, direct Muslim Arab control ended in 821 when power shifted to the Tahirid dynasty. Then the Turkic Ghaznavids took power in 977. Islamic control ended in 1124 when the non-Muslim Qara Khitai conquered Transoxania. Control of the region was economically beneficial for the Abbasid Arabs because it was on the Silk Road. Chinese prisoners captured in the aftermath of the battle are said to have brought paper-making technology to West Asia.",https://en.wikipedia.org/wiki/Battle_of_Talas
Kenya,4,Battle of Kanjaga,http://www.wikidata.org/entity/Q98408957,wd:Q98408957,64959910.0,Battle between Babatu and Ameria,The Battle of Kanjaga was a battle in Africa that was fought between Babatu and the people of Kanjaga. The battle was claimed to have taken place on 14 March 1897. Babatu and his warriors were defeated by the unified forces of Ameria and the French.,https://en.wikipedia.org/wiki/Battle_of_Kanjaga
Kiribati,33,Battle of Tarawa,http://www.wikidata.org/entity/Q250309,wd:Q250309,778138.0,"battle in the Pacific Theater of World War II, at the Tarawa Atoll in the Gilbert Islands","The Battle of Tarawa was fought on 20–23 November 1943 between the United States and Japan at the Tarawa Atoll in the Gilbert Islands, and was part of Operation Galvanic, the U.S. invasion of the Gilberts. Nearly 6,400 Japanese, Koreans, and Americans died in the fighting, mostly on and around the small island of Betio, in the extreme southwest of Tarawa Atoll.The Battle of Tarawa was the first American offensive in the critical central Pacific region. It was also the first time in the Pacific War that the United States had faced serious Japanese opposition to an amphibious landing. Previous landings met little or no initial resistance, but on Tarawa the 4,500 Japanese defenders were well-supplied and well-prepared, and they fought almost to the last man, exacting a heavy toll on the United States Marine Corps. The losses on Tarawa were incurred within 76 hours.",https://en.wikipedia.org/wiki/Battle_of_Tarawa
Kosovo,59,Battle of Kosovo,http://www.wikidata.org/entity/Q179288,wd:Q179288,159361.0,battle on 28th June 1389,"The Battle of Kosovo (Turkish: Kosova Savaşı; Serbian: Косовска битка) took place on 15 June 1389 between an army led by the Serbian Prince Lazar Hrebeljanović and an invading army of the Ottoman Empire under the command of Sultan Murad Hüdavendigâr. The battle was fought on the Kosovo field in the territory ruled by Serbian nobleman Vuk Branković, in what is today Kosovo, about 5 kilometers (3.1 mi) northwest of the modern city of Pristina. The army under Prince Lazar consisted of his own troops, a contingent led by Branković, and a contingent sent from Bosnia by King Tvrtko I, commanded by Vlatko Vuković. Prince Lazar was the ruler of Moravian Serbia and the most powerful among the Serbian regional lords of the time, while Branković ruled the District of Branković and other areas, recognizing Lazar as his overlord.
Reliable historical accounts of the battle are scarce. The bulk of both armies were wiped out, and Lazar and Murad were killed. However, Serbian manpower was depleted and had no capacity to field large armies against future Ottoman campaigns, which relied on new reserve forces from Anatolia. Consequently, the Serbian principalities that were not already Ottoman vassals, became so in the following years.",https://en.wikipedia.org/wiki/Battle_of_Kosovo
Kuwait,37,Invasion of Kuwait,http://www.wikidata.org/entity/Q856650,wd:Q856650,2035563.0,major conflict between the Ba'athist Iraq and the State of Kuwait,"The Iraqi invasion of Kuwait was an operation conducted by Iraq on 2 August 1990, whereby it invaded the neighboring State of Kuwait, consequently resulting in a seven-month-long Iraqi military occupation of the country. The invasion and Iraq's subsequent refusal to withdraw from Kuwait by a deadline mandated by the United Nations led to a direct military intervention by a United Nations-authorized coalition of forces led by the United States. These events came to be known as the first Gulf War, eventually resulting in the forced expulsion of Iraqi troops from Kuwait and the Iraqis setting 600 Kuwaiti oil wells on fire during their retreat, as a scorched earth strategy.
A variety of speculations have been made regarding the true intents behind the Iraqi move, including Iraq's inability to pay Kuwait more than US$14 billion that it had borrowed from Kuwait to finance the Iran–Iraq War, and Kuwait's surge in petroleum production levels which kept revenues down for Iraq. Throughout much of the 1980s, Kuwait's oil production was above its mandatory OPEC quota, which kept the oil prices down.  Iraq interpreted Kuwait's refusal to decrease its oil production as an act of aggression. In early 1990, Iraq accused Kuwait of stealing Iraqi petroleum through cross-border slant drilling, although some Iraqi sources indicated that Saddam Hussein's decision to attack Kuwait was already made a few months before the actual invasion. The invasion started on 2 August 1990, and within two days, most of the Kuwaiti military was either overrun by the Iraqi Republican Guard or retreated to neighboring Saudi Arabia and Bahrain. Immediately following the invasion, Iraq set up a puppet government known as the ""Republic of Kuwait"" to rule over Kuwait, eventually annexing it outright, when Saddam Hussein announced a few days later that it was the 19th province of Iraq.

",https://en.wikipedia.org/wiki/Iraqi_invasion_of_Kuwait
Kyrgyzstan,46,Battle of Talas,http://www.wikidata.org/entity/Q492415,wd:Q492415,458455.0,751 battle between the Abbasid Caliphate and the Chinese Tang dynasty,"The Battle of Talas or Battle of Artlakh (Chinese: 怛羅斯戰役; pinyin: Dáluósī Zhànyì; Arabic: معركة نهر طلاس, romanized: Maʿrakat nahr Ṭalās, Persian: نبرد طراز Nabard-i Tarāz) was a military encounter and engagement between the Abbasid Caliphate along with its ally, the Tibetan Empire, against the Chinese Tang dynasty. In July 751 AD, Tang and Abbasid forces met in the valley of the Talas River to vie for control over the Syr Darya region of central Asia. According to Chinese sources, after several days of stalemate, the Karluk Turks, originally allied to the Tang dynasty, defected to the Abbasid Army and tipped the balance of power, resulting in a Tang rout.
The defeat marked the end of the Tang westward expansion and resulted in Islamic control of Transoxiana for the next 400 years. However, direct Muslim Arab control ended in 821 when power shifted to the Tahirid dynasty. Then the Turkic Ghaznavids took power in 977. Islamic control ended in 1124 when the non-Muslim Qara Khitai conquered Transoxania. Control of the region was economically beneficial for the Abbasid Arabs because it was on the Silk Road. Chinese prisoners captured in the aftermath of the battle are said to have brought paper-making technology to West Asia.",https://en.wikipedia.org/wiki/Battle_of_Talas
