0,1,2,3,4,5,6,7,8
People's Republic of China,289,Confucius,http://www.wikidata.org/entity/Q4604,wd:Q4604,5823.0,"Chinese teacher, politician, and philosopher (551 – 479 BCE)","Confucius ( kən-FEW-shəs; Chinese: 孔夫子; pinyin: Kǒng Fūzǐ, ""Master Kǒng""; or commonly 孔子; Kǒngzǐ; c. 551 – c. 479 BCE) was a Chinese philosopher and politician of the Spring and Autumn period who is traditionally considered the paragon of Chinese sages. Confucius's teachings and philosophy underpin East Asian culture and society, remaining influential across China and East Asia to this day.Confucius considered himself a transmitter for the values of earlier periods which he claimed had been abandoned in his time. His philosophical teachings, called Confucianism, emphasized personal and governmental morality, correctness of social relationships, justice, kindness, and sincerity. His followers competed with many other schools during the Hundred Schools of Thought era, only to be suppressed in favor of the Legalists during the Qin dynasty. After the collapse of Qin and the victory of Han over Chu, Confucius's thoughts received official sanction in the new government. During the Tang and Song dynasties, Confucianism developed into a system known in the West as Neo-Confucianism, and later as New Confucianism. Confucianism was part of the Chinese social fabric and way of life; to Confucians, everyday life was the arena of religion.Confucius is traditionally credited with having authored or edited many of the Chinese classic texts, including all of the Five Classics, but modern scholars are cautious of attributing specific assertions to Confucius himself. Aphorisms concerning his teachings were compiled in the Analects, but only many years after his death.
Confucius's principles have commonality with Chinese tradition and belief. With filial piety, he championed strong family loyalty, ancestor veneration, and respect of elders by their children and of husbands by their wives, recommending family as a basis for ideal government. He espoused the Golden Rule, ""Do not do unto others what you do not want done to yourself"".

",https://en.wikipedia.org/wiki/Confucius
Peru,48,Inca Garcilaso de la Vega,http://www.wikidata.org/entity/Q334711,wd:Q334711,1263827.0,Spanish chronicler (1539-1616),"Inca Garcilaso de la Vega (12 April 1539 – 23 April 1616), born Gómez Suárez de Figueroa and known as El Inca, was a chronicler and writer born in the Viceroyalty of Peru. Sailing to Spain at 21, he was educated informally there, where he lived and worked the rest of his life. The natural son of a Spanish conquistador and an Inca noblewoman born in the early years of the conquest, he is known primarily for his chronicles of Inca history, culture, and society. His work was widely read in Europe, influential and well received. It was the first literature by an author born in the Americas to enter the western canon.After his father's death in 1559, Vega moved to Spain in 1561, seeking official acknowledgement as his father's son. His paternal uncle became a protector, and he lived in Spain for the rest of his life, where he wrote his histories of the Inca culture and Spanish conquest, as well as an account of De Soto's expedition in Florida.",https://en.wikipedia.org/wiki/Inca_Garcilaso_de_la_Vega
Philippines,25,Aileen Baviera,http://www.wikidata.org/entity/Q88181154,wd:Q88181154,63441101.0,Filipino sinologist,"Aileen San Pablo-Baviera (August 26, 1959 – March 21, 2020) was a Filipino political scientist and sinologist. She was one of the leading China experts in her country.

",https://en.wikipedia.org/wiki/Aileen_Baviera
Poland,161,Arthur Schopenhauer,http://www.wikidata.org/entity/Q38193,wd:Q38193,700.0,German philosopher (1788–1860),"Arthur Schopenhauer ( SHOH-pən-how-ər, German: [ˈaɐtʊɐ ˈʃoːpm̩haʊɐ] (listen); 22 February 1788 – 21 September 1860) was a German philosopher. He is best known for his 1818 work The World as Will and Representation (expanded in 1844), which characterizes the phenomenal world as the product of a blind noumenal will. Building on the transcendental idealism of Immanuel Kant (1724–1804), Schopenhauer developed an atheistic metaphysical and ethical system that rejected the contemporaneous ideas of German idealism. He was among the first thinkers in Western philosophy to share and affirm significant tenets of Indian philosophy, such as asceticism, denial of the self, and the notion of the world-as-appearance. His work has been described as an exemplary manifestation of philosophical pessimism.Though his work failed to garner substantial attention during his lifetime, Schopenhauer had a posthumous impact across various disciplines, including philosophy, literature, and science. His writing on aesthetics, morality, and psychology have influenced many thinkers and artists. Those who have cited his influence include philosophers Emil Cioran, Friedrich Nietzsche and Ludwig Wittgenstein, scientists Erwin Schrödinger and Albert Einstein, psychoanalysts Sigmund Freud and Carl Jung, writers Leo Tolstoy, Herman Melville, Thomas Mann, Hermann Hesse, Machado de Assis, Jorge Luis Borges, Marcel Proust and Samuel Beckett, and composers Richard Wagner, Johannes Brahms, Arnold Schoenberg and Gustav Mahler.

",https://en.wikipedia.org/wiki/Arthur_Schopenhauer
Portugal,50,Orosius,http://www.wikidata.org/entity/Q311456,wd:Q311456,79575.0,Roman historian and theologian (c.375/385 – c.420 AD),"Paulus Orosius (; born c. 375/385 – c. 420 AD), less often Paul Orosius in English, was a Roman priest, historian and theologian, and a student of Augustine of Hippo. It is possible that he was born in Bracara Augusta (now Braga, Portugal), then capital of the Roman province of Gallaecia, which would have been the capital of the Kingdom of the Suebi by his death. Although there are some questions regarding his biography, such as his exact date of birth, it is known that he was a person of some prestige from a cultural point of view, as he had contact with the greatest figures of his time such as Augustine of Hippo and Jerome of Stridon. In order to meet with them Orosius travelled to cities on the southern coast of the Mediterranean Sea, such as Hippo Regius, Alexandria, and Jerusalem.
These journeys defined his life and intellectual output. Orosius did not just discuss theological matters with Augustine; he also collaborated with him on the book City of God. In addition, in 415 he was chosen to travel to Palestine in order to exchange information with other intellectuals. He was also able to participate in a Church Council meeting in Jerusalem on the same trip and he was entrusted with transporting the relics of Saint Stephen. The date of his death is also unclear, although it appears to have not been earlier than 418, when he finished one of his books, or later than 423.He wrote a total of three books, of which his most important is his Seven Books of History Against the Pagans (Latin: Historiarum Adversum Paganos Libri VII), considered to be one of the books with the greatest impact on historiography during the period between antiquity and the Middle Ages, as well as being one of the most important Hispanic books of all time. Part of its importance comes from the fact that the author shows his historiographical methodology. The book is a historical narration focusing on the pagan peoples from the earliest time up until the time Orosius was alive.Orosius was a highly influential figure both for the dissemination of information (History Against the Pagans was one of the main sources of information regarding Antiquity that was used up to the Renaissance) and for rationalising the study of history (his methodology greatly influenced later historians).",https://en.wikipedia.org/wiki/Orosius
Qatar,51,Yusuf al-Qaradawi,http://www.wikidata.org/entity/Q64129,wd:Q64129,457803.0,"Egyptian Islamic theologian based in Doha, Qatar","Yusuf al-Qaradawi (Arabic: يوسف القرضاوي, romanized: Yūsuf al-Qaraḍāwī; or Yusuf al-Qardawi; 9 September 1926 – 26 September 2022) was an Egyptian Islamic scholar based in Doha, Qatar, and chairman of the International Union of Muslim Scholars. His influences included Ibn Taymiyya, Ibn Qayyim, Sayyid Rashid Rida, Hassan al-Banna, Abul Hasan Ali Hasani Nadwi, Abul A'la Maududi and Naeem Siddiqui. He was best known for his programme الشريعة والحياة, al-Sharīʿa wa al-Ḥayāh (""Sharia and Life""), broadcast on Al Jazeera, which had an estimated audience of 40–60 million worldwide. He was also known for IslamOnline, a website he helped to found in 1997 and for which he served as chief religious scholar.
Al-Qaradawi published more than 120 books, including The Lawful and the Prohibited in Islam and Islam: The Future Civilization. He also received eight international prizes for his contributions to Islamic scholarship, and was considered one of the most influential Islamic scholars living. Al-Qaradawi had a prominent role within the intellectual leadership of the Muslim Brotherhood, an Egyptian political organization, although he repeatedly stated that he was no longer a member and twice (in 1976 and 2004) turned down offers for the official role in the organization.Al-Qaradawi was sometimes described as a ""moderate Islamist"". Some of his views, such as his condoning of Palestinian suicide bombings against Israelis, caused reactions from governments in the West: he was refused an entry visa to the United Kingdom in 2008, and barred from entering France in 2012.",https://en.wikipedia.org/wiki/Yusuf_al-Qaradawi
Republic of Ireland,114,Edmund Burke,http://www.wikidata.org/entity/Q165792,wd:Q165792,10030.0,"Anglo-Irish statesman, political theorist and conservative philosopher (1729–1797)","Edmund Burke (; 12 January [NS] 1729 – 9 July 1797) was an Anglo-Irish statesman, economist, and philosopher. Born in Dublin, Burke served as a member of Parliament (MP) between 1766 and 1794 in the House of Commons of Great Britain with the Whig Party.
Burke was a proponent of underpinning virtues with manners in society and of the importance of religious institutions for the moral stability and good of the state. These views were expressed in his A Vindication of Natural Society. He criticised the actions of the British government towards the American colonies, including its taxation policies. Burke also supported the rights of the colonists to resist metropolitan authority, although he opposed the attempt to achieve independence. He is remembered for his support for Catholic emancipation, the impeachment of Warren Hastings from the East India Company, and his staunch opposition to the French Revolution.
In his Reflections on the Revolution in France, Burke asserted that the revolution was destroying the fabric of good society and traditional institutions of state and society and condemned the persecution of the Catholic Church that resulted from it. This led to his becoming the leading figure within the conservative faction of the Whig Party which he dubbed the Old Whigs as opposed to the pro–French Revolution New Whigs led by Charles James Fox.In the 19th century, Burke was praised by both conservatives and liberals. Subsequently, in the 20th century, he became widely regarded, especially in the United States, as the philosophical founder of conservatism.

",https://en.wikipedia.org/wiki/Edmund_Burke
Republic of the Congo,8,Théophile Obenga,http://www.wikidata.org/entity/Q3526683,wd:Q3526683,6146818.0,Congolese academic and politician,"Théophile Obenga (born 1936 in the Republic of the Congo) is professor emeritus in the Africana Studies Center at San Francisco State University. He is a politically active proponent of Pan-Africanism and an Afrocentrist. Obenga is an Egyptologist, linguist, and historian.

",https://en.wikipedia.org/wiki/Th%C3%A9ophile_Obenga
Romania,78,Emil Cioran,http://www.wikidata.org/entity/Q193405,wd:Q193405,251240.0,Romanian-French philosopher and essayist,"Emil Mihai Cioran (Romanian: [eˈmil tʃoˈran] (listen), French: [emil sjɔʁɑ̃]; 8 April 1911 – 20 June 1995) was a Romanian  philosopher, aphorist and essayist, who published works in both Romanian and French. His work has been noted for its pervasive philosophical pessimism, style, and aphorisms. His works frequently engaged with issues of suffering, decay, and nihilism. In 1937, Cioran moved to the Latin Quarter of Paris, which became his permanent residence, wherein he lived in seclusion with his partner, Simone Boué, until his death in 1995.

",https://en.wikipedia.org/wiki/Emil_Cioran
Russia,112,Peter Kropotkin,http://www.wikidata.org/entity/Q5752,wd:Q5752,51074.0,Russian revolutionary socialist and philosopher (1842–1921),"Pyotr Alexeyevich Kropotkin (; Russian: Пётр Алексе́евич Кропо́ткин Russian pronunciation: [ˈpʲɵtr ɐlʲɪkˈsʲejɪvʲɪt͡ɕ krɐˈpotkʲɪn]; 9 December 1842 – 8 February 1921) was a Russian anarchist, socialist, revolutionary, historian, scientist, philosopher, and activist who advocated anarcho-communism.
Born into an aristocratic land-owning family, Kropotkin attended a military school and later served as an officer in Siberia, where he participated in several geological expeditions. He was imprisoned for his activism in 1874 and managed to escape two years later. He spent the next 41 years in exile in Switzerland, France (where he was imprisoned for almost four years) and England. While in exile, he gave lectures and published widely on anarchism and geography. Kropotkin returned to Russia after the Russian Revolution in 1917, but he was disappointed by the Bolshevik state.
Kropotkin was a proponent of a decentralised communist society free from central government and based on voluntary associations of self-governing communities and worker-run enterprises. He wrote many books, pamphlets and articles, the most prominent being The Conquest of Bread and Fields, Factories, and Workshops, but also Mutual Aid: A Factor of Evolution, his principal scientific offering. He contributed the article on anarchism to the Encyclopædia Britannica Eleventh Edition and left unfinished a work on anarchist ethical philosophy.

",https://en.wikipedia.org/wiki/Peter_Kropotkin
Rwanda,10,Esther Mujawayo,http://www.wikidata.org/entity/Q1370094,wd:Q1370094,46510983.0,Rwandan sociologist and psychotherapist,"Esther Mujawayo (born 1958) is a Rwandan sociologist and psychotherapist. She survived the Rwanda genocide against the Tutsi in 1994, but lost many members of her family. She is the author of several books. In 1994, she founded the Association of Widows of the Rwandan Genocide. She gained a Graduate Diploma in Psychology from the University of East Anglia in 1997.",https://en.wikipedia.org/wiki/Esther_Mujawayo
Saudi Arabia,64,Malik ibn Anas,http://www.wikidata.org/entity/Q312299,wd:Q312299,272081.0,"Arab Islamic jurist, theologian and hadith traditionist (711–795)","Malik ibn Anas  (Arabic: مَالِك بن أَنَس, ‎ 711–795 CE / 93–179 AH), whose full name is Mālik bin Anas bin Mālik bin Abī ʿĀmir bin ʿAmr bin Al-Ḥārith bin Ghaymān bin Khuthayn bin ʿAmr bin Al-Ḥārith al-Aṣbaḥī al-Ḥumyarī al-Madanī (Arabic: مَالِك بِن أَنَس بِن مَالِك بن أَبِي عَامِر بِن عَمْرو بِن ٱلْحَارِث بِن غَيْمَان بِن خُثَين بِن عَمْرو بِن ٱلْحَارِث ٱلْأَصْبَحِي ٱلْحُمَيْرِي ٱلْمَدَنِي), reverently known as al-Imām Mālik (Arabic: ٱلْإِمَام مَالِك) by Sunni Muslims, was an Arab Muslim jurist, theologian, and hadith traditionist. Born in the city of Medina, Malik rose to become the premier scholar of prophetic traditions in his day, which he sought to apply to ""the whole legal life"" in order to create a systematic method of Muslim jurisprudence which would only further expand with the passage of time. Referred to as the ""Imam of Medina"" by his contemporaries, Malik's views in matters of jurisprudence were highly cherished both in his own life and afterwards, and he became the founder of one of the four schools of Sunni law, the Maliki, which became the normative rite for the Sunni practice of much of North Africa, Al-Andalus (until expulsion of Muslims), a vast portion of Egypt, and some parts of Syria, Yemen, Sudan, Iraq, and Khorasan, and the prominent Sufi orders, including the Shadiliyya and the Tijaniyyah.Perhaps Malik's most famous accomplishment in the annals of Islamic history is, however, his compilation of the Muwatta, one of the oldest and most revered Sunni hadith collections and one of ""the earliest surviving Muslim law-book[s],"" in which Malik attempted to ""give a survey of law and justice; ritual and practice of religion according to the consensus of Islam in Medina, according to the sunna usual in Medina; and to create a theoretical standard for matters which were not settled from the point of view of consensus and sunna."" Composed in the early days of the Abbasid caliphate, during which time there was a burgeoning ""recognition and appreciation of the canon law"" of the ruling party, Malik's work aimed to trace out a ""smoothed path"" (which is what al-muwaṭṭaʾ literally means) through ""the farreaching differences of opinion even on the most elementary questions."" Hailed as ""the soundest book on earth after the Quran"" by al-Shafi'i, the compilation of the Muwatta led to Malik being bestowed with such reverential epithets as ""Shaykh of Islam"", ""Proof of the Community"", ""Imam of the Abode of Emigration"", and ""Knowledgeable Scholar of Medina"" in later Sunni tradition.

According to classical Sunni tradition, the Islamic prophet Muhammad foretold the birth of Malik, saying: ""Very soon will people beat the flanks of camels in search of knowledge and they shall find no one more expert than the knowledgeable scholar of Medina,"" and, in another tradition, ""The people ... shall set forth from East and West without finding a sage other than the sage of the people in Medina."" While some later scholars, such as Ibn Hazm and Tahawi, did cast doubt on identifying the mysterious wise man of both these traditions with Malik, the most widespread interpretation nevertheless continued to be that which held the personage to be Malik. Throughout Islamic history, Malik has been venerated as an exemplary figure in all the traditional schools of Sunni thought, both by the exoteric ulema and by the mystics, with the latter often designating him as a saint in their hagiographies. Malik's most notable student, Al-Shafi'i (who would himself become the founder of another of the four orthodox legal schools of Sunni law) later said of his teacher: ""No one constitutes as great a favor to me in the Religion of God as Malik ... when the scholars of knowledge are mentioned, Malik is the guiding star.""",https://en.wikipedia.org/wiki/Malik_ibn_Anas
Senegal,11,Tidiane N'Diaye,http://www.wikidata.org/entity/Q1799961,wd:Q1799961,27483575.0,"Franco-Senegalese anthropologist, economist and writer","Tidiane N'Diaye (born 20 August 1950) is a Franco-Senegalese anthropologist, economist, and writer.
He is the author of a number of publications on the history of Black Africa and the African diaspora, as well as numerous economic studies of the Institut national de la statistique et des études économiques on the French overseas departments (Guadeloupe, French Guiana, Martinique).
N'Diaye's essays on the Arab slave trade (Le génocide voilé ""the veiled genocide"", Étude de la traite négrière arabo-musulmane ""study of the Arab-Muslim negro slave trade"") were nominated for the Prix Renaudot in 2008.",https://en.wikipedia.org/wiki/Tidiane_N%27Diaye
Serbia,63,Vuk Karadžić,http://www.wikidata.org/entity/Q202815,wd:Q202815,229247.0,Serbian philologist and linguist,"Vuk Stefanović Karadžić (Serbian Cyrillic: Вук Стефановић Караџић, pronounced [ʋûːk stefǎːnoʋitɕ kâradʒitɕ]; 6 November 1787 (26 October OS) – 7 February 1864) was a Serbian philologist, anthropologist and linguist. He was one of the most important reformers of the modern Serbian language. For his collection and preservation of Serbian folktales, Encyclopædia Britannica labelled him ""the father of Serbian folk-literature scholarship."" He was also the author of the first Serbian dictionary in the new reformed language. In addition, he translated the New Testament into the reformed form of the Serbian spelling and language.He was well known abroad and familiar to Jacob Grimm, Johann Wolfgang von Goethe and historian Leopold von Ranke. Karadžić was the primary source for Ranke's Die serbische Revolution (""The Serbian Revolution""), written in 1829.",https://en.wikipedia.org/wiki/Vuk_Karad%C5%BEi%C4%87
Sierra Leone,7,Samuel Johnson,http://www.wikidata.org/entity/Q7411859,wd:Q7411859,2720197.0,Nigerian historian,The Rev. Samuel Johnson (24 June 1846 – 29 April 1901) was an Anglican priest and historian of the Yoruba.,https://en.wikipedia.org/wiki/Samuel_Johnson_(Nigerian_historian)
Singapore,11,Lam Lay Yong,http://www.wikidata.org/entity/Q435599,wd:Q435599,26926721.0,mathematician,"Lam Lay Yong (maiden name Oon Lay Yong, Chinese: 蓝丽蓉; pinyin: Lán Lìróng; born 1936) is a retired Professor of Mathematics. 

",https://en.wikipedia.org/wiki/Lam_Lay_Yong
Slovakia,50,Ľudovít Štúr,http://www.wikidata.org/entity/Q315222,wd:Q315222,348170.0,"Slovak poet, philosopher, linguist, publicist, politician and writer (1815-1856)","Ľudovít Velislav Štúr (Slovak pronunciation: [ˈʎudɔʋiːt ˈʂtuːr]; Hungarian: Stur Lajos; 28 October 1815 – 12 January 1856), known in his era as Ludevít Štúr, (pen names : B. Dunajský, Bedlivý Ludorob, Boleslav Záhorský, Brat Slovenska, Ein Slave, Ein ungarischer Slave, Karl Wildburn, Pravolub Rokošan, Slovák, Starí, Velislav, and Zpěvomil) was a Slovak revolutionary politician, and writer. As a leader of the Slovak national revival in the 19th century, and the author of the Slovak language standard, he is lauded as one of the most important figures in Slovak history.
Štúr was an organizer of the Slovak volunteer campaigns during the Hungarian Revolution of 1848. He was also a politician, poet, journalist, publisher, teacher, philosopher, linguist and member of the Hungarian Parliament.",https://en.wikipedia.org/wiki/%C4%BDudov%C3%ADt_%C5%A0t%C3%BAr
Slovenia,92,Slavoj Žižek,http://www.wikidata.org/entity/Q184750,wd:Q184750,166969.0,Slovene philosopher,"Slavoj Žižek ( (listen) SLAH-voy ZHEE-zhek, Slovene: [ˈslaʋɔj ˈʒiʒɛk]; born 21 March 1949) is a Slovenian philosopher, cultural theorist and public intellectual. He is international director of the Birkbeck Institute for the Humanities at the University of London, visiting professor at New York University and a senior researcher at the University of Ljubljana's Department of Philosophy. He primarily works on continental philosophy (particularly Hegelianism, psychoanalysis and Marxism) and political theory, as well as film criticism and theology.
Žižek is the most famous associate of the Ljubljana School of Psychoanalysis, a group of Slovenian academics working on German Idealism, Lacanian psychoanalysis, ideology critique, and media criticism. His breakthrough work was 1989's The Sublime Object of Ideology, his first book in English, which was decisive in the introduction of the Ljubljana School's thought to English-speaking audiences. He has written over 50 books in multiple languages. The idiosyncratic style of his public appearances, frequent magazine op-eds, and academic works, characterised by use of obscene jokes and pop cultural examples, as well as politically incorrect provocations, have gained him fame, controversy and criticism both in and outside academia.In 2012, Foreign Policy listed Žižek on its list of Top 100 Global Thinkers, calling him ""a celebrity philosopher"", while elsewhere he has been dubbed the ""Elvis of cultural theory"" and ""the most dangerous philosopher in the West"". Žižek has been called ""the leading Hegelian of our time"", and ""the foremost exponent of Lacanian theory"". A journal, the International Journal of Žižek Studies, was founded by professors David J. Gunkel and Paul A. Taylor to engage with his work.

",https://en.wikipedia.org/wiki/Slavoj_%C5%BDi%C5%BEek
South Africa,29,Robert Broom,http://www.wikidata.org/entity/Q359576,wd:Q359576,39004.0,South African doctor and paleontologist,"Robert Broom FRS FRSE (30 November 1866 –  6 April 1951) was a British- South African doctor and palaeontologist. He qualified as a medical practitioner in 1895 and received his DSc in 1905 from the University of Glasgow.
From 1903 to 1910, he was professor of zoology and geology at Victoria College, Stellenbosch, South Africa, and subsequently he became keeper of vertebrate palaeontology at the South African Museum, Cape Town.

",https://en.wikipedia.org/wiki/Robert_Broom
South Korea,31,Yi I,http://www.wikidata.org/entity/Q379653,wd:Q379653,342409.0,Korean Confucianist,"Yi Yi (Korean: 이이; Hanja: 李珥; December 26, 1536 – February 27, 1584) was a Korean philosopher, writer, and Confucian scholar of the Joseon Dynasty.  Yi I is often referred to by his pen name Yulgok (""Chestnut valley""). He was also a politician and was the academical successor of Jo Gwang-jo.",https://en.wikipedia.org/wiki/Yi_I
