0,1,2,3,4,5,6,7,8
Cuba,50,Battle of the Atlantic,http://www.wikidata.org/entity/Q157627,wd:Q157627,57765.0,longest continuous military campaign in World War II,"The Battle of the Atlantic, the longest continuous military campaign in World War II, ran from 1939 to the defeat of Nazi Germany in 1945, covering a major part of the naval history of World War II. At its core was the Allied naval blockade of Germany, announced the day after the declaration of war, and Germany's subsequent counter-blockade. The campaign peaked from mid-1940 through to the end of 1943.
The Battle of the Atlantic pitted U-boats and other warships of the German Kriegsmarine (Navy) and aircraft of the Luftwaffe (Air Force) against the Royal Navy, Royal Canadian Navy, United States Navy, and Allied merchant shipping. Convoys, coming mainly from North America and predominantly going to the United Kingdom and the Soviet Union, were protected for the most part by the British and Canadian navies and air forces. These forces were aided by ships and aircraft of the United States beginning September 13, 1941. The Germans were joined by submarines of the Italian Regia Marina (Royal Navy) after Germany's Axis ally Italy entered the war on June 10, 1940.
As an island country, the United Kingdom was highly dependent on imported goods. Britain required more than a million tons of imported material per week in order to survive and fight. In essence, the Battle of the Atlantic involved a tonnage war; the Allied struggle to supply Britain, and the Axis attempt to stem the flow of merchant shipping that enabled Britain to keep fighting. Rationing in the United Kingdom was also used with the aim of reducing demand, by reducing wastage and increasing domestic production and equality of distribution. From 1942 onward, the Axis also sought to prevent the build-up of Allied supplies and equipment in the UK in preparation for the invasion of occupied Europe. The defeat of the U-boat threat was a prerequisite for pushing back the Axis in Western Europe. The outcome of the battle was a strategic victory for the Allies—the German blockade failed—but at great cost: 3,500 merchant ships and 175 warships were sunk in the Atlantic for the loss of 783 U-boats (the majority of them Type VII submarines) and 47 German surface warships, including 4 battleships (Bismarck,  Scharnhorst,  Gneisenau, and Tirpitz), 9 cruisers, 7 raiders, and 27 destroyers. Of the U-boats, 519 were sunk by British, Canadian, or other UK-based forces, 175 were destroyed by American forces, 15 were destroyed by the Soviets, and 73 were scuttled by their crews before the end of the war for various reasons. This front ended up being highly significant for the German war effort: Germany spent more money on producing naval vessels than it did every type of ground vehicle combined, including tanks.The Battle of the Atlantic has been called the ""longest, largest, and most complex"" naval battle in history. The campaign started immediately after the European War began, during the so-called ""Phoney War"", and lasted more than five years, until the German surrender in May 1945. It involved thousands of ships in more than 100 convoy battles and perhaps 1,000 single-ship encounters, in a theatre covering millions of square miles of ocean. The situation changed constantly, with one side or the other gaining advantage, as participating countries surrendered, joined and even changed sides in the war, and as new weapons, tactics, counter-measures and equipment were developed by both sides. The Allies gradually gained the upper hand, overcoming German surface-raiders by the end of 1942 and defeating the U-boats by mid-1943, though losses due to U-boats continued until the war's end. British Prime Minister Winston Churchill later wrote ""The only thing that really frightened me during the war was the U-boat peril. I was even more anxious about this battle than I had been about the glorious air fight called the 'Battle of Britain'.""",https://en.wikipedia.org/wiki/Battle_of_the_Atlantic
Cyprus,20,Battle of Cape Spartivento,http://www.wikidata.org/entity/Q1541340,wd:Q1541340,840266.0,Naval battle during the Battle of the Mediterranean,"The Battle of Cape Spartivento, known as the Battle of Cape Teulada in Italy, was a naval battle during the Battle of the Mediterranean in the Second World War, fought between naval forces of the Royal Navy and the Italian Regia Marina on 27 November 1940.",https://en.wikipedia.org/wiki/Battle_of_Cape_Spartivento
Czech Republic,70,Battle of Austerlitz,http://www.wikidata.org/entity/Q134114,wd:Q134114,118372.0,1805 battle during the War of the Third Coalition,"The Battle of Austerlitz (2 December 1805/11 Frimaire An XIV FRC), also known as the Battle of the Three Emperors, was one of the most important and decisive engagements of the Napoleonic Wars. The battle occurred near the town of Austerlitz in the Austrian Empire (modern-day Slavkov u Brna in the Czech Republic). The decisive victory of Napoleon's Grande Armée at Austerlitz brought the War of the Third Coalition to a rapid end, with the Treaty of Pressburg signed by the Austrians later in the month. The battle is often cited as a tactical masterpiece, in the same league as other historic engagements like Cannae or Gaugamela.After eliminating an Austrian army during the Ulm Campaign, French forces seized Vienna in November 1805. The Austrians avoided further conflict until the arrival of the Russians bolstered Allied numbers. Napoleon sent his army north in pursuit of the Allies, but then ordered his forces to retreat so he could feign a grave weakness. Desperate to lure the Allies into battle, Napoleon gave every indication in the days preceding the engagement that the French army was in a pitiful state, even abandoning the dominant Pratzen Heights near Austerlitz. He deployed the French army below the Pratzen Heights and deliberately weakened his right flank, enticing the Allies to launch a major assault there in the hopes of rolling up the whole French line. A forced march from Vienna by Marshal Davout and his III Corps plugged the gap left by Napoleon just in time. Meanwhile, the heavy Allied deployment against the French right weakened the allied center on the Pratzen Heights, which was viciously attacked by the IV Corps of Marshal Soult. With the Allied center demolished, the French swept through both enemy flanks and sent the Allies fleeing chaotically, capturing thousands of prisoners in the process.
The Allied disaster significantly shook the faith of Emperor Francis II in the British-led war effort. France and Austria agreed to an armistice immediately and the Treaty of Pressburg followed shortly after, on 26 December. Pressburg took Austria out of both the war and the Coalition while reinforcing the earlier treaties of Campo Formio and of Lunéville between the two powers. The treaty confirmed the Austrian loss of lands in Italy and Bavaria to France, and in Germany to Napoleon's German allies. It also imposed an indemnity of 40 million francs on the defeated Habsburgs and allowed the fleeing Russian troops free passage through hostile territories and back to their home soil. Critically, victory at Austerlitz permitted the creation of the Confederation of the Rhine, a collection of German states intended as a buffer zone between France and Central Europe. The Confederation rendered the Holy Roman Empire virtually useless, so the latter collapsed in 1806 after Francis abdicated the imperial throne. These achievements, however, did not establish a lasting peace on the continent. Prussian worries about growing French influence in Central Europe sparked the War of the Fourth Coalition in 1806.",https://en.wikipedia.org/wiki/Battle_of_Austerlitz
Democratic Republic of the Congo,7,Battle of Kolwezi,http://www.wikidata.org/entity/Q2745987,wd:Q2745987,24933988.0,battle of Kolwezi,The Battle of Kolwezi was an airborne operation by French and Belgian airborne forces that took place in May 1978 in Zaire during the Shaba II invasion of Zaire by the Front for the National Liberation of the Congo (FLNC). It aimed at rescuing European and Zairean hostages held by FLNC rebels after they conquered the city of Kolwezi. The operation succeeded with the liberation of the hostages and light military casualties.,https://en.wikipedia.org/wiki/Battle_of_Kolwezi
Denmark,54,Battle of Jutland,http://www.wikidata.org/entity/Q156554,wd:Q156554,4563.0,1916 naval battle during World War I,"The Battle of Jutland (German: Skagerrakschlacht, the Battle of the Skagerrak) was a naval battle fought between Britain's Royal Navy Grand Fleet, under Admiral Sir John Jellicoe, and the Imperial German Navy's High Seas Fleet, under Vice-Admiral Reinhard Scheer, during the First World War. The battle unfolded in extensive manoeuvring and three main engagements (the battlecruiser action, the fleet action, and the night action), from 31 May to 1 June 1916, off the North Sea coast of Denmark's Jutland Peninsula. It was the largest naval battle and the only full-scale clash of battleships in that war.  Jutland was the third fleet action between steel battleships, following the Battle of the Yellow Sea in 1904 and the Battle of Tsushima in 1905, during the Russo-Japanese War.  Jutland was the last major battle in history fought primarily by battleships.Germany's High Seas Fleet intended to lure out, trap, and destroy a portion of the British Grand Fleet, as the German naval force was insufficient to openly engage the entire British fleet. This formed part of a larger strategy to break the British blockade of Germany and to allow German naval vessels access to the Atlantic. Meanwhile, Great Britain's Royal Navy pursued a strategy of engaging and destroying the High Seas Fleet, thereby keeping German naval forces contained and away from Britain and her shipping lanes.The Germans planned to use Vice-Admiral Franz Hipper's fast scouting group of five modern battlecruisers to lure Vice-Admiral Sir David Beatty's battlecruiser squadrons into the path of the main German fleet. They stationed submarines in advance across the likely routes of the British ships. However, the British learned from signal intercepts that a major fleet operation was likely, so on 30 May, Jellicoe sailed with the Grand Fleet to rendezvous with Beatty, passing over the locations of the German submarine picket lines while they were unprepared. The German plan had been delayed, causing further problems for their submarines, which had reached the limit of their endurance at sea.
On the afternoon of 31 May, Beatty encountered Hipper's battlecruiser force long before the Germans had expected. In a running battle, Hipper successfully drew the British vanguard into the path of the High Seas Fleet. By the time Beatty sighted the larger force and turned back towards the British main fleet, he had lost two battlecruisers from a force of six battlecruisers and four powerful battleships—though he had sped ahead of his battleships of 5th Battle Squadron earlier in the day, effectively losing them as an integral component for much of this opening action against the five ships commanded by Hipper. Beatty's withdrawal at the sight of the High Seas Fleet, which the British had not known were in the open sea, would reverse the course of the battle by drawing the German fleet in pursuit towards the British Grand Fleet. Between 18:30, when the sun was lowering on the western horizon, back-lighting the German forces, and nightfall at about 20:30, the two fleets—totalling 250 ships between them—directly engaged twice.
Fourteen British and eleven German ships sank, with a total of 9,823 casualties. After sunset, and throughout the night, Jellicoe manoeuvred to cut the Germans off from their base, hoping to continue the battle the next morning, but under the cover of darkness Scheer broke through the British light forces forming the rearguard of the Grand Fleet and returned to port.Both sides claimed victory. The British lost more ships and twice as many sailors but succeeded in containing the German fleet. The British press criticised the Grand Fleet's failure to force a decisive outcome, while Scheer's plan of destroying a substantial portion of the British fleet also failed. The British strategy of denying Germany access to both the United Kingdom and the Atlantic did succeed, which was the British long-term goal. The Germans' ""fleet in being"" continued to pose a threat, requiring the British to keep their battleships concentrated in the North Sea, but the battle reinforced the German policy of avoiding all fleet-to-fleet contact. At the end of 1916, after further unsuccessful attempts to reduce the Royal Navy's numerical advantage, the German Navy accepted that its surface ships had been successfully contained, subsequently turning its efforts and resources to unrestricted submarine warfare and the destruction of Allied and neutral shipping, which—along with the Zimmermann Telegram—by April 1917 triggered the United States of America's declaration of war on Germany.Subsequent reviews commissioned by the Royal Navy generated strong disagreement between supporters of Jellicoe and Beatty concerning the two admirals' performance in the battle. Debate over their performance and the significance of the battle continues to this day.",https://en.wikipedia.org/wiki/Battle_of_Jutland
Djibouti,14,Maersk Alabama hijacking,http://www.wikidata.org/entity/Q1818072,wd:Q1818072,22351788.0,piracy incident,"The Maersk Alabama hijacking began on 9 April 2009, when four pirates in the Somali Basin seized the U.S. cargo ship Maersk Alabama at a distance of 240 nautical miles (440 km; 280 mi) southeast of Eyl, Somalia. The siege ended after a rescue effort by the United States Navy on 12 April.The incident was the first successful pirate seizure of a ship registered under the U.S. flag since the early 19th century. Many news reports cited the last pirate seizure as being during the Second Barbary War in 1815, although other incidents are believed to have occurred until at least 1822. It was the sixth vessel in a week to be attacked by pirates, who had previously extorted ransoms of tens of millions of dollars.
At the time of the hijacking, Maersk Alabama was owned by the Danish shipping company Maersk Line. The ship has since been acquired by Element Shipmanagement SA and has been renamed MV Tygra. As of 2021, the ship is still in active service.
The story of the incident was reported by Captain Richard Phillips, who had been master of the vessel at the time of the incident, in the 2010 book A Captain's Duty, which he co-wrote with Stephan Talty. The book was later adapted as the U.S. 2013 film Captain Phillips, starring Tom Hanks.",https://en.wikipedia.org/wiki/Maersk_Alabama_hijacking
Dominica,50,Battle of the Atlantic,http://www.wikidata.org/entity/Q157627,wd:Q157627,57765.0,longest continuous military campaign in World War II,"The Battle of the Atlantic, the longest continuous military campaign in World War II, ran from 1939 to the defeat of Nazi Germany in 1945, covering a major part of the naval history of World War II. At its core was the Allied naval blockade of Germany, announced the day after the declaration of war, and Germany's subsequent counter-blockade. The campaign peaked from mid-1940 through to the end of 1943.
The Battle of the Atlantic pitted U-boats and other warships of the German Kriegsmarine (Navy) and aircraft of the Luftwaffe (Air Force) against the Royal Navy, Royal Canadian Navy, United States Navy, and Allied merchant shipping. Convoys, coming mainly from North America and predominantly going to the United Kingdom and the Soviet Union, were protected for the most part by the British and Canadian navies and air forces. These forces were aided by ships and aircraft of the United States beginning September 13, 1941. The Germans were joined by submarines of the Italian Regia Marina (Royal Navy) after Germany's Axis ally Italy entered the war on June 10, 1940.
As an island country, the United Kingdom was highly dependent on imported goods. Britain required more than a million tons of imported material per week in order to survive and fight. In essence, the Battle of the Atlantic involved a tonnage war; the Allied struggle to supply Britain, and the Axis attempt to stem the flow of merchant shipping that enabled Britain to keep fighting. Rationing in the United Kingdom was also used with the aim of reducing demand, by reducing wastage and increasing domestic production and equality of distribution. From 1942 onward, the Axis also sought to prevent the build-up of Allied supplies and equipment in the UK in preparation for the invasion of occupied Europe. The defeat of the U-boat threat was a prerequisite for pushing back the Axis in Western Europe. The outcome of the battle was a strategic victory for the Allies—the German blockade failed—but at great cost: 3,500 merchant ships and 175 warships were sunk in the Atlantic for the loss of 783 U-boats (the majority of them Type VII submarines) and 47 German surface warships, including 4 battleships (Bismarck,  Scharnhorst,  Gneisenau, and Tirpitz), 9 cruisers, 7 raiders, and 27 destroyers. Of the U-boats, 519 were sunk by British, Canadian, or other UK-based forces, 175 were destroyed by American forces, 15 were destroyed by the Soviets, and 73 were scuttled by their crews before the end of the war for various reasons. This front ended up being highly significant for the German war effort: Germany spent more money on producing naval vessels than it did every type of ground vehicle combined, including tanks.The Battle of the Atlantic has been called the ""longest, largest, and most complex"" naval battle in history. The campaign started immediately after the European War began, during the so-called ""Phoney War"", and lasted more than five years, until the German surrender in May 1945. It involved thousands of ships in more than 100 convoy battles and perhaps 1,000 single-ship encounters, in a theatre covering millions of square miles of ocean. The situation changed constantly, with one side or the other gaining advantage, as participating countries surrendered, joined and even changed sides in the war, and as new weapons, tactics, counter-measures and equipment were developed by both sides. The Allies gradually gained the upper hand, overcoming German surface-raiders by the end of 1942 and defeating the U-boats by mid-1943, though losses due to U-boats continued until the war's end. British Prime Minister Winston Churchill later wrote ""The only thing that really frightened me during the war was the U-boat peril. I was even more anxious about this battle than I had been about the glorious air fight called the 'Battle of Britain'.""",https://en.wikipedia.org/wiki/Battle_of_the_Atlantic
Dominican Republic,50,Battle of the Atlantic,http://www.wikidata.org/entity/Q157627,wd:Q157627,57765.0,longest continuous military campaign in World War II,"The Battle of the Atlantic, the longest continuous military campaign in World War II, ran from 1939 to the defeat of Nazi Germany in 1945, covering a major part of the naval history of World War II. At its core was the Allied naval blockade of Germany, announced the day after the declaration of war, and Germany's subsequent counter-blockade. The campaign peaked from mid-1940 through to the end of 1943.
The Battle of the Atlantic pitted U-boats and other warships of the German Kriegsmarine (Navy) and aircraft of the Luftwaffe (Air Force) against the Royal Navy, Royal Canadian Navy, United States Navy, and Allied merchant shipping. Convoys, coming mainly from North America and predominantly going to the United Kingdom and the Soviet Union, were protected for the most part by the British and Canadian navies and air forces. These forces were aided by ships and aircraft of the United States beginning September 13, 1941. The Germans were joined by submarines of the Italian Regia Marina (Royal Navy) after Germany's Axis ally Italy entered the war on June 10, 1940.
As an island country, the United Kingdom was highly dependent on imported goods. Britain required more than a million tons of imported material per week in order to survive and fight. In essence, the Battle of the Atlantic involved a tonnage war; the Allied struggle to supply Britain, and the Axis attempt to stem the flow of merchant shipping that enabled Britain to keep fighting. Rationing in the United Kingdom was also used with the aim of reducing demand, by reducing wastage and increasing domestic production and equality of distribution. From 1942 onward, the Axis also sought to prevent the build-up of Allied supplies and equipment in the UK in preparation for the invasion of occupied Europe. The defeat of the U-boat threat was a prerequisite for pushing back the Axis in Western Europe. The outcome of the battle was a strategic victory for the Allies—the German blockade failed—but at great cost: 3,500 merchant ships and 175 warships were sunk in the Atlantic for the loss of 783 U-boats (the majority of them Type VII submarines) and 47 German surface warships, including 4 battleships (Bismarck,  Scharnhorst,  Gneisenau, and Tirpitz), 9 cruisers, 7 raiders, and 27 destroyers. Of the U-boats, 519 were sunk by British, Canadian, or other UK-based forces, 175 were destroyed by American forces, 15 were destroyed by the Soviets, and 73 were scuttled by their crews before the end of the war for various reasons. This front ended up being highly significant for the German war effort: Germany spent more money on producing naval vessels than it did every type of ground vehicle combined, including tanks.The Battle of the Atlantic has been called the ""longest, largest, and most complex"" naval battle in history. The campaign started immediately after the European War began, during the so-called ""Phoney War"", and lasted more than five years, until the German surrender in May 1945. It involved thousands of ships in more than 100 convoy battles and perhaps 1,000 single-ship encounters, in a theatre covering millions of square miles of ocean. The situation changed constantly, with one side or the other gaining advantage, as participating countries surrendered, joined and even changed sides in the war, and as new weapons, tactics, counter-measures and equipment were developed by both sides. The Allies gradually gained the upper hand, overcoming German surface-raiders by the end of 1942 and defeating the U-boats by mid-1943, though losses due to U-boats continued until the war's end. British Prime Minister Winston Churchill later wrote ""The only thing that really frightened me during the war was the U-boat peril. I was even more anxious about this battle than I had been about the glorious air fight called the 'Battle of Britain'.""",https://en.wikipedia.org/wiki/Battle_of_the_Atlantic
East Timor,19,Battle of Timor,http://www.wikidata.org/entity/Q1440764,wd:Q1440764,1824145.0,WWII battle in the Pacific Theatre,"The Battle of Timor occurred in Portuguese Timor and Dutch Timor during the Second World War. Japanese forces invaded the island on 20 February 1942 and were resisted by a small, under-equipped force of Allied military personnel—known as Sparrow Force—predominantly from Australia, United Kingdom, and the Dutch East Indies. Following a brief but stout resistance, the Japanese succeeded in forcing the surrender of the bulk of the Allied force after three days of fighting, although several hundred Australian commandos continued to wage an unconventional raiding campaign. They were resupplied by aircraft and vessels, based mostly in Darwin, Australia, about 650 km (400 mi) to the southeast, across the Timor Sea. During the subsequent fighting, the Japanese suffered heavy casualties, but they were eventually able to contain the Australians.
The campaign lasted until 10 February 1943, when the final remaining Australians were evacuated, making them the last Allied land forces to leave Southeast Asia following the Japanese offensives of 1941–1942. As a result, an entire Japanese division was tied up on Timor for more than six months, preventing its deployment elsewhere. Although Portugal was not a combatant, many Timorese and European Portuguese civilians fought with the Allies or provided them with food, shelter and other assistance. Some Timorese continued a resistance campaign following the Australian withdrawal. For this, they paid a heavy price and tens of thousands of Timorese civilians died as a result of the Japanese occupation, which lasted until the end of the war in 1945.",https://en.wikipedia.org/wiki/Battle_of_Timor
Ecuador,17,Battle of Pichincha,http://www.wikidata.org/entity/Q1402751,wd:Q1402751,2951268.0,"battle of the Ecuadorian War of Independence on the slopes of the Pichincha volcano overlooking Quito, resulting in a final victory for the independence movement a","The Battle of Pichincha took place on 24 May 1822, on the slopes of the Pichincha volcano, 3,500 meters above sea-level, right next to the city of Quito, in modern Ecuador.
The encounter, fought in the context of the Spanish American wars of independence, pitted a Patriot army under General Antonio José de Sucre against a Royalist army commanded by Field Marshal Melchor Aymerich. The defeat of the Royalist forces loyal to Spain brought about the liberation of Quito, and secured the independence of the provinces belonging to the Real Audiencia de Quito, or Presidencia de Quito, the Spanish colonial administrative jurisdiction from which the Republic of Ecuador would eventually emerge.",https://en.wikipedia.org/wiki/Battle_of_Pichincha
