0,1,2,3,4,5,6,7,8
Afghanistan,32,Rohullah Nikpai,http://www.wikidata.org/entity/Q230854,wd:Q230854,18942562.0,Taekwondo practitioner,"Rohullah Nikpai (Dari: روح‌الله نیکپا; born June 15, 1987) is an ethnic Hazara taekwondo practitioner and two-time Olympic bronze medalist from Afghanistan.

",https://en.wikipedia.org/wiki/Rohullah_Nikpai
Albania,27,Luiza Gega,http://www.wikidata.org/entity/Q4134683,wd:Q4134683,39851294.0,Albanian runner,"Luiza Gega (born 5 November 1988) is an Albanian middle- and long-distance runner who specialises in the 3000 metres steeplechase since 2016. She won the silver medal in the event at the 2016 European Championships, and a gold in 2022 setting the championship record in the process. Her silver was the first ever Albania’s European medal, while her gold was the first ever title for the country at the European Athletics Championships.Gega represented Albania at the 2016 Rio Olympics, and 2020 Tokyo Olympics, competing in the women's 3000 m steeplechase.She competed at the 2019 World Athletics Championships, finishing ninth, and at the 2022 World Athletics Championships, finishing fifth, both in the 3000 metres steeplechase. In 2022 she became European Champion in that discipline, where previously, in 2016, she had been runner-up.
Gega is the Albanian record holder in the 800, 1500, 3000 (those three out and indoor), 5000, 10,000 metres, half-marathon and marathon distances as well as the 2000 and 3000 metres steeplechase.",https://en.wikipedia.org/wiki/Luiza_Gega
Algeria,36,Sofia Boutella,http://www.wikidata.org/entity/Q258777,wd:Q258777,14882980.0,"Algerian actress, dancer, model and former rhythmic gymnast","Sofia Boutella (Arabic: صوفيا بوتلة; born 3 April 1982) is an Algerian actress, model, and dancer.

",https://en.wikipedia.org/wiki/Sofia_Boutella
Andorra,15,Quino Colom,http://www.wikidata.org/entity/Q2893282,wd:Q2893282,18353138.0,Spanish basketball player,"Joaquim ""Quino"" Colom Barrufet (born November 1, 1988) is a Spanish-Andorran professional basketball player for Bàsquet Girona of the Spain Liga ACB.",https://en.wikipedia.org/wiki/Quino_Colom
Angola,15,Antonia Moreira,http://www.wikidata.org/entity/Q463073,wd:Q463073,13587334.0,Angolan judoka,"Antónia Moreira de Fátima (born 26 April 1982 in Luanda), nicknamed Faia, is an Angolan judoka.She competed in the +70 kg division at the 2004 Summer Olympics and lost in the round of 16 to Kim Ryon-Mi of North Korea.
Moreira also won medals at the 2004 and 2005 African Judo Championships (gold in 2004, silver in 2005) as well as bronze medals at the 2007 All-Africa Games and the 2008 African Judo Championships and a gold medal at the 2015 African Games.
At the 2012 Olympic Games, she competed in the -70 kg division, and was knocked out in the second round by eventual bronze medallist Yuri Alvear.At the 2016 Summer Olympics in Rio de Janeiro, she competed in the women's 70 kg division. She finished in 9th place after being defeated by Laura Vargas Koch of Germany in the second round.",https://en.wikipedia.org/wiki/Ant%C3%B3nia_Moreira
Antigua and Barbuda,28,Rodney Williams,http://www.wikidata.org/entity/Q17566330,wd:Q17566330,43586519.0,Governor-General of Antigua and Barbuda (born 1947),"Sir Rodney Errey Lawrence Williams,  (born 2 November 1947) is the current and 4th Governor-General of Antigua and Barbuda.",https://en.wikipedia.org/wiki/Rodney_Williams_(governor-general)
Argentina,71,Juan Manuel Fangio,http://www.wikidata.org/entity/Q2069,wd:Q2069,48532.0,Argentine racing driver (1911–1995),"Juan Manuel Fangio (American Spanish: [ˈfanχjo], Italian: [ˈfandʒo]; 24 June 1911 – 17 July 1995), nicknamed El Chueco (""the bowlegged"" or ""bandy legged one"") or El Maestro (""The Master"" or ""The Teacher""), was an Argentine racing car driver. He dominated the first decade of Formula One racing, winning the World Drivers' Championship five times.From childhood, he abandoned his studies to pursue auto mechanics. In 1938, he debuted in Turismo Carretera, competing in a Ford V8. In 1940, he competed with Chevrolet, winning the Grand Prix International Championship and devoted his time to the Argentine Turismo Carretera becoming its champion, a title he successfully defended a year later. Fangio then competed in Europe between 1947 and 1949, where he achieved further success.
He won the World Championship of Drivers five times—a record that stood for 46 years until beaten by Michael Schumacher—with four different teams (Alfa Romeo, Ferrari, Mercedes-Benz, and Maserati). He holds the highest winning percentage in Formula One at 46.15%, winning 24 of 52 Formula One races he entered. Fangio is the only Argentine driver to have won the Argentine Grand Prix, which he won four times in his career, more than any other driver.After retirement, Fangio presided as the honorary president of Mercedes-Benz Argentina from 1987, a year after the inauguration of his museum, until his death in 1995. In 2011, on the centenary of his birth, Fangio was remembered around the world and various activities were held in his honor.

",https://en.wikipedia.org/wiki/Juan_Manuel_Fangio
Armenia,53,Levon Aronian,http://www.wikidata.org/entity/Q154586,wd:Q154586,2161769.0,Armenian-American chess player,"Levon Grigori Aronian (Armenian: Լևոն Գրիգորի Արոնյան, romanized: Levon Grigori Aronyan; born 6 October 1982) is an Armenian chess grandmaster. A chess prodigy, he earned the title of grandmaster in 2000, at age 17. Aronian held the No. 2 position in the March 2014 FIDE world chess rankings with a rating of 2830, becoming the fourth-highest rated player in history.
Aronian won the FIDE World Cup in 2005 and 2017. He led the Armenian national team to the gold medals in the Chess Olympiads of 2006 (Turin), 2008 (Dresden) and 2012 (Istanbul) and at the World Team Chess Championship in Ningbo 2011. He won the FIDE Grand Prix 2008–2010, qualifying him for the Candidates Tournament for the World Chess Championship 2012. He was also world champion in Chess960 in 2006 and 2007, in rapid chess in 2009, and in blitz chess in 2010.
Aronian has been the leading Armenian chess player since the early 2000s. His popularity in Armenia has led to him being called a celebrity and a hero. He was named the best sportsman of Armenia in 2005 and was awarded the title of Honoured Master of Sport of the Republic of Armenia in 2009. In 2012, he was awarded the Order of St. Mesrop Mashtots. In 2016, CNN called Aronian the ""David Beckham of chess"".Aronian announced his decision to transfer from the Armenian chess federation to the United States federation in late February 2021, citing a decline in government support for the sport as his motivation. The transfer was completed in December 2021.",https://en.wikipedia.org/wiki/Levon_Aronian
Australia,63,Mark Webber,http://www.wikidata.org/entity/Q82667,wd:Q82667,564161.0,Australian professional racing driver,"Mark Alan Webber  (born 27 August 1976) is an Australian retired professional racing driver who competed in Formula One from 2002 to 2013 and the FIA World Endurance Championship (WEC) between 2014 and 2016. He is a champion of the 2015 FIA WEC for Porsche with German Timo Bernhard and New Zealander Brendon Hartley.
Webber began karting at age 12 or 13 and achieved early success, winning regional championships before progressing to car racing in the Australian Formula Ford Championship and the British Formula 3 Championship. He competed for two years opposite Bernd Schneider in the FIA GT Championship with the AMG Mercedes team, finishing runner-up in the 1998 season with five wins in ten races before finishing second in the 2001 International Formula 3000 Championship driving for Super Nova Racing. Webber made his F1 debut with the Minardi team in the 2002 season and finished fifth in his first race, the Australian Grand Prix. He moved to the Jaguar squad for the 2003 and 2004 championships. For the 2005 season, he was granted an early release from his contract with Jaguar and joined the Williams team, securing his first podium finish at the Monaco Grand Prix. Webber remained at Williams until the 2006 campaign, driving for the Red Bull squad for the rest of his F1 career. He won nine F1 Grands Prix, thirteen pole positions and finished third in the World Drivers' Championship in the 2010, 2011 and 2013 seasons.
He left F1 after 2013 and moved to the WEC, sharing a Porsche 919 Hybrid with Bernhard and Hartley in the fully-professional Le Mans Prototype 1 class from the 2014 to 2016 seasons. The trio won eight races in the final two seasons and the 2015 World Endurance Drivers' Championship. He retired from motor sport in 2016, becoming a television pundit for Britain's Channel 4 and Australia's Network 10 and a driver manager. Webber received the Australian Sports Medal in 2000 and was appointed Officer of the Order of Australia (AO) in the 2017 Australia Day Honours. Webber is an inductee of both the Australian Motor Sport Hall of Fame and the FIA Hall of Fame.

",https://en.wikipedia.org/wiki/Mark_Webber_(racing_driver)
Austria,73,Niki Lauda,http://www.wikidata.org/entity/Q78489,wd:Q78489,40486.0,Austrian former Formula 1 driver (1949-2019),"Andreas Nikolaus ""Niki"" Lauda (22 February 1949 – 20 May 2019) was an Austrian Formula One driver and aviation entrepreneur. He was a three-time Formula One World Drivers' Champion, winning in 1975, 1977 and 1984, and is the only driver in Formula One history to have been champion for both Ferrari and McLaren, two of the sport's most successful constructors.
He was an aviation entrepreneur who founded and ran three airlines: Lauda Air, Niki and Lauda. He was also a consultant for Scuderia Ferrari and team manager of the Jaguar Formula One racing team for two years. Afterwards, he worked as a pundit for German TV during Grand Prix weekends and acted as non-executive chairman of Mercedes-AMG Petronas Motorsport, of which Lauda owned 10%.Lauda emerged as Formula One's star driver amid a 1975 title win and leading the 1976 championship battle. Lauda was seriously injured in a crash at the 1976 German Grand Prix while racing at the Nürburgring; during the crash his Ferrari 312T2 burst into flames nearly resulting in his death after he inhaled hot toxic fumes and suffered severe burns. He survived and recovered sufficiently to race again just six weeks later at the Italian Grand Prix. Although he lost that year's title by just one point to James Hunt, he won his second championship the year after, during his final season at Ferrari. After a couple of years at Brabham and two years' hiatus, Lauda returned and raced four seasons for McLaren between 1982 and 1985, during which he won the 1984 title by half a point over his teammate Alain Prost.",https://en.wikipedia.org/wiki/Niki_Lauda
Azerbaijan,113,Garry Kasparov,http://www.wikidata.org/entity/Q28614,wd:Q28614,12810.0,Russian chess grandmaster and activist,"Garry Kimovich Kasparov (born 13 April 1963) is a Russian chess grandmaster, former World Chess Champion, writer and political activist. His peak rating of 2851, achieved in 1999, was the highest recorded until being surpassed by Magnus Carlsen in 2013. From 1984 until his retirement in 2005, Kasparov was ranked world no. 1 for a record 255 months overall. Kasparov also holds records for the most consecutive professional tournament victories (15) and Chess Oscars (11).
Kasparov became the youngest-ever undisputed World Chess Champion in 1985 at age 22 by defeating then-champion Anatoly Karpov. He held the official FIDE world title until 1993, when a dispute with FIDE led him to set up a rival organization, the Professional Chess Association. In 1997 he became the first world champion to lose a match to a computer under standard time controls when he lost to the IBM supercomputer Deep Blue in a highly publicized match. He continued to hold the ""Classical"" World Chess Championship until his defeat by Vladimir Kramnik in 2000. Despite losing the PCA title, he continued winning tournaments and was the world's highest-rated player when he retired from professional chess in 2005.
Since retiring, he has devoted his time to politics and writing. He formed the United Civil Front movement and joined as a member of The Other Russia, a coalition opposing the administration and policies of Vladimir Putin. In 2008, he announced an intention to run as a candidate in that year's Russian presidential race, but after encountering logistical problems in his campaign, for which he blamed ""official obstruction"", he withdrew. In the wake of the Russian mass protests that began in 2011, he announced in 2013 that he had left Russia for the immediate future out of fear of persecution. Following his flight from Russia, he lived in New York City with his family. In 2014, he obtained Croatian citizenship, and has maintained a residence in Podstrana near Split.Kasparov is currently chairman of the Human Rights Foundation and chairs its International Council. In 2017, he founded the Renew Democracy Initiative (RDI), an American political organization promoting and defending liberal democracy in the U.S. and abroad. He serves as chairman of the group. Kasparov is also a security ambassador for the software company Avast.

",https://en.wikipedia.org/wiki/Garry_Kasparov
Bahrain,27,Rashid Ramzi,http://www.wikidata.org/entity/Q315111,wd:Q315111,2424015.0,Moroccan-born middle distance runner for Bahrain,"Rashid Ramzi (Arabic: رشيد رمزي) (born July 17, 1980) is a Moroccan-Bahraini track and field athlete competing internationally for Bahrain in the 800 metres and 1500 metres.  Ramzi was investigated by the IAAF after the 2008 Summer Olympics and was stripped of his gold medal for doping.Ramzi was born in Safi, Morocco.  After transferring to Bahrain, he ascended to the top of the Asian scene, winning gold medals at the Asian Athletics Championships and the 2002 Asian Games. He set an Asian indoor record over 800 metres to take the silver at the 2004 IAAF World Indoor Championships—his first global medal—and took part in the 2004 Athens Olympics. He reached the peak of his discipline the following year by becoming both the 800 m and 1500 m champion at the 2005 World Championships in Athletics – the first man to ever do such a double at the competition.
He failed to retain his titles at the 2007 World Championships, but still took the silver medal over 1500 m. At the 2008 Summer Olympics he was the recipient of the first ever medal for Bahrain at the Olympics – winning the 1500 m gold medal. However, his result did not stand and he was excluded from the sport for two years after his test came back positive for the banned blood-boosting substance CERA.",https://en.wikipedia.org/wiki/Rashid_Ramzi
Bangladesh,21,Shakib Al Hasan,http://www.wikidata.org/entity/Q266104,wd:Q266104,7218103.0,Bangladeshi cricketer,"Shakib Al Hasan (Bengali: সাকিব আল হাসান; born 24 March 1987) is a Bangladeshi cricketer and current captain of the Bangladesh national cricket team in Tests and T20Is. He plays for Barishal in domestic cricket as an all-rounder. He is currently the number 1 ranked all-rounder in ODI cricket and is widely considered to be one of the greatest all-rounders of all time. He is known for his aggressive left-handed batting style in the middle order and controlled slow left-arm orthodox bowling. He was ranked the 90th most famous athlete in the world by ESPN. As of 2022, he has taken the most wickets at T20 World Cups.Shakib Al Hasan made his test debut in 2007 against India. His breakthrough came in the Test against New Zealand in Chittagong in 2008. He picked up 7/36, which to date is the best figure by a Bangladeshi bowler. In the 2012 Asia Cup, Shakib scored 237 runs, including three fifties, and took six wickets. Bangladesh progressed to the tournament's final for the first time, losing to Pakistan by two runs. Shakib Al Hasan received many awards for his performance in the game.
He was awarded the Player of the Tournament award in the 2019 Cricket World Cup for hitting back-to-back centuries and half-centuries for his country. He ended up as the third most run-scorer in the tournament with 606 runs. He has received 31 man-of-the-match awards and 16 man-of-the-series awards in all formats. Currently, he holds the third most Player of the tournament awards in all forms after Sachin Tendulkar and Virat Kohli. Between 2009 and 2022, he captained the Bangladesh cricket team in 85 matches across all three formats.
Shakib is a vital cog in Bangladesh's line-up as a genuine all-rounder. He has been a consistent performer for his country over the years. Shakib is the most controversial figure in Bangladesh's cricket history, always making at to the top of the headlines. He is the most followed person on Facebook, Twitter and other social media platforms in Bangladesh, with more than 20 million followers. As of March 2022, Shakib holds the record for the most men's Twenty20 International wickets.",https://en.wikipedia.org/wiki/Shakib_Al_Hasan
Barbados,26,Obadele Thompson,http://www.wikidata.org/entity/Q366517,wd:Q366517,94253.0,Barbadian track and field sprinter,"Obadele ""Oba"" Thompson BSS (born 30 March 1976) is a Barbados-born former sprinter, lawyer, author, and speaker. He won Barbados's first and only Olympic medal as an independent country by placing third in the 100 metres at the 2000 Sydney Olympics. He is a three-time Olympian (1996, 2000, and 2004), and a finalist at each Olympics. His personal best performances are 9.87 seconds for the 100 m, 19.97 seconds for the 200 metres (both Barbadian records), and 45.38 seconds for the 400 metres. He has held the indoor 55 metres world record (5.99 sec.) since 1997.Obadele's Olympic success followed an outstanding collegiate career at the University of Texas-El Paso (UTEP) where he amassed several prestigious awards for his academics, athletics, and leadership. As a collegian, he won four individual NCAA sprint titles: indoor 200 m (1996 and 1997) and the outdoor 100 and 200 metres (1997). He set two NCAA records: indoor 55 m (1997) and indoor 200 m (1996). He established two world records: 55 m (1997) and the World Junior 100 m (1994). In 1996, he ran the then-fastest 100 m recorded under all conditions (a windy 9.69 sec.).He was an eleven-time NCAA All-American and a sixteen-time Western Athletic Conference (WAC) Champion. Thompson won several Athlete of the Year awards, including the UTEP Athlete of the Year (1996 and 1997), US Track & Field and Cross Country Coaches Association (USTFCCCA) NCAA Division I Male Indoor Athlete of the Year (1997), and the Stan Bates WAC Male Student-Athlete of the Year (1997). He has also been listed as one of UTEP's all-time top 10 male athletes.Thompson was a three-time USTFCCCA Academic All-American (1995–1997). In 1996, he became a member of Beta Gamma Sigma (BGS) honor society, the highest recognition business students worldwide can receive from an Association to Advance Collegiate Schools of Business (AACSB) accredited business program. In 1997, he was named a College Sports Information Directors of America (CoSIDA) First-Team At-Large Academic All-American (formerly the GTE First-Team At-Large Academic All-American award) and received the State of Texas Certificate of Merit for his exemplary achievement in academics and athletics. In 1998, he became a UTEP Alumni Association Top Ten Senior awardee, and received the NCAA Today's Top VIII Award (now the NCAA Today's Top 10) for outstanding leadership, athletics and academics, along with two-time NFL Super Bowl Champion, Peyton Manning, who attended the University of Tennessee.
After retiring from a decade-long professional athletics career, Thompson published his first book, Secrets of a Student-Athlete: A Reality Check, which was endorsed by legendary Duke basketball coach Mike Krzyzewski. Thompson was a keynote speaker at the official launch of the 2007 ICC Cricket World Cup in Barbados and has participated in leadership development programs, including with the West Indies Cricket Team. He has also served variously as a speaker and panellist on matters related to sports management, performance, and anti-doping.
Thompson was inducted into the UTEP Track and Field Hall of Fame in 2007, and into the UTEP Athletics and Drake Relays Halls of Fame in 2011.
He graduated from UTEP summa cum laude in economics and marketing and received his Juris Doctor (J.D.) from the University of Texas School of Law. He practices international arbitration and litigation.",https://en.wikipedia.org/wiki/Obadele_Thompson
Belarus,70,Victoria Azarenka,http://www.wikidata.org/entity/Q10118,wd:Q10118,3493545.0,Belarusian tennis player,"Victoria Fyodarauna Azarenka (Belarusian: Вікторыя Фёдараўна Азаранка; Russian: Виктория Фёдоровна Азаренко; born 31 July 1989) is a Belarusian professional tennis player. Azarenka is a former world No. 1 in singles, having claimed the top ranking for the first time on 30 January 2012. She was the year-end No. 1 in 2012 and has held the top ranking for a combined total of 51 weeks. 
Azarenka has won 21 WTA singles titles, including two Grand Slam singles titles at the 2012 and 2013 Australian Open, becoming the first Belarusian player, male or female, to win a Grand Slam tournament singles title. Azarenka is also a three-time major finalist at the US Open, finishing runner-up to Serena Williams in both 2012 and 2013 and to Naomi Osaka in 2020. In singles she also won six Premier Mandatory tournaments (including the Sunshine Double in 2016), four Premier 5 tournaments, and the singles bronze medal at the 2012 Summer Olympics in London. She was the runner-up at the 2011 WTA Finals to Petra Kvitová, reached four other Grand Slam singles semifinals (Australian Open in 2023 (Wimbledon in 2011 and 2012 and the French Open in 2013), and had nine other major quarterfinal appearances. She finished with a year-end top 10 singles ranking for five consecutive years between 2009 and 2013.
Azarenka has won nine WTA doubles titles (including two Premier Mandatory and two Premier 5 titles), reached four Grand Slam finals in women's doubles, and reached a career-high ranking of No. 7 in the world on 7 July 2008. She has won three mixed doubles titles — two being Grand Slam titles at the 2007 US Open with compatriot Max Mirnyi and the 2008 French Open with Bob Bryan, and the third being the Olympic gold medal in mixed doubles at the 2012 London Olympics with Mirnyi.

",https://en.wikipedia.org/wiki/Victoria_Azarenka
Belgium,88,Max Verstappen,http://www.wikidata.org/entity/Q2239218,wd:Q2239218,41758713.0,Belgian-Dutch racing driver (born 1997),"Max Emilian Verstappen (Dutch: [ˈmɑks vɛrˈstɑ.pə(n)]; born 30 September 1997) is a Belgian-Dutch racing driver and the 2021 and 2022 Formula One World Champion. He competes under the Dutch flag in Formula One with Red Bull Racing.
Verstappen is the son of racing drivers Jos Verstappen, who also competed in Formula One, and Sophie Kumpen. He had a successful run in junior karting and single-seater categories – including KF3, WSK World Series, KZ2 and European Formula 3 – beating several records.
At the 2015 Australian Grand Prix, when he was aged 17 years, 166 days, he became the youngest driver to compete in Formula One. After spending the 2015 season with Scuderia Toro Rosso, Verstappen started his 2016 campaign with the Italian team before being promoted to parent team Red Bull Racing after four races as a replacement for Daniil Kvyat. At the age of 18, he won the 2016 Spanish Grand Prix on his debut for Red Bull Racing, becoming the youngest-ever driver and the first Dutch driver to win a Formula One Grand Prix. After winning the 2021 Abu Dhabi Grand Prix, Verstappen became the first Dutch driver to win the Formula One World Championship, and the 34th Formula One World Drivers' Champion. He won his second consecutive Formula One championship the next season.
As of the 2022 Abu Dhabi Grand Prix, Verstappen has achieved 35 victories and 20 pole positions. He scored the first hat-trick of his career at the 2021 French Grand Prix and his first grand slam at the 2021 Austrian Grand Prix. He scored his second grand slam at the 2022 Emilia Romagna Grand Prix. Verstappen is set to remain at Red Bull until at least the end of the 2028 season after signing a contract extension.",https://en.wikipedia.org/wiki/Max_Verstappen
