0,1,2,3,4,5,6,7,8
Kyrgyzstan,63,Vitali Klitschko,http://www.wikidata.org/entity/Q31919,wd:Q31919,555483.0,Ukrainian boxer and politician (1971-),"Vitali Volodymyrovych Klitschko (; Ukrainian: Віта́лій Володи́мирович Кличко́ [wiˈtɑl⁽ʲ⁾ij woloˈdɪmɪrowɪtʃ klɪtʃˈkɔ]; born 19 July 1971) is a Ukrainian politician and former professional boxer who serves as mayor of Kyiv and head of the Kyiv City State Administration, having held both offices since June 2014. Klitschko is a former leader of the Petro Poroshenko Bloc and a former Member of the Ukrainian Parliament. He became actively involved in Ukrainian politics in 2005 and combined this with his professional boxing career until his retirement from the sport in 2013.  He holds a Doctoral Degree (Ph.D.) from Kyiv University's Physical Science Department.As a boxer, Klitschko won multiple world heavyweight championships. He held the World Boxing Organization (WBO) title from 1999 to 2000, the Ring magazine title from 2004 to 2005, and the World Boxing Council (WBC) title twice between 2004 and 2013. Overall, he defeated 15 opponents in world heavyweight title fights, and made 12 successful title defences. In 2011, Vitali and his younger brother Wladimir Klitschko entered the Guinness World Records as the pair of brothers with most world heavyweight title fight wins (30 at the time; 40 as of 2020). From 2006 until 2015, Vitali and Wladimir (also a multiple world champion) dominated heavyweight boxing, a period widely known as the ""Klitschko Era"" of the division. Klitschko's last fight was in 2012, but he remained the WBC heavyweight champion at age 42 when he announced his retirement in December 2013.
Klitschko formally began his political career in 2006 when he placed second in the Kyiv mayoral race. In 2010, he founded the party Ukrainian Democratic Alliance for Reform (UDAR) and was elected into parliament for this party in 2012. He was a leading figure in the 2013–2014 Euromaidan protests, and he announced his possible candidacy for the Ukrainian presidency but later withdrew and endorsed the eventual winner Petro Poroshenko. He was elected Mayor of Kyiv on 25 May 2014. He headed the election list of the winner of the 2014 Ukrainian parliamentary election, the Petro Poroshenko Bloc, but he gave up his parliamentary seat to stay on as Mayor of Kyiv. On 28 August 2015 the UDAR party merged into Petro Poroshenko Bloc. Klitschko thus became the new party leader. Klitschko was reelected as mayor on 15 November 2015. Klitschko revived UDAR, and left Petro Poroshenko Bloc with it, in May 2019 and simultaneously announced that UDAR would take part in the 2019 Ukrainian parliamentary election autonomously. UDAR however failed to win any seats.Klitschko was re-elected to a second term as mayor in 2020, securing 50.52% of the votes in the first round of voting and thus avoiding a run-off. Following the 2022 Russian Invasion of Ukraine, Klitschko and President Volodymyr Zelensky have been internationally praised as symbols of Ukrainian resistance.",https://en.wikipedia.org/wiki/Vitali_Klitschko
Laos,10,Santisouk Inthavong,http://www.wikidata.org/entity/Q26605699,wd:Q26605699,51396773.0,Laotian swimmer,"Santisouk Inthavong (born 2 September 1999) is a Laotian backstroke and freestyle swimmer. He competed in the men's 50 metre freestyle event at the 2016 Summer Olympics, where he ranked 69th with a time of 26.54 seconds, a national record. He did not advance to the semifinals.
In 2019, he represented Laos at the 2019 World Aquatics Championships held in Gwangju, South Korea and he finished in 109th place in the heats in the men's 50 metre freestyle event. In the men's 50 metre backstroke he finished in 67th place in the heats.",https://en.wikipedia.org/wiki/Santisouk_Inthavong
Latvia,72,Mikhail Tal,http://www.wikidata.org/entity/Q102664,wd:Q102664,183145.0,Soviet-Latvian chess player,"Mikhail Nekhemyevich Tal (9 November 1936 – 28 June 1992) was a Soviet-Latvian chess player and the eighth World Chess Champion. He is considered a creative genius and is widely regarded as one of the most influential chess players. Tal played in an attacking and daring combinatorial style. His play was known above all for improvisation and unpredictability. Vladislav Zubok said of him, ""Every game for him was as inimitable and invaluable as a poem"".His nickname was ""Misha"", a diminutive for Mikhail, and he earned the nickname ""The Magician from Riga"". Both The Mammoth Book of the World's Greatest Chess Games and Modern Chess Brilliancies include more games by Tal than any other player. He also held the record for the longest unbeaten streak in competitive chess history with 95 games (46 wins, 49 draws) between 23 October 1973 and 16 October 1974, until Ding Liren's streak of 100 games (29 wins, 71 draws) between 9 August 2017 and 11 November 2018. In addition, Tal was a highly regarded chess writer.
Tal died on 28 June 1992 in Moscow, Russia. The Mikhail Tal Memorial chess tournament has been held in Moscow annually since 2006.

",https://en.wikipedia.org/wiki/Mikhail_Tal
Lebanon,36,Steve Kerr,http://www.wikidata.org/entity/Q523630,wd:Q523630,221788.0,American basketball player and coach,"Stephen Douglas Kerr (born September 27, 1965) is an American professional basketball coach and former player who is the head coach of the Golden State Warriors of the National Basketball Association (NBA). He is a nine-time NBA champion, having won five titles as a player (three with the Chicago Bulls and two with the San Antonio Spurs) as well as four with the Warriors as a head coach. Kerr is the only NBA player to win four straight NBA titles after 1969. Kerr has the highest career three-point field goal percentage (45.4%) in NBA history for any player with at least 250 three-pointers made. He also held the NBA record for the highest three-point percentage in a season at 52.4% until the record was broken by Kyle Korver in 2010. He is known as the most accurate three-point shooter of all time, and one of the greatest coaches in NBA history.
Kerr played college basketball with the Arizona Wildcats. He was a two-time first-team all-conference player in the Pac-10 (now known as the Pac-12), and earned All-American honors as a senior in 1988. Selected by the Phoenix Suns in the second round of the 1988 NBA draft, he played 15 seasons in the NBA. Kerr became a minority owner of the Suns as part of the group led by Robert Sarver that purchased the team in 2004. In June 2007, Phoenix named Kerr the team's president of basketball operations and general manager, and was one of majority owner Sarver's trusted basketball advisors. Kerr announced he was leaving the position in June 2010, but retained his minority share until 2014. Afterward, Kerr returned as a color commentator for NBA on TNT until 2014, when he pursued a career in coaching.
In May 2014, Kerr received his first head coaching job with the Golden State Warriors. Under his leadership, the franchise entered the most successful period in its history, reaching six NBA Finals and winning four championships in 2015, 2017, 2018, and 2022. The 2015–16 Warriors won an unprecedented 73 games, breaking the record for the most wins in an NBA season, previously held by Kerr's 1995–96 Chicago Bulls.
As member of the U.S. national team, Kerr won the 1986 FIBA World Championship as a player, and was an assistant coach on the gold medal-winning 2020 Olympic team. He was named the head coach of Team USA for 2023–24.",https://en.wikipedia.org/wiki/Steve_Kerr
Lesotho,9,Tsepo Mathibelle,http://www.wikidata.org/entity/Q5307471,wd:Q5307471,36703856.0,Mosotho athlete,"Tsepo Ramonene Mathibelle (born 30 June 1991) is a long-distance runner from Lesotho.
Mathibelle took up running aged 14. He ran his first marathon in 2012 and qualified for the 2012 Olympics. He ran his second marathon at the Olympics and finished last in a time of 2:55:54. After walking the majority of the last 3 km, Ramonene summoned the strength to jog over the finish line nearly 48 minutes behind the race winner. Shortly after the crowd cheered him to the finish line, he collapsed with exhaustion.
He went to the 2015 Marathon Championships in Beijing, leading the break at 30 km, and then fading to 14th, to finish in 2:17:17. He failed to finish the 2016 Olympic marathon.
He competed at the 2022 Commonwealth Games where he finished 17th in the marathon event.",https://en.wikipedia.org/wiki/Tsepo_Mathibelle
Liberia,13,George Scott,http://www.wikidata.org/entity/Q3101920,wd:Q3101920,6593625.0,boxer,"George Kelly Scott (born 20 December 1966), earlier George Cramne, is a retired Swedish professional boxer of Liberian descent. He won the Swedish championship five years in a row, took a silver medal in the Olympic games in Seoul 1988. He became a pro boxer and trained for the legendary Angelo Dundee and won the world champion belt for WBU. He never lost his belt in the ring, but would later have it taken away from him following a disagreement with his manager.",https://en.wikipedia.org/wiki/George_Scott_(boxer)
Libya,28,Lorenzo Bandini,http://www.wikidata.org/entity/Q173006,wd:Q173006,1226484.0,Italian racecar driver,Lorenzo Bandini (21 December 1935 – 10 May 1967) was an Italian motor racing driver who raced in Formula One for the Scuderia Centro Sud and Ferrari teams.,https://en.wikipedia.org/wiki/Lorenzo_Bandini
Liechtenstein,47,Lara Gut-Behrami,http://www.wikidata.org/entity/Q30293,wd:Q30293,15556757.0,Swiss alpine skier,"Lara Gut-Behrami (née Gut; Italian pronunciation: [ˈlaːra ˈɡut]; born 27 April 1991) is a Swiss World Cup alpine ski racer who competes in all disciplines and specializes in the speed events of downhill and Super-G. She won the gold medal in the Super-G event at the 2022 Winter Olympics in Beijing.

",https://en.wikipedia.org/wiki/Lara_Gut-Behrami
Lithuania,50,Arvydas Sabonis,http://www.wikidata.org/entity/Q297750,wd:Q297750,679859.0,Lithuanian basketball player and executive,"Arvydas Romas Sabonis (Lithuanian pronunciation: ​[ˈaːrviːdaːs ˈsaːboːnʲɪs]; born December 19, 1964) is a Lithuanian former professional basketball player and businessman. Recognized as one of the best European players of all time, he won the Euroscar six times and the Mr. Europa Award twice. He played in a variety of leagues, including the Spanish ACB League, and spent seven seasons in the National Basketball Association (NBA). Playing the center position, Sabonis won a gold medal at the 1988 Summer Olympics, in South Korea, for the Soviet Union, and later earned bronze medals at the 1992 Olympic Games and 1996 Olympic Games representing Lithuania. He retired from professional basketball in 2005. Sabonis was selected by the Portland Trail Blazers in the first round of the 1986 NBA draft, but he did not play his first NBA game until 1995, at the age of 30.
Sabonis is considered one of the best big man passers, as well as one of the best overall centers, in the history of the game. Bill Walton once called Sabonis ""a 7 ft 3 in (2.21 m) Larry Bird"" due to his unique court vision, shooting range, rugged in-game mentality, and versatility.On August 20, 2010, Sabonis was inducted into the FIBA Hall of Fame, in recognition of his great play in international competition. On April 4, 2011, Sabonis was named to the Naismith Memorial Basketball Hall of Fame, and he was as a player, inducted on August 12, 2011. At that time, he was the tallest player to ever enter the Naismith Memorial Basketball Hall of Fame; one year later, he would be surpassed by 7 ft 4 in (2.24 m) Ralph Sampson. On October 24, 2011, Sabonis was voted as the next President of the Lithuanian Basketball Federation, replacing Vladas Garastas, who had led the LBF since 1991. He resigned from the position on October 2, 2013, but came back to it on October 10, 2013.
His son, Domantas Sabonis, is a current NBA player for the Sacramento Kings.",https://en.wikipedia.org/wiki/Arvydas_Sabonis
Luxembourg,40,Andy Schleck,http://www.wikidata.org/entity/Q241280,wd:Q241280,3102774.0,Luxembourgish road bicycle racer,"Andy Raymond Schleck (pronounced [ˈɑndi ˈʀɑɪmont ˈʃlæk]; born 10 June 1985) is a Luxembourgish former professional road bicycle racer. He won the 2010 Tour de France, being awarded it retroactively in February 2012 after Alberto Contador's hearing at the Court of Arbitration for Sport. He has also been the runner-up at the Tour twice; in 2009 and 2011. He is the younger brother of Fränk Schleck, also a professional rider between 2003 and 2016. Their father Johny Schleck rode the Tour de France and Vuelta a España between 1965 and 1974.",https://en.wikipedia.org/wiki/Andy_Schleck
Madagascar,15,Dally Randriantefy,http://www.wikidata.org/entity/Q264088,wd:Q264088,2620429.0,Madagascar tennis player,"Dally Randriantefy  (born 23 February 1977 in Antananarivo, Madagascar) is a former professional female tennis player.
Randriantefy has won seven singles and 3 doubles titles on the ITF circuit in her career. On 11 April 2005, she reached her best singles ranking of world number 44. On 6 May 2002, she peaked at world number 193 in the doubles rankings. Her best results have been two semi-final appearance at the WTA Strasbourg tournament (a Tier III event) and WTA Acapulco (Tier III).
She retired from professional tennis after a first round loss at the 2006 Australian Open against Akgul Amanmuradova.
Randriantefy took part in 3 Olympic Games in Barcelona (1992), Atlanta (1996) and Athens (2004). She was the Flag bearer of Malagasy (Nationality &, adjective) Olympic Team in Atlanta.
Randriantefy is the best ranked Austronesian, of the Indian Ocean Area player of the Open era.",https://en.wikipedia.org/wiki/Dally_Randriantefy
Malawi,28,Cate Campbell,http://www.wikidata.org/entity/Q261594,wd:Q261594,18442258.0,"Australian swimmer, Olympic gold medallist, world champion, former world record-holder","Cate Natalie Campbell,  (born 20 May 1992) is a Malawian-born Australian competitive swimmer, and a current multiple world record holder, who won two bronze medals at the 2008 Summer Olympics, a gold medal at the 2012 Summer Olympics, a gold and a silver medal at the 2016 Summer Olympics and a gold medal at the 2020 Summer Olympics. She is the current world record holder in the Long Course 4 x 100 m Freestyle Relay with Team Australia and the short course 100 m freestyle. Campbell was one of the flagbearers for Australia at the Tokyo 2020 Olympics alongside basketball player Patty Mills.
She is coached by Simon Cusack at the Commercial Swimming Club.",https://en.wikipedia.org/wiki/Cate_Campbell
Malaysia,36,Lee Chong Wei,http://www.wikidata.org/entity/Q319346,wd:Q319346,907293.0,Malaysian badminton player,"Datuk Lee Chong Wei  (Chinese: 李宗偉; Pe̍h-ōe-jī: Lí Chong-úi; born 21 October 1982) is a Malaysian former badminton player. As a singles player, Lee was ranked first worldwide for 349 weeks, including a 199-week streak from 21 August 2008 to 14 June 2012. He is the fifth Malaysian player after Foo Kok Keong, Rashid Sidek, Roslin Hashim and Wong Choong Hann to achieve such a ranking (since official rankings were first kept in the 1980s), and is the only Malaysian shuttler who has held the number one ranking for more than a year.Lee is a triple silver medalist at the Olympic Games, and the sixth Malaysian to win an Olympic medal. He won his first silver medal in 2008, also the first time a Malaysian had reached the finals in the men's singles event. This achievement earned him the title Datuk, and led to then Malaysian Prime Minister Najib Razak describing him as national hero. He repeated the achievement twice more in 2012 and 2016, thus making him the most successful Malaysian Olympian in history.On 13 June 2019, Lee announced his retirement after struggling to return to full fitness following a nose cancer diagnosis. He was appointed as Malaysia's chef de mission for the 2020 Summer Olympics, but skipped the event due to his health concerns. He retained his role, albeit serving it virtually.",https://en.wikipedia.org/wiki/Lee_Chong_Wei
Maldives,9,Afa Ismail,http://www.wikidata.org/entity/Q4688777,wd:Q4688777,36645326.0,Olympic sprinter,Afa Ismail (born 1 November 1993 in Malé) is a Maldivian sprinter. She competed in the 100 metres competition at the 2012 Summer Olympics and 200 metres event for the Maldives at the 2016 Summer Olympics in Rio de Janeiro. She was the flag bearer for the Maldives during the closing ceremony.She is the current national record holder in the 200 metres and the 4×100 metres relay.,https://en.wikipedia.org/wiki/Afa_Ismail
Mali,23,Ladji Doucouré,http://www.wikidata.org/entity/Q357461,wd:Q357461,2390877.0,French athlete,"Ladji Doucouré (born 28 March 1983 in Juvisy-sur-Orge, department of Essonne in France) is a French track and field athlete.",https://en.wikipedia.org/wiki/Ladji_Doucour%C3%A9
Malta,24,David Millar,http://www.wikidata.org/entity/Q358203,wd:Q358203,784422.0,Scottish cyclist (born 1977),"David Millar (born 4 January 1977) is a Scottish retired professional road racing cyclist. He rode for Cofidis from 1997 to 2004 and Garmin-Sharp from 2008 to 2014. He has won four stages of the Tour de France, five of the Vuelta a España and one stage of the Giro d'Italia. He was the British national road champion and the national time trial champion, both in 2007.
Millar was banned for two years in 2004 after he admitted to taking banned performance-enhancing drugs. Upon his return from his ban, Millar became an anti-doping campaigner, a stance which eventually resulted in journalist Alasdair Fotheringham describing him as an 'elder statesman' of cycling.",https://en.wikipedia.org/wiki/David_Millar
Marshall Islands,10,Roman Cress,http://www.wikidata.org/entity/Q3269961,wd:Q3269961,18916501.0,Marshallese sprinter,"Roman William Cress (born August 2, 1977, in Kaven) is a track athlete from the Marshall Islands. He was born to an American father and Marshallese mother. Cress attended South High School and participated in Track as a student. He then attended MCTC, transferred to St. Thomas for his bachelor's degree and participated in Track as a student athlete.Cress has won the bronze medal in the 100 metres sprint at the 2006 Micronesia Games and gold in the 200 metres event at the same Games. He was the first Marshallese track athlete in history to compete in the Olympic Games, representing his country at the 2008 Summer Olympics in Beijing. At the 100 metres he finished 8th in his heat in a time of 11.18 seconds He is currently a school administrator at Robbinsdale Middle School in Robbinsdale, Minnesota.",https://en.wikipedia.org/wiki/Roman_Cress
Mauritania,10,Jidou El Moctar,http://www.wikidata.org/entity/Q328251,wd:Q328251,36584249.0,Olympic sprinter,"Jidou Ould Khaye El Moctar (born 8 July 1985 in Nouakchott, Mauritania) is a Mauritanian runner who competed at the 2012 Summer Olympics in the 200 m event. He was the flagbearer of Mauritania at the opening ceremony. El Moctar was eliminated in the first round but finished with a personal best time of 22.94 seconds.
He competed in the 100 m event at the 2016 Summer Olympics in Rio de Janeiro. He finished 6th in his heat during the preliminary round and did not qualify for the first round of the finals. He was the flagbearer for Mauritania during the Parade of Nations.",https://en.wikipedia.org/wiki/Jidou_El_Moctar
Mauritius,32,Chad le Clos,http://www.wikidata.org/entity/Q313891,wd:Q313891,29053860.0,South African swimmer,"Chad Guy Bertrand le Clos, OIS (born 12 April 1992) is a South African competitive swimmer who is an Olympic, World and Commonwealth Games champion. He is the African record, Commonwealth record, and South African record holder in the short course and long course 200-metre butterfly and the short course 100-metre butterfly. He also holds the African records and South African records in the long course 200-metre freestyle and 100-metre butterfly, and the short course 100-metre freestyle. Formerly, he was a world record holder in the short course 100-metre butterfly and 200-metre butterfly.
At the 2012 Summer Olympics, he won a gold medal in the 200-metre butterfly and a silver medal in the 100-metre butterfly, as well as silver medals in the 200-metre freestyle and 100-metre butterfly at the 2016 Summer Olympics. At the 2010 Summer Youth Olympics, he won five total medals. Le Clos has won the Swimming World Cup overall male winner title four times: 2011, 2013, 2014, and 2017. Across the 2010, 2014, 2018 and 2022 Commonwealth Games, he has won a total of 18 medals, including seven gold medals, four silver medals, and seven bronze medals. He has won a total of 19 medals, 12 gold medals, 5 silver medals, and 2 bronze medals, in individual events at Short Course World Championships.
At the 2014 Commonwealth Games, he tied the record set by Ian Thorpe for the most number of medals won at a single Commonwealth Games with seven medals. When he won his fourth Olympic medal at the 2016 Summer Olympics, he became South Africa's most decorated Olympian. In 2017, he became the first male to win the overall title in the Swimming World Cup four times. Upon his completion of the 2018 Swimming World Cup, he won the Guinness World Record for ""most gold medals won in the FINA Swimming World Cup by a male swimmer"" for the 143 gold medals he won between 2009 and 2018, inclusive. In the same year, he became the most decorated Commonwealth Games swimmer, with 17 total medals, and the first man to win the Commonwealth Games title in the 200-metre butterfly three times in a row. At the 2022 Commonwealth Games, he became the third person to win 18 medals at the Commonwealth Games and tied for the title of the most decorated competitor.

",https://en.wikipedia.org/wiki/Chad_le_Clos
Mexico,56,Sergio Pérez,http://www.wikidata.org/entity/Q82805,wd:Q82805,19801645.0,Mexican racing driver,"Sergio Michel ""Checo"" Pérez Mendoza (Spanish: [ˈseɾxjo ˈpeɾes] (listen); born 26 January 1990), is a Mexican racing driver who races in Formula One for Red Bull Racing, having previously driven for Sauber, McLaren, Force India, and Racing Point. He won his first Formula One Grand Prix at the 2020 Sakhir Grand Prix, breaking the record for the number of starts before a race win at 190. He also earned his first Formula One pole position at the 2022 Saudi Arabian Grand Prix, breaking the record for the most races before a first pole position at 215. Pérez has a contract with Red Bull Racing until the end of the 2024 season.Up until 2012, Pérez was a member of the Ferrari Driver Academy. He made his Formula One debut driving for Sauber during the 2011 season. He took his first Formula One podium at the 2012 Malaysian Grand Prix with Sauber. Due to his young age and performance, he was referred to as ""The Mexican Wunderkind"". Pérez joined McLaren for the 2013 season, but the team did not score a single podium finish. Subsequently, the team decided to replace Pérez with Kevin Magnussen for the 2014 season.Force India signed Pérez for the 2014 season with a €15 million contract. He remained with Force India when the team went into administration in 2018 and reformed as the Racing Point team for 2019. In 2019, Racing Point signed a three-year extension with Pérez. In September 2020, Racing Point announced that Pérez would be leaving the team at the end of the season as Sebastian Vettel, a four-time F1 world champion, had been signed to replace him. In December, Pérez signed with Red Bull Racing for the 2021 season. Pérez then won the 2021 Azerbaijan Grand Prix with the team and secured the second Formula 1 Grand Prix win of his career. Pérez scored his maiden Formula One pole position at the 2022 Saudi Arabian Grand Prix, with his third career win coming at the 2022 Monaco Grand Prix. Pérez scored his fourth win at the 2022 Singapore Grand Prix.",https://en.wikipedia.org/wiki/Sergio_P%C3%A9rez
Moldova,31,Lia Manoliu,http://www.wikidata.org/entity/Q261329,wd:Q261329,4828786.0,Romanian athletics competitor (1932-1998),Lia Manoliu (Romanian pronunciation: [ˈli.a manoˈli.u]; 25 April 1932 – 9 January 1998) was a Romanian discus thrower who won one gold and two bronze Olympic medals. She was the first track and field athlete to compete at six Olympics (1952–1972).,https://en.wikipedia.org/wiki/Lia_Manoliu
Monaco,56,Charles Leclerc,http://www.wikidata.org/entity/Q17541912,wd:Q17541912,44924226.0,Monegasque racing driver,"Charles Marc Hervé Perceval Leclerc (French pronunciation: ​[ʃaʁl ləklɛʁ]; born 16 October 1997) is a Monégasque racing driver, currently racing in Formula One for Scuderia Ferrari. He won the GP3 Series championship in 2016 and the FIA Formula 2 Championship in 2017.
Leclerc made his Formula One debut in 2018 for Sauber, a team affiliated with Ferrari, for which he was part of the Ferrari Driver Academy. With Sauber having finished last the year before, Leclerc led the charge to improve its finishing position in the Constructors' Championship to eighth, and was the higher ranked of the two Sauber drivers. He joined Ferrari the next season and became the second-youngest driver to qualify on pole position in Formula One at the 2019 Bahrain Grand Prix. The 2019 season also saw Leclerc take his first career win in Belgium. He won the FIA Pole Trophy for most pole positions in the 2019 season, becoming the youngest driver to win it, before winning it again in 2022. Leclerc finished runner-up to Max Verstappen in the 2022 World Drivers' Championship.
As of the 2022 Abu Dhabi Grand Prix, Leclerc has achieved 5 race wins and 18 pole positions in Formula One. He scored the first grand slam of his career at the 2022 Australian Grand Prix. Leclerc is set to remain at Ferrari until at least the end of the 2024 season.

",https://en.wikipedia.org/wiki/Charles_Leclerc
