0,1,2,3,4,5,6,7,8
Croatia,113,Garry Kasparov,http://www.wikidata.org/entity/Q28614,wd:Q28614,12810.0,Russian chess grandmaster and activist,"Garry Kimovich Kasparov (born 13 April 1963) is a Russian chess grandmaster, former World Chess Champion, writer and political activist. His peak rating of 2851, achieved in 1999, was the highest recorded until being surpassed by Magnus Carlsen in 2013. From 1984 until his retirement in 2005, Kasparov was ranked world no. 1 for a record 255 months overall. Kasparov also holds records for the most consecutive professional tournament victories (15) and Chess Oscars (11).
Kasparov became the youngest-ever undisputed World Chess Champion in 1985 at age 22 by defeating then-champion Anatoly Karpov. He held the official FIDE world title until 1993, when a dispute with FIDE led him to set up a rival organization, the Professional Chess Association. In 1997 he became the first world champion to lose a match to a computer under standard time controls when he lost to the IBM supercomputer Deep Blue in a highly publicized match. He continued to hold the ""Classical"" World Chess Championship until his defeat by Vladimir Kramnik in 2000. Despite losing the PCA title, he continued winning tournaments and was the world's highest-rated player when he retired from professional chess in 2005.
Since retiring, he has devoted his time to politics and writing. He formed the United Civil Front movement and joined as a member of The Other Russia, a coalition opposing the administration and policies of Vladimir Putin. In 2008, he announced an intention to run as a candidate in that year's Russian presidential race, but after encountering logistical problems in his campaign, for which he blamed ""official obstruction"", he withdrew. In the wake of the Russian mass protests that began in 2011, he announced in 2013 that he had left Russia for the immediate future out of fear of persecution. Following his flight from Russia, he lived in New York City with his family. In 2014, he obtained Croatian citizenship, and has maintained a residence in Podstrana near Split.Kasparov is currently chairman of the Human Rights Foundation and chairs its International Council. In 2017, he founded the Renew Democracy Initiative (RDI), an American political organization promoting and defending liberal democracy in the U.S. and abroad. He serves as chairman of the group. Kasparov is also a security ambassador for the software company Avast.

",https://en.wikipedia.org/wiki/Garry_Kasparov
Cuba,84,José Raúl Capablanca,http://www.wikidata.org/entity/Q160702,wd:Q160702,170402.0,Cuban chess player (1888-1942),"José Raúl Capablanca y Graupera (19 November 1888 – 8 March 1942) was a Cuban chess player who was world chess champion from 1921 to 1927. A chess prodigy, he is widely renowned for his exceptional endgame skill and speed of play.
Capablanca was born in 1888 in Havana. He beat Cuban champion Juan Corzo in a match on 17 November 1901, two days before his 13th birthday. His victory over Frank Marshall in a 1909 match earned him an invitation to the 1911 San Sebastian tournament, which he won ahead of players such as Akiba Rubinstein, Aron Nimzowitsch and Siegbert Tarrasch. Over the next several years, Capablanca had a strong series of tournament results. After several unsuccessful attempts to arrange a match with then world champion Emanuel Lasker, Capablanca finally won the world chess champion title from Lasker in 1921. Capablanca was undefeated from 10 February 1916 to 21 March 1924, a period that included the world championship match with Lasker.
Capablanca lost the title in 1927 to Alexander Alekhine, who had never beaten Capablanca before the match. Following unsuccessful attempts to arrange a rematch over many years, relations between them became bitter. Capablanca continued his excellent tournament results in this period but withdrew from serious chess in 1931. He made a comeback in 1934, with good results, but also showed symptoms of high blood pressure. He died in 1942 of a brain hemorrhage.
Capablanca excelled in simple positions and endgames; Bobby Fischer described him as possessing a ""real light touch"". He could play tactical chess when necessary, and had good defensive technique. He wrote several chess books during his career, of which Chess Fundamentals was regarded by Mikhail Botvinnik as the best chess book ever written. Capablanca preferred not to present detailed analysis but focused on critical moments in a game. His style of chess was influential in the play of future world champions Bobby Fischer and Anatoly Karpov.",https://en.wikipedia.org/wiki/Jos%C3%A9_Ra%C3%BAl_Capablanca
Cyprus,42,Marcos Baghdatis,http://www.wikidata.org/entity/Q207084,wd:Q207084,1421422.0,Cypriot tennis player,"Marcos Baghdatis (Greek: Μάρκος Παγδατής, Arabic: ماركوس بغداتيس; pronounced [ˈmarkos paɣðaˈtis]; born 17 June 1985) is a Cypriot former professional tennis player. He was the runner-up at the 2006 Australian Open and a semifinalist at the 2006 Wimbledon Championships, and reached a career-high ATP singles ranking of world No. 8 in August 2006. In the latter part of his career, Baghdatis endured a series of injuries that impacted his play.

",https://en.wikipedia.org/wiki/Marcos_Baghdatis
Czech Republic,92,Martina Navratilova,http://www.wikidata.org/entity/Q54545,wd:Q54545,198092.0,American-Czech tennis player,"Martina Navratilova (Czech: Martina Navrátilová [ˈmarcɪna ˈnavraːcɪlovaː] (listen); née Šubertová [ˈʃubɛrtovaː]; born October 18, 1956) is a Czech–American former professional tennis player. Widely considered among the greatest tennis players of all time, Navratilova won 18 major singles titles, 31 major women's doubles titles, and 10 major mixed doubles titles, for a combined total of 59 major titles, the most in the Open Era. Alongside Chris Evert, her greatest rival, Navratilova dominated women's tennis in the 1970s and 1980s.
Navratilova was ranked as the world No. 1 in singles for a total of 332 weeks (second only to Steffi Graf), and for a record 237 weeks in doubles, making her the only player in history to have held the top spot in both disciplines for over 200 weeks. She won 167 top-level singles titles and 177 doubles titles, both the Open Era records. She won a record six consecutive singles majors across 1983 and 1984 while simultaneously winning the Grand Slam in doubles. Navratilova claims the best professional season winning percentage, 98.8% in 1983 (going 98–1 for the season), and the longest all-surface winning streak of 74 straight match wins. She reached the Wimbledon singles final 12 times, including for nine consecutive years from 1982 through 1990, and won the title a record nine times. Navratilova is one of the three tennis players, along with Margaret Court and Doris Hart, to have accomplished a career Grand Slam in singles, same-sex doubles, and mixed doubles, called the career ""Boxed Set"". She won her last major title, the mixed doubles crown at the 2006 US Open, shortly before her 50th birthday, and 32 years after her first major title in 1974.
Originally from Czechoslovakia, Navratilova was stripped of her citizenship when, in 1975 at age 18, she asked the United States for political asylum and was granted temporary residence. She became a US citizen in 1981. On January 9, 2008, Navratilova acquired Czech citizenship, thus becoming a dual citizen. She stated she has not renounced her U.S. citizenship nor does she plan to do so, and that reclaiming Czech nationality was not politically motivated. Navratilova has been openly lesbian since 1981, and has been an activist for LGBT issues.",https://en.wikipedia.org/wiki/Martina_Navratilova
Democratic Republic of the Congo,42,Dikembe Mutombo,http://www.wikidata.org/entity/Q313481,wd:Q313481,241113.0,Congolese-American basketball player,"Dikembe Mutombo Mpolondo Mukamba Jean-Jacques Wamutombo (born June 25, 1966) is a Congolese-American former professional basketball player. Mutombo played 18 seasons in the National Basketball Association (NBA). Outside basketball, he has become well known for his humanitarian work.The 7 ft 2 in (2.18 m), 260-pound (120 kg) center, who began his career with the Georgetown Hoyas, is commonly regarded as one of the greatest shot blockers and defensive players of all time, winning the NBA Defensive Player of the Year Award four times; he was also an eight-time All-Star. On January 10, 2007, he surpassed Kareem Abdul-Jabbar as the second most prolific shot blocker in NBA history, behind only Hakeem Olajuwon, and he averaged a double-double for most of his career.At the conclusion of the 2009 NBA playoffs, Mutombo announced his retirement. On September 11, 2015, he was inducted into the Naismith Memorial Basketball Hall of Fame.",https://en.wikipedia.org/wiki/Dikembe_Mutombo
Denmark,69,Caroline Wozniacki,http://www.wikidata.org/entity/Q30767,wd:Q30767,2276820.0,Danish professional tennis player,"Caroline Wozniacki  (Danish: [kʰɑʁoˈliːnə vʌsniˈɑkʰi]; born 11 July 1990) is a Danish former professional tennis player. She was ranked world No. 1 in singles for a total of 71 weeks, including at the end of 2010 and 2011. She achieved the top ranking for the first time on 11 October 2010, becoming the 20th player in the Open era and the first woman from a Scandinavian country to hold the top position. In 2018, she became the first Dane to win a Grand Slam singles title, after winning the 2018 Australian Open.
Known for her footwork and defensive abilities, Wozniacki won 30 WTA singles titles (including six in both 2010 and 2011, the most in a year by a WTA player from 2008–2011) and two doubles titles. A junior Grand Slam champion, she won the 2006 Wimbledon girls' singles title over Magdaléna Rybáriková, and was voted the WTA Newcomer of the Year in 2008. She won a Grand Slam singles title at the 2018 Australian Open, beating Simona Halep and becoming the first Dane to win a Grand Slam singles title. Previously, she had reached two Grand Slam finals at the US Open, falling to Kim Clijsters in 2009 and to her friend Serena Williams at the 2014 US Open. Wozniacki also won the season-ending WTA Finals in Singapore in 2017, beating Venus Williams, after finishing runner-up to Clijsters at the event in 2010. Her other major career highlights include winning three Premier Mandatory and three Premier 5 titles, reaching four Grand Slam semifinals (the 2011 Australian Open and the 2010, 2011 and 2016 US Opens, three Grand Slam quarterfinals (the 2012 Australian Open and the 2010 and 2017 French Opens), and the quarterfinals at the 2012 London Olympics.
Wozniacki retired on 24 January 2020, following a third-round loss at the Australian Open. She became an ESPN commentator in 2022.

",https://en.wikipedia.org/wiki/Caroline_Wozniacki
Dominican Republic,36,Félix Sánchez,http://www.wikidata.org/entity/Q1689,wd:Q1689,936895.0,Dominican track and field athlete,"Félix Sánchez, (born August 30, 1977) is a retired Dominican-American track and field athlete. He is of Dominican descent, was born and raised in the United States, and competed for the Dominican Republic, specializing in the 400 meter hurdles. He is a two-time Olympic gold medallist, winning gold in 2004 and 2012, and was also World Champion in 2001 and 2003.  Just before turning 36, he set the Masters M35 World Record with a time of 48.10. Sanchez acquired many nicknames: ""Super Felix"", ""the Invincible"", ""Superman"", and ""the Dictator"".The Félix Sánchez Olympic Stadium, the Dominick Republic’s smallest stadium, is named after him.
Sánchez retired in April 2016, citing the recent birth of his son.

",https://en.wikipedia.org/wiki/F%C3%A9lix_S%C3%A1nchez_(hurdler)
East Timor,14,Yohan Goutt Goncalves,http://www.wikidata.org/entity/Q15648135,wd:Q15648135,41660332.0,East Timorese alpine skier,"Yohan Carlos Goutt Gonçalves (born 20 December 1994 in Suresnes, France) is a French-East Timorese alpine skier who has competed since 2013. Goutt Gonçalves has also qualified to compete for East Timor at the 2014 Winter Olympics in Sochi, Russia. By doing so, he became the first athlete ever to qualify from the country at the Winter Olympics. He also competed for East Timor at the 2018 Winter Olympics in PyeongChang.
Goutt Gonçalves is the son of a French father, and his mother is from East Timor, allowing him to compete for the latter country. His father's mother was Estonian Eva Goutt (maiden name Liiv), who is related to Estonian poet Juhan Liiv.On 29 December 2013, in a race in Serbia, Goutt Gonçalves managed to lower his point total to below 140 and officially qualify for the 2014 Winter Olympics.Goutt Gonçalves decided against participating at the  2017 FIS Alpine World Ski Championships to participate at the 2017 Asian Winter Games, becoming the first athlete to represent East Timor in the continental competition.",https://en.wikipedia.org/wiki/Yohan_Goutt_Gon%C3%A7alves
Ecuador,32,Richard Carapaz,http://www.wikidata.org/entity/Q16298132,wd:Q16298132,51807336.0,Ecuadorian bicycle racer,"Richard Antonio Carapaz Montenegro (born 29 May 1993) is an Ecuadorian professional road racing cyclist who currently rides for UCI WorldTeam EF Education–EasyPost. Carapaz won the 2019 Giro d'Italia, becoming the first Ecuadorian rider to win the race. In July 2021, he won the gold medal in the road race at the 2020 Summer Olympics, becoming the first Ecuadorian cyclist to win a medal and only the second Ecuadorian in any sport to win a gold medal at the Olympic Games. In doing so, he became the first cyclist to achieve an Olympic road race gold medal and a podium finish in each of the three Grand Tours.

",https://en.wikipedia.org/wiki/Richard_Carapaz
Egypt,29,Jaroslav Drobný,http://www.wikidata.org/entity/Q365518,wd:Q365518,2138013.0,Czech tennis and ice hockey player,"Jaroslav Drobný (Czech pronunciation: [ˈjaroslav ˈdrobniː]; 12 October 1921 – 13 September 2001) was a World No. 1 amateur tennis and ice hockey champion. He left Czechoslovakia in 1949 and travelled as an Egyptian citizen before becoming a citizen of the United Kingdom in 1959, where he died in 2001. In 1954, he became the first and, to date, only player with African citizenship to win the Wimbledon Championships (aside from dual citizen Roger Federer, who holds South African citizenship but officially represents only Switzerland in sports).

",https://en.wikipedia.org/wiki/Jaroslav_Drobn%C3%BD
El Salvador,17,Marcelo Arevalo,,,,,--,--
Equatorial Guinea,26,Eric Moussambani,http://www.wikidata.org/entity/Q288305,wd:Q288305,623906.0,piloto,"Eric Moussambani Malonga (born 31 May 1978) is an Equatoguinean swimmer. Nicknamed Eric the Eel by the media, Moussambani won brief international fame at the 2000 Summer Olympics for an extremely unlikely victory. Moussambani, who had never seen an Olympic-sized swimming pool before, swam his heat of the 100 m freestyle on 19 September in the unprecedentedly slow time of 1:52.72. This was the slowest time in Olympic history by far, and Moussambani had trouble finishing the race, but he won his heat after both his competitors were disqualified due to false starts. Although Moussambani's time was still too slow to advance to the next round, he set a new personal best and an Equatoguinean national record. He later became the coach of the national swimming squad of Equatorial Guinea.",https://en.wikipedia.org/wiki/Eric_Moussambani
Eritrea,30,Zersenay Tadese,http://www.wikidata.org/entity/Q192033,wd:Q192033,926251.0,Eritrean long-distance runner,"Zersenay Tadese Habtesilase (Tigrinya: ዘርእሰናይ ታደሰ; born 8 February 1982) is an Eritrean long-distance track and road running athlete. He held the men's half marathon world record from 2010 to 2018. His bronze medal in the 10,000 metres at the 2004 Athens Olympics made him the first ever Eritrean Olympic medallist, and his 20-km title at the 2006 IAAF World Road Running Championships also made him the country's first athlete to win at a world championship event. He does not use a sprint finish to win races; his strategy relies on a combination of efficient running and fast pace setting.
Zersenay (""Tadese"" is his father's name) has found most of his success in the half marathon, with four consecutive victories in the World Half Marathon Championships from 2006 to 2009 (with a 2006 20 km edition), a silver medal in 2010 and a fifth title in 2012. His 5 titles are a record. He set a world record at the Lisbon Half Marathon in 2010.
He has also excelled in cross country running, winning a gold, a silver, and two bronze medals in the long-distance race over five IAAF World Cross Country Championships. He is a four-time Olympian (2004, 2008, 2012 and 2016).
In 2009, Zersenay became only the second man (after Paul Tergat) to win three World Championship medals over three different surfaces in the same year, winning World Cross Country bronze, 10,000 metres World Championship silver on the track, and gold in road running at the World Half Marathon Championships. He is a popular public figure in his home country; 2500 guests attended his wedding to Merhawit Solomon, which was broadcast live on Eritrean television. His brother, Kidane Tadese, is also a professional distance runner.
In 2016, he was chosen to be part of Nike's Breaking2 team to try to break 2 hours for the marathon and finished in 2:06:51h.",https://en.wikipedia.org/wiki/Zersenay_Tadese
Estonia,50,Paul Keres,http://www.wikidata.org/entity/Q207727,wd:Q207727,295845.0,Estonian and Soviet chess player,"Paul Keres ([ˈpɑu̯l ˈkeres]; 7 January 1916 – 5 June 1975) was an Estonian chess grandmaster and chess writer. He was among the world's top players from the mid-1930s to the mid-1960s, and narrowly missed a chance at a World Chess Championship match on five occasions. As Estonia was repeatedly invaded and occupied during World War II, Keres was forced by the circumstances to represent the former Soviet Union (1940–41, 1944–75) and Nazi Germany (1941–44) in international tournaments. 
Keres won the AVRO 1938 chess tournament, which led to negotiations for a title match against the reigning World Champion Alexander Alekhine, but the match never took place due to the outbreak of World War II in 1939. Keres was runner-up in the Candidates Tournament on four consecutive occasions in 1953–1962. Due to these and other strong results, many chess historians consider Keres one of the greatest players in history, and the strongest player never to become world champion. ""Super grandmaster"" is an informal term to refer to the world's elite players — usually players who are serious contenders for the World Championship — and Keres fits this description. He was nicknamed ""Paul the Second"", ""The Eternal Second"" and ""The Crown Prince of Chess"".

",https://en.wikipedia.org/wiki/Paul_Keres
Eswatini,12,Sibusiso Matsenjwa,http://www.wikidata.org/entity/Q7507323,wd:Q7507323,36654859.0,Swazi sprinter,"Sibusiso Bruno Matsenjwa (born 2 May 1988) is a sprinter from Eswatini. He competed in the 200 metres at the 2012 and 2016 Olympics, but failed to reach the finals. He broke the national record on both occasions and served as the flag bearer for Eswatini during the opening ceremony in 2016. Matsenjwa holds national records over 100–400 m distances. He represented his country at three outdoor and three indoor world championships. Sibusiso also competed at the 2018 Gold Coast Commonwealth Games.
He competed in the men's 200m at the 2020 Summer Olympics.",https://en.wikipedia.org/wiki/Sibusiso_Matsenjwa
Ethiopia,62,Abebe Bikila,http://www.wikidata.org/entity/Q52596,wd:Q52596,671288.0,Ethiopian double Olympic marathon champion,"Shambel Abebe Bikila (Amharic: ሻምበል አበበ ቢቂላ; August 7, 1932 – October 25, 1973) was an Ethiopian marathon runner who was a back-to-back Olympic marathon champion. He is the first Ethiopian Olympic gold medalist, winning his and Africa's first gold medal at the 1960 Summer Olympics in Rome while running barefoot. At the 1964 Tokyo Olympics, he won his second gold medal. In turn, he became the first athlete to successfully defend an Olympic marathon title. In both victories, he ran in world record time.
Born in Shewa, Abebe moved to Addis Ababa around 1952 and joined the 5th Infantry Regiment of the Ethiopian Imperial Guard, an elite infantry division that safeguarded the emperor of Ethiopia. Enlisting as a soldier before his athletic career, he rose to the rank of shambel (captain). Abebe participated in a total of sixteen marathons. He placed second on his first marathon in Addis Ababa, won twelve other races, and finished fifth in the 1963 Boston Marathon. In July 1967, he sustained the first of several sports-related leg injuries that prevented him from finishing his last two marathons. Abebe was a pioneer in long-distance running. Mamo Wolde, Juma Ikangaa, Tegla Loroupe, Paul Tergat, and Haile Gebrselassie—all recipients of the New York Road Runners' Abebe Bikila Award—are a few of the athletes who have followed in his footsteps to establish East Africa as a force in long-distance running.On March 22, 1969, Abebe was paralysed due to a car accident. He regained some upper-body mobility, but he never walked again. While he was receiving medical treatment in England, Abebe competed in archery and table tennis at the 1970 Stoke Mandeville Games in London. Those games were an early predecessor of the Paralympic Games. He competed in both sports at a 1971 competition for disabled people in Norway and won its cross-country sleigh-riding event. Abebe died at age 41 on October 25, 1973, of a cerebral haemorrhage related to his accident four years earlier. He received a state funeral, and Emperor Haile Selassie declared a national day of mourning. Many schools, venues, and events, including Abebe Bikila Stadium in Addis Ababa, are named after him. He is the subject of biographies and films documenting his athletic career, and he is often featured in publications about the marathon and the Olympics.

",https://en.wikipedia.org/wiki/Abebe_Bikila
Federated States of Micronesia,10,Jennifer Chieng,http://www.wikidata.org/entity/Q26472808,wd:Q26472808,51386038.0,Micronesian boxer and mixed martial arts fighter,"Jennifer Dugwen Chieng (born April 29, 1986) is an American-born boxer and mixed martial artist who represents the Federated States of Micronesia in sports. She competed at the 2016 Summer Olympics in the women's boxing - lightweight event, in which she was eliminated in the round of 16 by Mikaela Mayer. She was the flag bearer for her country at the Parade of Nations.",https://en.wikipedia.org/wiki/Jennifer_Chieng
Fiji,28,Vijay Singh,http://www.wikidata.org/entity/Q331942,wd:Q331942,426484.0,Fijian-Indian professional golfer (born 1963),"Vijay Singh  (Fiji Hindi: विजय सिंह pronounced [ˈʋɪdʒəj sɪ̃ɦ]; born 22 February 1963), nicknamed ""The Big Fijian"", is a Fijian professional golfer. He has won 34 events on the PGA Tour, including three major championships: one Masters title (2000) and two PGA Championships (1998, 2004). He is the first person of South Asian descent to win a major championship. He was elected to the World Golf Hall of Fame in 2006.Singh reached world number one in the Official World Golf Ranking for 32 weeks in 2004 and 2005.  Vijay was the 12th man to reach the world No. 1 ranking and was the only new world No. 1 in the 2000s decade. Singh was the leading PGA Tour money winner in 2003, 2004 and 2008. He also captured the FedEx Cup in 2008.",https://en.wikipedia.org/wiki/Vijay_Singh
